Date,Title,Content
2020-12-19 박근희 기자,"[아무튼, 주말] 그리들, 수비드, 칵테일··· 당신에겐 이 세가지 ‘비밀병기’가 있습니까","‘아듀 2020’ 홈파티 풍경
코로나 재확산으로 ‘집콕’으로 한 해를 마무리하겠다는 이가 많다. 누가 뭐래도 집콕은 ‘장비’전. 각종 소셜미디어에선 재택 생존을 위한 신종 병기들이 속속 올라오고 있다. 연말 송년회 단골 코스인 노래방 대신 ‘홈 노래방’을 꾸미고, 전문 셰프처럼 수비드(sous vide·진공포장한 음식을 정확히 계산된 온도의 물로 가열해 조리하는 방법) 조리 도구를 갖춰 스테이크를 익혀 먹는다. ‘홈바’를 꾸며 나만의 칵테일 파티를 하는 이도 있다. 집이라는 안전지대에서 보내는 연말 파티 신풍속도를 들여다봤다.

◇노래방, PC방으로 변신한 집

‘셀프 자가 격리 노래방 개장’. 지난 14일 경기도 하남시에 사는 예비 부부 김세민(29)·나지민(25)씨 신혼집 거실은 별안간 노래방으로 변신했다. 블루투스 노래방 마이크에선 애창곡 반주가 흘러나오고 주먹만 한 미러볼을 켜자 거실 천장과 벽면엔 화려한 조명이 흘렀다. 남편은 잔잔한 반주에 맞춰 노래를, 아내는 야광봉을 흔들며 분위기를 돋웠다. 주변 이웃을 의식해 음량을 한껏 낮췄지만, 기분만큼은 데이트 코스로 자주 가던 노래방이나 다름없었다. 발라드 위주로 각자 애창곡을 몇 곡씩 부른 뒤 부부는 방 한쪽에 나란히 꾸민 PC방으로 가 좋아하는 PC 게임을 즐겼다.

“예년 같으면 외식하고 영화 한 편 보고, 칵테일바나 노래방에 갔을 겁니다. 코로나 때문에 일상적인 데이트가 어려워져서 신혼집을 빨리 꾸미게 됐죠. 코로나 사태가 언제까지 이어질지 몰라 불필요한 혼수 대신 집콕 생활을 즐겁게 할 수 있는 시스템으로요.” 부부는 “노래방 마이크와 5000원짜리 조명이 스트레스 푸는 ‘가성비 혼수’가 됐다”며 웃었다.

의료계에 종사하는 강동수(32·경기 일산)씨는 올 연말 ‘가족들과 칵테일 파티’를 계획 중이다. 칵테일을 좋아해 그동안 칵테일바를 즐겨 찾았지만, 코로나 감염증 확산 후 발길을 끊은 지 오래. 일 특성상 병원 출입이 잦아 코로나에 특히 주의하고 있다는 강씨는 최근 ‘홈텐딩(홈+바텐딩, 집에서 칵테일을 만들어 즐기는 것)’에 입문했다. 주류 브랜드에서 한정판으로 판매한 홈텐딩 패키지를 구해 도전했다. 시험 삼아 진토닉, 롱아일랜드티, 마르가리타 등 쉬운 칵테일부터 만들어 가족들과 시음했다. 좋아하는 양주와 와인을 진열·보관할 수 있는 작은 거치대도 마련했다. 거리 두기를 유지하며 당분간 홈술을 즐길 계획이다. “술을 한잔도 못하셨던 어머니께 도수 낮은 칵테일을 만들어 드리니 좋아하셨어요. 온 가족이 모처럼 스트레스를 날렸답니다.”

돌이켜보면 바이러스가 창궐하는 이 험한 세상에서 지루한 집콕 생활을 버틴 건 ‘비밀 병기’ 덕이었다. 집밥에 지쳐갈 때쯤 ‘밀키트’(meal kit·요리에 필요한 식재료와 양념을 세트로 구성한 식품)로 한 끼를 해결했다. 무료함을 견디려 거품기로 ‘달고나 커피’를, 와플기로 ‘크로플(와플 형태의 크루아상)’이란 걸 만들어 먹었으니까.

연말 송년회 시즌엔 ‘회식 아이템’들이 홈 파티 ‘비장의 무기’로 소환되고 있다. ‘오늘은 홈술’을 펴낸 홈술(집에서 즐기는 술) 크리에이터 류지수(29)씨는 “연말이면 회식이나 모임으로 마시고 싶지 않은 술을 마시게 되는 경우가 다반사였는데 올해는 집에서 자신에게 맞는 술을 발견하고 싶어 홈텐딩에 도전하는 이들이 늘었다”고 했다. 네이버 주류 정보 창구이자 술 동호인 커뮤니티엔 연말 모임 장소 추천 글 대신 홈술 관련 글들이 넘쳐난다.

◇캠핑용 장비가 홈 파티 도구로

닭갈비 집이나 전문 고깃집에서나 볼 법한 양손잡이 철판구이·볶음팬 ‘그리들’은 연말 홈 캠핑 파티의 주인공으로 떠올랐다. 코로나발 캠핑 붐이 일면서 캠핑용품의 하나로 주목받기 시작한 그리들이 연말 집 안 요리 도구로 떡 하니 한자리를 차지했다. 온라인 쇼핑몰 ‘G마켓’에 따르면 캠핑 비수기에 접어든 최근 한 달(11월 10일~12월 10일)간 그리들 판매량은 지난해 같은 기간보다 무려 669% 신장률을 보였다. 인스타그램에서 ‘그리들’을 검색하면 캠핑장뿐 아니라 집 안에서 그리들을 활용해 요리하는 게시물이 2만장 가까이 올라와 있다.

용인에 사는 파티플래너 전근영(45)씨도 올 연말 홈 파티 아이템으로 그리들을 선택했다. 예년 같으면 파티플래너로서 일년 중 연말이 가장 바쁠 때지만 올해는 코로나로 파티와 축제, 이벤트가 줄줄이 취소되면서 반강제적으로 휴식 중이다. 연말 버킷리스트의 하나였던 ‘가족 여행’을 포기한 대신 지난 15일 일찌감치 집 마당에서 홈 캠핑 형식의 파티를 했다. 각자 방에서 재택근무와 온라인 수업으로 지친 가족들은 동그란 그리들 하나에 옹기종기 모여 앉아 춘천식 닭갈비, 장어구이 등을 차례로 요리해 즐겼다.

전씨는 “맛있는 요리가 있으면 공감대가 형성되기 마련”이라며 “그리들은 호떡이나 가래떡 굽기에도 안성맞춤이고, 파전, 스테이크 요리까지 웬만한 요리는 다 가능해 ‘먹방 파티’할 때 유용하다”고 했다. 그리들과 함께 ‘구이바다’라 불리는 가스 스토브도 빠질 수 없단다. 고기 구이부터 전골, 라면까지 다채로운 요리를 간편하게 해 먹을 수 있는 캠핑용품으로 가정에서도 두루 사용한다.

연말 홈 파티에 스테이크를 포기할 수 없다는 이들 사이에선 ‘수비드 스테이크’가 주목받고 있다. 고기를 숙성시켜 수비드 머신을 이용해 저온 방식으로 익혀내는 스테이크로 전문 레스토랑에서나 맛볼 수 있었다. 예능에 등장하면서 마니아들 사이에서 집콕 생활에 재미를 더하는 아이템으로 등극했다. 해외 직구로 수비드 머신을 사 직접 수비드 스테이크 요리에 도전한 대기업 연구원 박래영(45)씨는 “시간이 오래 걸린다는 단점이 있지만, 일정한 맛의 스테이크 요리를 즐길 수 있어 당분간 외식은 안 해도 될 것 같다”고 했다. 박씨는 “연말 가족들과 홈 파티 할 때 수비드 스테이크와 함께 외국 영화에 종종 등장하는 크리스마스 음료 에그노그(eggnog·술, 달걀, 설탕, 우유를 넣어 만든 음료) 만들기에 도전해볼 것”이라고 했다.

◇59.2% “집에서 연말 보내”

서울 및 수도권과 일부 지역에서 사회적 거리 두기 2.5단계가 유지되는 연말, ‘아무튼, 주말’이 SM C&C 설문조사 플랫폼 ‘틸리언 프로’(Tillion Pro)와 함께 20~60대 성인 남녀 5018명에게 ‘코로나 연말 계획’에 대해 물었다. 응답자 중 59.2%가 안전과 사회적 분위기를 고려해 ‘집콕’(35%)이거나 ‘홈파티’(24.2%)를 하는 등 집에 머무는 연말을 보낼 것이라고 답했다. ‘여행’과 ‘외식’은 각각 24.5%, 16%였다.

‘홈 파티 할 예정’이라고 응답(1213명)한 이들이 ‘홈 파티 할 때 가장 고민하는 것’은 음식(42.7%). 다음은 여가 활동(22%)인 것으로 나타났다. 파티 분위기 연출(19.7%)이나 참여 인원(15.6%)에 대한 고민도 있었다. ‘음식 외 홈 파티를 위해 꼭 필요하다고 생각하는 아이템은?’이란 질문(복수 응답)엔 응답자 중 절반가량이 ‘함께 만들거나 즐길 아이템’(48.8%)이라고 답했다. ‘빔 프로젝터 등 영화 관람 시스템’(23%), ‘요리를 풍성하게 도와주는 도구’(17.9%), ‘음향 및 노래방 마이크’(13.1%), ‘게임기’(12.5%)가 그 뒤를 이었다.

최근 소비 동향도 설문 결과와 크게 다르지 않다. G마켓에 따르면 집콕이나 홈 파티를 위한 용품 판매 신장률은 지난해 같은 기간보다 전반적으로 늘어났다. 그중 ‘크리스마스트리’가 112%, 간식이나 디저트를 직접 만들어 먹는 ‘간식 메이커’가 246% 증가했다. 영화 관람 등을 위한 프로젝터 판매도 56% 늘었다. ‘거리 두기’가 이어지는 만큼 집에서 무엇을 하며 시간을 보낼지가 고민인 연말이 됐다는 얘기다.

◇홈 파티, 코로나 우울증에 도움

정신·심리 전문가들은 연말 가족이나 사랑하는 사람과 보내는 홈 파티가 ‘코로나 블루’ 해소에 도움이 될 수 있다고 했다. 다만, 시기가 시기인 만큼 최소한의 인원이 함께할 것을 권했다. 정신과 전문의 최명기 청담하버드심리센터 소장은 “연말을 마무리하는 작은 파티나 선물은 1년을 살아온 자신에게 수고했다는 심리적 보상을 해주는 기능을 한다”며 “‘코로나 때문에’라는 이유로 무조건 집콕만 하기보다는 집에서라도 가족, 사랑하는 사람과 오붓하게 이벤트를 즐기는 것이 코로나 블루 해소에 도움이 될 수 있다”고 했다. 특히 대인 관계로 삶의 만족도가 높아지는 성격이라면 마냥 조용히 칩거만 할 경우 우울감이 심해질 수 있다. 크리스마스 용품으로 집을 꾸미거나 새로운 물건들을 다루면 우울한 기분을 환기할 수 있다.

최명기 소장은 “집에 있는 시간이 길어지면 신체를 쓰지 않게 되고, 신체를 쓰지 않으면 누구나 답답함을 느끼게 된다. 이럴 때 새로운 도구나 물건을 접하면 일정 부분 몸을 쓰게 되고 집중력을 발휘할 수 있게 된다”고 설명했다. 거품기를 활용해 달고나 커피를 만들면서 스트레스를 해소하는 것도 비슷한 이치다. 최 소장은 여럿이 모이기보다는 홀로 또는 직계가족 위주 소박한 파티를 열고 영상이나 화상, 사진으로 파티 분위기를 공유하는 비대면 연말 파티를 제안했다. “이미 많은 이가 1년 가까이 비대면 방식의 사회적 활동을 해왔기에 연말 파티 역시 따로 있어도 함께 있는 듯 얼마든지 비대면으로 즐길 수 있다”고 했다."
2020-12-18 임대환,"현대그린푸드, 홈파티 밀키트 기획전","가족간 연말 오붓한 홈파티용



현대백화점그룹 계열 종합식품기업 현대그린푸드는 오는 31일까지 ‘홈파티 밀키트 기획전’을 연다고 18일 밝혔다.



이번 기획 상품은 집에서 간편하게 조리가 가능한 ‘밀키트(meal kit)’ 방식으로, 레스토랑에서 먹는 것과 같은 분위기와 맛을 경험할 수 있도록 건강한 식재료 사용과 고급스러운 메뉴 구성이 특징이다.



먼저, 현대그린푸드의 맞춤형 케어푸드 브랜드 ‘그리팅’은 오는 31일까지 애피타이저(샐러드), 메인(파스타, 스테이크), 디저트(케이크, 차류)로 구성된 ‘홈파티 코스 패키지’를 판매한다. ‘홈파티 코스 패키지’는 집에서 접하기 힘든 ‘토마호크’(사진), ‘T본’ 등의 고급 스테이크 메뉴를 누구나 간편하게 조리할 수 있도록 구성된 것이 특징이다.



이탈리아 프리미엄 식문화 공간 ‘이탈리(EATALY)’도 같은 기간 동안 프리미엄 식재료를 활용해 이탈리아인 셰프가 직접 만든 밀키트 5종(파스타 3종, 이탈리아 전통 바비큐, 등심 스테이크) 및 홈파티용 ‘EATALY D.I.Y 와인 세트’를 선보인다. 홈파티용 와인 세트는 고객이 매장에서 직접 선택한 이탈리 와인 및 안주로 햄퍼(HAMPER·식품바구니)를 제작해주는 것이 특징이며 개별 구매가격보다 최대 30% 할인된 가격에 판매한다.



제품 판매 기간은 오는 31일까지며, 판매처는 ‘홈파티 코스 패키지’는 그리팅 온라인몰 ‘그리팅몰(www.greating.co.kr)’에서, 이탈리 밀키트 등은 현대백화점 판교점 지하 1층 ‘이탈리(EATALY)’에서 판매한다.



현대그린푸드 관계자는 “신종 코로나바이러스 감염증(코로나19)으로 인해 외부에서 연말 모임을 하기보다는 가족 및 연인과 오붓한 홈파티를 계획하는 소비자가 많을 것으로 예상되는 만큼 레스토랑에 간듯한 고급스러운 분위기 연출과 간편하게 조리 가능한 메뉴들로 기획했다”고 설명했다.



임대환 기자 hwan91@munhwa.com"
2020-12-18 신성은,"중기부 1인 미디어콘텐츠 제작지원 사업, 소상공인 살리기에 기여","소상공인들이 코로나19로 인한 경제난으로 어려움을 겪고 있는 가운데, 온라인 판로를 개척하고 싶어도 인력과 자금이 부족해 망설이는 경우가 많다.
이에 중소벤처기업부는 ‘2020년 소상공인 온라인 판로지원사업’을 통해 소상공인들이 비대면 소비문화 확산 트렌드 속에서 위기를 미래의 기회로 바꾸고, 빠르게 디지털 기반으로 전향할 수 있도록 돕고 있다.
특히 ‘2020년 소상공인 온라인 판로지원사업’의 하나인 1인 미디어콘텐츠 제작지원(PPL)이 소상공인들에게 인기다. 인기 연예인 하하, 강재준 지조 등이 출연해 소상공인 제품 PPL을 진행하는 ‘ㅎㅎ마트’가 대표적인 콘텐츠다.
ㅎㅎ마트는 인기 연예인 하하가 직접 먹거리를 시식하고 평가하며, 제품에 대해 상세히 설명하는 포맷으로 소비자에게 재미와 정보를 동시에 전달하고 있다. 실제로 소상공인들은 ㅎㅎ마트 PPL을 통해 매출이 증대되는 효과를 보기도 했다.
창업 1년차인 ‘주식회사 올바른’ 맹지수 대표는 창업과 동시에 코로나19 확산으로 많은 어려움을 겪었다. 오프라인 매장 오픈에 차질을 빚고, 미리 준비했던 백화점 시식 행사마저 무산되자 급한 마음에 마케팅을 진행했지만 전문성이 부족해 별 효과를 보지 못했다.
그러던 중 ‘기업마당’에서 소상공인을 위한 지원 사업을 검색하다 우연히 ‘소상공인 온라인판로지원’을 발견해 ‘1인 미디어 콘텐츠 제작지원’을 신청했다. 그 결과 온라인 판로를 넓히는 데 많은 도움을 얻을 수 있었다.
맹지수 대표는 “타 플랫폼 기획전에 들어가려면 MD섭외부터 비용, 수수료 등 신경쓸 일이 많은데 중기부 지원사업을 통해 기획전에 참여한 덕에 타 플랫폼에 손쉽게 진입할 수 있었다”며 “지난 10월말 가치삽시다TV와 티몬이 협업한 라이브커머스 방송으로 매출이 늘었고, 소비자에게 ‘쌀어묵’을 본격적으로 선보일 수 있는 기회도 얻었다”고 말했다.주식회사 커피만나 박준상 대표 역시 ㅎㅎ마트를 통해 광고 효과를 톡톡히 본 사례다. ㅎㅎ마트 PPL로 간접 노출된 커피만나 원두커피 검색량이 늘어났고, 사이트에 방문한 고객들이 자연스럽게 원두커피 외의 다른 커피 재료를 구입하는 연쇄 구매 현상이 발생했다. 코로나19로 인해 ‘홈카페 홈바리스타’ 제품에 소비자들의 관심이 컸던 것도 주효했다. 이는 커피만나 원두커피 단일 품목의 150%, 회사 전체 매출의 35% 성장으로 이어졌다. 현재 옥션, 지마켓, 11번가, 인터파크 온라인기획전도 주기적으로 지원받고 있다.
ㅎㅎ마트 외에 개그맨 이상준, 김용명, 이은지와 배우 황석정, 백봉기 등이 출연하는 웹예능 ‘어떰유통 시즌2’ 역시 주목받고 있다. 2021년 2월까지 소상공인 제품 PPL홍보를 이어갈 예정이다.
어떰유통은 ‘2020 merry K-MAS 라이브마켓’을 열고 황석정 부장의 특명으로 라이브커머스를 진행한다. 소상공인 매출 증대 도모를 위한 비대면 행사다. 국민MD 선정 제품인 ‘아임셰프 밀키트’, ‘스카이트립 캠핑박스’, ‘핸드메이드 제주 모몽마카롱’ 등을 비롯해 12개 소상공인 제품을 소개한다.
어떰유통 라이브커머스 방송 일정은 12월 20일(일)과 27일(일) 각각 13시와 15시다. 가치삽시다TV 유튜브 채널과 어떰유통 유튜브 채널, 가치삽시다 플랫폼 등에서 시청할 수 있다. 가치삽시다 플랫폼 기획전에서도 판매 상품 확인이 가능하며, 라이브 방송 도중 구매할 경우 프로모션 혜택까지 받을 수 있다.
온라인뉴스부 iseoul@seoul.co.kr"
2020-12-18,"중기부, ‘소상공인 온라인판로지원 사업’으로 소상공인 디지털화 지원","중소기업벤처기업부가 시행한 ‘2020년 소상공인 온라인판로지원 사업’의 소상공인 디지털화 지원 성과가 두드러진다. 코로나19의 발발로 어려움을 겪은 창업 초기의 회사들이 많은 도움을 받으며 위기를 극복해냈다.

㈜올바른(대표 맹지수, 이하 올바른)은 창업 1년 차 회사로, 창업과 동시에 코로나19가 발발했다. 때문에 오프라인 매장의 오픈은 예정대로 진행될 수 없었고, 미리 준비했던 백화점 시식 행사마저 무산되는 등 시작부터 어려움을 겪어야 했다.



올바른은 중소벤처기업부의 ‘소상공인 온라인판로지원 사업 – 1인 미디어 콘텐츠 제작지원(PPL)’을 통해 이 위기를 극복했다. <ㅎㅎ마트> 출연으로 인기 연예인 하하가 상품을 시식하고 평가해 주는 등 제품의 홍보 효과를 톡톡히 얻었다. 이를 계기로 10월 말 ‘가치삽시다TV’와 티몬이 협업한 라이브커머스까지 진행했다.

맹지수 대표는 “열정만으로 창업을 했지만 코로나19로 인해 포기하고 싶은 순간이 많았다. 그때마다 중기부 사업의 도움을 받았다”며, “타 플랫폼 기획전에 들어가려면 무척 힘들다. MD 섭외부터 비용, 수수료 등 신경 써야 할 게 너무 많은데, 중기부 지원사업을 통해 기획전에 참여한 덕분에 플랫폼 진입에 수월했다”고 전했다. 또한 “매출 상승뿐만 아니라 소비자들에게 ‘쌀어묵’을 본격적으로 선보이며 소비자와의 소통이 필요하다는 것을 느꼈다. 이를 위한 온라인 진출의 중요성을 깨달았다”고 소감을 밝혔다.

원두커피 브랜드 ㈜커피만나(대표 박준상, 이하 커피만나)는 월 매출액 기준 500만 원을 채 넘기지 못하는 론칭한 지 3년 된 회사이다. 코로나19의 확산으로 그나마 발생하던 매출 역시 급감하면서, 배너 광고와 리스팅 광고 등 마케팅에도 노력을 기울였지만 효과가 미미했다. 이러한 상황에 고민하던 찰나 “아임스타즈”의 ‘소상공인 온라인판로지원 사업’을 알게 된 것이다.

박준상 대표는 “유튜브나 아프리카 BJ 같은 1인 미디어 콘텐츠가 효과적인 마케팅 수단으로 확대되고 있는 시기에, 1인 미디어 콘텐츠를 제작해 주고 PPL까지 지원한다는 사업 내용을 접하면서 곧바로 이거다 싶었다”며, “웹예능 <ㅎㅎ마트> 출연을 통해 인지도 척도라 할 수 있는 웹검색 횟수가 확연히 늘었다”고 전했다.

<ㅎㅎ마트>의 시청자들이 PPL 된 커피만나의 원두커피를 검색해 유입되며 원두커피를 직접 구매하는 것은 물론 다른 커피 재료까지 구매하는 현상이 발생했다. 이에 커피만나 원두커피 단일 품목은 150%, 회사 전체 매출의 35%가 성장하는 등 직접적으로 결과가 나타났다.

올바른과 커피만나를 지원한 <ㅎㅎ마트>는 인기 연예인 하하, 강재준, 지조가 출연해 소상공인들의 제품을 소개하는 형태의 웹예능이다. 소상공인들의 높은 관심으로 50개사 지원에 275개 업체가 신청할 만큼 인기가 많다.

중기부는 <ㅎㅎ마트> 외에도 개그맨 이상준, 김용명, 이은지와 배우 황석정, 백봉기 등이 출연하는 웹예능 <어떰유통 시즌2>를 오는 2021년 2월까지 진행, 소상공인 제품 PPL 홍보에 힘쓸 계획이다.

어떰유통은 비대면 행사 ‘2020 merry K-MAS 라이브마켓’을 진행해 소상공인 제품 12개 판매에 도전한다. 국민 MD 선정 제품 ‘아임셰프 밀키트’, ‘스카이트립 캠핑박스’, ‘핸드메이드 제주 모몽마카롱’을 포함해 소상공인 매출 증대를 도모한다.

어떰유통 라이브커머스는 12월 20일(일), 27일(일) 각 13시와 15시에 여러 채널을 통해 방송한다. 가치삽시다TV 유튜브 채널, 어떰유통 유튜브 채널, 가치삽시다 플랫폼 등이다. 판매 제품은 가치삽시다 플랫폼 기획전에서도 구매할 수 있으며, 라이브 방송 중에 구매할 경우에는 프로모션 혜택까지 지원할 예정이다.

이처럼 중소벤처기업부의 ‘2020년 소상공인 온라인판로지원 사업’은 코로나19의 확산으로 비대면 소비문화가 확대된 현재의 위기를 미래의 기회로 바꿀 소상공인들의 길잡이가 되고 있다. 디지털로의 전환을 통해 스마트 대한민국으로 나아갈 앞으로가 기대된다.
 "
2020-12-18 이미정,"중소기업벤처사업부 ‘온라인판로지원 사업’, 소상공인 디지털화로 위기 극복 도와","PPL 제작지원 사업... 연간 약 500개사 신청에 100개사 지원
자금난과 인력난으로 존립 위기에 처하거나 마땅한 홍보 수단을 찾지 못해 시장에서 사장되는 소상공인이 많은 것이 현실이다.



중소벤처기업부는 '2020년 소상공인 온라인판로지원 사업'을 통해 소상공인이 디지털로의 전환을 통해 비대면 소비문화 확산 속에서 위기를 기회로 바꿀 수 있도록 지원하고 있다.



주식회사 올바른(대표 맹지수)은 창업과 동시에 창궐한 코로나19로 시작부터 어려움을 겪었다. 오프라인 매장을 오픈할 예정이었으나 예정대로 진행되지 않았을 뿐만 아니라 미리 준비했던 백화점 시식 행사마저 무산됐다. 원두커피 브랜드인 주식회사 커피만나(대표 박준상)는 브랜드 론칭 이후 3년이 흘렀지만 월 매출액 기준 500만 원을 채 넘기지 못 하는 상황에서 코로나19로 그나마 발생하던 매출도 급감했다. 배너 광고, 리스팅 광고 등을 집행하며 마케팅에 힘써봤지만 저가 원두 광고에 밀려 효과를 보지 못 하는 상황이 이어졌다.



두 업체는 계속되는 실패 속에서 중소벤처기업부의 '소상공인 온라인판로지원 사업- 1인 미디어 콘텐츠 제작지원(ppl)'을 알게 되어 인기 연예인 하하 등 3명의 출연자가 소상공인들의 제품을 소개하는 형태의 웹예능 'ㅎㅎ마트'에 출연해 마케팅 도움을 받았다.



올바른은 ㅎㅎ마트 출연에 이어 가치삽시다TV와 티몬이 협업한 라이브커머스 방송으로 매출 증대는 물론 소비자에게 '쌀어묵'을 선보이며 소통과 온라인 진출의 필요성을 깨달았다. 커피만나는 ㅎㅎ마트에 ppl된 원두커피를 검색하여 유입된 소비자로 인해 직접 구매까지 이어지는 것은 물론, 다른 커피 재료를 구매하는 현상이 발생했다. 이에 직접적으로는 커피만나 원두커피 단일 품목의 150%, 회사 전체 매출의 35% 성장이라는 결과로 이어졌다.



올바른 맹지수 대표는 ""타 플랫폼 기획전에 들어가려면 MD섭외부터 비용, 수수료 등 신경 써야 할 게 너무 많고 지식이나 여력이 따라주질 못해 어려운데 중기부 지원사업을 통해 참여한 덕에 수월했다""고 전했다.



커피만나 박준상 대표는 ""중기부 사업을 통해 다른 온라인 기획전에서도 주기적으로 지원받을 수 있게 됐다""며 ""포스트 코로나가 아닌 위드 코로나 시대를 중기부 지원 사업과 함께 지혜롭게 헤쳐나가고 있다""고 전했다.



한편 올바른과 커피만나를 지원한 중기부의 '2020년 소상공인 온라인판로지원 사업-1인 미디어 콘텐츠 제작지원(PPL)'은 ㅎㅎ마트 외에도 개그맨 이상준, 김용명, 이은지와 배우 황석정, 백봉기 등이 출연하는 '어떰유통 시즌2'를 통해 오는 21년 2월까지 소상공인 제품의 홍보에 나선다.



특히 어떰유통은 소상공인 매출 증대를 위한 비대면 행사 '2020 merry K-MAS 라이브마켓'에 참여하며 국민MD 선정 제품인 '아임셰프 밀키트', '스카이트립 캠핑박스', '핸드메이드 제주 모몽마카롱'등을 비롯한 소상공인 제품 12개를 판매한다.



어떰유통 라이브 커머스는 12월 20일(일) 13시, 27일(일) 15시에 가치삽시다TV와 어떰유통 유튜브 채널 그리고 가치삽시다 플랫폼에서 시청 가능하며 판매 제품을 라이브 도중 구매할 경우 프로모션 혜택까지 제공할 예정이다.



이미정기자 lmj0919@dt.co.kr"
