Date,Title,Content
2020-12-10 김성준,"""충남 바이오식품산업 활성화해야""","상생형 일자리 특화 컨설팅 용역 중간보고회…사업체 수 많지만 종사자 수 저조
충남도가 고부가가치 일자리를 창출하기 위해 바이오식품산업을 활성화해야 한다는 제언이 나왔다.
도가 최근 개최한 '상생형 일자리 특화 컨설팅 용역 중간보고회' 자료에 따르면 올해 상반기 기준 충남의 바이오식품산업의 사업체 수는 1931개로 친환경자동차부품산업과 차세대디스플레이산업 등 3대 주력산업 중 가장 많은 반면 종사자 수는 가장 낮은 1만 4408명인 것으로 조사됐다.
조직형태별로 보면 개인사업체가 1452개로 가장 많았고 회사법인 391개, 회사 외 법인 86개, 비법인 2개 순이었다. 또한 바이오식품산업 사업체 중 1531개(78.3%)는 5인 이하 사업체로, 자동차부품산업(590개)과 차세대디스플레이(369개)에 비해 소규모 사업장이 많은 것으로 나타났다.
바이오식품산업은 그동안 자동차부품산업이나 디스플레이산업 등의 산업군에 비해 상대적으로 소외받아 왔으며, 이로 인한 양극화로 산업군 간 소득 격차가 확대돼 왔다. 바이오식품산업의 월평균 급여는 지난 9월 기준 272만 543원으로 2018년 동기 대비 7.6% 증가했지만, 여전히 주력산업과 비교시 -1.15% 낮은 것으로 분석됐다.
보고서는 바이오식품산업의 △양에 초점을 둔 생산철학 보유하고 있으며 질은 부차적으로 검토 △소비자만족을 위한 투자는 부재 △자기주도적 자체 사업화역량 제한적 △자체브랜드로 IT소통을 하는 업체는 소규모이나 관심 증대 △유통과 연계된 상품화 시도에 관심은 있으나 역량보유기업 소수 △진행하는 기업도 플랫폼에 수동적으로 끌려가는 기업이 다수 등을 지적했다.
구체적으로 보면 현재 사업자들은 글로벌화와 디지털화로 높아진 소비자 수준을 따라가지 못하고 있으며, 자본이 부족해 스마트공장과 신상품 개발 등에 적정한 투자와 기술확보를 하지 못하고 있는 것으로 드러났다. 또한 오프라인 중심의 지역적인 사업네트워크만 형성하고 있어 고부가가치 상품화를 추진하는 데 제한적인 점도 문제점으로 제시됐다.
도는 이러한 문제점들을 고려해 내년부터 오는 2025년까지 바이오식품산업 경쟁력 강화를 위한 단계별 로드맵을 구상하는 것에 대해 검토 중이라고 설명했다.
도 관계자는 ""충남의 바이오식품산업을 활성화하기 위해서는 소비자 욕구를 충족시킬 수 있는 차별화 노력이 필요하다""며 ""가정간편식과 조리 전 신선한 식재료를 제공하는 밀키트 등 새로운 유통과 연계된 상품화 등이 요구되는 시점""이라고 말했다.김성준 기자"
2020-12-10 이미정,"한국야쿠르트, 언택트시대 시대 색다른 신선배송 코코픽(COCO PICK)","한국야쿠르트는 발효유와 신선간편식 등 냉장상태로 보관이 필요한 제품을 비대면으로 배송 받을 수 있는 '코코픽'(COCO PICK)을 선보인다.



프레시 매니저를 통해 고객이 주문한 제품이 '코코픽'에 도착하면 도착알림과 함께 QR코드가 전송 된다. 고객은 코코픽에 설치된 스캐너에 전송받은 QR코드를 갖다 대면 제품을 찾아갈 수 있다.



제품의 도착부터 수령까지 전 과정에 걸쳐 프레시 매니저와 고객 모두 별도의 대면접촉이 없는 편리한 과정을 통해 신선한 상태로 제품을 전달 받을 수 있다.



코코픽 기본형은 개인형냉장보관함 32개와 신선간편식 중 밀키트 등 부피가 큰 제품을 보관 할 수 있는 공용 냉장 보관함 3개 총 35개로 구성되어 있다. 이용 고객이 많을 경우를 대비해 자유롭게 확장할 수 있는 모듈형 설계를 적용했다.



코코픽이 설치된 장소에서 한국야쿠르트 정기배송 서비스를 이용할 경우 고객은 비대면 픽업 서비스와 함께 개인형 냉장고 용도로도 사용 할 수 있다.



코코픽에 설치된 스마트 키오스크를 통해 한국야쿠르트 발효유와 신선간편식 '잇츠온' 등 제품을 자유롭게 주문 할 수 있다. 비대면 고객 문의를 위한 프레시 매니저 호출 기능을 이용해 실시간 통화도 가능하다.



기기 설치도 간단하다. 전원을 연결할 수 있는 공간만 있으면 바로 코코픽을 사용 할 수 있다. 기기 관리도 한국야쿠르트에서 직접 지속적으로 제공한다.



하성오 한국야쿠르트 개발담당자는 ""언택트 서비스에 대한 시대적 요구가 높아지는만큼 한국야쿠르트도 고객 니즈에 맞춘 변화에 박차를 가하고 있다""며 ""고객 경험 중심의 현장조사를 바탕으로 고객만족과 편의를 모두 충족시킬 수 있는 시스템과 서비스를 지속적으로 선보일 계획이다""고 말했다.



이미정기자 lmj0919@dt.co.kr"
2020-12-10 임소라,"한국야쿠르트, 기아차와 손잡고 THE K9 멤버십 고객 위한 ‘언택트 다이닝’ 실시","한국야쿠르트가 기자자동차와 손잡고 THE K9 멤버십 고객을 위한 비대면 만찬 프로그램인 'THE K9 멤버십 고메 언택트 다이닝'을 실시한다고 밝혔다.

'THE K9 멤버십 고메 언택트 다이닝'은 기아차가 THE K9 멤버십 고객들이 직접 요리한 음식으로 가족들과 특별한 홈파티를 즐길 수 있도록 기획한 연말 프로모션이다.

올해는 코로나19 상황을 고려해 한국야쿠르트의 신선 간편식 브랜드인 '잇츠온'과 함께 특별 구성한 5개의 밀키트 패키지를 당첨 고객에게 배송한다. 레시피 카드와 '잇츠온' 총괄 셰프의 레시피 영상도 함께 제공한다.

이번 프로모션은 12월 3일부터 12월 14일까지 기아차 공식 홈페이지, 기아 레드멤버스 사이트를 비롯해 기아차 통합 모바일 고객 앱 'KIA VIK' 또는 THE K9 멤버십 컨시어지를 통해 신청할 수 있다. THE K9 멤버십 회원이라면 누구나 응모 가능하다.

응모 시 크리스마스 홈파티와 연말 홈파티로 구분해 배송날짜를 선택할 수 있다. 총 600명의 고객을 선정해 색다른 만찬을 즐길 기회를 제공할 예정이다. 당첨자는 12월 16일 개별 통보된다.

한국야쿠르트 관계자는 “기아자동차와 함께 고객분들에게 즐거움을 드릴 기회가 생겨 기쁘게 생각한다”며, “앞으로도 업종의 경계를 넘어 많은 기업과의 협업으로 고객분들께 다양한 혜택이 돌아갈 수 있도록 노력하겠다”고 말했다.

임소라 기자 mail00@asiae.co.kr"
2020-12-10 이승진,"롯데百, 연말 홈파티 겨냥 ‘티본스테이크 밀키트’ 신규 출시","[아시아경제 이승진 기자] 롯데백화점이 크리스마스 연휴 및 연말 홈파티를 즐기는 고객들을 위해 오는 24일 ‘그레이터 오마하 티본스테이크 밀키트'를 신규 출시한다.

최근 홈쿡, 홈파티 등 집에서 즐기는 레스토랑이 대세가 되면서 구이용 소고기에 대한 수요가 급증했다. 특별한 날이 아닌 평상시에도 소고기를 즐기는 고객들이 많아져, 한우는 물론 부담 없는 가격에 즐길 수 있는 미국산, 호주산 등 수입육에 대한 매출이 크게 증가했다. 롯데백화점의 수입 소고기 매출은 최근 3개월 동안 36% 이상 신장했다. 등심, 안심 등 구이용의 경우 50% 이상 고신장 했다.

롯데백화점은 이러한 수요를 반영해 지난 10월부터 홈파티족을 겨냥한 스테이크 밀키트를 새롭게 선보이고 있다. 롯데백화점에서만 만날 수 있는 상품으로, 와규 부채살, 윗등심 스테이크 등 ‘스테이크 밀키트’ 6종, ‘시즈닝된 플렉스 스테이크 밀키트’ 5종 등 총 11종이다. 본점, 잠실점, 강남점 등 수도권 주요 점포에서 판매하고 있으며, 새로운 밀키트 출시에 힙입어 롯데백화점 수입 소고기 매출은 12월 들어 42% 이상 신장하고 있다.

롯데백화점은 크리스마스 연휴를 겨냥해 기존 스테이크 밀키트에 더해 특별한 날을 위한 ‘그레이터 오마하 티본스테이크 밀키트’를 추가로 선보인다. ‘그레이터 오마하’는 1920년 설립된 미국 프리미엄 소고기 생산업체로, 2017년 미국 백악관에서 열린 우수상품행사에 소고기 생산회사로는 유일하게 초청돼 ‘백악관 소고기’로 유명하다.

티본스테이크는 소의 안심과 등심 사이에 T자형의 뼈부분에 있는 것이라 붙여진 이름으로, 안심과 등심을 한꺼번에 맛볼 수 있는 고급 부위로 꼽힌다. 이번 밀키트 가격은 3만 9900원이며, 구성은 미국산 티본스테이크 560g, 소용량 올리브오일, 스테이크 시즈닝, 레드와인 소스가 포함되어 있어 간편하게 조리해서 즐길 수 있다.

롯데백화점은 티본스테이크 밀키트 출시를 기념해 지난 10월에 출시한 ‘플렉스 스테이크 밀키트’ 5종과 ‘와규 스테이크 밀키트’ 등 총 11종을 24일부터 27일까지 4일간 20% 특별 할인 판매할 예정이다.

전일호 롯데백화점 상품본부 식품팀장은 “최근 수입산 소고기에 대한 수요가 증가할 뿐만 아니라, 간편하게 즐기는 밀키트가 홈쿡의 필수로 자리 잡았다”며 “롯데백화점에서만 만날 수 있는 다양한 밀키트 상품들을 지속적으로 선보일 계획”이라고 말했다.

이승진 기자 promotion2@asiae.co.kr"
2020-12-10 김온유,"‘홈파티’ 대세 … 롯데, ‘백악관 스테이크’ 출시","트리 100여종·허브차 4종도



롯데가 신종 코로나바이러스 감염증(코로나19) 확산으로 연말 홈파티를 준비하는 이들을 위한 마케팅에 팔을 걷어붙였다.



롯데백화점은 오는 24일 ‘그레이터 오마하 티본스테이크 밀키트’를 새로 출시한다고 10일 밝혔다. ‘그레이터 오마하’는 1920년 설립된 미국 프리미엄 소고기 생산업체로, 2017년 미국 백악관에서 열린 우수상품행사에 소고기 생산회사로는 유일하게 초청돼 ‘백악관 소고기’로도 유명하다. 이번 밀키트는 미국산 티본스테이크 560g, 소용량 올리브오일, 스테이크 시즈닝, 레드와인 소스로 구성됐으며 가격은 3만9900원이다. 롯데마트는 오는 16일까지 ‘100여 종의 크리스마스트리와 다양한 장식품’을 할인가에 판매한다. 대표 상품으로 미니 장식트리 세트를 정상가 1만4900원에서 3000원 할인한 1만1900원에 판매하며, 솔나무트리 외에 다양한 크리스마스트리 100여 종을 선보인다. 롯데마트는 추운 연말을 따뜻하게 즐길 수 있는 친환경 허브차 4종도 내놨다. 롯데마트의 디저트 자체브랜드(PB)인 스윗허그 제품으로, 캐모마일·페퍼민트·루이보스·얼그레이 홍차 등 4종(2g*20입)이다. 식물 성분인 옥수수 전분으로 만든 폴리락타이드(PLA) 티백을 사용해 미세플라스틱 배출 염려를 줄인 친환경 제품이기도 하다.



김온유 기자 kimonu@munhwa.com"
2020-12-10 최일영,‘대구 곱창의 변신’ 남구 새 곱창요리 개발·보급,"대구의 명물인 ‘곱창’이 새롭게 태어난다. 대구 남구는 곱창요리의 고급화, 대중화를 통해 지역 상권을 부활시킬 계획이다.

남구는 최근 ‘전국 곱창요리 레시피 공모전(안지랑의 맛)’을 개최해 새로운 곱창요리 10개를 선정했다고 10일 밝혔다. 이 사업은 코로나19로 침체된 안지랑 곱창골목 상권을 살리기 위한 것이다. 냄새 등의 이유로 호불호가 갈리는 곱창 원재료를 개선해 곱창요리를 대학생 등 젊은 세대가 즐겨 찾는 먹거리로 만들겠다는 것이다.

남구에는 50여개의 곱창·막창 가게들이 모여 있는 안지랑 곱창골목이 있다. 지역 명소로 꼽히지만 예전만큼 손님이 몰리지 않고 있다. 여기에 코로나19까지 겹쳐 상인들이 어려움을 겪고 있다.

전국 곱창요리 레시피 공모전은 코로나19 상황 때문에 비대면 행사로 열렸다. 요리를 전공하는 전국 고등학생과 대학생들이 젊은 감성을 담은 새로운 곱창요리 조리법과 조리 과정 영상을 제출했다. 지난 9월 14일부터 10월 30일까지 7주간의 공모 기간 동안 고등학생 4팀, 대학생 47팀, 기타 5팀 등 56팀이 참가했다.

요리 전문가와 안지랑 곱창골목 상인, 계명문화대학교 학생들이 심사를 해 새롭고 참신한 곱창요리 10작품을 최종 선정했다. 대상은 ‘곱창무침’이 차지했고 최우수상은 ‘곱창강정’, 우수상은 ‘안지랑 치즈 곱창숙주부추볶음’과 ‘돼지곱창 오코노미야끼 부침개’, 장려상은 ‘곱창 마라탕’과 ‘불곱창 맥앤치즈 짜글이’가 차지했다. ‘고추깐풍곱창과 중화풍 볶음국수’ ‘돼지곱창 대파고추잡채’ ‘돼지곱창 볼’ ‘치폴레마요 곱창 핫도그’도 심사를 통과했다.

남구는 최종 선정된 10작품 중 안지랑 곱창골목 번영회에서 관심을 가진 메뉴 5개의 조리법 등을 안지랑 곱창골목 상인 20여명에게 전수했다. 또 이번 공모전에서 대상을 받은 ‘곱창무침’ 제품을 밀키트(Meal-Kit·간편하게 요리할 수 있도록 필요한 식재료와 양념, 조리법을 제공하는 제품)로 만들어 안지랑 곱창골목 전체 음식점에 보급했다.

남구는 이달 안에 새 곱창요리 조리법을 모두 표준화하고 조리법 책자, 조리 영상을 제작해 안지랑 곱창골목에 보급할 예정이다.

대구=최일영 기자 mc102@kmib.co.kr"
2020-12-10 정혜윤|기자|,롯데百 '백악관 소고기' 티본스테이크 밀키트 출시,"[머니투데이 정혜윤 기자] [구이용 수입 소고기 매출 증가, 최근 3개월 50% 신장]


롯데백화점이 ‘그레이터 오마하 티본스테이크 밀키트'를 출시한다고 10일 밝혔다.

최근 홈쿡, 홈파티 등 집에서 즐기는 레스토랑이 대세가 되면서, 구이용 소고기에 대한 수요가 급증했다. 한우는 물론 부담 없는 가격에 즐길 수 있는 미국산, 호주산 등 수입육에 대한 매출이 크게 증가했다. 롯데백화점의 수입 소고기 매출은 최근 3개월 동안 36% 이상 신장했으며 등심, 안심 등 구이용의 경우 50% 이상 증가했다.

롯데백화점은 지난 10월부터 홈파티족을 겨냥한 스테이크 밀키트를 새롭게 선보이고 있다. 와규 부채살, 윗등심 스테이크 등 ‘스테이크 밀키트’ 6종, ‘시즈닝된 플렉스 스테이크 밀키트’ 5종 등 총 11종이다.

본점, 잠실점, 강남점 등 수도권 주요 점포에서 판매하고 있으며 밀키트 출시에 힙입어 롯데백화점 수입 소고기 매출은 12월 들어 42% 이상 신장하고 있다.

롯데백화점은 오는 24일 기존 스테이크 밀키트에 더해 특별한 날을 위한 ‘그레이터 오마하 티본스테이크 밀키트’를 추가로 선보인다. ‘그레이터 오마하’는 1920년 설립된 미국 프리미엄 소고기 생산업체로, 2017년 미국 백악관에서 열린 우수상품행사에 소고기 생산회사로는 유일하게 초청돼 ‘백악관 소고기’로 유명하다.

티본스테이크는 소의 안심과 등심 사이에 T자형의 뼈부분에 있는 것이라 붙여진 이름으로, 안심과 등심을 한꺼번에 맛볼 수 있는 고급 부위로 꼽힌다. 밀키트 가격은 3만 9900원이며, 구성은 미국산 티본스테이크 560g, 소용량 올리브오일, 스테이크 시즈닝, 레드와인 소스가 포함되어 있어 간편하게 조리해서 즐길 수 있다.

롯데백화점은 티본스테이크 밀키트 출시를 기념해, 지난 10월에 출시한 ‘플렉스 스테이크 밀키트’ 5종과 ‘와규 스테이크 밀키트’ 등 총 11종을 오는 24일부터 27일까지 4일간 20% 특별 할인 판매할 예정이다."
2020-12-10 이미경(capital@hankyung.com);,'연말 외식도 못하는데'…홈파티 인기에 소고기 매출도 '껑충',"신종 코로나바이러스 감염증(코로나19)으로 연말 모임이 홈파티로 많이 개최되며 대표 메뉴인 소고기 수요도 늘고 있다.

롯데백화점은 지난 9~11월 수입 소고기 매출이 지난해 같은 기간 대비 36% 증가했다고 10일 밝혔다. 특히 등심, 안심 등 구이용 매출은 50% 이상 증가했다.

외식 대신 집밥을 먹는 경우가 늘면서 특별한 날이 아닌 때에도 부담 없는 가격에 수입 소고기를 즐기는 소비자가 많아진 것으로 롯데백화점은 분석했다.

롯데백화점은 이에 발맞춰 지난 10월부터 본점과 잠실점 등 수도권 주요 점포에서 홈파티를 겨냥한 스테이크 밀키트 11종을 판매하고 있다.

롯데백화점은 크리스마스이브인 오는 24일 수도권 주요 점포에서 '그레이터 오마하 티본스테이크 밀키트'를 추가로 선보인다.

'그레이터 오마하'는 미국의 프리미엄 소고기 생산업체로, 2017년 미국 백악관에서 열린 우수상품행사에 초청돼 '백악관 소고기' 업체로 알려지기도 했다.

롯데백화점 상품본부 전일호 식품팀장은 ""최근 수입산 소고기에 대한 수요가 증가할 뿐만 아니라, 간편하게 즐기는 밀키트가 홈쿡의 필수로 자리 잡았다""고 전했다.

이미경 한경닷컴 기자 capital@hankyung.com"
2020-12-09 김아름,연말엔 송년회 대신 집콕… `홈파티` 공략 나선 유통업계,"수도권 사회적 거리두기 2.5단계 집객 마케팅 애로 라그릴리아 등 위기돌파용 홈파티용 제품 선봬
[디지털타임스 김아름 기자] 연말과 크리스마스를 앞둔 유통업계가 '홈파티' 카드를 꺼내들었다. 수도권의 사회적 거리두기 2.5단계 실시로 적극적인 집객 마케팅을 펼치기 어려운 상황에서 '홈파티용' 제품들을 선보여 위기를 돌파한다는 계획이다.



9일 업계에 따르면 주요 외식 브랜드들은 연말을 맞아 홈파티용 세트 메뉴를 출시하고 예약 배달 서비스를 선보이는 등 '홈파티족'을 겨냥한 서비스를 잇달아 내놓고 있다.



SPC그룹의 캐주얼 레스토랑 브랜드 라그릴리아는 파티 세트, 스페셜 세트 등의 세트 메뉴를 박스 패키지에 담아 고객이 원하는 시간과 장소에 배송해 주는 서비스를 진행하고 있다. 연말까지는 모든 메뉴의 배달을 무료로 진행하며 4만원 이상 주문 시 추가 메뉴를 증정하는 이벤트도 진행 중이다.



CJ푸드빌이 운영하는 배달 전용 브랜드 '빕스 얌 딜리버리'는 홈파티를 위한 '윈터 얌파티 세트'를 출시했다. 연말 분위기를 더해줄 미니 화로 굿즈 '얌그릴'과 디저트로 마쉬멜로 스큐어도 함께 제공한다.



이미 크리스마스 모드에 돌입한 백화점들도 올해엔 홈파티용 상품 판매에 집중하고 있다. 신세계백화점은 라이프스타일 매장 '피숀'을 통해 크리스마스 한정판 상품들을 선보였고 롯데백화점도 오는 20일까지 본점에서 수입 테이블 웨어 및 홈데코 상품들을 판매하는 '크리스마스 마켓'을 진행한다.



단체 모임보다는 가족, 연인과 오붓한 홈파티를 계획하는 소비자들을 겨냥한 파티용 밀키트를 내놓기도 한다.



CJ제일제당의 밀키트 브랜드 '쿡킷'은 연말 저녁 식탁을 화려하게 수놓고 싶은 소비자들을 타깃으로 한 홈파티 테마의 신메뉴 4종을 선보였다. 랍스타와 양갈비 스테이크, 수비드 닭가슴살 스테이크 등 기존보다 호화로운 재료들을 사용한 것이 특징이다.



파리바게뜨도 크리스마스 케이크 출시와 함께 자체 간편식 브랜드인 퍼스트 클래스 키친의 메뉴로 구성한 '홈파티 패키지'를 선보인다. GS25가 집에서 칵테일을 즐기고픈 사람들을 위해 선보인 '캄파리 홈텐딩 키트'는 14만5000원이라는 고가임에도 불구하고 출시되자마자 500세트가 완판됐다.



한 업계 관계자는 ""외식·유통업계는 예년같은 연말 특수를 기대할 수 없는 상황""이라며 ""시장 트렌드가 홈파티·집콕 등으로 모이고 있는 만큼 이에 맞춘 상품들로 위기를 돌파하겠다""고 말했다.



김아름기자 armijjang@dt.co.kr"
2020-12-09 박원수 기자,”변화로 위기 돌파”... 새 레시피 개발한 대구 안지랑 곱창골목,"전국 곱창요리 레시피 공모전 개최 대상 수상작 ‘곱창무침’은 밀키트로 판매할 수 있도록 추진
대구 남구 안지랑 곱창골목은 전국적으로 이름이 알려진 음식거리다. 1980년 시장 인근에서 양념곱창으로 시작된 이 골목은 점차 음식점 수가 늘어나면서 현재 50여개의 음식점이 곱창요리 제품을 판매하고 있는 단일 품목으로는 전국 최대의 골목이다.

지난달 농림축산식품부가 주최한 ‘전국 외식업 선도지구 경진대회’에서 최우수거리로 선정됐으며, 전국 5대 음식테마거리 및 한국 관광100선에도 선정돼 인기를 구가하고 있다. 지금도 밤이면 불에 익는 곱창 냄새가 풍겨오고 있지만 코로나19로 이곳 역시 고전을 면치 못하고 있다.

그러나 이곳 안지랑 곱창골목이 위기돌파를 위해 새로운 메뉴 개발을 꾀하고 있다. 안주하지 않고 끊임없는 변신을 통해 진화하고 있는 것이다.

대구 남구청은 지난 4일 전국 곱창요리 레시피 공모전인 ‘안지랑의 맛’ 사업 성과 보고회를 열었다. 여기에는 계명문화대 산학협력단 및 안지랑 곱창골목 상가번영회 등 20여명이 참석했다.

이번 ‘안지랑의 맛’ 공모사업이 추진된 것은 코로나19로 침체된 안지랑 곱창골목 상권을 살리고 곱창의 원재료를 개선해 대학생 등 젊은 세대가 즐겨 찾는 활기찬 먹거리 골목으로 탈바꿈 하기 위해서다

당초 라이브 경연대회로 출발했지만 지난 8월을 기점으로 전국적으로 코로나19가 확산세를 보임에 따라 ‘전국 언택트 곱창요리 레시피 공모전&컨설팅’으로 변경해 진행했다.

이번 공모전에는 요리를 전공하는 전국의 고등학생과 대학생들이 젊은 감성을 담은 새로운 곱창요리의 레시피와 조리 전 과정 영상을 제출하는 방법으로 진행됐다. 참가팀은 고등학생 4팀, 대학생 47팀, 기타 5팀 등 총 56팀이었다.

참가팀들이 제출한 곱창요리 레시피에 대해 요리 전문가와 현장 경험이 풍부한 안지랑 곱창골목 음식점 영업주, 계명문화대학교 학생들이 세 번에 걸쳐 심사를 진행했다. 그 결과 남녀노소 누구나 좋아할 새롭고 참신한 곱창요리 10작품을 최종 선정했다.

심사 결과 대상은 ‘곱창무침’이 선정됐다. 최우수상은 ‘곱창강정’, 우수상은 ‘안지랑 치즈 곱창숙주부추볶음’과 ‘돼지곱창 오코노미야끼 부침개’가, 장려상은 ‘곱창 마라탕’과 ‘불곱창 맥앤치즈 짜글이’, 입선은 ‘고추깐풍곱창과 중화풍 볶음국수’, ‘돼지곱창 대파고추잡채’, ‘돼지곱창 볼’, ‘치폴레마요 곱창 핫도그’가 각각 선정됐다.

이중 대상을 수상한 ‘곱창무침’은 일반적으로 곱창이 불에 구워 먹는다는 것에서 탈피해 회무침을 벤치마킹해 곱창을 삶은뒤 무침으로 요리하는 것이다. 쫄깃한 곱창과 채소의 조화로운 만남을 통한 상큼한 맛이 일품이라는 평가를 받았다.

남구는 최종 선정된 10작품 중 안지랑 곱창골목 번영회에서 선호하는 다섯 가지 메뉴로 지난달 22일 안지랑 곱창골목 영업주 20여명을 대상으로 요리 전문가 실습 교육과 곱창 원재료 손질법 등 컨설팅을 진행했다.

이와 함께 공모전에서 대상을 받은 ‘곱창무침’ 제품을 음식점에서 밀키트(Meal-Kit·식재료와 양념, 조리법을 세트로 구성해 제공하는 제품)화 해 상품으로 판매할 수 있도록 시제품을 만들어 안지랑 곱창골목 전체 음식점에 보급했다.

한편 남구는 올해 안으로 새롭게 발굴한 곱창요리 메뉴 레시피를 표준화해 제작한 레시피 책자와 조리 영상을 안지랑 곱창골목 전체 음식점에 보급할 예정이다.

머지 않아 안지랑 곱창골목이 새로운 메뉴로 무장해 고객들을 맞이할 수 있을 것으로 기대되고 있다.

조재구 남구청장은 “이번 ‘안지랑의 맛’ 공모전을 통해 젊은 감각이 묻어나는 새로운 곱창요리가 발굴돼 매우 기쁘다”며 “새롭게 개발한 곱창요리 메뉴를 음식점에 맞게 활용해 안지랑 곱창골목에 많은 젊은 세대가 찾아와 다시 번창할 수 있는 계기가 되기를 바란다”고 말했다."
