Date,Title,Content
2020-07-31 이세연,캠핑 감성 ‘업’ 해주는 고음질의 보스(BOSE) 사운드...캠핑 스타일별 알맞은 블루투스 스피커 추천,"언택트 여가문화가 확산되고 있는 가운데 캠핑의 인기가 날로 치솟고 있다. 텐트나 캠핑의자 등 캠핑 용품은 품귀 현상을 보이고 있으며, 캠핑용 밀키트나 아이스박스 등 관련 제품 수요도 함께 급증하고 있다. 계절의 변화와 자연을 가장 가까이에서 느낄 수 있는 캠핑은 트레킹을 즐길 수 있는 백패킹부터 특별한 장비 없이 즐길 수 있는 오토캠핑 그리고 낭만적인 글램핑 등 각자의 취향에 따라 즐길 수 있어 더욱 매력적이다. 이 같은 캠핑에 빠질 수 없는 것이 바로 분위기를 좌우하는 블루투스 스피커다. 공간의 제약 없이 캠핑 감성을 한층 끌어올려 주기 때문이다. 휴대하기 간편하고 날씨 변화에 최적화돼 야외 활동 시 활용하기 좋은 블루투스 스피커 제품을 소개한다.

미니멀한 백패킹에 어울리는 가벼운 블루투스 스피커

백패킹은 배낭에 간단한 장비만 챙겨 떠나는 미니멀 캠핑으로, 자연을 가장 가까이에서 느낄 수 있는 매력이 있다. 최소한의 장비와 음식을 챙기는 백패킹의 특성상 꼭 필요한 짐만 챙겨 가방의 무게를 조절하는 것이 관건이다. 콤팩트한 무게로 야외 활동에 최적화되어 백패킹의 매력을 배가시켜주는 블루투스 스피커를 함께 챙겨 보자.

보스(BOSE)의 ‘보스 사운드링크 마이크로(Bose SoundLink Micro)’는 290g의 가벼운 무게로 날씨와 환경에 구애받지 않도록 설계된 제품이다. 부드럽고 견고한 실리콘 러버 외관으로 생활 속 충격에 강해 야외 활동 시 적합하며, IPX7의 완전 방수 등급 덕에 활동 중 예측하지 못한 비에도 걱정할 필요가 없다. 제품의 다목적 스트랩을 활용하면 백팩이나 자전거에 고정할 수 있어 등산 및 라이딩 시 양손 자유롭게 언제 어디서나 간편히 휴대하여 풍부한 중저음의 사운드를 즐길 수 있다. 실제 해당 제품은 많은 라이딩족 사이에서 유용한 블루투스 스피커로 입소문을 타고 있다.

‘보스 사운드링크 컬러 2(Bose SoundLink Color II)’는 콤팩트한 사이즈와 IPX4 등급의 생활 방수를 지원해 야외 활동에 최적화된 제품이다. 둥근 형태의 디자인으로 그립감이 탁월하며 유연한 소재의 실리콘 바디를 갖춰 휴대성과 내구성을 두루 갖췄다. 보스의 독자적인 음향 기술이 집약된 듀얼패시브라디에이터가 내장돼 깊은 베이스와 크고 풍성한 풀레인지 사운드를 최대 8시간 동안 즐길 수 있다.

‘보스 사운드웨어 컴패니언(Bose SoundWear Companion)'은 어깨에 편안하게 걸쳐 간편하게 착용할 수 있는 웨어러블 스피커 제품이다. 오픈 이어 형태를 갖춰 두 손과 귀가 자유로우며 266g의 가벼운 무게와 IPX4 등급의 방수 기능을 지녀 백패킹에 활용하기 좋다. 개인의 신체에 맞게 조정 가능한 특수 소재로 설계돼 장시간 착용하고 있어도 편안함을 느낄 수 있다.



글램핑장을 영화관으로 만들어줄 파워풀한 블루투스 스피커

텐트를 비롯한 캠핑 장비가 이미 세팅되어 있어 누구나 쉽고 편하게 경험할 수 있는 글램핑은 분리된 공간에서 온전한 휴식을 즐길 수 있기에 초보 캠퍼들에게 인기를 얻고 있다. 최근에는 텐트 벽이나 캠핑용 스크린으로 영상을 볼 수 있는 미니빔 프로젝터를 챙겨 영상을 즐기는 캠핑족도 늘어나고 있어 이에 걸맞은 사운드를 제공해 줄 블루투스 스피커를 함께 챙겨가는 것이 좋다.

‘보스 포터블 홈 스피커(Bose Portable Home Speaker)’는 넓게 퍼지는 360도의 사운드와 파워풀한 베이스로 장소와 관계없이 놀라운 사운드를 경험할 수 있게 해준다. 편리하게 휴대할 수 있는 핸들 디자인 덕에 실내는 물론 야외에서도 쉽게 휴대하여 사용할 수 있으며, 최대 12시간 동안 사용 가능해 출발하는 차 안에서부터 캠핑장에 도착하기까지 하루 종일 사용해도 방전 걱정이 없다. 우수한 내구성과 IPX4등급의 방수 기능 덕에 캠핑 도중 예측하지 못한 비가 내리거나 외부 충격이 발생해도 걱정할 필요가 없다.

360도 사운드로 차박 캠핑 분위기 띄워주는 블루투스 스피커

장비를 싣고 차 안에서 즐기는 차박은 텐트나 특별한 캠핑 장비가 없어도 간편하게 이동하고 머물 수 있다는 장점 덕에 솔로부터 가족 단위까지 다양한 차박 마니아들을 생성해내고 있다. 안락하게 즐기는 차박 캠핑에서 분위기에 걸맞은 사운드를 제공하는 블루투스 스피커를 활용한다면 낭만적인 차박 분위기를 한층 더 고조시켜줄 것이다.

‘보스 사운드링크 리볼브(Bose SoundLink Revolve)’는 360도의 사운드를 제공해 어떤 방향에서 들어도 중후하고 파워풀한 사운드를 느낄 수 있다. 스피커의 상, 하부는 부드러운 소재로 제작돼 외부 충격에 강할 뿐 만 아니라, IPX4 등급의 방수 기능으로 갑작스럽게 물이 튀거나 비가 오게 돼도 걱정 없이 음악을 즐길 수 있다.

‘보스 사운드링크 리볼브+(Bose SoundLink Revolve+)’는 파워풀한 360도의 사운드를 최대 16시간 동안 즐길 수 있어 아침에는 음악감상, 밤에는 영화감상 등 다방면으로 활용할 수 있다. 내구성이 뛰어난 IPX4등급의 방수 설계 덕에 어떤 날씨 변화에도 방해 받지 않고 유용하게 사용할 수 있다. 제품을 손쉽게 이동할 수 있게 해주는 유연한 패브릭 핸들 덕에 캠핑장 어느 곳에서나 휴대하기 좋다.

디지털기획팀 이세연 lovok@kmib.co.kr"
2020-07-31 백인철,“캠핑 감성 ‘업’해주는 고음질의 보스(BOSE) 사운드” 캠핑 스타일별 알맞은 블루투스 스피커 추천,"언택트 여가문화가 확산되고 있는 가운데 캠핑의 인기가 날로 치솟고 있다. 텐트나 캠핑의자 등 캠핑 용품은 품귀 현상을 보이고 있으며, 캠핑용 밀키트나 아이스박스 등 관련 제품 수요도 함께 급증하고 있다. 계절의 변화와 자연을 가장 가까이에서 느낄 수 있는 캠핑은 트레킹을 즐길 수 있는 백패킹부터 특별한 장비 없이 즐길 수 있는 오토캠핑 그리고 낭만적인 글램핑 등 각자의 취향에 따라 즐길 수 있어 더욱 매력적이다. 이 같은 캠핑에 빠질 수 없는 것이 바로 분위기를 좌우하는 블루투스 스피커다. 공간의 제약 없이 캠핑 감성을 한층 끌어올려 주기 때문이다. 프리미엄 오디오 브랜드 보스가 알려주는, 휴대하기 간편하고 날씨 변화에 최적화돼 야외 활동 시 활용하기 좋은 블루투스 스피커 제품을 소개한다.



■ 미니멀한 백패킹에 어울리는 가벼운 블루투스 스피커



백패킹은 배낭에 간단한 장비만 챙겨 떠나는 미니멀 캠핑으로, 자연을 가장 가까이에서 느낄 수 있는 매력이 있다. 최소한의 장비와 음식을 챙기는 백패킹의 특성상 꼭 필요한 짐만 챙겨 가방의 무게를 조절하는 것이 관건이다. 콤팩트한 무게로 야외 활동에 최적화되어 백패킹의 매력을 배가시켜주는 블루투스 스피커를 함께 챙겨 보자.



보스(BOSE)의 '보스 사운드링크 마이크로(Bose SoundLink Micro)'는 290g의 가벼운 무게로 날씨와 환경에 구애받지 않도록 설계된 제품이다. 부드럽고 견고한 실리콘 러버 외관으로 생활 속 충격에 강해 야외 활동 시 적합하며, IPX7의 완전 방수 등급 덕에 활동 중 예측하지 못한 비에도 걱정할 필요가 없다. 제품의 다목적 스트랩을 활용하면 백팩이나 자전거에 고정할 수 있어 등산 및 라이딩 시 양손 자유롭게 언제 어디서나 간편히 휴대하여 풍부한 중저음의 사운드를 즐길 수 있다. 실제 해당 제품은 많은 라이딩족 사이에서 유용한 블루투스 스피커로 입소문을 타고 있다.



'보스 사운드링크 컬러 2(Bose SoundLink Color II)'는 콤팩트한 사이즈와 IPX4 등급의 생활 방수를 지원해 야외 활동에 최적화된 제품이다. 둥근 형태의 디자인으로 그립감이 탁월하며 유연한 소재의 실리콘 바디를 갖춰 휴대성과 내구성을 두루 갖췄다. 보스의 독자적인 음향 기술이 집약된 듀얼패시브라디에이터가 내장돼 깊은 베이스와 크고 풍성한 풀레인지 사운드를 최대 8시간 동안 즐길 수 있다.



'보스 사운드웨어 컴패니언(Bose SoundWear Companion)'은 어깨에 편안하게 걸쳐 간편하게 착용할 수 있는 웨어러블 스피커 제품이다. 오픈 이어 형태를 갖춰 두 손과 귀가 자유로우며 266g의 가벼운 무게와 IPX4 등급의 방수 기능을 지녀 백패킹에 활용하기 좋다. 개인의 신체에 맞게 조정 가능한 특수 소재로 설계돼 장시간 착용하고 있어도 편안함을 느낄 수 있다.



■ 글램핑장을 영화관으로 만들어줄 파워풀한 블루투스 스피커



텐트를 비롯한 캠핑 장비가 이미 세팅되어 있어 누구나 쉽고 편하게 경험할 수 있는 글램핑은 분리된 공간에서 온전한 휴식을 즐길 수 있기에 초보 캠퍼들에게 인기를 얻고 있다. 최근에는 텐트 벽이나 캠핑용 스크린으로 영상을 볼 수 있는 미니빔 프로젝터를 챙겨 영상을 즐기는 캠핑족도 늘어나고 있어 이에 걸맞은 사운드를 제공해 줄 블루투스 스피커를 함께 챙겨가는 것이 좋다.



'보스 포터블 홈 스피커(Bose Portable Home Speaker)'는 넓게 퍼지는 360도의 사운드와 파워풀한 베이스로 장소와 관계없이 놀라운 사운드를 경험할 수 있게 해준다. 편리하게 휴대할 수 있는 핸들 디자인 덕에 실내는 물론 야외에서도 쉽게 휴대하여 사용할 수 있으며, 최대 12시간 동안 사용 가능해 출발하는 차 안에서부터 캠핑장에 도착하기까지 하루 종일 사용해도 방전 걱정이 없다. 우수한 내구성과 IPX4등급의 방수 기능 덕에 캠핑 도중 예측하지 못한 비가 내리거나 외부 충격이 발생해도 걱정할 필요가 없다.



■ 360도 사운드로 차박 캠핑 분위기 띄워주는 블루투스 스피커



장비를 싣고 차 안에서 즐기는 차박은 텐트나 특별한 캠핑 장비가 없어도 간편하게 이동하고 머물 수 있다는 장점 덕에 솔로부터 가족 단위까지 다양한 차박 마니아들을 생성해내고 있다. 안락하게 즐기는 차박 캠핑에서 분위기에 걸맞은 사운드를 제공하는 블루투스 스피커를 활용한다면 낭만적인 차박 분위기를 한층 더 고조시켜줄 것이다.



'보스 사운드링크 리볼브(Bose SoundLink Revolve)'는 360도의 사운드를 제공해 어떤 방향에서 들어도 중후하고 파워풀한 사운드를 느낄 수 있다. 스피커의 상, 하부는 부드러운 소재로 제작돼 외부 충격에 강할 뿐 만 아니라, IPX4 등급의 방수 기능으로 갑작스럽게 물이 튀거나 비가 오게 돼도 걱정 없이 음악을 즐길 수 있다.



'보스 사운드링크 리볼브+(Bose SoundLink Revolve+)'는 파워풀한 360도의 사운드를 최대 16시간 동안 즐길 수 있어 아침에는 음악감상, 밤에는 영화감상 등 다방면으로 활용할 수 있다. 내구성이 뛰어난 IPX4등급의 방수 설계 덕에 어떤 날씨 변화에도 방해 받지 않고 유용하게 사용할 수 있다. 제품을 손쉽게 이동할 수 있게 해주는 유연한 패브릭 핸들 덕에 캠핑장 어느 곳에서나 휴대하기 좋다.



백인철기자 chaos@dt.co.kr"
2020-07-31 김동호 기자,“캠핑 감성 ‘업’해주는 고음질의 보스(BOSE) 사운드”캠핑 스타일별 알맞은 블루투스 스피커 추천,"언택트 여가문화가 확산되고 있는 가운데 캠핑의 인기가 날로 치솟고 있다. 텐트나 캠핑의자 등 캠핑 용품은 품귀 현상을 보이고 있으며, 캠핑용 밀키트나 아이스박스 등 관련 제품 수요도 함께 급증하고 있다. 계절의 변화와 자연을 가장 가까이에서 느낄 수 있는 캠핑은 트레킹을 즐길 수 있는 백패킹부터 특별한 장비 없이 즐길 수 있는 오토캠핑 그리고 낭만적인 글램핑 등 각자의 취향에 따라 즐길 수 있어 더욱 매력적이다. 이 같은 캠핑에 빠질 수 없는 것이 바로 분위기를 좌우하는 블루투스 스피커다. 공간의 제약 없이 캠핑 감성을 한층 끌어올려 주기 때문이다. 휴대하기 간편하고 날씨 변화에 최적화돼 야외 활동 시 활용하기 좋은 블루투스 스피커 제품을 소개한다. 미니멀한 백패킹에 어울리는 가벼운 블루투스 스피커 백패킹은 배낭에 간단한 장비만 챙겨 떠나는 미니멀 캠핑으로, 자연을 가장 가까이에서 느낄 수 있는 매력이 있다. 최소한의 장비와 음식을 챙기는 백패킹의 특성상 꼭 필요한 짐만 챙겨 가방의 무게를 조절하는 것이 관건이다. 콤팩트한 무게로 야외 활동에 최적화되어 백패킹의 매력을 배가시켜주는 블루투스 스피커를 함께 챙겨 보자. 보스(BOSE)의 ‘보스 사운드링크 마이크로(Bose SoundLink Micro)’는 290g의 가벼운 무게로 날씨와 환경에 구애받지 않도록 설계된 제품이다. 부드럽고 견고한 실리콘 러버 외관으로 생활 속 충격에 강해 야외 활동 시 적합하며, IPX7의 완전 방수 등급 덕에 활동 중 예측하지 못한 비에도 걱정할 필요가 없다. 제품의 다목적 스트랩을 활용하면 백팩이나 자전거에 고정할 수 있어 등산 및 라이딩 시 양손 자유롭게 언제 어디서나 간편히 휴대하여 풍부한 중저음의 사운드를 즐길 수 있다. 실제 해당 제품은 많은 라이딩족 사이에서 유용한 블루투스 스피커로 입소문을 타고 있다. ‘보스 사운드링크 컬러 2(Bose SoundLink Color II)’는 콤팩트한 사이즈와 IPX4 등급의 생활 방수를 지원해 야외 활동에 최적화된 제품이다. 둥근 형태의 디자인으로 그립감이 탁월하며 유연한 소재의 실리콘 바디를 갖춰 휴대성과 내구성을 두루 갖췄다. 보스의 독자적인 음향 기술이 집약된 듀얼패시브라디에이터가 내장돼 깊은 베이스와 크고 풍성한 풀레인지 사운드를 최대 8시간 동안 즐길 수 있다. ‘보스 사운드웨어 컴패니언(Bose SoundWear Companion)'은 어깨에 편안하게 걸쳐 간편하게 착용할 수 있는 웨어러블 스피커 제품이다. 오픈 이어 형태를 갖춰 두 손과 귀가 자유로우며 266g의 가벼운 무게와 IPX4 등급의 방수 기능을 지녀 백패킹에 활용하기 좋다. 개인의 신체에 맞게 조정 가능한 특수 소재로 설계돼 장시간 착용하고 있어도 편안함을 느낄 수 있다.

글램핑장을 영화관으로 만들어줄 파워풀한 블루투스 스피커 텐트를 비롯한 캠핑 장비가 이미 세팅되어 있어 누구나 쉽고 편하게 경험할 수 있는 글램핑은 분리된 공간에서 온전한 휴식을 즐길 수 있기에 초보 캠퍼들에게 인기를 얻고 있다. 최근에는 텐트 벽이나 캠핑용 스크린으로 영상을 볼 수 있는 미니빔 프로젝터를 챙겨 영상을 즐기는 캠핑족도 늘어나고 있어 이에 걸맞은 사운드를 제공해 줄 블루투스 스피커를 함께 챙겨가는 것이 좋다. ‘보스 포터블 홈 스피커(Bose Portable Home Speaker)’는 넓게 퍼지는 360도의 사운드와 파워풀한 베이스로 장소와 관계없이 놀라운 사운드를 경험할 수 있게 해준다. 편리하게 휴대할 수 있는 핸들 디자인 덕에 실내는 물론 야외에서도 쉽게 휴대하여 사용할 수 있으며, 최대 12시간 동안 사용 가능해 출발하는 차 안에서부터 캠핑장에 도착하기까지 하루 종일 사용해도 방전 걱정이 없다. 우수한 내구성과 IPX4등급의 방수 기능 덕에 캠핑 도중 예측하지 못한 비가 내리거나 외부 충격이 발생해도 걱정할 필요가 없다. 360도 사운드로 차박 캠핑 분위기 띄워주는 블루투스 스피커 장비를 싣고 차 안에서 즐기는 차박은 텐트나 특별한 캠핑 장비가 없어도 간편하게 이동하고 머물 수 있다는 장점 덕에 솔로부터 가족 단위까지 다양한 차박 마니아들을 생성해내고 있다. 안락하게 즐기는 차박 캠핑에서 분위기에 걸맞은 사운드를 제공하는 블루투스 스피커를 활용한다면 낭만적인 차박 분위기를 한층 더 고조시켜줄 것이다. ‘보스 사운드링크 리볼브(Bose SoundLink Revolve)’는 360도의 사운드를 제공해 어떤 방향에서 들어도 중후하고 파워풀한 사운드를 느낄 수 있다. 스피커의 상, 하부는 부드러운 소재로 제작돼 외부 충격에 강할 뿐 만 아니라, IPX4 등급의 방수 기능으로 갑작스럽게 물이 튀거나 비가 오게 돼도 걱정 없이 음악을 즐길 수 있다. ‘보스 사운드링크 리볼브+(Bose SoundLink Revolve+)’는 파워풀한 360도의 사운드를 최대 16시간 동안 즐길 수 있어 아침에는 음악감상, 밤에는 영화감상 등 다방면으로 활용할 수 있다. 내구성이 뛰어난 IPX4등급의 방수 설계 덕에 어떤 날씨 변화에도 방해 받지 않고 유용하게 사용할 수 있다. 제품을 손쉽게 이동할 수 있게 해주는 유연한 패브릭 핸들 덕에 캠핑장 어느 곳에서나 휴대하기 좋다. /김동호 기자 dongho@sedaily.com"
2020-07-31 임소라,“캠핑 감성 ‘업’해주는 고음질의 보스(BOSE) 사운드” 캠핑 스타일별 알맞은 블루투스 스피커 추천,"언택트 여가문화가 확산되고 있는 가운데 캠핑의 인기가 날로 치솟고 있다. 텐트나 캠핑의자 등 캠핑 용품은 품귀 현상을 보이고 있으며, 캠핑용 밀키트나 아이스박스 등 관련 제품 수요도 함께 급증하고 있다. 계절의 변화와 자연을 가장 가까이에서 느낄 수 있는 캠핑은 트레킹을 즐길 수 있는 백패킹부터 특별한 장비 없이 즐길 수 있는 오토캠핑 그리고 낭만적인 글램핑 등 각자의 취향에 따라 즐길 수 있어 더욱 매력적이다. 이 같은 캠핑에 빠질 수 없는 것이 바로 분위기를 좌우하는 블루투스 스피커다. 공간의 제약 없이 캠핑 감성을 한층 끌어올려 주기 때문이다. 휴대하기 간편하고 날씨 변화에 최적화돼 야외 활동 시 활용하기 좋은 블루투스 스피커 제품을 소개한다.

미니멀한 백패킹에 어울리는 가벼운 블루투스 스피커

백패킹은 배낭에 간단한 장비만 챙겨 떠나는 미니멀 캠핑으로, 자연을 가장 가까이에서 느낄 수 있는 매력이 있다. 최소한의 장비와 음식을 챙기는 백패킹의 특성상 꼭 필요한 짐만 챙겨 가방의 무게를 조절하는 것이 관건이다. 콤팩트한 무게로 야외 활동에 최적화되어 백패킹의 매력을 배가시켜주는 블루투스 스피커를 함께 챙겨 보자.

보스(BOSE)의 ‘보스 사운드링크 마이크로(Bose SoundLink Micro)’는 290g의 가벼운 무게로 날씨와 환경에 구애받지 않도록 설계된 제품이다. 부드럽고 견고한 실리콘 러버 외관으로 생활 속 충격에 강해 야외 활동 시 적합하며, IPX7의 완전 방수 등급 덕에 활동 중 예측하지 못한 비에도 걱정할 필요가 없다. 제품의 다목적 스트랩을 활용하면 백팩이나 자전거에 고정할 수 있어 등산 및 라이딩 시 양손 자유롭게 언제 어디서나 간편히 휴대하여 풍부한 중저음의 사운드를 즐길 수 있다. 실제 해당 제품은 많은 라이딩족 사이에서 유용한 블루투스 스피커로 입소문을 타고 있다.

‘보스 사운드링크 컬러 2(Bose SoundLink Color II)’는 콤팩트한 사이즈와 IPX4 등급의 생활 방수를 지원해 야외 활동에 최적화된 제품이다. 둥근 형태의 디자인으로 그립감이 탁월하며 유연한 소재의 실리콘 바디를 갖춰 휴대성과 내구성을 두루 갖췄다. 보스의 독자적인 음향 기술이 집약된 듀얼패시브라디에이터가 내장돼 깊은 베이스와 크고 풍성한 풀레인지 사운드를 최대 8시간 동안 즐길 수 있다.

‘보스 사운드웨어 컴패니언(Bose SoundWear Companion)'은 어깨에 편안하게 걸쳐 간편하게 착용할 수 있는 웨어러블 스피커 제품이다. 오픈 이어 형태를 갖춰 두 손과 귀가 자유로우며 266g의 가벼운 무게와 IPX4 등급의 방수 기능을 지녀 백패킹에 활용하기 좋다. 개인의 신체에 맞게 조정 가능한 특수 소재로 설계돼 장시간 착용하고 있어도 편안함을 느낄 수 있다.

글램핑장을 영화관으로 만들어줄 파워풀한 블루투스 스피커

텐트를 비롯한 캠핑 장비가 이미 세팅되어 있어 누구나 쉽고 편하게 경험할 수 있는 글램핑은 분리된 공간에서 온전한 휴식을 즐길 수 있기에 초보 캠퍼들에게 인기를 얻고 있다. 최근에는 텐트 벽이나 캠핑용 스크린으로 영상을 볼 수 있는 미니빔 프로젝터를 챙겨 영상을 즐기는 캠핑족도 늘어나고 있어 이에 걸맞은 사운드를 제공해 줄 블루투스 스피커를 함께 챙겨가는 것이 좋다.

‘보스 포터블 홈 스피커(Bose Portable Home Speaker)’는 넓게 퍼지는 360도의 사운드와 파워풀한 베이스로 장소와 관계없이 놀라운 사운드를 경험할 수 있게 해준다. 편리하게 휴대할 수 있는 핸들 디자인 덕에 실내는 물론 야외에서도 쉽게 휴대하여 사용할 수 있으며, 최대 12시간 동안 사용 가능해 출발하는 차 안에서부터 캠핑장에 도착하기까지 하루 종일 사용해도 방전 걱정이 없다. 우수한 내구성과 IPX4등급의 방수 기능 덕에 캠핑 도중 예측하지 못한 비가 내리거나 외부 충격이 발생해도 걱정할 필요가 없다.

360도 사운드로 차박 캠핑 분위기 띄워주는 블루투스 스피커

장비를 싣고 차 안에서 즐기는 차박은 텐트나 특별한 캠핑 장비가 없어도 간편하게 이동하고 머물 수 있다는 장점 덕에 솔로부터 가족 단위까지 다양한 차박 마니아들을 생성해내고 있다. 안락하게 즐기는 차박 캠핑에서 분위기에 걸맞은 사운드를 제공하는 블루투스 스피커를 활용한다면 낭만적인 차박 분위기를 한층 더 고조시켜줄 것이다.

‘보스 사운드링크 리볼브(Bose SoundLink Revolve)’는 360도의 사운드를 제공해 어떤 방향에서 들어도 중후하고 파워풀한 사운드를 느낄 수 있다. 스피커의 상, 하부는 부드러운 소재로 제작돼 외부 충격에 강할 뿐 만 아니라, IPX4 등급의 방수 기능으로 갑작스럽게 물이 튀거나 비가 오게 돼도 걱정 없이 음악을 즐길 수 있다.

‘보스 사운드링크 리볼브+(Bose SoundLink Revolve+)’는 파워풀한 360도의 사운드를 최대 16시간 동안 즐길 수 있어 아침에는 음악감상, 밤에는 영화감상 등 다방면으로 활용할 수 있다. 내구성이 뛰어난 IPX4등급의 방수 설계 덕에 어떤 날씨 변화에도 방해 받지 않고 유용하게 사용할 수 있다. 제품을 손쉽게 이동할 수 있게 해주는 유연한 패브릭 핸들 덕에 캠핑장 어느 곳에서나 휴대하기 좋다.

임소라 기자 mail00@asiae.co.kr"
