Date,Title,Content
2020-12-24 김효혜,"[트렌드] `집콕족` 유혹하는 버거, 언양 불고기 맛 그대로","2020년은 코로나19의 출현으로 외출을 자제하고 집에서 시간을 보내는 것이 자연스러운 일상으로 자리 잡은 한 해였다. 휴식뿐 아니라 근무·여가생활까지 자택에서 하는 '집콕' 문화의 확산은 식문화에도 많은 변화를 가져왔다. 특히 맛집 여행이나 지역 특산물을 즐기고자 하는 갈망이 커진 사람들을 위해 유통업계는 집에서도 손쉽게 전국 각지의 로컬 메뉴나 식재료들을 만나볼 수 있는 노력을 선보이고 있다.
버거킹은 최근 언양식 불고기의 맛과 식감을 살린 '직화 소불고기버거'와 '직화 버섯불고기버거'를 새롭게 출시했다. '언양식 불고기' 방식 그대로 슬라이스된 순쇠고기에 파와 마늘, 숙성간장으로 양념한 패티를 직화 방식으로 조리한 것이 특징으로, 출시 4주도 채 되지 않아 판매량 100만개를 넘길 정도로 큰 사랑을 받고 있다. 버거킹 관계자는 ""기존 불고기버거 제품에서는 만날 수 없었던 100% 순쇠고기 슬라이스로 만든 패티로 진짜 불고기 같은 맛과 식감을 즐길 수 있다""며 ""버거킹 고유의 직화 방식으로 패티를 구워 '불맛'까지 느껴지는 것이 특징""이라고 전했다.
식음료 트렌드에 민감한 편의점 업계는 집에서 직접 간편하게 즐길 수 있도록 편의성을 강화하는 데 중점을 뒀다. GS25는 국내 팔도 지역의 고유 식재료를 콘셉트로 '팔도차림' 도시락 시리즈를 선보인다고 밝혔으며, 올해 9월 첫 번째 상품으로 경상북도 의성의 대표 메뉴인 '의성마늘보쌈 도시락'을 내놨다. CU는 이달 모바일 애플리케이션 '포켓CU'를 통해 전국 맛집 메뉴들을 모은 세트를 새롭게 출시했다. 부산 얼짱 쭈꾸미, 영주 나드리 쫄면 등으로 구성된 '경상도 맛집 세트', 광주 알찬 냄비 알찜, 고양 서오릉 화동갈비 떡갈비 등으로 구성된 '전국 맛집 캠핑 세트', 의정부 한양 부대찌개, 속초 티각태각 고구마 등으로 구성된 '맛집 다드림 세트' 등 총 3종으로 구성됐다. 특정 지역을 콘셉트로 한 메뉴를 선보이는 곳도 있다. 이마트는 '한식'을 기반으로 지역 특색 음식을 밀키트로 재구성해 선보일 계획을 밝혔다. 첫 번째 시리즈로 올해 7월 '강원도의 밥상'을 출시했으며, '강릉식 짬뽕 순두부' '원주식 장칼국수' '영월식 청국장' 등 지역 특징을 살린 메뉴로 구성했다.
한편 전국 각지의 식재료들을 안방으로 가져오기 위해 유통 판로를 지원하는 기업들의 활동도 눈에 띈다. 롯데쇼핑의 온라인 플랫폼 롯데온(ON)은 강원도와 업무 협약을 맺고 강원 우수 특산품 발굴 및 마케팅 활성화, 판로 확대 지원에 나섰다.
[김효혜 기자]"
2020-12-24 백희준,올 연말은 ‘집콕 홈리데이’로 즐겨볼까,"집에서 보내는 크리스마스·연말 지역 유통가, 집콕족 위한 대규모 할인 간편식·홈파티완구·와인 등 최대 80%
유통가가 집에서 연말과 크리스마스를 보내는 ‘홈리데이’(Home+Holiday) 열풍에 맞춰 대규모 할인행사를 펼친다.
이마트는 연말까지 가정간편식을 비롯해 즉석조리식품 등 먹거리를 20% 할인 판매한다고 23일 밝혔다.
이 기간 동안 이마트는 자체 출시한 ‘피코크’ 상품을 행사카드로 사면 20% 할인한다.
대표 상품으로 ‘피코크 잭슨피자 시카고 페퍼로니’와 ‘피코크 감바스·감바스 스파이’, ‘피코크 레드와인소스 스테이크’ ‘피코크 마몰로 뉴욕 치즈케익’ 등이 있다.
또 신세계포인트 회원을 대상으로 브랜드 한우 전품목을 30% 할인해주며, ‘남해안 생굴’(250g·봉)도 2000원 할인된 7980원에 판매한다.
이달 들어 1~15일 이마트의 밀키트 매출은 1년 전보다 335.4%나 증가했다. 밀키트는 손질된 식재료를 데우기만 하면 완성되는 즉석 조리 식품이다.
이와 함께 이마트는 오는 27일까지 홈파티에 사용할 수 있는 완구 전품목을 행사카드로 10만원 이상 구매 때 2만원 할인 판매한다. 같은 기간 동안 보드게임 총 350여 종을 20% 저렴한 가격에 내놓는다.
㈜광주신세계는 코로나19로 억눌린 소비심리가 표출되는 ‘보상소비’ 경향을 겨냥해 다양한 프리미엄 생활 가전·가구를 선보이고 있다.
광주신세계 8층 생활전문관에서는 프랑스 음향기기 제조사의 캡슐 모양 스피커 ‘드비알레 팬텀’을 선보이고 있다. 이 제품은 500만원을 호가하는데, 이 매장에서는 200만~1000만원대 프리미엄 오디오와 스피커 제품을 만날 수 있다.
같은 층에서는 이달 31일까지 맞춤형 프리미엄 가구 브랜드인 ‘블랑드누아’ 임시매장(팝업스토어)이 운영된다. 판매되는 식탁은 친환경 세라믹 소재로, 고객 주문에 따라 맞춤형으로 식탁 상판과 다리가 제작된다. 이 식탁(스타투아리오)은 임시매장 운영 기간 동안 160만원 할인한 290만원에 판매된다. 방수·발수·향균 기능을 갖춘 쇼파(클라우드·피카소)는 각 240만원 할인한 410만원에 내놓았다.
100만~500만원 이상 구매한 고객에 구매 금액에 따라 할인 혜택도 주어진다.
롯데백화점 광주점 지하 1층 와인매장은 오는 27일까지 1000여 종 와인을 할인 가격에 선보인다.
최대 할인율은 30~80%로, 스위스, 프랑스, 이탈리아 그리스 등에서 온 와인을 만날 수 있다. 홈파티를 즐길 수 있도록 세계 각국의 다양한 치즈도 함께 매대를 채웠다. 같은 백화점 2층 ‘록시땅’ 화장품 매장은 연말을 맞아 핸드크림, 바디로션 등으로 구성된 ‘홀리데이 에디션’ 상품을 선보이고 있다.
롯데아울렛 남악점은 오는 27일까지 1층 ‘러블리스퀘어’에 ‘크리스마스 설렘’이라는 주제로 ‘마크라메’를 활용한 인테리어 소품을 전시한다. 마크라메란 끈으로 매듭을 엮어 만든 조형물로, 다양한 분위기를 연출하는 소품으로 쓰이고 있다.
롯데마트 광주수완점과 월드컵점에 있는 ‘토이저러스’ 매장은 크리스마스를 앞두고 영유아 장난감, 학습완구, 블록놀이, 역할놀이, 미술 창작놀이 등 총 1만여 개의 장난감을 품목별로 최대 50% 할인 판매한다. 제휴카드로 7만원 이상 구매하면 1만원 상당 롯데상품권도 증정한다.
/백희준 기자 bhj@kwangju.co.kr"
2020-12-24 김기정,[Consumer Journal] 미쉐린 맛집이 우리집 식탁으로 왔다,"미쉐린 맛집 대표 메뉴를 카트에 담아 집에서 간편하게 해 먹는 시대가 열렸다. 방배동 파스타 맛집 '도우룸'의 '까르보나라', 한남동 가정식 맛집 '일호식'의 스키야키, 연남동 태국식당 '툭툭누들타이'의 팟타이, 서교동 순대 맛집 '리북방'의 순대전골 등 피코크 '고수의 맛집' 브랜드가 미쉐린까지 라인업을 확장하고 있다.
서초구 방배동에 위치한 도우룸은 미쉐린 1스타를 획득한 서래마을 파인 다이닝 레스토랑 '스와니예'의 이준 셰프가 선보인 미쉐린 플레이트 맛집이다. 음식점 이름부터 '파스타 면을 만드는 공간'이라는 의미를 지닐 정도로 '생면 파스타'를 고집하는 이탈리안 레스토랑이다. 일반 파스타 면은 장기간 보관할 수 있고 상대적으로 가격이 저렴한 건면이다. 하지만 도우룸은 생면을 써야 제대로 된 파스타 요리를 표현할 수 있다는 철학 아래 힘들고 번거롭지만 생면을 고수한다. 이마트는 지난해 12월 도우룸 메뉴를 피코크 밀키트로 개발해보자는 의사를 타진했다. 이후 가장 대중적이면서도 이탈리아를 대표하는 면 요리인 까르보나라를 밀키트 개발 메뉴로 선정했으며, 면을 전문적으로 제조하는 협력회사 '면사랑'과 손잡고 이마트·도우룸·면사랑이 6개월간 상품 개발 과정을 거친 끝에 피코크 도우룸 까르보나라를 선보일 수 있었다.
용산구 한남동에 자리한 일호식은 2018년, 2020년, 2021년 세 차례 미쉐린 가이드에 오른 가정식 맛집이다. 김범환 이마트 피코크 담당 바이어는 신규 미쉐린 밀키트를 구상하다 온 가족이 먹기 좋고 집에 있는 식재료를 넣어 먹기에도 안성맞춤인 대용량 찌개, 나베 등이 인기가 높은 점에 착안해 맛집 탐방에 나서게 됐다. 일호식의 대표 메뉴 스키야키는 김 바이어 마음을 바로 사로잡았다. 맛이 달달하고 진한 일본 정통 스키야키와 달리 일호식 스키야키는 국물이 자작해 샤브샤브와 스키야키의 중간 형태를 띠면서 맛이 심심한 대신 산뜻한 유자간장을 활용해 맛에 포인트를 줬다. 이마트는 올해 5월 일호식에 스키야키 밀키트 상품화를 제안했으며 10차례 넘게 시제품을 만들고 개선하는 노력 끝에 지난 11월 피코크 일호식 스키야키를 내놓게 됐다.
마포구 연남동에 위치한 태국 음식점 툭툭누들타이는 국내 태국 음식 전문점 1세대로 여겨지는 곳으로, 미쉐린 가이드 서울에 4년 연속으로 선정될 만큼 대중에게도 널리 알려진 맛집이다. 특히 태국 현지 셰프들을 직접 고용해 본고장 맛을 고스란히 재현해낸 덕에 꾸준한 인기를 구가하고 있다.
실제로 미쉐린 가이드는 툭툭누들타이에 대해 ""레몬 그라스와 고수, 라임과 코코넛 밀크 등 태국 음식에서 빠질 수 없는 재료를 이용해 특유의 시큼 달달한 맛의 음식을 선보인다. 셰프의 넉넉한 인심과 태국 현지 분위기를 느낄 수 있어 더욱 매력적인 이곳에서 파란색 툭툭(Tuk Tuk)과 함께 이국적인 정취를 느껴보길 바란다""고 평하고 있다. 이마트는 지난 7월 툭툭누들타이와 손잡고 피코크 밀키트 개발에 나서 태국 하면 가장 먼저 떠오르는 팟타이를 출시했으며, 향후 ?얌꿍·텃만꿍 등 툭툭누들타이 대표 요리를 추가로 선보이기 위해 상품 개발에 박차를 가하고 있다.
지난달 5일 출시한 피코크 리북방 순대전골은 서교동에 위치한 순대 맛집 리북방의 레시피로 만든 전통 이북식 순대전골이다. 리북방은 이름에서도 알 수 있듯이 이북식 음식을 전문으로 하는 곳으로, 함경도 출신 할머니에게 조리법을 전수받은 최지형 셰프가 선보인 순대 기반 요리가 일품으로 평가받는다. 최 셰프는 미국에서 요리를 배우고 국내 양식 레스토랑에서 일하면서 익혔던 양식 레시피를 녹여 이북식 순대와 양식의 볼로네즈 소스를 베이스로 하는 이북방 고유의 순대전골을 창조해냈다. 이를 바탕으로 2019년과 2020년에는 '서교고메'라는 이름으로 미쉐린 명단에 이름을 올렸으며, 리북방으로 상호를 변경한 뒤 2021년에도 미쉐린 플레이트에 선정됐다. 리북방은 새벽에 재료를 구매해 이북식 레시피에 맞춰 매일 직접 만드는 순대를 사용하는 것으로 유명하다. 이마트는 이와 같은 순대 레시피를 가정간편식에 그대로 녹여내는 데 어려움을 겪었지만 순대 전문 제조사 '보승'과 협업해 가장 근접한 맛을 잡아낼 수 있었다.
이렇게 탄생한 피코크 리북방 순대전골은 백순대, 피순대 등 두 가지 순대를 모두 맛볼 수 있는 것이 특징으로 직화용기를 활용해 어디서든 간편하게 조리할 수 있다. 집에서는 물론 야외활동 중에도 간편하게 즐길 수 있다.
※ 유명 맛집과 컬래버, 집콕 미식가 필수템…피코크 '고수의 맛집'은
미쉐린 밀키트를 포함한 피코크 '고수의 맛집' 브랜드는 유명 맛집과의 컬래버레이션으로 완성된 제품이다. 이마트가 올해 1~11월 매출을 분석한 결과 피코크 고수의 맛집 누계 매출이 200억원을 넘어선 것으로 확인됐다. 이는 지난해 같은 기간 대비 112.3% 늘어난 수치로 같은 기간 피코크 전체 매출 신장률 31.4%를 훌쩍 넘어선다. 히트 상품도 눈에 띈다. 올해 피코크 가정간편식 매출 순위 1~10위를 살펴보면 고수의 맛집 상품이 5개나 자리 잡고 있는 것을 확인할 수 있다.
[김기정 기자]"
2020-12-24 이여진,유명맛집 메뉴 간편하게 집에서 즐긴다…경기중기청-프레시지 '맞손',"백년가게 제품 '밀키트' 출시
지동관의 깐쇼새우, 장흥회관의 낙지곱창전골 등 경기도 유명 맛집 메뉴를 간편조리식품으로 집에서 간편히 먹을 수 있게 됐다.

경기지방중소벤처기업청(이하 경기중기청)은 간편식품 제조기업 (주)프레시지와 손잡고 오는 28일 경기지역 백년가게 제품 밀키트(간편조리식품)를 출시한다고 23일 밝혔다.

이는 지난 10월 중소벤처기업부가 프레시지·백년가게협의회와 체결한 '백년가게 소상공인의 디지털 전환 지원을 위한 업무협약'에 따른 것이다.

이번에 밀키트로 출시되는 상품은 50년 정통의 의정부 '지동관' 깐쇼새우, 35년 전통의 이천 '장흥회관' 낙지곱창전골, 30년 전통의 화성 '이화횟집' 산낙지볶음과 낙지전골 등 3개 점포 4개 메뉴다.

오는 28일 배달의민족 'B마트'에서 첫 선을 보이며 1월 첫 주부터는 전국 온·오프라인 유통망을 통해 전 국민에게 본격적으로 판매된다.

이는 백년가게 메뉴가 밀키트화 돼 디지털로 판매되는 전국 최초 사례다.

경기중기청은 수도권 소재 백년가게 9곳을 밀키트 사업대상으로 추가 선정해 상품 개발에 착수하는 한편, 내년 상반기 전국 40여곳의 백년가게 메뉴를 밀키트로 출시하는 등 백년가게 디지털화에 박차를 가한다는 방침이다.

백운만 경기중기청장은 ""코로나19로 어려움을 겪는 음식점을 돕기 위해 예비 유니콘 기업인 프레시지와 백년가게가 상생 협력했다""며 ""이번 사업으로 소상인들이 활력을 얻고 K-FOOD의 위상을 높이기 위해 노력할 것""이라고 밝혔다.

/이여진기자 aftershock@kyeongin.com"
2020-12-24 김태희 기자,소상공인 비대면 판로개척 돕는 백년가게 밀키트 본격 출시…전국 첫 상생협력 사례,"경기지역 백년가게들의 온라인 판로 개척을 위해 탄생한 ‘백년가게 밀키트’가 첫선을 보인다. 백년가게 메뉴가 밀키트화 된 전국 첫 상생협력 사례로, 비대면 시대를 맞아 백년가게의 디지털화를 촉진할 수 있을 것으로 기대를 모으고 있다.

경기지방중소벤처기업청(청장 백운만)은 오는 28일 간편 식품 전문 제조기업인 ㈜프레시지와 경기지역 백년가게 협업을 통해 생산한 밀키트를 본격 출시한다고 23일 밝혔다. 지난 10월 ‘백년가게 소상공인의 디지털 전환 지원’을 위해 중기부-프레시지-백년가게협의회간 자상한 기업 업무협약을 체결한 지 2달 만에 이뤄진 성과다.

이번에 출시되는 백년가게 매뉴는 지동관(중화요리ㆍ의정부), 장흥회관(해물탕ㆍ이천), 이화횟집(낙지전골ㆍ화성) 등 3개 업체 4개 매뉴다. 점포에서 직접 조리한 음식의 맛을 내기 위해 백년가게 대표가 개발 과정에 참여해 백년가게의 깊은맛을 집에서도 즐길 수 있도록 했다.

㈜프레시지는 시범사업으로 추진한 백년가게의 밀키트 개발ㆍ생산이 완료됨에 따라 28일 배달의 민족 ‘B마트’를 통해 처음 출시할 예정이다. 1월 첫째주부터는 전국 유통망을 갖고 있는 온ㆍ오프라인 채널을 통해 본격 판매를 개시한다. 판매수익의 일부는 백년가게에게 로열티 형태로 지급된다.

아울러 경기중기청은 전국 백년가게를 대상으로 밀키트화를 추진하고 있다. 우선 수도권에 소재한 백년가게 9곳을 선정해 밀키트 개발에 착수했으며, 내년 상반기에는 전국적으로 최대 40여곳의 백년가게 매뉴를 밀키트로 만나 볼 수 있게 될 전망이다.

백운만 청장은 “코로나19로 음식점들이 어려움을 겪고 있는 상황을 극복하기 위해 경기지역에 소재한 예비유니콘 기업인 프레시지와 백년가게가 자발적으로 상생협력하는 사례로 큰 의미가 있다”며 “내년에는 전국 백년가게들이 밀키트로 온라인 시장 진출을 촉진하고 국내를 넘어 세계화될 수 있도록 정책역량을 집중하겠다”고 말했다.

한편 용인에 위치한 프레시지는 이번 사업을 통해 중소ㆍ벤처기업으로서는 최초로 ‘자상한 기업’으로 선정됐다. 자상한 기업은 자발적 상생 협력 기업의 줄임말로, 자발적 상생협력 문화를 확산함으로써 지속 가능한 새로운 상생모델로서 추진하고 있는 사업이다.

김태희기자"
2020-12-23 추승현 기자,"'뽕숭아학당' 임영웅X영탁X장민호, 자가격리 셀프캠 공개…TOP6 감격의 상봉","‘뽕숭아학당’에서 트롯맨들의 2주간의 자가 격리 생활을 고스란히 담은 ‘100% 리얼’ 셀프캠을 최초로 공개한다.

23일 방송되는 TV CHOSUN 예능 프로그램 ‘뽕숭아학당’에서는 신종 코로나바이러스 감염증(코로나19) 여파로 자가 격리에 돌입했던 트롯맨들이 직접 찍은 ‘자가 격리 셀프카메라’를 통해 각자 자신만의 방식으로 보낸 집콕 생활을 낱낱이 선보인다.

임영웅-영탁-장민호는 방송에서 보여준 멋진 모습이 아닌, 순도 만점의 생생함을 거리낌 없이 드러내 놀라움을 안겼다. 특히 깎지 않은 덥수룩한 수염까지 과시한 임영웅은 소파와 한 몸이 된 채 TV를 보다 잠이 드는 모습으로 친근감을 높였다.

그동안 바빠서 하지 못했던 취미활동인 ‘신발 커스텀’에 돌입한 임영웅은 라텍스 장갑까지 끼고 장인다운 포스를 뿜어냈다. 이어 임영웅은 세상에 단 하나뿐인 ‘임영웅표 신발’을 완성했고, 이를 ‘뽕숭아학당’ 컴백 녹화에 선물로 가지고 와 환호를 불러일으켰다. 과연 트롯맨들과 붐쌤에 이르기까지 모두가 탐내 현장을 아수라장으로 만든 임영웅표 ‘커스텀 신발’의 주인공은 누가 될 지 궁금증이 증폭되고 있다.

트롯맨 대표 ‘싱어송라이터’ 영탁은 꺼지지 않는 예술혼을 불태워 눈길을 사로잡았다. 최근 한 시상식에서 ‘베스트 송라이터상’을 수상하기도 했던 영탁은 자가 격리 중에도 곡 작업에 열정을 쏟아내며 시간을 보냈던 것. 기본 멜로디 작곡부터 가이드 녹음까지 프로듀싱 전반을 셀프캠에 담은 영탁은 ‘니가 왜 거기서 나와’를 함께 만든 작곡가 지광민에게 전화를 걸어 여자 목소리까지 흉내 내며 자문을 구해, 최고의 열정 만렙임을 다시 한번 증명했다.

맏형 장민호는 ‘트롯 신사’다운 고품격 취미로 우아한 집콕 생활을 보여줬다. ‘사슴’이라는 별명에 걸맞게 스스로 ‘사슴 트리’를 조립하고, 전구를 활용해 거실을 꾸미는 가하면, ‘턴테이블’로 노래 감상을 하는 등 겨울에 딱 어울리는 활동들로 아늑하고 따뜻한 분위기를 자아냈다.

더욱이 트롯맨들 ‘OB 라인’인 첫째 장민호와 둘째 영탁은 둘만의 오붓한 랜선 식사를 통해 우애를 다졌다. ‘요.알.못’이었던 영탁은 ‘안동 찜닭 밀키트’를 활용해 요리에 나섰지만 당면을 불리는 과정에서 우왕좌왕하며 폭소를 유발한 반면, 장민호는 ‘차돌박이 떡볶이’를 완벽하게 성공시키는 모습으로 요리왕의 위용을 드러냈다. 좌충우돌 준비과정 끝에 두 사람은 랜선 식사를 함께하면서 ‘언택트 건배’를 건네 서로를 향한 돈독함을 더했다.

드디어 자가 격리가 해제된 후 정동원까지 합세한 TOP6의 감격적인 첫 녹화 현장도 공개된다. 2주 만에 재회한 TOP6는 더욱 격하게 서로를 반기며 기뻐했고, 트롯맨으로 함께 맞이하는 첫 크리스마스를 보내며, 유쾌한 흥을 분출했다.

제작진 측은 “항상 기쁨과 감동을 선사하기 위해 노력했던 트롯맨들이 무사히 자가 격리를 마치고 시청자들 품으로 돌아왔다”라며 “어려운 상황 속에서도 걱정해 준 많은 팬들을 위해 트롯맨들 역시 선물 같은 시간을 준비했다. 끝까지 행복한 마음으로 지켜봐 주시면 좋겠다”라고 전했다.

/추승현기자 chush@sedaily.com"
2020-12-23 김현주,"친환경 옷 입는 식품업계, 진화하는 ‘에코 패키지’ 눈길","최근 친환경에 대한 필요성이 높아지면서 식품업계에서도 친환경 패키지를 적용한 제품들이 주목받고 있다. 특히 최근 친환경에 대한 필요성이 높아지면서 식품업계에서도 친환경 패키지를 적용한 제품들이 주목받고 있다. 소비자들 사이에 가치소비 트렌드가 확산되고 정부의 친환경 포장 정책이 강화되면서 손쉬운 분리배출을 위한 에코 라벨부터 기존 플라스틱 용기를 종이 용기로 대체한 제품, 인증 받은 친환경 소재를 포장에 도입한 제품 등이 출시되고 있다.

정식품은 최근 손쉽게 분리할 수 있는 ‘에코 라벨’을 도입한 ‘베지밀 검은콩 두유’ 병 제품을 리뉴얼 출시했다. 에코 라벨은 소비자가 쉽고 빠르게 라벨을 제거하고 재활용할 수 있도록 분리배출선이 적용된 라벨이다. 절취선 부분에 '라벨을 병과 분리해서 재활용해 주세요'라는 안내문구를 넣어 소비자의 자발적인 분리배출 참여를 유도한 것이 특징이다. 또한 내년 초에는 달콤한 두유 베지밀 비 950ml 팩 제품을 시작으로 950ml 대용량 팩 제품군에 친환경 원료로 만들어진 바이오 캡(뚜껑) 도입을 추진한다는 계획이다.

풀무원녹즙은 지난 달 ‘수분리 라벨’을 적용한 ‘프레시 석류&콜라겐’과 ‘프레시 당근&망고’를 출시했다. 수분리 라벨은 물에 쉽게 녹아 분리가 용이한 라벨로, 소비자들이 손쉽게 분리배출 할 수 있도록 만들어졌다.

기존 사용하던 포장재를 변경해 플라스틱 사용량 감축에 나선 기업도 있다. 동원F&B는 지난 8월 외부 충격으로부터 내용물을 보호하는 플라스틱 용기를 제거한 ‘양반김 에코패키지’를 출시했다. 포장 부피가 줄어 플라스틱은 물론 비닐과 종이 사용까지 절감했다. 포장지에는 ‘레이저 컷팅 필름’ 기술을 도입한 점선을 넣어 손쉽게 뜯을 수 있게 해 포장지를 뜯는 과정에서 발생하는 제품 파손을 방지했다.

밀키트 전문기업 프레시지는 플라스틱 패키지를 지함 형태의 종이 패키지로 전면 교체했다. 이를 통해 자연 분해되지 않는 플라스틱의 사용량을 90% 이상 절감한 효과를 얻었다. 여기에 별도 제공되던 레시피 안내문을 패키지 후면에 넣어 종이 사용량도 함께 줄였다.

친환경 인증을 받은 소재를 사용한 제품도 있다. 롯데제과는 지난 9월부터 대표 제품인 ‘마가렛트’에 녹색인증 포장을 적용하고 있다. 농림축산식품부와 녹색인증사무국으로부터 환경 독성 물질 대체 및 유해성 저감에 대해 인증 받은 것으로, 롯데제과는 마가레트를 시작으로 녹색인증 포장 제품을 늘려나갈 계획이다.

편의점 CU는 이달 초 친환경 발포 PLA(Poly Lactic Acid) 용기를 도입한 ‘채식주의 도시락’ 시리즈를 출시했다. 콩불고기 바질파스타와 단호박 크랜베리가 담긴 파스타형 도시락으로, 제품 포장 용기는 사탕수수, 옥수수 등 식물성 재료로 만들어진 발포 PLA로 제작됐다. 발포 PLA는 대표적인 친환경 소재로 180일 이내에 자연 분해되므로 별도의 분리배출 없이 일반 쓰레기로 버릴 수 있다.

김현주 기자 hjk@segye.com"
