Date,Title,Content
2017-12-27,"연말연시 ‘홈파티족’ 확산, 홈파티 ‘잇츠온’ 간편식 직접 체험해보니","요리하는 재미 ‘쏠쏠~~’ 맛도 ‘일품’ 분위기는 ‘덤’



거리를 가득 메운 인파, 1시간은 기본인 식당과 카페의 대기시간, 고가의 ‘크리스마스 특별메뉴’만 주문 가능한 방침 등등 크리스마스와 연말 모임을 떠올리면 점점 부담스럽다는 생각이 앞선다. 가성비를 추구하는 소비자들도 늘어나면서 실속있고 의미 있게 집에서 즐기는 ‘홈파티족’이 확산되고 있다. 유통업계는 이에 맞춰 최근 식품 매출을 견인하고 있는 가정간편식(HMR)의 연말 홈파티용 제품들을 앞다퉈 내놓고 있다.



그중 한국야쿠르트의 ‘잇츠온(EATS ON)’은 간편하면서도 보다 건강한 재료를 갖춘 밀키트(fresh meal kit)를 중심으로 다양한 비밀 선물을 포함한 연말용 ‘럭키박스’를 출시해 좋은 반응을 얻고 있다. 일반적 레토르트와 달리 주문 마감 후 매일 바로 요리에 들어가며, 이를 냉장상태로 배송한다. 이 때문에 갓 만든 듯한 재료의 풍미를 느낄 수 있다는 게 가장 큰 장점이다. 또 2차 조리는 직접 해야 하기 때문에 제대로 요리를 하고 있다는 기분도 낼 수 있다.



기자도 이번 크리스마스이브에 친구 두 명과 함께 홈파티를 하기로 결정하고, 가정간편식을 직접 체험해봤다. 먼저 21일 오전 ‘하이프레시(hyFresh)’ 앱을 다운로드해 프라임스테이크와 쉬림프크림파스타가 들어 있는 ‘럭키박스 A’(4만1900원)와 단품 ‘감바스알아히요’(1만6800원)를 주문, 이틀 후인 23일 저녁 시간대로 배송 날짜를 지정했다. 1시간 단위로 배송 희망 시간을 선택할 수 있고, 야쿠르트 아줌마가 직접 배달해주기 때문에 배달비는 무료다. 23일 빨간색 럭키박스를 받으니 크리스마스 선물을 받은 것 같은 기분이었다. 럭키박스에 랜덤으로 3가지 이상 담기는 선물로는 커트러리와 크림치즈 브랜드 ‘끼리(kiri)’, ‘하루야채’ 마스크팩, ‘콜드브루’ 커피, ‘야쿠르트 구미 젤리’가 선택됐다.



그런데 아뿔싸 너무 많이 시켰다. 크리스마스에는 풍족해야 한다는 생각에 우리의 위장을 너무 고평가했다. 막상 받고 나니 각 제품이 2~3인분 기준이어서 3명이 3개를 다 먹기에는 무리가 있어 쉬림프크림파스타를 제외하고 일단 프라임스테이크와 감바스알아히요 요리를 시작했다. 프라임스테이크 밀키트에는 고기뿐 아니라 아스파라거스, 새송이버섯, 토마토, 양파, 웨지감자 등 가니시 재료가 알맞은 크기로 썰려 손질된 채 함께 들어 있었다. 2~3%에 해당하는 프라임 등급의 ‘척아이롤’ 프라임스테이크는 생고기 품질을 잘 모르는 기자가 보기에도 두툼한 크기에 마블링이 적절히 섞여 군침을 돌게 했다. 동봉된 종이 레시피나 스마트폰 앱의 정보에 따라 약 15분간 4번의 과정을 거치면 완성. 과연 사진처럼 할 수 있을지는 의문이었다. 먼저 기자가 키친타월로 핏물을 제거하고 허브솔트와 오일을 골고루 발라 마리네이드하는 동안 다른 한 명은 팬에 가니시 재료를 담아 구웠다. 그리고 10분의 숙성을 거친 고기를 팬에 넣고 구웠다. 나머지 한 명은 스테이크의 각 면을 구울 때마다 레시피상 시간을 재고, 마치 고든 램지에 빙의한 듯 지금 뒤집어야 한다고 큰소리로 재촉했다. 강불에서 앞뒤 각 1분씩, 약불에서 2~3번씩 5분간 익혔다. 미디엄을 의도했지만, 인덕션의 화력이 약했던 탓인지 덜 익은 듯해 2분 정도 더 익혔다.



감바스알아히요도 레시피에 따라 새우, 버섯, 브로콜리, 베트남고추, 마늘, 로즈메리 등의 재료로 약 15분간 4번의 과정을 거쳐 완성했다. 모든 재료가 딱 정량에 맞게 손질돼 있어 성가신 음식물 쓰레기는 나오지 않았다. 만드는 과정도 쏠쏠한 재미가 있었다.



완성된 요리들을 예쁜 접시에 담고 향초와 와인을 곁들여 크리스마스 캐럴까지 틀자 레스토랑 부럽지 않은 분위기가 만들어졌다. 기자와 친구들이 만들었다고는 믿기지 않을 만큼 맛이 일품이었다. 고기는 마지막에 버터를 녹여 살짝 구워내 부드러운 풍미와 함께 두툼한 두께 덕에 쫄깃한 식감도 있었다. 가니시들은 적당히 익어 고기와 맛의 조화를 이뤘다. 감바스알아히요의 새우는 생각보다 큰 사이즈여서 씹는 맛이 있었다. 올리브오일에 재료를 끓여냈는데, 상당히 매운 베트남고추와 로즈메리 향이 어우러져 느끼함을 잡아주고 풍부한 향을 냈다.



김동주 한국야쿠르트 마케팅 이사는 “최근 1인 가구의 증가와 함께 필요한 만큼의 식재료가 손질돼 배송되는 밀키트 제품이 인기”라면서 “특히 미리 만들지 않고 주문 후 매일 요리하는 잇츠온의 요리 방식 때문에 맛과 신선도를 유지하고 있다”고 설명했다.



지난 7월 전국 판매를 시작한 잇츠온은 올해 매출 목표 60억 원을 넘어서 11월 말 누적 기준 매출 77억 원을 돌파했다. 10월 45억 원에서 한 달 만에 77%나 증가한 것으로, 홈파티가 증가하는 12월 연말 매출은 더 증가할 것으로 전망된다. 하이프레시 앱 다운로드 누적 건수는 72만 건, 방문자 수는 530만 명을 기록하고 있다. 현재 판매품목은 80여 종으로, 2018년에는 더욱 다양화할 예정이다.



유현진 기자 cworange"
2017-12-27,식물성·간편식·슈퍼곡물에 빠졌던 2017년,"식품을 낭비없이 먹는 ‘제로 웨이스트’…SNS발달로 이국적 맛 ‘에스닉 푸드’ 등 올 식품 트렌드 9가지

건강한 삶이 중요해지면서 소비자들의 식품 선택 기준도 점점 더 까다로워지고 있다. 영양성분표를 확인하며 꼼꼼하게 비교하는 것은 물론, 건강한 영양성분으로 주목받는 식재료에도 관심이 높다. 건강한 식품에 대한 수요는 식품 트렌드를 주도적으로 이끌었으며 앞으로도 이어질 것으로 보인다. 특히 올해에는 자연식 섭취를 강조하는 ‘클린이팅’(Clean Eating) 트렌드가 확대되면서 내추럴푸드의 선호도가 높아져 샐러드나 식물성 기반의 식품들이 큰 인기를 끌었다. 1인가구의 증가로 개인 중심의 소비 패턴이 뚜렷해짐에 따라 간편식이나 ‘밀키트’의 수요도 늘었다. 아울러 젊은층에는 SNS의 발달로 아름다운 외형을 가진 식품이나 이국적인 맛의 ‘에스닉 푸드’(Ethnic Food)가 인기를 끌었다. 친환경에 대한 인식의 확대는 식품을 낭비없이 먹는 ‘제로 웨이스트(Zero Waste)’ 운동이나 다양한 비건(Vergan) 식품의 출시로 이어졌다. 리얼푸드가 올 한해 국내뿐 아니라 전세계적으로 주목을 끌었던 ‘2017 식품 트렌드’를 9가지로 정리했다. 


1.식물성 기반 식품
콜레스테롤이나 포화지방 등 과도한 동물성 식품 섭취가 성인병의 주요원인으로 지목되면서 저칼로리에 각종 항산화 성분까지 들어있는 식물성 기반 식품이 관심을 끌었다. 햄프씨드 등 고기 대신 단백질 보충에 좋은 식물성 식품이 주목을 받았으며, 우유를 대체할 식물성 우유도 수요가 늘었다. 또한 ‘한끼 샐러드’ 트렌드를 통해 채소가 메인자리에 올라서면서 식물성 식품의 인기를 입증하고 있다.

2. 가정 간편식 확대
국내에서 지난해 2조3000억 원의 시장규모(농림축산식품부 자료)를 기록한 가정간편식(HMR)은 올해도 식품업계가 가장 주목하는 분야가 됐다. 520만명을 돌파한 1인 가구, 새로운 라이프스타일의 변화와 함께 제조기술도 발전하면서 다양한 제품들이 출시되고 있다. 최근에는 가격이 조금 더 비싸더라도 깨끗하면서도 건강한 영양성분의 제품이 트렌드를 이끌고 있다.

3. 슈퍼곡물 열풍
슈퍼푸드 열풍은 ‘슈퍼곡물’로 이어졌다. 전세계 많은 식품업계와 레스토랑에서는 슈퍼곡물을 이용한 음식과 제품 개발에 한창이다. 특히 퀴노아, 아마란스, 이집트콩, 테프 등의 ‘고대작물’은 전 세계가 주목하는 인기 곡물이다. 고대 곡물은 현대 과학과 농업기술로 교배 혹은 육종된 작물이 아닌 과거부터 이어진 자연 농작물을 말하는 데 최근들어 영양학적인 우수성이 알려지면서 인기가 높아지고 있다.

4. 비건 식품의 다양화
채식을 선호하는 트렌드는 올해도 빠질수 없는 요소였다. 고기 대신 콩이나 두부 등으로 만든 ‘대체 고기’ 업체들이 주목을 받았으며, 디저트나 음료 등 식품 영역도 점차 넓어졌다. 올해에는 살충제 달걀 등 식품의 안정성 문제가 대두되면서 비건 식품도 더욱 관심을 끌었다. 우유나 달걀, 버터 등을 넣지 않는 건강한 비건 베이커리 사업도 활성화되고 있다.

5. 이국적ㆍ 매운맛
해외 여행 증가와 SNS의 발달은 젊은층에게 이국적인 맛을 선호하게 만들었다. 이국적인 맛과 풍미에 매료된 젊은층들은 SNS에 요리 레시피, 식당 등을 공유하며 관련 식품의 수요를 더 높였다. 미국의 베이킹비즈니스는 2017 글로벌 식품 트렌드 중 하나로 다양하게 변형된 ‘에스닉 푸드’(Ethnic Food)를 꼽았다. 이와함께 젊은층의 입맛을 사로잡은 것은 ‘매운맛’이다. 매운 햄버거, 매운 스낵, 매운 치킨 등 매운 맛의 음식들이 미국과 아시아지역에서 다양하게 출시됐으며, 관련제품을 먹는 동영상도 화제를 모았다.

6. 건강 스낵
웰빙 흐름에 따라 스낵 시장도 인공첨가물이 없는 건강한 스낵이 인기다. 특히 미국에서는 한끼 식사대용으로 건강 스낵을 이용하는 경우가 늘면서 관련 업계는 호황을 누리고 있다. 국내에서도 설탕과 소금 함유량이 높은 제품보다는 견과류나 건조과일 등 건강한 스낵 제품들이 주목받고 있다.

7. 아름다운 비주얼
음식 사진을 SNS에 올리는 이들이 늘어나면서 음식에서도 아름다운 비주얼이 강조되고 있다. ‘유니콘푸드’나 ‘블랙푸드’ 등 이 대표적인 사례로, 식품업계에서는 식품의 미적 아름다움을 마케팅에 이용하는 경우가 많아졌다. 이에 따라 화려하거나 독특한 색감을 과시하는 식재료들이 주목을 받았다. 물론 웰빙흐름에 따라 식품업계의 관심을 끄는 것은 인공색소가 아닌 스피쿨리나와 같은 천연 색소이다.

8. 제로 웨이스트(ZERO waste)
이제 소비자들은 환경을 생각하면서 점차 가치소비를 늘려가고 있다. 식품 구매에서도 음식물 쓰레기를 줄이기 위해 음식낭비를 줄이자는 인식이 커지는 추세다. 모양은 예쁘지 않지만 품질에 문제가 없는 ‘못난이 농산물’ 구입이나 요리시 쓰레기로 버려지던 식재료의 줄기나 뿌리, 껍질도 활용하자는 움직임이 이에 해당된다.

9. 밀키트 (meal kit)
손질된 재료가 집까지 도착하길 바라는 간편성의 욕구, 이왕이면 내 손으로 더 건강하게 만들고 싶은 욕구가 합쳐져 ‘밀키트’의 성장을 이끌어냈다. 밀키트는 주로 외식으로 먹던 음식을 간편하게 만들 수 있다는 장점이 부각되면서 국내서도 꾸준하게 성장 중이다. 

육성연 기자/gorgeous@heraldcorp.com"
2017-12-27,"올해만 10여개 브랜드 출시, 가정간편식 '춘추전국시대'","야구르트 아줌마가 배달하는 간편식,백화점의 프리미엄 간편식, 편의점에서 간단히 만나보는 간편식 등 간편식 춘추 전국 시대다. 특히 올해는 기존 대형마트 외에도 백화점, 편의점 등 유통 채널도 간편식 시장에 가세하면서 무한경쟁으로 치닫고 있다.

26일 업계에 따르면 올해 선보인 가정간편식(HMR) 브랜드는 10개가 넘는다. 현대백화점은 지난 11월 프리미엄 간편식 브랜드 '원테이블'을 출시했다. 양볶음밥과, 소불고기 등 기존 간편식 보다 비싼 5000원~1만원대의 가격이지만 '프리미엄'을 무기로 내세웠다. 해당 제품은 출시 40일 만에 4만2000세트가 팔리며 당초 목표인 1만3000세트보다 3배 이상 팔렸다.

신세계 계열 편의점 이마트24는 이달 프리미엄 간편식 브랜드 '올가니카 클린푸드'를 출시했다. 도시락 4종, 샐러드 2종 등 총 9종이다. 도시락의 경우 5800원으로 일반 편의점 도시락 가격인 3000~4000원 보다 높게 책정했다.

편의점 GS25 등을 운영하는 GS리테일은 이달 22일부터 밀키트 배송서비스 '심플리 쿡'을 론칭했다. 밀키트는 반조리 상태의 식재료 배달 서비스다. GS리테일은 GS프레시와 푸드 플랫폼 기업인 해먹남녀를 통해 판매를 시작한다. 내년에는 GS25의 모바일 앱을 통해서도 판매하고 향후에는 편의점 픽업 서비스도 도입할 예정이다.

유통채널 간편식 브랜드의 경우 기존에는 매장 수가 많은 대형마트를 중심으로 운영돼 왔다. 이마트 '피코크', 롯데마트 '요리하다', 홈플러스 '올 어바웃 푸드' 등이 대표적이다. 올해는 백화점과 편의점도 간편식 브랜드를 신규 론칭하며 시장에 합류했다.

CJ제일제당 관계자는 ""가공식품에 대한 소비자의 눈높이와 수요가 다양화 됐다""며 ""기업도 과거에는 싸고 값싼 제품을 대량생산해왔다면 최근에는 프리미엄, 세분화된 간편식에 주력하고 있다""고 말했다.

식품 대기업들은 밀키트, 술안주, 디저트 등 메뉴를 세분화한 간편식 브랜드를 잇따라 선보이고 있다.한국야쿠르트는 올 6월 야쿠르트 아줌마가 매일매일 배달해 주는 밀키트 간편식 브랜드 '잇츠온'을 출시했다. 국.탕, 요리, 김치, 반찬 등 총 80종의 밀키트를 주문 후 손질해 무료로 배송해 준다. 한국야쿠르트 관계자는 ""국내에 처음으로 반조리 간편식인 밀키트를 선보였다""며 ""간편식에 엄마의 손맛까지 더한 것이 특징""이라고 말했다.

대상청정원은 논현동 포장마차 스타일의 술안주 메뉴인 돼지껍데기, 무뼈닭발 등을 주 메뉴로 한 '안주야'를 출시했다. 동원F&B도 심야식당이란 브랜드를 출시하고 '혼술족'을 겨냥한 안주 제품을 판매하고 있다. CJ제일제당은 기존 냉장.냉동 간편식을 상온에서도 간편하게 즐길 수 있는 '고메 상온 간편식'을 올해 새로 선보였다. 함박스테이크, 토마토미트볼 등 서양 요리를 용기에 담아내 전자레인지로 90초간 조리 후 바로 먹을 수 있다. 상온에서도 9개월까지 보관이 가능하다.

hwlee@fnnews.com 이환주 기자"
2017-12-26,유통업계 '밀 솔루션' 경쟁 본격화,"유통업계가 소비자 라이프스타일 변화에 발맞춰 간편한 한끼 식사가 가능한 제품과 서비스를 제공하는 '밀 솔루션'(Meal solution) 시장에 팔을 걷어 붙이고 나섰다. 기본적인 가정간편식(HMR) 자체브랜드(PB)에 더해 프리미엄 라인을 론칭하고 식재료 배송 서비스에 도전하는 등 업태를 뛰어넘어 경쟁이 격화되고 있다.

◇백화점 VIP도 가정간편식 홀릭…커지는 시장= 25일 현대백화점은 지난달 출시한 프리미엄 간편식 브랜드 '1테이블'(원테이블)이 한달 만에 3만4000세트, 40일만에 4만2000세트 판매된 것으로 집계됐다고 밝혔다. 이는 당초 목표 판매량인 1만3000세트보다 3배 넘게 팔린 것이다.

'양볶음밥'과 '소불고기' 제품은 출시 초기부터 완판 행진을 이어가며 호응을 얻고 있고, 내년 하반기로 예정된 '벌교 꼬막밥'과 '담양 죽순밥' 등의 출시 시기는 내년 상반기로 앞당겼다.

현대백화점은 고급 재료로 차별화한 가정간편식을 선보인 전략이 통한 것으로 분석했다. 실제로 원테이블 제품의 가격은 5000원부터 1만원대까지 다양하며, 일반 간편식 제품보다 5~10% 가격이 비싸다. 백화점 VIP 매출 비중도 약 50%로 높게 집계됐다.

무항생제 화식한우, 청정해역 가파도 미역, 울릉도 특산물 부지깽이 나물, 양구 펀치볼 시래기 등 고급 식재료를 사용하고 타깃층인 30∼40대 주부 고객과 전문가 등으로 구성된 맛평가단과 함께 1년여의 준비과정을 거쳤다. 현대백화점은 향후 원테이블 제품을 25개에서 300여개로 확대하고 아울렛, 온라인몰, 홈쇼핑으로도 판매 채널을 넓힐 계획이다.

홍정란 현대백화점 식품사업부장은 ""다른 간편식 제품보다 가격이 10~15% 비싸지만 고객들 사이에서 품질 좋고 맛있다고 입소문이 나면서 '원 테이블'을 찾는 고객들이 크게 늘고 있다""며 ""내부적으로 품질력을 앞세운 '프리미엄 단독 상품' 전략이 통했다고 분석하고 있다""고 말했다

◇마트 가정간편식 신성장동력으로…편의점도 가세 =마트업계에서도 가정간편식이 주력 상품으로 자리매김해 나가고 있다.

롯데마트는 가정간편식 PB '요리하다'를 2015년 말 론칭했다. 올해 초 상품 수 100여개에서 연말 기준 200여개로, 매출은 전년대비 2배 늘어난 150억원 수준으로 전망된다. 이마트는 2013년 론칭한 가정간편식 브랜드 '피코크'가 그룹 내 핵심 콘텐츠로 주목받고 있다. 2014년 매출 750억원, 지난해에는 1900억원까지 늘었다. 신세계백화점, SSG닷컴, 이마트24 등 신세계 그룹 안팎의 다수 채널에 판매되며 별도 식품브랜드로서의 저력도 갖게 됐다.

GS리테일은 한걸음 더 나아가 신선한 식재료 손질해서 배송하는 '밀키트' 시장 개척에 나섰다. 갈비찜, 스키야키, 월남쌈, 파스타 등 레스토랑급 요리를 간편하게 맛보고 싶은 2~3인 가족 수요를 노렸다. 필요한 육류, 야채, 소스, 육수 등 모든 식재료를 바로 조리할 수 있는 상태로 정량만큼 포장해 요리법과 함께 제공한다. 주문과 동시에 재료 손질을 해 원하는 시간, 장소로 배송한다. 전자렌지를 이용하는 HMR(가정간편식)이나 반조리 상품인 RTC와는 차별화된 서비스로 국내 첫 시도라는 설명이다.

유통업계에 따르면 HMR 시장 규모는 2010년 7700억원에서 지난해 2조3000억원으로 연평균 약 20%씩 성장해왔다. 올해 시장규모는 3조원을 넘어설 것으로 전망되는 등 성장세가 가팔라지고 있다.
{


박진영 기자 jyp@"
2017-12-19,"해먹남녀, GS리테일 ‘심플리쿡’ 판매 진행 “칼질 없이 일품요리 즐겨”","푸드 콘텐츠 커머스 플랫폼 ‘해먹남녀’를 운영하는 바이탈힌트 코리아(대표 정지웅)는 GS리테일이 준비한 신규 브랜드 ‘심플리쿡(Simply Cook)’의 판매를 진행한다고 밝혔다.

심플리쿡은 신선식품 카테고리와 물류 및 유통에 강점을 가진 GS리테일이 본격적으로 선보이는 밀키트(Meal Kits)제품으로 ‘칼질도 필요 없이’ 누구나 요리에 성공할 수 있도록 하는 것이 특징이다.

해먹남녀는 모바일 콘텐츠와 온라인 커머스에 가지고 있는 강점을 살려 혁신적인 요리 문화를 개선하는 가정간편식을 론칭하고자 하는 계획이 있어 GS리테일의 ‘심플리쿡’이라는 차별화된 브랜드와 만나 이번 판매를 함께 하게 됐다.

공식 상품은 22일 론칭 예정이며, 현재 해먹남녀 스토어를 통해 구매가 가능하다. 해먹남녀 앱과 해먹남녀 스토어 및 SNS 채널에서는 ‘심플리쿡’과 관련된 푸드 콘텐츠를 미리 만나볼 수 있다.

바이탈힌트 코리아 정지웅 대표는 “해먹남녀는 요리를 어려워하는 세대들의 고민을 덜어주고 집밥 고민을 해결하는 푸드테크 플랫폼”이라며, “앞으로도 오프라인 제조, 유통, 해외 브랜드 등 혁신적인 요리 문화를 개선해 나가고자 하는 많은 파트너사들과 협업해 다양한 서비스를 선보일 계획”이라고 밝혔다.

한편, ‘해먹남녀’는 구글 플레이가 선정한 ‘2017 올해를 빛낸 앱’에 선정되는 등 소비자로부터 호평을 받고 있는 요리 콘텐츠 추천 플랫폼이다. 올해 본격적으로 커머스를 전개하며 소비자들의 집밥 고민을 직접 해결하고 있다.

디지털기획팀 이세연 lovok@kmib.co.kr"
2017-12-19,"GS리테일 ‘심플리쿡’, 해먹남녀 스토어에서 먼저 만난다","푸드 콘텐츠 커머스 플랫폼 ‘해먹남녀’를 운영하는 ‘바이탈힌트 코리아(대표 정지웅)’는 GS리테일이 준비한 신규 브랜드 ‘심플리쿡(Simply Cook)’의 판매를 진행한다고 밝혔다.

350만 명의 사용자가 이용중인 ‘해먹남녀’는 배달 음식에 익숙해진 2030세대가 느끼는 ‘제대로 된 요리에 대한 욕구’를 충족시켜주는 플랫폼이다. 요리에 익숙하지 않은 젊은 층도 맛있는 집밥을 즐길 수 있도록 푸드 콘텐츠를 추천하는 것은 물론, 영양 정보와 간편식 추천 등을 제공하며 빠른 성장세를 이어가고 있다.

해먹남녀가 모바일 콘텐츠와 온라인 커머스에 가지고 있는 강점을 살려 혁신적인 요리 문화를 개선하는 가정간편식을 론칭하고자 하는 계획이 있어 GS리테일의 ‘심플리쿡’이라는 차별화된 브랜드와 만나 이번 판매를 함께 하게 됐다.

심플리쿡은 신선식품 카테고리와 물류 및 유통에 강점을 가진 GS리테일이 본격적으로 선보이는 밀키트(Meal Kits)제품으로 ‘칼질도 필요 없이’ 누구나 요리에 성공할 수 있도록 하는 것이 특징이다. GS리테일이 엄선한 신선하고 건강한 식재료를 소분, 가공 및 세척 후 2~3인분 분량으로 소포장 후 제공하여 평소 접하기 어렵고 난이도가 높은 세계의 다양한 요리도 누구나 쉽게 즐길 수 있도록 셰프의 노하우를 그대로 담아 전달할 계획이다.

공식 상품은 22일 론칭 예정이며, 현재 해먹남녀 스토어에서 구매가 가능하다. 해먹남녀 앱과 해먹남녀 스토어 및 SNS채널을 통해 ‘심플리쿡’과 관련된 푸드 콘텐츠도 미리 만나볼 수 있다.

바이탈힌트 코리아 정지웅 대표는 “해먹남녀는 요리를 어려워하는 세대들의 고민을 덜어주고 집밥 고민을 해결하는 푸드테크 플랫폼”이라며, “앞으로도 오프라인 제조, 유통, 해외 브랜드 등 혁신적인 요리 문화를 개선해 나가고자 하는 많은 파트너사들과 협업해 다양한 서비스를 선보일 계획”이라고 밝혔다.

한편, ‘해먹남녀’는 구글 플레이가 선정한 ‘2017 올해를 빛낸 앱’에 선정되는 등 소비자로부터 호평을 받고 있는 요리 콘텐츠 추천 플랫폼이다. 올해 본격적으로 커머스를 전개하며 소비자들의 집밥 고민을 직접 해결하고 있다.

김예지 기자 / yjkim@heraldcorp.com"
