Date,Title,Content
2020-05-31 김아름,"롯데百, 강남점에 ‘올가 홀푸드’ 메가샵 오픈…친환경·건강식 강화","[디지털타임스 김아름 기자] 롯데백화점은 포스트 코로나 시대의 '친환경 집밥 열풍'을 반영해 '올가 홀푸드 메가샵' 매장을 강남점에 오픈했다고 31일 밝혔다.



롯데백화점은 친환경 식품과 지속가능한 소비에 대한 관심을 반영해 강남점의 친환경 식품 매장 '올가'를 업계 최초로 '올가 홀푸드 메가샵'으로 전환했다. 전국 올가 메가샵 중 가장 큰 규모다. 강남점은 인근에 아파트 단지가 많은 포켓 상권에 위치하고 있어 식품 수요가 상대적으로 높다. 강남구는 평균 소득 수준이 높고 최신 소비 트렌드에 빠르게 반응하는 시장이기도 하다. 이 매장은 기존 친환경 신선 식품에 더해, '현장 실연형 가정 간편식'과 '맞춤형 건강 식품' 등을 추가로 선보인다.



올가 홀푸드 메가샵에서 판매하는 신선식품 키워드는 '동물복지'와 '극(極)신선'이다. '지속가능한 축수산물 전문존'에서는 정부가 인증한 동물복지 상품을 만나볼 수 있으며, 도축한지 4일 이내의 돈육과 항공직송생연어 등 '극신선 식품'과 '제철 산지 직송 농산물'도 준비돼 있다.



'현장 실연 가정 간편식'을 만나볼 수 있는 공간도 마련돼 있다. 유기농 식자재로 만든 샐러드, 샌드위치 등 즉석섭취식품(RTE)과 밀키트, 이유식 등 즉석조리식품(RTC)을 판매하며 '라이브 키친'에서는 현장에서 조리한 가정 간편식을 바로 맛볼 수도 있다.



더불어, 이 매장은 식생활과 건강 상태, 인바디(InBody) 체성분 측정 결과에 따라 개인에게 가장 맞는 맞춤형 건강기능식품을 제안한다. ?건강 상품 카테고리를 세분화해, 기능성 드링크존, 액티브시니어존, 자녀존 등으로 나눈 것도 특징이다.



신남선 롯데백화점 수도권1지역MD팀장은 ""최근 지속 성장하고 있는 친환경 먹거리 트렌드를 반영해 백화점 업계 최초로 올가홀푸드 메가샵을 도입했다""며 ""지속가능성을 고려한 축수산물, 즉석 실연형 가정 간편식, 개인 맞춤형 건강 식품 등 차별화된 친환경 콘텐츠로 고객의 다양한 니즈를 충족시키고, 무료 택배 서비스 등을 통한 비대면 서비스도 강화할 것""이라고 말했다.



김아름기자 armijjang@dt.co.kr"
2020-05-30 김성윤 음식전문기자,"[아무튼, 주말] 밥 한 톨 안 들어갔는데, 날개 돋친 듯 팔리는 김밥?","트렌드로 자리 잡는 키토김밥
서울 강남역 '보슬보슬'은 월 매출 1억원이 넘는 인기 김밥집이다. 그런데 이 집 대표 메뉴인 '키토김밥'은 쌀밥이 한 톨도 들어가지 않는다. 밥이 있어야 할 자리를 채운 건 노란 지단. 김밥 한 줄당 무려 달걀 다섯 알 분량의 지단으로 꽉 차 있다. 가늘게 채 썰어 넣은 덕분에 포슬포슬 보드랍게 씹히는 식감이 독특하다.

보슬보슬 사장 이용훈씨는 ""이전 다른 이름의 분식집을 할 때 김밥 주문하는 손님들이 '밥양을 줄여달라'거나 '밥을 아예 빼고 말아달라'는 요청이 많아서 지단 넣는 아이디어를 떠올렸다""고 했다. 키토는 '키토제닉 식단(ketogenic diet)'을 줄인 말. ""탄수화물 되도록 먹지 않는 게 키토제닉이라서 그렇게 이름 붙였지요."" 이곳 말고도 서울 낙성대역 '소풍가는날', 신도림동 '앞산분식', 여러 지점을 둔 프리미엄 김밥집 '마녀김밥' 등이 밥을 아예 넣지 않거나 거의 없다시피 한 김밥을 선보이며 '키토김밥집'으로 손님을 모으고 있다.

키토김밥은 키토제닉 식단이 얼마나 한국 사회에 확산됐는지 단적으로 보여준다. 케토제닉이라 부르기도 하는 키토제닉 식단은 밥·빵·국수 등 탄수화물 대신 지방을 에너지원으로 삼도록 만들어주는 식이요법을 말한다. 탄수화물 대신 지방을 주 에너지원으로 사용하는 상태를 키토시스(ketosis)라고 하는데, 여기서 키토제닉이라는 말이 나왔다. 저탄고지(저탄수화물 고지방)·저탄수화물·당질제한 식단도 기본적으로 탄수화물을 제한한다는 점에서 키토제닉과 뿌리가 같다. 키토시스 상태에서 섭취하는 지방은 모두 에너지로 쓰거나 배출하고, 모자라면 몸에 쌓인 체지방을 태워 보충하기 때문에 별다른 노력 없이도 체지방이 줄어들게 된다는 게 이 식단을 추종하는 사람들이 주장하는 원리다.

키토제닉 식단이 국내에서 대중적으로 알려진 건 지난 2016년 MBC 다큐멘터리 '지방의 누명'이 방영되면서다. 기름 많은 고기와 버터 등 동물성 포화지방을 마음껏 먹어도 될 뿐 아니라 심지어 살이 빠지고 건강해진다는, 그동안의 상식과 완전히 반대되는 내용은 많은 이에게 놀라움으로 다가왔다. 1만7000여 부가 팔려나간 베스트셀러 '진주의 해피 키토 키친'을 쓴 푸드 스타일리스트 겸 요리 연구가 진주씨는 ""지방의 누명을 보고 큰 충격을 받았다""며 ""나와 남편이 왜 계속 살이 쪘는지에 대한 실마리를 찾은 듯했다""고 했다. 진주씨와 남편은 2016년 키토제닉 식단 실시 이후 각각 20㎏ 이상 감량해 유지하고 있다.

다큐멘터리 방영이 4년여 지난 현재 키토제닉 식단은 확실하게 뿌리 내린 듯하다. 보슬보슬 이용훈 대표는 ""손님층이 20~30대부터 60대까지 다양하다""고 했다. 진주씨는 ""건강한 노년을 보내려면 키토제닉 식단을 해야겠다고 생각하는 분이 많아졌다""고 했다.

진주씨는 ""2~3년 전만 해도 키토제닉 제품은 외국산 외에는 없었는데, 최근에는 간편하게 먹을 수 있는 밀키트(meal kit·손질한 음식 재료가 양념, 요리법과 함께 들어 있는 간편식의 일종)까지 나왔을 만큼 보편화됐다""고 했다. 먹을 수 있는 음식도 서양식 일색에서 고추장, 불고기, 파전 등 한국 사람 입에 맞는 한식 메뉴가 속속 등장했다. 최근에는 밥 없이 불고기·오이지·아보카도·치즈 등으로 속을 채운 김밥, 일반 식빵 대신 밀가루 없이 달걀, 아몬드 가루, 베이킹파우더로 만드는 대용 빵을 이용한 토스트 등 분식·길거리 음식까지 범위가 확산됐다.

키토제닉은 아직 논란거리다. 뉴잉글랜드 의학 저널(New England Journal of Medicine·NEJM)에 2003년 여러 다이어트 실험 결과가 보고됐다. 저탄수화물·고지방·고단백질('황제 다이어트'로 알려진 앳킨스 다이어트) 식단이 3개월과 6개월에서는 전통적 다이어트보다 체중 감량에 효과적이었으나, 1년이 지나자 차이가 없었다. 2009년 NEJM에 실린 보고서에는 과체중 성인 811명을 네 그룹으로 나눠 키토제닉·저지방·고탄수화물 다이어트를 2년에 걸쳐 장기 진행한 실험이 소개됐다. 실험 결과는 열량을 제한하면 어떤 식사든 체중이 줄어드는 것으로 나타났다. 다이어트 비결은 '비율'이 아니라 '총열량'이란 당연한 결론이었다. 풀무원기술원 남기선 박사(영양학)는 ""한국인은 평균적으로 탄수화물 섭취량이 높아 전체 열량의 50~55%로 낮출 필요는 있다""며 ""동시에 전체 섭취 열량도 적정 수준을 유지해야지 그러지 않으면 다른 문제가 생길 수 있다""고 했다."
2020-05-29 김보리 기자,"""'언택트'해야 고객 '콘택트'""...百 레스토랑부터 호텔 식당까지 배달","현대그린푸드 '이탈리', 테이크 아웃 서비스 선봬
코로나19 사태로 비대면 소비가 급증하면서 콧대높은 고급 레스토랑도 배달에 합류하고 있다. 배달하면 피자나 치킨만을 떠올렸던 기존 고정관념이 깨진 지 오래, 이젠 고급 레스토랑과 호텔도 배달이 낯설지 않다.

현대백화점그룹 계열 종합식품기업 현대그린푸드는 현대백화점 판교점에 위치한 이탈리아 프리미엄 식문화 공간 ‘이탈리(EATALY)’에서 테이크 아웃 서비스를 시작한다고 29일 밝혔다. 테이크 아웃(Take out)이 가능한 메뉴는 ‘이탈리’ 매장에서 판매하고 있는 스테이크·파스타·피자 등 39종 전 메뉴와 햄버거(6종), 도시락(11종) 등 총 60여 종이다. 대표 메뉴로는 마르게리타 피자(1만7,000원), 까르보나라 파스타(1만7,000원), 앤초비 치킨 샐러드(1만4,000원), 블랙 토퍼플 버거 도시락(1만8,000원) 등이 있다.

스테이크·파스타·피자 39종을 테이크 아웃하는 고객에게는 정상 판매가에서 20% 할인 혜택도 제공한다. 이탈리아 식재료를 활용한 아라비아파스타, 알리오 올리오 파스타, 등심스테이크 등 밀키트 3종도 선보인다.

호텔 음식 배달도 인기다. 근사한 호텔 음식을 내 식탁에서 손쉽게 만날 수 있다.

JW메리어트 동대문 스퀘어의 ‘타볼로 24’는 배달라이더스를 이용해 ‘JW 안식 투 고’를 선보였다. 특제 소스를 더한 소·돼지 양념구이와 소금구이 등 4가지 2인 세트 메뉴를 사이드 메뉴와 함께 선보인다.

서울 웨스틴조선호텔은 일식 레스토랑 ‘스시조’, 중식 레스토랑 ‘홍연’, 베이커리 ‘조선델리’의 메뉴를 상시 배달 서비스로 제공한다. 올해 들어 4월 21일까지 서울 웨스틴조선호텔의 도시락 배달 및 테이크아웃 판매 실적을 살펴보면 홍연과 조선델리가 전년 동기 대비 284% 늘었고, 스시조는 152% 상승했다.

드라이브스루를 선보인 호텔도 있다. 롯데호텔서울은 업계 최초로 차에서 내리지 않고 호텔 셰프 요리를 맛볼 수 있는 드라이브 스루 상품을 출시했다. 롯데호텔 서울의 일식당 모모야마에서 판매하는 도시락 박스와 뷔페 레스토랑 라세느의 대표 메뉴인 양갈비와 랍스터도 드라이브스루를 통해 구매할 수 있다. 뷔페 레스토랑 라세느의 대표 메뉴인 양갈비와 랍스터로 구성된 ‘시그니처 셀렉트‘는 양갈비 2쪽, 랍스터 2쪽, 수프, 샐러드, 빵, 밥으로 구성된 ‘1인용 도시락’이 5만9000원, 양갈비 6쪽과 모둠 채소구이를 즐길 수 있는 ‘패밀리 2인’ 메뉴는 7만원이다. 업계관계자는 “픽업이나 배달 등 언택트는 이제 일시적인 현상이 아니라 문화로 자리잡고 있다”며 “외식업의 성공여부도 배달과 언택트를 정착에 달려있을 정도”라고 말했다.
/김보리기자 boris@sedaily.com"
2020-05-29 한경닷컴,"호주산 최고급 안심, 사상 최대 물량 대형마트·온라인 시장에 풀린다","코로나 사태의 장기화로 인해 전 세계 외식업이 침체되어 있는 가운데, 각국의 식자재 업체들이 비교적 상황이 안정화되고 있는 한국 시장을 집중 공략하고 있다.

이에 호주 육류 수출업계도 5성급 호텔이나 파인다이닝(고급 레스토랑)으로만 주로 유통되던 호주산 소고기 안심 부위를 이달부터 다양한 대형마트, 이커머스 업체를 통해 최대 40% 이상 할인된 가격에 공급한다.

이번에 유통되는 호주산 안심은 대표적인 고급 소고기 부위로, 약 700톤의 물량이 올해 연말까지 대형마트 및 창고형 할인마트, 백화점, 이커머스 업체, 홈쇼핑, 밀키트 업체, 중소형 식자재 마트 등 다양한 채널에 풀릴 계획이다.

이마트, 롯데마트, 홈플러스 3대 대형 할인마트는 이미 지난 5월 28일부터 안심 부위 판매를 시작했으며, 이 중 롯데마트는 정상 유통가의 거의 반값에 달하는 100g당 3,900원이라는 가격에 고급 안심육을 제공하고 있다.

6월 이후로도 호주산 안심 부위를 취급하는 유통 채널은 점차 늘어날 전망이다. 또한 국내 유통업체들 역시 재난지원금 지급으로 인한 소고기 소비 증가 추세에 발맞춰 긴급재난지원금 사용가능처를 중심으로 유통망 확대에 적극 나설 예정이다.

이 같은 수입 고급육의 대규모 유통 및 파격 할인 행사가 가능하게 된 것은 전 세계 외식업계가 코로나 사태 장기화로 인한 불황을 겪는 탓에 판로 개척에 어려움을 겪던 호주 육류 수출업계가 한국에 한시적으로 물량을 공급하기로 결정했기 때문이다.

한 업계 관계자는 이와 같은 대규모 판매 활동에 대해 “이번에 공급되는 안심은 전 세계 5성급 호텔, 국내에서도 최고급 호텔이나 고급 레스토랑으로만 극히 일부가 유통되던 고급육”이라며, “소비자들이 일반 대형마트에서 직접 구매할 수 있게 된 것은 이번이 처음”이라고 전했다.


한경닷컴 뉴스룸 open@hankyung.com"
2020-05-29 김동호 기자,"호주산 최고급 안심, 대형마트·온라인 시장에 사상 최대 물량 풀린다","고급 호텔에만 유통되던 호주산 고급 안심육, 한국 소비자 시장 유통 확대
코로나19 장기화로 전 세계 외식업이 침체되어 있는 가운데, 각국의 식자재 업체들이 비교적 상황이 안정화되고 있는 한국 시장을 집중 공략하고 있다. 이에 호주 육류 수출업계도 5성급 호텔이나 파인다이닝(고급 레스토랑)으로만 주로 유통되던 호주산 소고기 안심 부위를 이달부터 다양한 대형마트, 이커머스 업체를 통해 최대 40% 이상 할인된 가격에 공급한다. 이번에 유통되는 호주산 안심은 대표적인 고급 소고기 부위로, 약 700톤의 물량이 올해 연말까지 대형마트 및 창고형 할인마트, 백화점, 이커머스 업체, 홈쇼핑, 밀키트 업체, 중소형 식자재 마트 등 다양한 채널에 풀릴 계획이다. 이마트, 롯데마트, 홈플러스 3대 대형 할인마트는 이미 지난 5월 28일부터 안심 부위 판매를 시작했으며, 이 중 롯데마트는 정상 유통가의 거의 반값에 달하는 100g당 3,900원이라는 가격에 고급 안심육을 제공하고 있다. 6월 이후로도 호주산 안심 부위를 취급하는 유통 채널은 점차 늘어날 전망이다. 또한 국내 유통업체들 역시 재난지원금 지급으로 인한 소고기 소비 증가 추세에 발맞춰 긴급재난지원금 사용가능처를 중심으로 유통망 확대에 적극 나설 예정이다. 이 같은 수입 고급육의 대규모 유통 및 파격 할인 행사가 가능하게 된 것은 전 세계 외식업계가 코로나 사태 장기화로 인한 불황을 겪는 탓에 판로 개척에 어려움을 겪던 호주 육류 수출업계가 한국에 한시적으로 물량을 공급하기로 결정했기 때문이다. 한 업계 관계자는 이와 같은 대규모 판매 활동에 대해 “이번에 공급되는 안심은 전 세계 5성급 호텔, 국내에서도 최고급 호텔이나 고급 레스토랑으로만 극히 일부가 유통되던 고급육”이라며, “소비자들이 일반 대형마트에서 직접 구매할 수 있게 된 것은 이번이 처음”이라고 전했다. /김동호 기자 dongho@sedaily.com"
2020-05-29 임소라,"호주산 최고급 안심, 한국 대형마트ㆍ온라인 시장에 최대 물량 풀린다","전 세계 외식업이 코로나19 장기화로 경제불황과 함께 침체되어 있는 가운데, 각국의 식자재 업체들이 비교적 상황이 안정화되고 있는 한국 시장을 집중 공략하고 있다.

이에 호주 육류 수출업계도 5성급 호텔이나 파인다이닝(고급 레스토랑)으로만 주로 유통되던 호주산 소고기 안심 부위를 이달부터 다양한 대형마트, 이커머스 업체를 통해 최대 40% 이상 할인된 가격에 공급한다.

이번에 유통되는 호주산 안심은 대표적인 고급 소고기 부위로, 약 700톤의 물량이 올해 연말까지 대형마트 및 창고형 할인마트, 백화점, 이커머스 업체, 홈쇼핑, 밀키트 업체, 중소형 식자재 마트 등 다양한 채널에 풀릴 계획이다.

이마트, 롯데마트, 홈플러스 3대 대형 할인마트는 이미 지난 5월 28일부터 안심 부위 판매를 시작했으며, 이 중 롯데마트는 정상 유통가의 거의 반값에 달하는 100g당 3,900원이라는 가격에 고급 안심육을 제공하고 있다.

6월 이후로도 호주산 안심 부위를 취급하는 유통 채널은 점차 늘어날 전망이다. 또한 국내 유통업체들 역시 재난지원금 지급으로 인한 소고기 소비 증가 추세에 발맞춰 긴급재난지원금 사용가능처를 중심으로 유통망 확대에 적극 나설 예정이다.

이 같은 수입 고급육의 대규모 유통 및 파격 할인 행사가 가능하게 된 것은 전 세계 외식업계가 코로나 사태 장기화로 인한 불황을 겪는 탓에 판로 개척에 어려움을 겪던 호주 육류 수출업계가 한국에 한시적으로 물량을 공급하기로 결정했기 때문이다.

한 업계 관계자는 이와 같은 대규모 판매 활동에 대해 “이번에 공급되는 안심은 전 세계 5성급 호텔, 국내에서도 최고급 호텔이나 고급 레스토랑으로만 극히 일부가 유통되던 고급육”이라며, “소비자들이 일반 대형마트에서 직접 구매할 수 있게 된 것은 이번이 처음”이라고 전했다.

임소라 기자 mail00@asiae.co.kr"
2020-05-29,세상 편한 밀키트[바람개비],"종종 내 손으로 직접 요리하고 싶다. 하지만 장보기, 재료 손질, 남은 식재료 보관을 생각하면 엄두가 안 난다. 이런 고민을 밀키트(Meal Kit)가 해결했다. 씻어 나온 적당량의 재료, 양념, 거기에 손쉬운 레시피까지 친절하게 포장되어 있다. 따라 하면 짜장면도 파스타도 내손으로 완성한다. 무척 그럴듯하다. 요리하는 즐거움은 덤이다. 밀키트 덕분에 우리 집이 맛집이 되었다. 참 편한 세상이다.

이윤화 음식칼럼니스트"
