Date,Title,Content
2017-10-27,"오늘은 아빠가 요리사! 한국야쿠르트, 밀키트 제품 출시로 요리하는 즐거움 선사","- 아마존, 식품 신규 서비스로 밀키트 출시... 전 세계적 신규 식품 서비스로 각광
- 밑손질 끝낸 식재료와 양념을 세트로 판매... 간편하게 요리하는 재미와 인증샷 인기
- 간편식 브랜드 ‘잇츠온’, 9월부터 밀키트 제품 선봬... 파스타, 월남쌈 등 소비자 반응 후끈

여의도에 사는 직장인 정대철(39세)씨는 최근 파스타를 만드는 재미에 푹 빠졌다. 한국야쿠르트에서 선보인 밀키트 제품인 ‘쉬림프 크림 파스타’를 주문해 손쉽게 파스타를 만들 수 있기 때문이다.
정씨는 “최근 딸아이 생일에 파스타를 만들어 온가족이 함께 즐길 수 있었다. 아이가 아빠 요리 최고라며 치켜세울 때 오랜만에 다정한 아빠 역할을 한 것 같아 뿌듯한 마음이 들었다”고 말했다. 정씨는 파스타 외에도 평소 요리해보고 싶었던 메뉴에 계속 도전하고 있다고 했다.
▶밀키트, 간편식의 신규 카테고리로 각광
시간이나 요리실력은 부족해도 직접 요리를 해먹으려는 소비자가 증가하고 있다. 덕분에 요리법(레시피)과 식재료를 함께 담아 제공하는 ‘밀키트(Meal kit-반조리 식품)’도 인기다.
밀키트는 밑손질 끝낸 식재료와 양념이 세트로 구성되어 있다. 장 보는 시간은 줄여주고 식재료도 필요한 양만 들어 있어 경제적이다. 더불어 요리하는 즐거움도 경험할 수 있어 요리에 서툰 사람들도 많이 이용한다. 평소 도전해 보고 싶었던 요리를 만들어 SNS에 올리는 재미도 크다.
밀키트는 미국의 한 스타트업 회사를 시작으로 미국 내 대형식품·유통업체 등이 시장에 진출하거나 진출 계획을 밝히며 식품업계 시장의 새로운 아이템으로 뜨거운 관심을 받고 있다. 최근에는 아마존이 식품 신규 서비스로 밀키트 제품군을 출시하며 전세계적 신규 식품 서비스로 각광받고 있다.
미국의 금융 데이터 분석 기업인 카드리틱스(Cardlytics)의 조사에 따르면 전세계 밀키트 배달시장은 2014년부터 3년간 311% 성장했다. 또한 골드만삭스는 밀키트 배달 산업이 2020년에는 최대 50억 달러까지 증가할 것으로 분석했다.
▶ 한국야쿠르트, 9월부터 ‘밀키트’ 9종 선보이며 잇츠온 브랜드 강화
한국야쿠르트는 지난 7월 ‘잇츠온’(EATS ON) 브랜드를 선보이며 간편식 시장에 진출했다.
밀키트, 국·탕·찌개, 요리, 김치, 반찬 등으로 구성한 ‘잇츠온’은 주문 후 매일 요리해서 전달한다. 무엇보다 야쿠르트 아줌마 채널의 장점을 활용하는데 집중했다. ‘잇츠온’ 전 제품은 야쿠르트 아줌마가 직접 전달한다.
특히 기존 발효유와 마찬가지로 단 하나만 구매해도 배송비가 없고 단품주문도 가능한 것이 특징이다. 최소 주문 금액이 있거나 일정 금액 미만일 경우 배송비를 지급하는 타 업체와 차별화를 꾀한 것이다.
한국야쿠르트는 잇츠온 브랜드 강화를 위해 9월부터 ‘밀키트’ 카테고리를 새롭게 선보였다.
이를 통해 기존 완제품인 반찬, 요리류 등 RTE(Ready to Eat), RTH(Ready to heat) 제품에서 소비자가 손쉽게 요리할 수 있는 식재료로 구성된 RTC(Ready to Cook) 제품으로 라인업을 확장했다.
잇츠온 밀키트는 ‘훈제오리월남쌈’과 ‘땅콩비빔국수키트’, ‘황태해장국’, ‘알리오올리오파스타키트’ 등 총 9종이 출시되어 있다.
딱 필요한 만큼의 식재료와 요리방법이 적힌 레시피 카드가 함께 배송되어 누구나 쉽게 근사한 요리를 즐길 수 있다. 특히, 1인가구나 맞벌이 부부뿐만 아니라 평소 음식을 만드는데 어려움을 겪는 남성들이 가족을 위한 특별한 요리를 준비할 수 있는 색다른 재미까지 선사한다.
김동주 한국야쿠르트 마케팅 이사는 “‘잇츠온’은 건강한 가정식을 찾는 소비자에게 가장 잘 부합하는 간편식”이라며, “주문 후 요리하기 때문에 보다 신선하게 간편식을 즐길 수 있으며, 다양한 밀키트 제품군으로 요리하는 즐거움도 누릴 수 있다”고 말했다.
한편 한국야쿠르트는 11월 30일까지 ‘잇츠온 선물하기’ 이벤트를 진행중이다. 한국야쿠르트 홈페이지에서 지인에게 잇츠온을 선물하고 주문번호를 입력하면 다양한 경품을 증정한다."
2017-10-17,"배달HMR 인기에..동원·야쿠르트, 이색 제품군 확대","동원홈푸드 '더반찬', 한국야쿠르트 '잇츠온' 등 가정간편식(HMR)을 배달 판매하는 대표 브랜드들이 최근 호실적을 바탕으로 이색 제품군 확대에 나섰다.

주문 후 음식을 만들어 배달해주는 차별화된 판매방식으로 충성 고객층을 확보한 데 이어 어린이 전용식, 반조리 제품 등 이색 제품군의 판매를 강화해 추가 고객을 유인하겠다는 전략이다.

16일 식품업계에 따르면 더반찬은 최근 어린이 기호와 영양에 맞춰 완성한 '키즈 HMR' 제품군의 판매를 본격화했다.

더반찬은 어린이 성장에 필요한 영양소를 골고루 담은 재료를 활용, 아이들의 선호 식감을 고려해 잘게 썰거나 모양을 내 어린이 전용 HMR을 만들었다. 일반 HMR 제품보다 전반적으로 간을 약하게 해 아이들의 건강을 챙긴 것이 특징이다.

메뉴는 니모애호박볶음, 키즈불고기, 키즈모듬콩카레 등 27개로, 더반찬은 키즈 제품군 확대를 위해 추가 제품 개발을 이어가고 있다. 아울러 키즈 HMR을 알리기 위해 최근 아이가 좋아하는 간식을 반찬과 묶어 할인 판매하는 마케팅 활동을 시작했다.

한국야쿠르트는 지난달 '밀키트'(Fresh Meal Kit)라는 제품군을 새롭게 내놓았다. △훈제오리월남쌈 △땅콩비빔국수 △알리오올리오파스타 등 메뉴 9종으로, 필요한 만큼의 식재료와 요리방법이 적힌 레시피 카드가 함께 배송되는 제품이다.

밀키트는 반조리 제품으로 국·탕·찌개, 반찬류 등 기존 제품들이 데워먹거나 즉시 먹을 수 있는 완제품이었던 점과 대비된다. 한국야쿠르트 관계자는 ""소비자들이 단순히 간편하게 한 끼를 떼우려고 HMR을 찾는다는 기존 선입견을 넘어 쉽게 요리하며 재미까지 느낄 수 있도록 제품을 내놓게 됐다""고 말했다.

한편 더반찬은 올해 1~9월 매출이 약 250억원으로 전년동기 대비 50% 이상 늘었고, 올해 연간 매출은 400억원을 달성할 전망이다. 잇츠온은 지난 6월 론칭 후 지난 8월까지 두달여만에 매출이 30억원을 돌파하는 등 초반 흥행에 성공했다.


박상빈 기자 bini@mt.co.kr"
2017-09-27,[issue&] 홈피·쇼핑몰 통합 O2O 기업 진화 … 클릭하면 야쿠르트 아줌마가 찾아갑니다,"원하는 장소·시간에 신선하게 배달 간편식 시장 진출에 밀키트 출시도
한국야쿠르트

한국야쿠르트가 기존 홈페이지와 쇼핑몰을 하나로 통합한 온라인 통합 몰 ‘하이프레시(hyFresh)’를 앞세워 O2O(Online to Offline) 사업으로 진화하고 있다.

한국야쿠르트는 지난 1월 기존 홈페이지와 쇼핑몰을 하나로 통합한 하이프레시를 오픈했다. 8개월 만에 애플리케이션을 다운받은 수가 누적 40만 건을 기록하며 빠른 성장 속도를 보이고 있다.

이 기간에 방문자 수가 전년 동기 대비 50% 이상 늘어나 275만 명을 넘어섰다. 온라인 매출의 경우 35억원을 기록했다.

한국야쿠르트 관계자는 “지난해 온라인 매출 41억원을 무난하게 달성할 예정이다. 연간 매출은 60억원까지 전망하고 있다”면서 “하이프레시의 인기비결은 야쿠르트 아줌마와 함께 하는 O2O 서비스에 있다”고 전했다.

고객이 클릭 몇 번으로 원하는 시간과 원하는 장소로 제품을 주문하면 전국 1만3000여 명의 야쿠르트 아줌마가 신선하게 전달한다. 야쿠르트 아줌마 위치와 연락처도 쉽게 확인할 수 있다.

한편 1인 가구와 맞벌이가 늘면서 한국야쿠르트는 지난 7월 가정간편식(HMR) 시장에 진출했다. 동네 구석구석 매일 고객을 만나는 야쿠르트 아줌마의 경쟁력을 활용하는 데 집중했다.

기존 발효유와 마찬가지로 간편식 제품은 야쿠르트 아줌마가 직접 전달한다. 하나만 구매해도 배송비가 없다. 단품 주문이 가능하다.

한국야쿠르트 관계자는 “최소 주문 금액이 있거나 일정 금액 미만일 경우 배송비를 지급하는 타 업체와 차별화를 꾀했다”고 말했다.

간편식 브랜드는 신선함에 초점을 두고 ‘주문 후 요리하는 콘셉트의 ’잇츠온(EATS ON)‘으로 정했다. 잇츠온은 주문 후 매일 요리해서 전달한다는 의미를 담고 있다. 국·탕·찌개, 요리, 김치, 반찬 등 총 60여 종이 있다.

최근 최근 전 세계적으로 새로운 식품 서비스로 각광받는 ‘밀키트(Meal Kit)’ 제품도 출시했다. 기존 간편식에서 차별화 된 훈제오리월남쌈·땅콩비빔국수키트·쉬림프크림파스타키트 등 총 8종의 밀키트 제품을 새롭게 선보였다.

현재 훈제오리월남쌈·땅콩비빔국수키트·황태해장국·황태미역국 4종은 이미 판매 중이다. 알리오올리오파스타키트·쉬림프크림파스타키트·감자수제비키트·얼큰버섯전골 등 4종이 추가 될 예정이다.

밀키트는 요리 시 필요한 식재료를 미리 손질해 구성한 RTC(Ready to Cook) 식품을 말한다. 홀푸드를 인수한 미국의 아마존을 비롯해 전 세계 대형 식료품업체와 유통업체 등이 이 시장에 속속 진출하고 있다.

밀키트는 필요한 만큼의 식재료와 요리방법이 적힌 레시피 카드가 함께 배송된다. 집에서도 누구나 쉽게 조리해 근사한 요리를 즐길 수 있도록 했다.

훈제오리월남쌈은 담백한 훈제오리와 신선한 야채를 라이스페이퍼로 돌돌 말아 칠리소스에 곁들여 먹을 수 있다. 땅콩비빔국수키트는 곱게 간 땅콩 가루를 매콤·새콤한 비빔면에 뿌려 간편하게 즐길 수 있다. 황태해장국과 황태미역국은 시원한 국물 맛을 자랑한다.

한국야쿠르트 관계자는 “앞으로 시즌메뉴, 1인 가구 맞춤 제품 등을 추가해 메뉴를 더욱 확대해 나갈 계획”이라고 밝혔다.

배은나 객원기자 bae.eunna@joongang.co.kr"
2017-09-26,"한국야쿠르트, 신선한 '잇츠온'으로 삼시세끼 하세요","#. 서울 서초구 방배동에 사는 직장인 김동옥(32) 씨는 오늘도 간편식으로 저녁상을 차린다. 퇴근 후 매일 요리하기도 번거로울 뿐 아니라 남은 음식물과 식재료를 처리하기도 어려워서다. 김 씨는 집 앞 마트에서도 다양한 종류의 간편식을 살 수 있지만 한국야쿠르트에서 출시한 잇츠온을 고집한다. 고객이 주문을 해야 요리를 만들어 배송한다는 점과 짧은 유통기한으로 다른 간편식보다 신선하다고 믿기 때문이다.

김씨는 “매일같이 간편식으로 식사를 하는데 유통기한이 긴 제품을 먹기는 찜찜하고 기왕 먹을 거면 내가 직접 주문한 후에 만들어진 제품을 먹고 싶다”며 “평소에 잘 알고 지내던 야쿠르트 아줌마가 신선하게 냉장 배송해주는 점도 맘에 든다”고 말했다.



한국야쿠르트가 선보인 '잇츠온'은 모든 제품이 주문 후 요리해 냉장 유통된다. 요리 본연의 맛을 살리기 위해 유통기한도 최소화했다. 제품 겉면에는 요리 일자를 표기해 신선함을 강조하면서 소비자들이 안심하고 즐길 수 있도록 했다.

'잇츠온'이 신선함을 장점으로 내세울 수 있었던 비결은 1만3000여명에 달하는 야쿠르트 아줌마다. 전국 골목골목 뻗어있는 유통망이 뒷받침하고 있기 때문에 주문 후 요리된 제품을 단 한 개라도 무료로 냉장배송 할 수 있다.

주문 후 요리라는 신선함을 내세운 브랜드의 강점과 전국 야쿠르트 아줌마 유통망을 기반으로 잇츠온의 매출은 출시 이후 누적 30억원을 돌파했다.

한국야쿠르트는 9월 잇츠온 '밀키트' 제품군도 새롭게 선보였다. 기존 완제품인 반찬, 요리류 등 레디 투 잇(RTE), 레디 투 히트(RTH) 제품에서 소비자가 손쉽게 요리할 수 있도록 식재료로 구성된 레디 투 쿡(RTC) 제품으로 라인업을 확장한 것.

밀키트는 미국의 한 스타트업 회사를 시작으로 미국 내 대형식품・유통업체 등이 시장에 진출하거나 진출 계획을 밝히며 식품업계 시장의 새로운 아이템으로 뜨거운 관심을 받고 있다.

잇츠온 밀키트는 딱 필요한 만큼의 식재료와 요리방법이 적힌 레시피 카드가 함께 배송돼 누구나 쉽게 근사한 요리를 즐길 수 있다.

9월 출시된 잇츠온 밀키트는 '훈제오리월남쌈'과 '땅콩비빔국수키트', 시원한 국물 맛을 자랑하는 '황태해장국', '황태미역국' 등 총 4종이다. 특히 '훈제오리월남쌈'은 담백한 훈제오리와 신선한 야채를 라이스페이퍼로 돌돌 말아 칠리소스와 곁들여 먹을 수 있다.

한국야쿠르트 관계자는 “잇츠온은 건강한 가정식을 찾는 소비자에게 가장 잘 부합하는 간편식”이라며 “주문 후 요리하기 때문에 보다 신선하게 간편식을 즐길 수 있고 다양한 밀키트 제품군으로 요리하는 즐거움도 누릴 수 있다”고 말했다.

이주현 유통 전문기자 jhjh13@etnews.com"
2017-09-26,"한국야쿠르트 HMR 잇츠온, 누적매출 30억 돌파","한국야쿠르트가 선보인 가정간편식(HMR) ‘잇츠온’이 신선함과 편리한 서비스를 무기로 인기를 얻고 있다. 한국야쿠르트는 잇츠온 매출이 출시 후 누적 30억원을 돌파했다고 25일 밝혔다.

잇츠온은 모든 제품이 주문 후 요리돼 냉장 유통된다. 요리 본연의 맛을 살리기 위해 유통기한도 최소화했다. 제품 겉면에는 요리 일자를 표기해 신선함을 강조하면서 소비자들이 안심하고 즐길 수 있도록 했다.

잇츠온이 신선함을 장점으로 내세울 수 있었던 비결은 바로 1만3000여 명에 달하는 야쿠르트 아줌마 덕분이다. 전국 골목골목 뻗어있는 유통망이 뒷받침하고 있기 때문에 주문 후 요리된 제품을 단 한 개라도 무료로 냉장배송할 수 있다.

한국야쿠르트는 이달 잇츠온 ‘밀키트(Fresh Meal Kit)’ 제품군도 새롭게 선보였다. 기존 완제품인 반찬, 요리류 등 RTE(Ready to Eat), RTH(Ready to heat) 제품에서 소비자가 손쉽게 요리할 수 있도록 식재료로 구성된 RTC(Ready to Cook) 제품으로 라인업을 확장한 것.

밀키트는 미국의 한 스타트업 회사를 시작으로 미국 내 대형식품·유통업체 등이 시장에 진출하거나 진출 계획을 밝히는 등 식품업계 시장의 새로운 아이템으로 뜨거운 관심을 받고 있다.

잇츠온 밀키트는 딱 필요한 만큼의 식재료와 요리방법이 적힌 레시피 카드가 함께 배송돼 누구나 쉽게 근사한 요리를 즐길 수 있다.

잇츠온 밀키트는 ‘훈제오리월남쌈’과 ‘땅콩비빔국수키트’, 시원한 국물 맛을 자랑하는 ‘황태해장국’, ‘황태미역국’ 등 총 4종이다. 특히 ‘훈제오리월남쌈’은 담백한 훈제오리와 신선한 야채를 라이스페이퍼로 돌돌 말아 칠리소스와 곁들여 먹을 수 있다.

이달 중으로 파스타키트 2종도 추가할 예정이다. 잇츠온 밀키트 출시를 기념해 오는 30일까지 ‘훈제오리월남쌈’을 구매하면 곱게 간 땅콩 가루의 고소함이 살아있는 매콤새콤 ‘땅콩비빔국수키트’를 무료로 증정한다.

한국야쿠르트 관계자는 “잇츠온은 건강한 가정식을 찾는 소비자에게 가장 잘 부합하는 간편식”이라며 “주문 후 요리하기 때문에 보다 신선하게 간편식을 즐길 수 있으며, 다양한 밀키트 제품군으로 요리하는 즐거움도 누릴 수 있다”고 말했다.


김소연 기자 nicksy@"
