Date,Title,Content
2019-02-12 신소연 기자,‘홈 IoT 쇼핑’ 시대 성큼…가속화되는 유통과 전자의 합종연횡,"GS리테일, LG전자와 업무협약
집에서 음성으로 장보고 제품 추천도
이마트도 스마트카트ㆍ자율주행 시동

김용원 GS리테일 디지털사업본부장(우)과 황정환 LG전자 융복합사업개발부문장이 홈 IoT 기반의 AI장보기 및 스토어 이노베이션 구현을 위한 업무협약 체결 후 기념촬영을 하고 있다. [사진=GS리테일 제공]
[헤럴드경제=신소연 기자] 맞벌이 부부인 A씨, 야근하는 아내를 위해 맛있는 요리를 할까 생각 중이다. 냉장고를 보니 질 좋은 쇠고기가 있어 찹스테이크를 하기로 마음을 먹었다. 하지만 찹스테이크에 곁들일 채소가 없다. A씨가 “감자와 파프리카 좀 주문해줘”라고 말하자 냉장고와 연결된 홈 IoT(사물인터넷)가 A씨 집 근처 GS수퍼마켓에 감자와 파프리카 주문을 넣는다. 고기의 밑간이 밸 때쯤 감자와 파프리카가 들어 있는 신선팩이 도착한다.

A씨의 일상은 비단 먼 미래의 일이 아니다. 유통업계가 고객들의 쇼핑 경험을 업그레이드 하기 위해 AI(인공지능)과 IoT 기술을 보유한 IT업체들과 합종연횡에 적극적으로 나서고 있기 때문이다. 이에 따라 조만간 일반 고객들도 보다 ‘스마트한 쇼핑’으로 편의가 높아질 전망이다. ‘홈 IoT 쇼핑’ 시대가 성큼 다가오고 있는 것이다.

12일 유통업계에 따르면, GS리테일은 지난 11일 LG전자와 ‘홈 IoT 기반의 AI장보기 서비스’와 ‘스토어 이노베이션 구현’을 위한 업무협약(이하 MOU)을 체결했다.

이날 협약식에는 김용원 GS리테일 디지털사업본부장과 황정환 LG전자 융복합사업개발부문장 등이 참석해 가전, 쇼핑 데이터를 연계ㆍ활용 방안에 대한 다양한 의견을 나눴다.


GS리테일은 이번 협약을 통해 LG전자 홈 IoT 가전제품에 GS리테일 제품을 주문하고 쉽게 결제할 수 있는 이커머스를 구축하기로 했다. 냉장고나 TV, AI스피커 등 LG전자 제품에 말 한마디로 GS리테일의 모바일 쇼핑몰인 GS프레시나 밀키트 서비스인 심플리쿡, 배달음식 서비스 ‘미식일상’ 등에서 간편하게 주문할 수 있게 된다.

GS리테일은 또 고객의 주문 데이터 분석을 통해 가전제품 이용 빈도나 시점 등을 LG전자에 제공, 가전제품 모델 개발에 도움을 줄 예정이다. GS리테일도 고객의 구매상품 및 유형 등을 파악해 홈 IoT 제품에서 상품을 추천하는 시스템을 구축할 방침이다.

GS25나 GS슈퍼마켓 등 오프라인 매장에서는 LG전자의 5G나 AI, IoT 기술 등을 활용해 말만 해도 쉽게 쇼핑과 결제가 가능한 시스템을 구상할 계획이다.

GS리테일은 이번 협약으로 LG전자 홈 IoT 제품에 이커머스 서비스를 제공할 수 있어 매출 신장을 기대할 수 있게 됐다. 또 4차산업 기술을 통한 점포 운영 프로세스도 업그레이드할 수 있을 것으로 본다.


이에 앞서 이마트도 국내 최초 자율주행 스마트카트인 ‘일라이’의 뒤를 이을 차세대 스마트 카트 개발을 위해 LG전자와 협약을 맺었다. 일라이의 세부 기능 가운데 카트가 고객을 따라오는 ‘고객 추종 기능’에 개발 초점이 맞춰졌다. 만약 2세대 스마트카트가 상용화되면 더이상 마트에서 무거운 카트를 밀고 다닐 필요가 없어진다. 이마트는 또 스타트업 업체인 ‘토르 드라이브’와 협력해 올 하반기께 무인 자율주행 배송도 선보일 방침이다.

GS리테일 관계자는 “IoT, AI 등 첨단 기술이 보편화하면서 유통업체들이 고객들의 업그레이된 쇼핑 경험을 위해 IT업체들과의 제휴를 활발히 진행하고 있다”며 “GS리테일이 IoT기반의 대표적인 쇼핑플랫폼으로 자리매김할 수 있도록 서비스를 지속적으로 확대할 것”이라고 말했다.

carrier@heraldcorp.com"
2019-02-12 신미진,"""하이 엘지! 계란 주문해줘""…GS리테일, 홈 장보기 나선다","LG전자의 스마트 가전기기에서 GS리테일의 가정간편식 등을 주문할 수 있게 됐다.
GS리테일과 LG전자는 지난 11일 '홈 IoT 기반의 AI장보기 서비스'와 '스토어 이노베이션 구현을 위한 업무협약(이하 MOU)을 체결했다고 12일 밝혔다.
이를 통해 양사는 ▲LG전자 홈 IoT 가전제품 내 이커머스 구축 ▲홈 IoT 쇼핑 서비스로 구축된 데이터의 오프라인 적용 ▲GS리테일 오프라인 매장 인프라 개선 등에 협력하기로 했다.
고객들은 LG전자의 IoT 가전 제품을 통해 말 한마디로 GS리테일 모바일 쇼핑몰 GS프레시, 밀키트 서비스 심플리쿡, 배달 음식 서비스 미식일상을 주문할 수 있게 될 전망이다.
GS리테일은 구매 상품 및 고객 유형 분석을 통한 가전 제품 모델 개발과 가전 이용 시점 및 빈도 분석을 통한 상품 추천 등을 진행 할 예정이다. 또 GS25와 GS수퍼마켓에 LG전자의 5G, 인공지능, IoT 기술을 탑재한 모델 개발도 검토 할 계획이다.
이강철 GS리테일 디지털기획팀장은 ""LG전자와 협업을 지속적으로 늘려 GS리테일이 IoT기반의 대표적인 쇼핑플랫폼으로 자리매김할 수 있도록 서비스를 지속적으로 확대해 나가겠다""고 말했다.
[디지털뉴스국 신미진 기자]"
2019-02-12 이지은,LG전자 IoT 가전으로 GS프레시 신선식품 구매 가능해진다,"[아시아경제 이지은 기자] 앞으로 LG전자의 사물인터넷(IoT) 홈 가전을 통해 GS프레시 신선식품을 구매하거나 GS리테일의 밀키트를 구입하는 것이 가능해진다. GS리테일과 LG전자는 이달 11일 '홈 IoT 기반의 AI장보기 서비스'와 '스토어 이노베이션 구현을 위한 업무협약(MOU)'를 진행했다고 12일 밝혔다. 양사는 MOU에서 ▲LG전자 홈 IoT 가전제품 내 이커머스 구축 ▲홈 IoT 쇼핑 서비스로 구축된 데이터의 오프라인 적용 ▲GS리테일 오프라인 매장 인프라 개선 등의 사안에 협력키로 했다. 이번 MOU를 계기로 GS리테일과 LG전자는 홈 IoT 지급결제 쇼핑 서비스를 제공키로 했다. LG전자의 IoT 가전 제품을 통해 말 한마디로 GS리테일 모바일 쇼핑몰 GS 프레시, 밀키트 서비스 심플리쿡, 배달 음식 서비스 미식일상을 바로 주문할 수 있게 된다. 이를 통해 GS리테일의 구매 상품 및 고객 유형 분석을 통한 가전 제품 모델을 개발할 수 있게 되고, 가전 제품 이용 시점·빈도를 분석해 고객에게 알맞은 상품을 추천할 수도 있게 된다. 또 양사는 향후 GS25, GS수퍼마켓의 오프라인 매장 제품에 LG전자의 5G·인공지능·IoT 기술을 탑재한 모델 개발도 검토할 계획이다.이번 협약을 통해 GS리테일은 매년 출시되는 홈 IoT에 GS fresh 등의 이커머스 서비스를 제공하게 되어 매출 신장과 IoT 기술을 접목한 점포 운영 프로세스의 변화를, LG전자는 쇼핑 데이터 및 고객 DB 공유를 통한 인공지능 기반의 개인화 서비스 및 마케팅 실현의 효과를 볼 것으로 기대된다.이강철 GS리테일 디지털기획팀 팀장은 ""IoT 기술이 점차 고객들의 일상생활에 깊숙하게 파고들고 보편화됨에 따라 대한민국 대표 기술 기업인 LG전자와 전략적 업무 제휴를 하게 됐다""며 ""LG전자와 협업을 지속적으로 늘려, GS리테일이 IoT기반의 대표적인 쇼핑플랫폼으로 자리매김할 수 있도록 서비스를 지속적으로 확대해 나가겠다""고 밝혔다. 이지은 기자 leezn@asiae.co.kr"
2019-02-12 장우정 기자,"LG전자·GS리테일, 스마트 가전으로 장보기 서비스 업무협약","LG전자와 GS리테일은 11일 서울 강남구 역삼동 GS타워에서 홈 사물인터넷(IoT) 기반의 장보기 서비스를 선보이고 오프라인 매장을 혁신하기 위한 업무협약을 체결했다고 12일 밝혔다.

홈 IoT 기반의 장보기는 사용자의 음성 명령을 인식하는 LG전자 스마트 가전을 통해 GS리테일의 온라인 쇼핑몰 ‘GS프레시’, 밀키트(가정 간편식) 배송 서비스 ‘심플리쿡’, 배달 음식 서비스 ‘미식일상’ 등에 필요한 물건을 주문하는 서비스다.

GS리테일은 온·오프라인 매장을 통해 해당 상품을 고객에게 배송할 예정이다.

양사는 또 고객들이 LG전자 스마트 가전으로 주로 어떤 기능을 사용했는지 제품 사용 습관과 GS리테일 매장에서 물건을 구입한 이력을 분석해 맞춤형 제품을 추천하는 서비스를 선보일 예정이다. LG전자의 5세대(G) 이동통신, IoT 등 최신기술을 적용해 고객들이 편리하게 쇼핑할 수 있도록 기존 GS리테일 오프라인 매장을 첨단화하는 방안도 마련할 계획이다.

이날 협약식에는 LG전자 융복합사업개발부문장 황정환 부사장, GS리테일 디지털사업본부장 김용원 부사장 등 양사 관계자들이 참석했다.

황정환 LG전자 부사장은 ""LG전자가 보유한 첨단 기술과 GS리테일이 축적해 온 유통 역량을 결합해 새로운 쇼핑 문화를 만들 것""이라고 강조했다."
2019-02-12 김아름,"GS리테일, LG전자와 ‘홈IoT’ 구축 MOU 체결","[디지털타임스 김아름 기자] LG전자의 스마트 가전에서 GS리테일의 스마트 스토어를 만나볼 수 있게 됐다.



GS리테일과 LG전자는 지난 11일 '홈 IoT 기반의 AI장보기 서비스'와 '스토어 이노베이션 구현을 위한 업무협약(MOU)을 체결했다고 12일 밝혔다.



GS리테일 본사에서 진행된 이번 협약식에는 김용원 GS리테일 디지털사업본부장과 황정환 LG전자 융복합사업개발부문장 등 양 사의 임직원이 참석해 양사가 갖고 있는 가전, 쇼핑 데이터를 연계·활용하는 방안에 대한 의견을 나눴다.



양사는 LG전자 홈 IoT 가전제품 내 이커머스 구축·홈 IoT 쇼핑 서비스로 구축된 데이터의 오프라인 적용·GS리테일 오프라인 매장 인프라 개선 등의 사업을 진행할 예정이다.



이를 통해 LG전자의 IoT 가전 제품에서 GS리테일 모바일 쇼핑몰 GS fresh, 밀키트 서비스 심플리쿡, 배달 음식 서비스 미식일상 등을 바로 이용할 수 있게 된다. 또한 GS25, GS수퍼마켓의 오프라인 매장 제품에 LG전자의 5G, 인공지능, IoT 기술을 탑재한 모델을 개발하는 것도 검토한다.



이번 협약으로 GS리테일은 매년 출시되는 홈 IoT에 GS fresh 등의 이커머스 서비스를 제공하게 돼 매출 신장과 점포 운영 프로세스의 변화를, LG전자는 쇼핑 데이터 및 고객 DB 공유를 통한 인공지능 기반의 개인화 서비스 및 마케팅 실현 효과를 볼 것으로 기대된다.



이강철 GS리테일 디지털기획팀장은 ""IoT 기술이 점차 고객들의 일상생활에 깊숙하게 파고들고 보편화됨에 따라 대한민국 대표 기술 기업인 LG전자와 전략적 업무 제휴를 하게 됐다""며 ""LG전자와 협업을 지속적으로 늘려, GS리테일이 IoT기반의 대표적인 쇼핑플랫폼으로 자리매김할 수 있도록 서비스를 지속적으로 확대해 나가겠다""고 말했다.



김아름기자 armijjang@dt.co.kr"
2019-02-12 이혜미 기자,[음식혁명! 푸드스타트업]김재훈 식탁이있는삶 대표 “‘농가와 상생’ 본질 지키며 오프라인 매장ㆍ간편식 등 혁신 시작”,"-산지 직거래로 농가-소비자 ‘윈윈’ 추구
-오는 5월 첫 오프라인 매장 오픈…6곳 오픈 계획
-가공식품, 간편식 확대도 속도…“본질 남기고 변화ㆍ혁신”

김재훈 식탁이있는삶 대표가 서울 마포구 합정동에 위치한 사무실에서 포즈를 취하고 있다. [제공=식탁이있는삶]
[헤럴드경제=이혜미 기자] “제가 제일 듣기 싫은 말이 ‘할 거 없으면 농사나 짓지’라는 소리예요(웃음). 현재 농업 관련해 상장된 정보기술(IT) 회사가 하나도 없다는 게 안타깝지만 현실이죠.”

최근 서울 마포구 합정동에 위치한 ‘식탁이있는삶(이하 식삶)’ 본사에서 만난 김재훈(35) 대표는 이렇게 말했다.

식삶은 150여곳 농가와 손잡고 산지 직거래 신선식품 만을 취급하는 식품 전문몰이다. 이커머스업계의 최대 과제인 ‘싸게’, ‘빠르게’ 만을 외치지 않는다. ‘생산자는 제 값을 받고, 소비자는 합리적 가격에 최상의 상품을 받아보는 것’을 지향한다. 아울러 우수 산지 상품을 알리는 캠페인과 함께 관련 레시피, 칼럼 등 콘텐츠도 제공하고 있다. “농가가 정부 보조금 없이 자생할 수 있는 환경이 돼야 식품몰도 이커머스 시장에서 살아남을 수 있다”는 믿음 때문이다.

▶“손 내밀어준 농가에 보탬되고 싶었죠”= 김 대표는 대학교 2학년 때부터 농산물 유통 사업에 뛰어들었다. 고향인 경북 의성의 흑마늘 몇 박스를 챙겨들고 무작정 싱가포르로 향한 것이 계기였다. 목적지는 세계적인 미용ㆍ건강 관련 박람회 ‘뷰티아시아’ 무대. 이곳에서 운좋게 20만불에 달하는 수출 실적을 올렸다. “그 때부터 학교에서 수업 들은 기억이 없다”고 그는 멋적게 말했다. 농가 대상으로 상품을 기획해주는 컨설팅을 하는가 하면, 해외 신품종을 들여와 재배ㆍ유통하기도 했다. 하는 일마다 술술 풀리는 듯 했다.

그러던 중 케냐에서 심해 게를 들여와 국내 유통한 것이 그야말로 ‘대박’이 났다. 한 주에 컨테이너 8~9개씩 수입했다. 컨테이너 하나당 3000~4000만원이 남는 장사였다. 하지만 석달 만에 위기가 닥쳤다. 게잡이 배에 아예 투자했는데 그 배가 소말리아 해적에 납포된 것이다. 50~60일 뒤 풀려났지만 실려있던 게는 이미 상품성이 떨어진 채였다.

고시원 생활이 시작됐다. 미국 캘리포니아에 건너가 체리도 따고, 한국에 돌아와선 영화 보조출연도 하며 버텼다. 극단적인 생각을 할 때도 있었다. 그를 다시 일으켜세운 건 과거 컨설팅으로 인연을 맺은 농가들이었다. 농가 8곳이 그에게 “돈은 나중에 받겠다”며 자식같은 작물을 건넸다. 가장 힘든 순간에 손 내밀어준 농가에 그도 보탬이 되고 싶었다. 그 때부터 신품종을 들여와 국산화하고, 농업 관련 콘텐츠를 제작하는 등 농가와 함께 성장할 수 있는 사업에 매진했다.

식탁이있는삶 사내이사로 합류한 강레오 셰프(왼쪽에서 세번째)가 농가 및 직원들과 ‘스마일농부캠페인’에 참여한 모습. [제공=식탁이있는삶]
▶‘초당옥수수’ 등 신품종 승승장구= 2014년 식삶 몰을 시작하면서 거둔 가장 큰 성과는 초당(超糖)옥수수를 국내 보급시킨 것이다. 찰옥수수와 달리 날 것 그대로 먹을 수 있는 상품이다. 풍부한 단맛과 아삭아삭한 식감이 일품이다. 김 대표는 성공을 확신했지만 주위 반응은 시큰둥했다. 몇년 전만 해도 시장에 없던 상품이다보니 소비자 반응을 예상하기 어려웠다. 이에 김 대표는 농가에 선도금을 제시하고, 수확하면 일정 금액에 매입하겠다는 약속도 했다. 그렇게 농가는 초당옥수수 재배에, 김 대표와 직원들은 마케팅 활동에 매진했다. 이에 힘입어 상품은 매진 행렬을 이어갔다. 김 대표는 “초당옥수수처럼 잘된 사례를 만드니 지금은 농가들이 서로 (재배)하겠다고 한다”고 귀띔했다. 귤처럼 껍질이 얇은 ‘클레멘타인 오렌지’ 등도 식삶이 단독 재배해 유통하기 시작한 신품종이다.

이처럼 다양한 품종을 보급ㆍ유통할 뿐 아니라 농업 관련 캠페인도 주요 사업으로 진행해오고 있다. 이름하여 ‘스마일농부 캠페인’이다. 소위 ‘돈 되는’ 사업은 아니다. 농가 자생력을 기르는 것이 우선 목표다. 그는 “농민 덕에 돈을 벌게 됐으니 우리나라 농업을 위해 의미있는 일을 해보자 해서 시작한 법인이 식삶”이라고 설명했다. 좋은 취지에 공감해 개그맨 정찬우, 배우 위양호 등이 고문으로 참여하고 있다. 캠페인을 함께 해오던 스타셰프 강레오는 아예 식삶 사내이사로 정식 합류했다. 김 대표는 “산지를 찾아다니면서 강셰프 얘기를 가장 많이 들었다”며 “식품에 정말 관심이 많은 분이고 농가가 잘 돼야 한다고 생각하는 셰프 중 하나”라고 신뢰를 드러냈다.

▶“치킨게임 지양…큐레이션 등으로 차별화”= 식삶은 식품몰 외에도 신품종 계약재배, 식자재 납품 업무를 하는 농업회사법인 시즌랩과 세목골 농장 등을 관계사로 보유하고 있다. 설립 4년여 만에 지난해 기준 매출 300억원을 달성했다. 식삶 몰 매출만 20~30억원, 순이익은 7억원 수준이다. 연간 마케팅비를 1000만원도 채 쓰지 않고 올린 매출이라는 점을 김 대표는 강조했다. 올해는 연 매출 400억원을 목표로 하고 있다.

“계약재배는 마진(이익)이 30~40% 정도 남아요. 벤더(공급자)를 거치면 떨어질 수 밖에 없죠. 오픈마켓은 식품 마진율이 한 자릿수가 안 되기도 하다보니 ‘택배비 따먹기’라는 말도 나와요. 결국 우리나라 오픈마켓 시장은 치킨게임 형국이 될 수 밖에 없어요.”

다른 식품몰과 차별화된 경쟁력을 위해 식삶은 빅데이터를 통한 ‘큐레이션(맞춤추천)’ 기능도 고도화하고 있다. 다른 큐레이션 몰의 경우 회사가 상품을 정해서 노출시키는 경우가 많다. 식삶은 소비자의 구매 이력과 앱 내 동선 등을 분석해 성향에 맞는 상품을 제공하는 서비스를 오는 3월 시작할 계획이다.

▶“본질 남기고 실험 거듭…실물 매장, 간편식 확대”= 김 대표는 온라인만큼 오프라인 유통 채널에도 관심이 많다. 브랜드 홍보 효과 등을 기대할 수 있기 때문이다. 이에 김 대표는 오는 5월 서울 신사역 인근에 식삶 첫 매장을 오픈하기로 했다. 이를 시작으로 수도권에 6개 매장 문을 열 계획이다.

변화하는 식품 소비 트렌드에 발 맞춰 가공식품, 간편식 등 확대에도 속도를 내고 있다. 계약된 산지의 신선한 원물을 활용해 60여종 자체브랜드(PB) 상품을 개발해둔 상태다. 간편식은 강레오 셰프와 협업해 식삶 브랜드의 밀키트(반조리 음식)와 밀프렙(미리 준비해두고 끼니 때마다 꺼내먹는 식사) 등을 선보일 예정이다. 다른 간편식 제조사와 달리 생산자와 협의해 원료부터 제어할 수 있다는 점에서 김 대표는 품질을 자신했다.

“그간 대기업에서 인수 제의도 받았지만 거절했어요. 가치 키워서 팔려고 세운 회사가 아니니까요. 올해 저희 캐치프레이즈가 ‘본질은 남기고 변화하고 혁신하자’에요. 저희의 본질은 농민과 함께 하는 것이죠. 보다 진심과 전문성이 담긴, 우리만 팔 수 있는 상품으로 승부하고 싶어요. 그리고 좋은 일에 참여할 수록 좀 더 이익을 가져갈 수 있다는 것을 식삶을 통해 보여주고 싶어요.”

ham@heraldcorp.com"
2019-02-10 성기호,"""설이 끝이 아니다""…유통업계 '포스트 명절' 이벤트 활발","[아시아경제 성기호 기자] 유통업계가 포스트 설을 위한 이벤트에 나서고 있다. 명절 이후 가벼워진 주머니와 '나를 위한 소비'를 찾는 고객들을 위한 것이다.10일 롯데슈퍼에 따르면, 12일까지 '우리집 비상 식량' 프로모션을 열고 간편조리식을 최대 35% 할인한다.CJ 고메 콤비네이션 피자(415g)를 4590원에, 건국 오! 우유(1ℓ)를 1450원에, 하림 통가슴살 치킨너겟(500g)을 5490원에 판매하며, CJ 가쓰오 우동(4인)을 5490원에 판매한다.명절 음식으로 느끼해진 속을 달래 줄 비비고 얼큰 버섯 칼국수(592g)는 6990원에, 오뚜기 참깨라면을 750원에 판매한다. 이밖에도 청정원 카레여왕(108g)을 2490원에, 대상 사골 김치찌개(450g)를 4590원에, 오뚜기 3분카레(200g)를 990원에, 비비고 육개장·미역국(500g)을 3590원에 각각 판매한다.롯데슈퍼 대표 밀키트인 '쿠킹박스'도 함께 할인 판매한다. 소고기 샤브샤브(740g)를 정상가 대비 52% 할인된 가격인 8900원에, 블랙라벨 스테이크 세트(530g)를 1만2900원에, 리코타치즈 샐러드(140g)를 3900원에, 밀푀유나베(815g)를 1만2900원에 각각 판매한다.올리브영은 '스마일 프로젝트'를 통해 최대 50% 할인 행사와 CJ ONE 포인트 3배 적립, 스마일 젤 네일 스트립 증정 행사를 펼친다.구정이 지나고 진짜 새해를 맞는 2월은 졸업, 입학, 새학기 등 본격적인 새로운 시작을 준비하는 달로, 올리브영은 새로운 시작을 준비하는 고객들에게 긍정 에너지를 전달하고 기분 전환을 돕기 위해 스마일 프로젝트를 진행하는 것이다.스마일 젤 네일 스트립은 올리브영이 셀프 네일 인기 브랜드 '데싱디바'와 협업해 한정 수량 제작한 스티커 네일로, 이번 프로젝트의 각양각색의 스마일 캐릭터가 그려진 것이 특징이다. '스마일 젤 네일 스트립'은 올리브영 전국 매장과 공식 온라인몰에서 4만원 이상 구매 시 선착순 증정한다.다가오는 발렌타인데이를 기념해 이달 14일까지 7일간 일부 품목에 한해 CJ ONE 포인트를 3배 적립하는 행사도 펼친다. 참여 브랜드로는 존바바토스, 클린, 페라리 등 향수 브랜드를 비롯해 바이오더마, 더마비, 클로란, 메이블린, 유세린, 마녀공장, 데싱디바, 젤라또팩토리 등이 있다.이외에도 같은 기간 동안 메이크업 쿠션 제품을 최대 50% 할인하는 '쿠션대전' 행사를 통해 발렌타인데이와 새학기 메이크업을 준비하는 고객들에게 더욱 큰 혜택을 제공한다.성기호 기자 kihoyeyo@asiae.co.kr"
