Date,Title,Content
2019-03-01 이지은,"3·1운동 100주년…""독립운동가 도시락·유관순 모나미로 더욱 뜻깊게""","[아시아경제 이지은 기자] 1919년 3·1운동이 시작된 지 100주년을 맞는 역사적인 날이다. 평소에는 역사에 큰 관심이 없더라도, 오늘만은 독립을 위해 분연히 일어선 독립운동가들의 애국 정신을 마음 깊이 새겨보는 것은 어떨까. 유통업체들도 독립운동가의 얼굴과 사적지 등을 상품에 적극 반영하고, 유관순 열사 캠페인을 벌이며 3·1운동 100주년을 적극 기리고 있다. 유통업계에 따르면 GS25에서는 동풍신·유관순 등 여성 독립운동가 51인의 스티커를 제작, 현재 취급 중인 도시락 전상품 20종에 이달 말까지 부착한다. 보훈처 측과 오랜 기간 숙고를 거친 끝에 나온 결과물이다. 우리나라 독립을 위해 생애를 바쳤지만, 상대적으로 잘 알려지지 않은 자랑스런 여성 독립 운동가 51명을 기억하자는 취지다. GS계열인 GS수퍼마켓, 밀키트 브랜드 '심플리쿡'도 이에 동참한다. CU도 3·1운동 100주년 기리기에 동참했다. 점포 내 안내게시판에 상품 정보 대신 국가보훈처가 선정한 '2019 이달의 독립운동가' 포스터를 매월 게시한다. 3월에는 손병희 선생이 이달의 독립운동가로 게시된다. PB상품을 통해 우리가 기억해야 할 3·1운동 사적지도 소개한다. 헤이루 PB상품 가공유, 스낵 13종을 선정해 만국 공원(인천), 아우내 장터(천안), 미밋 동산(제주) 등 전국 각지의 3·1 운동 사적지를 제품 패키지에 넣는다.이마트24는 대표 독립운동가인 유관순 열사를 테마로 대국민 캠페인을 진행한다. 캠페인 기간 동안 도시락 전 상품, 이프레소 원두 커피컵, 하루e리터 생수에 3·1운동 연관 키워드를 넣은 태극문양을 부착해 판매한다. 하루e리터 판매금액의 1%는 유관순 열사 기념사업회 후원금으로도 쓰여 더욱 뜻깊다. 또 태극기의 흰색 바탕을 볼펜 바디에, 태극 문양의 파란색과 빨간색을 상품 패키지에 적용한 모나미 153 유관순 에디션도 선보인다. 이마트24는 맛보장 행사에 참여한 고객 1000명에게 선착순으로 유관순 에디션을 증정할 계획이다.이지은 기자 leezn@asiae.co.kr"
2019-02-28 김동호 기자,"프리미엄 반찬 ‘집반찬연구소’, 매콤제육볶음 등 쿠킹박스/밀키트 8종 출시","프리미엄 반찬 브랜드 ‘집반찬연구소’가 집에서 간편하게 조리할 수 있는 한돈 매콤제육볶음 등 쿠킹박스 8종을 출시했다. ‘집반찬연구소’는 27년간 외식업에 종사하며 한식만을 연구해온 전문가, 세 아이의 부모에 의해 탄생한 프리미엄 반찬 브랜드다. 한식, 토속음식, 한정식 전문점을 운영하며 쌓아온 노하우를 집대성해 제대로 된 신선반찬을 선보이고 있다. 해당 브랜드가 이번에 선보인 쿠킹박스(밀키트)는 남녀노소 선호도가 높은 반찬을 중심으로 구성했다. ▲자극적이지 않은 ‘간장 순살 닭갈비’ ▲밥에도 술에도 어울리는 ‘매콤 순살닭갈비’ ▲집에서 즐기는 건강한 꼬치구이 ‘모듬 닭꼬치’ ▲달큰한 육수와 풍부한 채소가 어우러진 ‘서울식 버섯불고기전골’ ▲통인시장에서 먹던 그 맛 ‘우리쌀로 만든 기름떡볶이’ ▲명실상부 대표 밥반찬 ‘한돈 매콤 제육볶음’ ▲국내산 오징어와 한돈의 만남 ‘한돈 오징어제육볶음’ ▲공깃밥 한 그릇 뚝딱할 수 있는 ‘한돈 통목살 김치찜’ 총 8종이다. 집반찬연구소 쿠킹박스는 한식이 필요한 재료가 많은 데다 맛을 내기 어렵고 시간까지 많이 소요한다는 편견을 깨기 위해 기획됐다. 패키지를 뜯어서 데우기만 하면 될 정도로 레시피가 간단하지만 집에서 엄마가 만들어준 집밥과 같은 맛을 구현해내 1인가구, 자취생, 혼밥러들 뿐만 아니라 부부형, 아이 키우는 가정에서도 관심을 끄는 중이다. 한식 HMR 전문 집반찬연구소 관계자는 “새롭게 론칭한 쿠킹박스(밀키트)는 요리 재료는 물론 조리법까지 함께 제공하기 때문에 건강한 맛과 요리하는 즐거움 모두 즐길 수 있다”며 “차후 지속적으로 품목을 늘릴 계획이다. 레시피가 간단하고 활용도가 높아 집들이음식이나 캠핑, 가족모임 식사 메뉴 때문에 고민하는 경우에도 좋은 대안이 될 것”이라고 강조했다.

한편 집반찬연구소는 새벽배송, 하루특송 서비스로 고객만족도 향상을 위해 노력하는 중이다. 특히 하루특송은 아침 9시 전까지 주문을 완료할 경우 저녁 6시~8시 사이에 당일 만든 신선반찬을 배송해줘 혁신적이라고 평가 받아왔다. 새벽배송의 경우 고객 편의와 환경까지 생각해 아이스박스 및 아이스팩을 수거한다. 또한 작은 차이가 프리미엄을 만든다는 믿음 하에 모든 식재료와 함량을 제품 패키지나 상세페이지를 통해 공개하고 있다. 고추장, 된장, 간장은 물론 고춧가루, 들깨기름, 참깨기름, 현미유 등 놓치기 쉬운 부분까지 국내산 장류 및 기름을 사용한다. 쿠킹박스 및 각종 반찬류는 집반찬연구소 공식 온라인 쇼핑몰 또는 네이버 스마트스토어를 통해 만나볼 수 있다."
2019-02-27 김현주,"""'밥 잘 사주는 예쁜 엄마'가 대세라고요?""","가족을 위한 식사 준비에 가정간편식(HMR)을 이용하는 비율이 증가하고 있다.

한 언론사에서 지난 25일 발표한 서울·수도권 성인남녀 468명 대상 설문조사 결과에 따르면 ‘가족 밥상을 차릴 때 간편식을 활용해본 적이 있다’고 응답한 비율은 전체 응답자의 76%에 달했다.

이는 서울·수도권 거주자 10명 중 7명 이상이 가족 식사 때 가정간편식을 이용한 적이 있는 것으로 집밥 대용품 정도로 여겨지던 가정간편식이 이제 집밥의 일부가 된 셈이다.

국내 가정간편식 시장은 지난해 3조원을 넘는 등 연평균 21% 성장률을 기록하며 급성장하고 있다. 맞벌이 가구가 늘어나고 전업주부도 아이 교육으로 시간이 여유롭지 않아 1인 가구뿐만 아니라 가정에서 집밥 노동의 부담이 큰 주부들도 가정간편식을 많이 찾는 것으로 분석된다.

2019년 소비트렌드로 언급된 신(新) 소비주역 밀레니얼 세대에게 가정간편식으로 밥을 차려주는 ‘밥 잘 사주는 예쁜 엄마’가 주목 받은 사실에서도 이러한 사실을 유추해 볼 수 있다.

특히 2월 말부터 3월 초는 봄방학에서 신학기로 넘어가면서 아이들 새 학기 준비와 적응으로 매 끼니를 챙겨야 하는 주부들의 부담이 늘어나는 시기다. 이에 식품 및 유통업계는 복잡한 조리 과정 없이 요리 시간을 줄여 간편하게 데워 한끼 식사를 준비할 수 있는 가정간편식 제품 할인 행사와 가족형 밀키트 제품을 출시하며 3월 신학기를 앞둔 밀레니얼 세대의 주부층 잡기에 총력을 기울이고 있다.

유럽풍 프리미엄 미트샵 ‘앵거스박’은 신학기를 맞아 ‘왕갈비찜’, ‘왕갈비탕’ 등 손수 오랜 시간 정성을 들여야 하는 소고기 음식을 가정간편식으로 출시해 근사한 한끼를 차릴 수 있는 제품을 세트로 구성해 할인전을 실시한다. ‘앵거스박’ 가정간편식 제품은 고품질 소고기를 엄선해 만들 뿐만 아니라 가성비까지 뛰어나 밀레니얼세대 주부들에게 인기몰이 중이다. ‘앵거스박’은 ‘프리미엄 블랙앵거스 전문점’으로 북미산 프리미엄 소고기 브랜드 ‘엑셀비프(Excel®)’로 만든 가정간편식 제품을 선보이고 있다. 프리미엄 소고기 ‘엑셀비프’는 작년 5월 미국 PIERS 리포트 기준으로 국내 미국산 소고기 시장 점유율의 37%를 차지할 정도로 한국에서 위상을 굳건히 하고 있는 브랜드다.

동원홈푸드가 운영하는 신선 가정간편식 전문몰 '더반찬'은 온 가족의 간편 밥상을 위한 밀키트(meal kit) 브랜드 ‘맘스키트’를 이달 초 론칭했다. ‘맘스키트’는 요리 패키지 제품으로 엄선된 요리 재료와 더반찬 쉐프가 직접 만든 소스가 들어있다. 누구나 간편하게 조리할 수 있도록 정량화된 재료와 소스를 키트화 하여 간편 레시피와 함께 제공되는 패키지 상품이다. ‘맘스키트’는 동봉된 레시피 카드를 참고해 약간의 조리 과정을 거치면 직접 조리하기 어려운 외식 메뉴들을 20분 내외로 간편하게 만들어 즐길 수 있다.

롯데마트도 신학기를 앞두고 가족의 주말 한끼를 든든하게 책임져 줄 가정간편식 ‘요리하다’ 제품을 할인판매 한다. 롯데마트 ‘요리하다’는 ‘요리에 즐거움을 더하다’는 뜻으로 한식뿐만 아니라 세계 요리를 집에서 즐길 수 있는 가정간편식 전문브랜드다. 국, 탕과 같은 한식 메뉴와 집에서 쉽게 요리하기 어려운 다양한 세계 음식을 집밥으로 준비할 수 있는 것이 특징이다. ‘대만식 치즈감자’, ‘하와이안 쉬림프 핫칠리’, ‘히노아지 돈코츠 라멘’ 등 다양한 세계 요리를 가정간편식으로 출시해 각국의 음식을 집에서 간편하게 한끼 식사로 차릴 수 있어 주부들에게 인기가 많다.

앞서 롯데마트는 지난 19일, 올해 테마를 품질과 가격을 더한 ‘품격’으로 정하고 두 가지를 모두 잡을 수 있는 상품 제안에 나선다고 밝혔다. 롯데마트는 매주 ‘생활의 답’과 ‘가성비의 답’ 섹션을 운영한다.

롯데마트 관계자는 “연이은 경기불황으로 체감 물가 상승률이 지속 상승하고 있는 상황에서 소비자들의 장바구니 고민이 계속되고 있다”며 “롯데마트는 합리적인 가격과 함께 초고가 상품과 비교해도 손색없는 품질의 상품들을 제공하기 위해 지속적으로 노력할 것”이라고 말했다.

전문가들은 이제 가정간편식은 집밥 대용품에서 집밥 일부가 되고 있다며 식품 및 유통업계는 맞벌이 주부뿐만 아니라 신학기를 맞아 아이들의 교육과 학교 생활을 챙기느라 시간이 부족한 주부를 겨냥해 가정간편식 시장 확대에 주력할 것으로 전망하고 있다.

김현주 기자 hjk@segye.com "
2019-02-27 석유선,"3.1운동 100주년, 유통업계 사활 거는 이유","‘착한 소비’ 추구하는 코즈 마케팅 일환…편의점업계 대국민 캠페인 앞장
편의점 이마트24가 3월 31일까지 삼일운동 100주년 기념 대국민 캠페인을 전개합니다. 이번 캠페인은 유관순 열사로, 이마트24는 하루e리터 판매금액의 1% 유관순열사기념사업회에 기부, 다큐 영화 '1919 유관순' 공식 후원, 모나미 153 유관순 에디션을 선착순 증정하는 행사를 진행한다. [사진=이마트24 제공]3.1운동 100주년을 맞아 국내 기업들이 그 어느 때보다 바쁜 모습이다.특히 소비자 접점이 많은 유통업계는 3.1절을 전후해 애국심 마케팅을 앞세워, 남녀노소 구분 없이 자사의 상품을 특가에 판매하거나 다양한 이벤트를 열고 있는 상황.마케팅 전문가들은 업계가 3.1운동 100주년 마케팅에 사활을 거는 것은 이른바 ‘착한 소비’를 유도해 매출을 노리는 홍보 전략이라고 말한다.전문 용어로 ‘코즈 마케팅(cause marketing)’라고 하는데, 환경·보건·빈곤 등 사회적인 이슈를 기업이 자사의 이익 추구를 위해 활용하는 것을 말한다. 기업이 소비자를 통해 경제적 가치와 공익적 가치를 동시에 추구하는 것이다.BGF리테일이 독립기념관과 업무제휴를 맺고 '함께해요 3∙1운동 100주년' 캠페인을 진행한다. 이달의 독립운동가, 3∙1운동 사적지를 CU 점포와 PB상품 패키지(사진)를 통해 알리고 올바른 독립운동 역사 교육에 보탬이 되고자 기부금을도 전달한다. [사진=BGF리테일 제공]3.1운동 100주년과 연계한 코즈 마케팅에 가장 바쁜 곳은 24시간 어디서든 만날 수 있는 편의점 업계다.편의점 CU를 운영사인 BGF리테일은 독립기념관과 ‘독립운동사 대중화를 위한 업무협약’을 체결, 3월부터 ‘함께해요 3∙1운동 100주년 캠페인’을 진행한다.이 캠페인은 이달의 독립운동가, 3∙1운동 사적지와 관련된 정보를 전달하고 소비자들과 함께 그 숭고한 뜻을 기리기 위함이다.안내게시판에 국가보훈처가 선정한 ‘2019 이달의 독립운동가’ 포스터를 매월 게시, 3월 손병희 선생을 시작으로 12월 윤봉길 의사까지 365일 24시간 독립운동가들의 공훈을 널리 알릴 예정이다.또한 CU의 인기 PB상품을 통해 3∙1운동 사적지도 소개한다. 헤이루(HEYROO) PB상품 가공유, 스낵 13종 등에 만국 공원, 아우내 장터, 미밋 동산 등 전국 각지의 3∙1 운동 사적지를 제품 패키지에 넣었다.CU 멤버십 앱인 ‘포켓CU’를 활용한 역사퀴즈 이벤트도 실시한다. 내달 1일까지 출제되는 3∙1운동 퀴즈의 정답을 맞힌 선착순 응모자 3100명에게 삼각김밥을 100원에 구매할 수 있는 할인쿠폰도 제공한다. GS25, 역사 알리기 캠페인 관련 이미지[사진=GS리테일 제공]GS25 운영사인 GS리테일은 3·1운동과 임시정부수립 100주년을 맞아 창업주 허만정 선생의 정신을 이어 받아 ‘국민이 지킨 역사, 국민이 이끌 나라’를 핵심 테마로 한 국가보훈처의 역사 알리기 사업에 나선다.역사 알리기 활동은 3·1절을 즈음해 연중 다양한 월별 테마로 지속된다. 편의점 GS25, GS수퍼마켓, 랄라블라, GS프레시, 각종 공식 SNS 채널 등 하루 700만명이 이용하는 GS리테일의 모든 온·오프라인 고객 접점 채널을 총동원키로 했다.특히 편의점 GS25는 여성 독립운동가 51인의 스티커를 제작해 현재 취급 중인 도시락 전 상품 20종에 부착한다. 또 GS수퍼마켓과 GS리테일 밀키트 브랜드인 심플리쿡의 조리 식품과 밀키트 상품에도 여성 독립운동가 알리기 스티커를 부착해 판매한다.이마트24는 3·1운동 100주년을 맞아 내달 31일까지 대국민 캠페인 ‘유관순 열사의 열정과 용기를 응원합니다’를 진행한다. 유관순 열사를 통해 3·1운동의 의미를 되새긴다는 방침이다.도시락 전 상품, 이프레소 원두커피컵, 하루e리터 2종에 태극 문양을 부착해 판매한다. 태극 문양엔 유관순 열사를 비롯한 7인의 여성독립운동가, 대한독립만세 등 3·1운동 연관 키워드를 넣었다.캠페인 기간 하루e리터 2종 판매금액의 1%를 적립해 4월 중 유관순열사기념사업회에 기부하며, 유관순 열사와 여성 독립 운동가들을 다룬 다큐 영화 ‘1919 유관순’을 공식 후원한다.맛보장 행사 참여 고객 1000명에게 모나미, 삼성카드와 협업해 만든 한정판 볼펜 '모나미 153 유관순 에디션'을 선착순 증정한다.업계 관계자는 “이번 3·1운동 100주년 기념 대국민 캠페인을 통해 독립을 위해 헌신한 순국선열을 기리는 일에 편의점 업계도 일조하려 한다”며 “착한 소비를 추구하는 대국민 캠페인을 지속적으로 전개하는 것은 기업의 브랜드 이미지 제고에 큰 도움이 된다”고 말했다.
석유선 기자 stone@ajunews.com"
2019-02-26 성기호,"""간단하게 즐기는 수산 요리""…GS수퍼마켓 '밀키트' 100여종 출시 눈앞","[아시아경제 성기호 기자] GS리테일이 운영하는 GS수퍼마켓이 인기 수산 요리를 간편하게 즐길 수 있는 ‘심플리쿡’의 노하우를 접목 한 수산 요리 재료키트를 이달 출시한다고 26일 밝혔다.GS수퍼마켓은 지난해에는 물만 넣어 조리하는 알탕, 동태탕 등 60여종의 수산 가공 상품 등을 출시 했고, 올해는 간편 랍스타팩과 낙지, 주꾸미 볶음 등 100여가지 신상품 출시를 앞두고 있다.GS리테일의 주요 수산 가공 상품으로는 GS25 히트상품인 대게딱지장과 연어장 등이 있다.이번 출시하는 상품은 고객들이 수산물만 따로 구입해 준비하면 약 10여분만에 요리를 만들 수 있도록 모든 재료를 세척, 커팅해 제공하고, 추가적으로 셰프의 노하우를 접목한 소스를 통해 집에서 내기 힘든 불맛, 국물맛 등이 구현 가능한 상품이다.1차 선보이는 상품은 매콤해물볶음용재료(3980원), 강릉식순두부 해물짬뽕용재료(4580원), 얼큰해물탕용재료(3980원), 중화식 해물누룽지탕용재료(5980원)이다. 추가적으로 이와 같은 형태로 조림류, 볶음류 재료 키트를 준비중이다.하민주 GS리테일 수산MD는 “건강을 추구하는 고객들이 증가함에 따라 웰빙 수산물에 대한 매출이 지속 상승하고 있지만, 까다로운 손질과 조리법으로 어려움이 있는 고객들이 있어, GS리테일 심플리쿡을 밀키트 노하우를 이번 상품에 접목해 개발했다”며, “GS수퍼마켓에서 싱싱한 수산물을 구입해, 서툰 칼질, 귀찮은 부재료 장보기 없이 맛있는 음식을 즐기시기 바란다.”고 말했다.성기호 기자 kihoyeyo@asiae.co.kr"
2019-02-26 김기환,이미지 높이고 고객 잡고… ‘애국 마케팅’ 후끈,"편의점 이마트24는 3·1운동 100주년을 맞아 다음 달 말까지 대국민 캠페인 ‘유관순 열사의 열정과 용기를 응원합니다’를 진행한다. 도시락 모든 제품과 이프레소 원두커피 컵, 생수 하루e리터(500mL, 2L)에 태극 문양을 부착해 판매한다. 이마트24는 캠페인 기간 하루e리터 판매금액의 1를 적립해 ‘유관순열사기념사업회’에 기부할 예정이다. 이마트24는 또 이벤트 참여 고객 1000명에게 ‘모나미 153 유관순 에디션’을 선착순으로 증정한다.

3·1운동과 임시정부 수립 100주년을 맞아 유통업계가 국민들에게 애국심을 고취시키기 위해 ‘애국 마케팅’을 벌이고 있다. 판매 상품에 독립운동가 알리기 스티커를 부착하거나 판매 수익금 일부를 관련 사업에 기부하는 등 독립운동 역사 알리기에 적극 나서고 있다. 하지만 3·1운동을 대표하는 ‘태극기 마케팅’은 자취를 감췄다. 100주년을 맞는 이번 삼일절을 맞아 대형 백화점·마트 모두 태극기 마케팅을 하지 않기로 했다. ‘태극기 부대’의 정치적 메시지를 의식한 것으로 보인다.

GS리테일은 국가보훈처와 함께 ‘국민이 지킨 역사, 국민이 이끌 나라’라는 테마로 역사 알리기 사업을 진행한다. GS리테일이 운영하는 편의점 GS25는 여성 독립운동가 51인의 스티커를 제작해 현재 판매 중인 도시락 20종에 부착 했다. 이름이 알려지지 않은 여성 독립운동가 51명을 기억하자는 취지에서 기획됐다. GS수퍼마켓과 GS리테일의 밀키트(Meal Kit) 브랜드인 심플리쿡에도 각각 조리 식품과 밀키트 상품에 여성 독립운동가 알리기 스티커가 부착된다.

편의점 CU를 운영하는 BGF리테일은 독립기념관과 ‘독립운동사 대중화를 위한 업무협약’을 체결하고, 오는 3월부터 ‘함께해요 3·1운동 100주년 캠페인’을 진행한다. 전국 CU 점포 내 게시판에 국가보훈처가 선정한 ‘2019 이달의 독립운동가’ 포스터를 매달 게시하고 독립운동사를 알릴 계획이다. 
25일 오전 서울 중구 필동 이마트24 R충무로스타점에서 모델들이 다음달 말까지 진행하는 3·1운동 100주년 기념 캠페인 상품을 소개하고 있다.
연합뉴스
바나나우유와 콘소메맛 팝콘 등 인기 자체브랜드(PB) 상품 13종에는 포장에 인천 만국공원과 천안 아우내장터 등 전국 각지의 3·1운동 사적지 사진이 들어간다. 아동·청소년들이 올바른 독립운동 역사를 배울 수 있도록 관련 프로그램 개발을 위해 독립기념관 교육사업부에 기부금도 전달할 예정이다.

식품업계에서는 농심이 3월 한 달 동안 대표 상품인 ‘안성탕면’ 판매액의 3.1를 국가유공자 복지와 보훈 선양 사업에 기부한다. 안성탕면의 월평균 매출이 90억원가량임을 고려하면 기부금은 약 3억원에 이를 전망이다. 안성탕면과 해물안성탕면 멀티팩 포장에는 3·1절 100주년 기념 캠페인 문구를 넣은 한정판 패키지도 선보인다.

김기환 유통전문기자 kkh@segye.com"
