Date,Title,Content
2020-06-23 임혜선,[무더위 경제학]펄펄 끊는 더위에 유통가 해빙 모드,"[아시아경제 임혜선 기자] 낮 최고 기온이 30도를 넘으며 '6월 찜통 더위'가 이어지자 사람들의 경제활동이 바뀌고 있다. 무더위를 피해 사람들은 시원하게 에어컨이 가동되는 실내 쇼핑몰ㆍ백화점ㆍ마트로 몰려들었고 편의점에선 얼음과 음료 등이 불티나게 팔렸다. 여름철 가전인 에어컨과 선풍기는 사상 최대 매출고를 올렸다. 반면 고깃집과 전통시장 등은 더운 날씨 탓에 손님이 끊겨 한숨이 깊어지고 있다.

더위 피해 실내 찾는 사람들

23일 유통업계에 따르면 기온이 32.7도까지 오른 지난 주말(19~21일) 이마트를 찾은 고객은 전달보다 10% 증가했다. 무더위가 지속되면 시원한 실내를 찾는 사람들이 많아 대형 유통업체들이 수혜를 누린다. 서울 기온이 1907년 10월1일 기상 관측을 시작한 이래 가장 높은 39.6도를 기록한 2018년 8월1일 롯데월드몰을 찾은 사람은 처음으로 20만명을 넘었다. 다음 날인 2일(37.9도)에는 21만명으로 쇼핑몰 오픈 이후 주중 역대 최고 기록을 세웠다. 같은 해 상반기 주중 하루 평균 방문객 수는 11만명이었다. 사람들이 몰리면서 매출도 급증했다.

지난해 한 백화점에서 여름 상품 트렌드를 분석한 결과 기온이 30도를 넘어가면 점심ㆍ저녁 시간대에 집중적으로 매출이 증가했다. 품목별로는 식당 및 식품 코너에서 스시ㆍ냉면ㆍ샐러드 판매가 늘었고 피자ㆍ파스타ㆍ찌개를 찾는 수요는 감소했다. 밀키트 등 간편조리, 다이어트 식품 매출은 증가한 반면 베이커리류(케이크)와 떡 판매는 줄었다. 또 에어컨 등 전통적인 여름 상품과 라이프스타일 상품으로 매출이 집중됐다. 별다른 목적 없이 더위를 피해 들렀다가 구매를 결정한 경우가 많아서다. 연령대로 보면 50~60대 시니어 고객과 가족 단위 고객의 방문이 늘었다. 시니어 고객들은 주로 보석, 양산, 가전제품, 식기 등을 구매했고 가족 단위 고객들은 물놀이 용품 등을 주로 샀다.

백화점ㆍ마트ㆍ편의점 '특수'

무더위가 시작되며 유통가는 모처럼 웃고 있다. 연일 무더위가 이어진 지난 19~22일 신세계백화점 전체 매출은 전년 동기 대비 9.9% 신장했다. 카테고리별로 보면 명품, 생활, 골프 의류, 아웃도어 등의 판매가 각각 54.6%, 39.6%, 20.5%, 18.6% 증가했다. 현대백화점도 매출이 5.2% 늘었다. 에어컨과 선풍기 등 여름철 가전제품은 일찍부터 판매량이 급증했다. 롯데하이마트에 따르면 최근 일주일간(14~21일) 서큘레이터와 선풍기 매출은 전년 동기 대비 각각 185%, 50% 급증했다. 롯데백화점에선 에어컨과 선풍기 판매가 전년 동기 대비 각각 28%, 62% 증가했다. 신세계백화점에서도 가전제품 매출이 43.2% 신장했다. 편의점 GS25에서는 샐러드, 봉지얼음, 컵얼음, 아이스음료 등의 매출이 각각 115.0%, 66.0%, 42.6%, 29.4% 늘었다. 세븐일레븐도 고급 아이스크림과 얼음 매출이 37.0%, 12.5% 증가했다.

일찍 찾아온 더위에 울상인 곳도 있다. 날씨의 영향을 많이 받는 전통시장과 고깃집은 손님이 뚝 끊겼다. 서울 망원시장의 경우 지난 주말부터 방문객이 절반으로 줄었다. 망원시장에서 채소를 판매하는 박모씨는 ""더워지면서 시장을 찾는 사람들이 예년보다 줄었다""면서 ""오늘 가져온 물량의 절반도 못 팔았다""고 하소연했다. 고깃집들도 폭염에 직격탄을 맞았다. 시청역 근처에서 고깃집에는 저녁 시간대에도 고작 테이블 3개만 자리가 찼다. 이곳에서 근무하는 이모씨는 ""코로나19로 손님도 없는데 더워지면서 손님이 오질 않는다""며 ""고기 굽는 열기에 손님들이 꺼리는 것 같다""고 토로했다.

무더위로 일부 농산물 가격이 오르면서 밥상 물가가 뛸 조짐도 보인다. 한국농수산식품유통공사(aT)에 따르면 더위에 약한 상추는 고온에 따른 생육장해로 작황이 부진해 22일 기준 가격이 1만9460원(중품ㆍ4㎏)으로 한 달 전보다 62.7% 올랐다. 시금치(중품ㆍ4㎏)와 오이(10개) 가격도 각각 1만4260원, 6820원으로 68.1%, 30.9% 상승했다.

임혜선 기자 lhsro@asiae.co.kr"
2020-06-23 김은지,패션기업들 “온라인 고객 잡아라”… 앞다퉈 전문 편집숍 오픈,"코로나 사태로 오프라인 한계 절감 한섬, 밀레니얼 세대 겨냥 숍 론칭 LF, 고객층 세분화 3개몰 운영 이랜드, 아동 라이프스타일 숍 선봬
대형 패션기업들이 최근 각기 다른 콘셉트의 온라인 패션 편집숍을 적극 선보이고 있다. 각기 다른 전략으로 차별화된 쇼핑 플랫폼을 제공해 온라인으로 빠르게 옮겨가는 소비자를 사로잡기 위해서다.

패션기업이 온라인 편집숍에 관심을 기울이는 이유는 신종 코로나바이러스 감염증(코로나19) 사태로 인해 오프라인 기반 패션 사업의 한계가 명확해졌기 때문이다. 삼성물산 패션부문은 올 1분기(1∼3월) 310억 원의 영업손실을 내고 적자로 전환했다. LF, 한섬도 영업이익이 각각 130억 원, 293억 원으로 지난해 같은 기간 대비 50.2%, 14.9% 줄었다.

반면 대표적인 온라인 패션 편집숍 무신사는 지난해 매출, 영업이익이 각각 2197억 원, 493억 원으로 전년 대비 105%, 92% 늘었다. 자사 브랜드뿐 아니라 다양한 브랜드를 취급하는 편집숍은 여러 장점이 있다. 젊은 소비자층을 확보하기에 좋고 여러 형태의 시장을 테스트해 볼 수 있어서다. 이 때문에 ‘LF몰’ ‘이랜드몰’ 등 자사 브랜드 제품을 위주로 모아놓은 통합 쇼핑몰보다 특정 콘셉트를 중심으로 한 전문 편집숍이 각광을 받고 있다.

현대백화점그룹 계열 패션 전문기업 한섬은 지난달 27일 밀레니얼 세대를 겨냥한 편집숍 ‘EQL’을 론칭했다. 18일에는 EQL에서만 판매하는 전용 캐주얼 브랜드인 ‘레어뷰’를 론칭했다. 수천 개가 넘는 브랜드가 입점해 있는 무신사와 달리 EQL은 최대 200개 수준으로 선별된 브랜드만 유치하는 것이 특징이다. EQL을 통해 젊은 고객을 ‘타임’ ‘시스템’ 등 한섬의 기존 고급 패션 브랜드로 유인하는 것이 목적이다. 한섬 관계자는 “입점 브랜드는 한섬의 아이덴티티가 반영된 자체 브랜드(PB)와 온라인에서 반응이 좋은 브랜드, 새롭게 발굴한 신진 디자이너 브랜드 등으로 엄선해 구성할 예정”이라고 밝혔다.

LF는 기존 통합몰인 ‘LF몰’뿐만 아니라 온라인 편집숍인 ‘어라운드더코너닷컴’ ‘아우(AU)’ 등 총 세 개의 온라인 쇼핑몰을 운영 중이다. 각 플랫폼이 겨냥하는 고객층이 세분돼 있는 점이 특징이다. 통합몰인 ‘LF몰’은 20∼50대의 일반 고객을 두루 노리고 있고, 동명의 오프라인 편집숍에 기반한 ‘어라운드더코너닷컴’은 16∼32세의 젊은층을 타깃으로 한다. 여기에 이어 지난해 12월에는 30, 40대 ‘그루밍족’(패션과 미용에 아낌없이 투자하는 남성)을 위한 ‘아우’를 열었다.

삼성물산 패션부문은 자사 통합 쇼핑몰인 ‘SSF샵’ 안에 온라인 편집숍인 ‘어나더샵(ANOTHER#)’을 꾸렸다. 패션·뷰티 브랜드뿐 아니라 프랑스 디자인숍 ‘렉슨’, 밀키트 브랜드 ‘앙트레’ 등 인테리어, 푸드를 포함한 라이프스타일 전반을 아우르는 점이 특징이다.

이랜드는 국내 아동복 시장 점유율 1위라는 강점을 살려 올 4월 아동 라이프스타일 편집숍인 ‘키디키디’를 론칭했다. 0세에서 7세까지 각 연령대에 맞는 제품을 다양하게 선보여 ‘아동판 무신사’를 표방한다. 이랜드그룹 차원에서도 키디키디를 주요 전략 신사업으로 고려해 젊은 직원들을 중심으로 조직을 운영 중이다.

업계에서는 앞으로 온라인 편집숍을 비롯한 신사업에 더욱 무게가 실릴 것으로 보고 있다. 업계 관계자는 “코로나19 사태 이후 오프라인 패션사업의 수익성이 눈에 띄게 악화되고 있는 만큼 온라인 채널 투자에 무게가 실릴 수밖에 없다”고 말했다.
김은지 기자 eunji@donga.com"
2020-06-22 김지원 기자 deepdeep@kyunghyang.com,햄버거 ‘구독’ 신청하고 얼음컵 ‘정기권’ 끊었어요,"ㆍ서비스·콘텐츠 중심 ‘구독경제’, 유통·요식업계로 확장



한 달에 4900원을 지불하면 일주일에 햄버거 1개씩을 거의 반값에 구입할 수 있다. 최근 버거킹이 내놓은 ‘햄버거 구독 서비스’다. 그동안 서비스, 콘텐츠 등 무형 재화를 중심으로 빠르게 세를 키워온 ‘구독경제’가 식음료 상품으로도 확장되고 있다.

이마트24는 편의점 업계 최초로 ‘얼음컵 구독’ 상품을 200개 한정으로 출시한다고 22일 밝혔다. 정기권 값은 7일권과 14일권이 각 2940원, 4200원으로 매일 구매를 가정했을 때 정가 대비 각각 30%, 50% 저렴하다. 이마트24는 올해 초 냉장커피, 스낵 등에 대해 구독 서비스를 한정상품으로 시범실시한 바 있다. 이마트24 관계자는 “향후 구독 서비스의 품목 및 혜택 대상을 더 넓혀가겠다”고 말했다.

매일 직접 구매하는 것보다 ‘저렴’…과자·커피·과일 등 품목 다양
소비자 ‘록인 효과’ 노리는 업계 “가성비·충성도 동시에 잡는 수단”

백화점 업계도 최근 잇따라 일부 점포나 매장에서 구독 서비스 실험에 열중하고 있다. 신세계백화점은 지난 16일 서울 강남점 VIP 고객을 대상으로 약 20만원 상당의 제철 과일을 집으로 보내주는 과일 정기구독 서비스를 시작했다. 롯데백화점은 지난 4월부터 서울 노원점에서 빵과 와인, 커피 등의 구독 서비스를 시범운영하고 있다.

구독경제는 유통업체뿐 아니라 제조, 요식업계도 주목하고 있다. 버거킹은 SK플래닛과 협업해 지난해 12월 처음으로 커피 정기구독 서비스를 시작하고 지난 5월엔 정기구독 서비스를 햄버거 상품까지로 확장했다. 커피 정기구독 서비스가 사회관계망서비스(SNS) 등에서 이슈가 되면서 긍정적인 성과를 거두자 품목을 추가한 것이다. 롯데제과도 제과업계 최초로 월 9900원을 내면 롯데제과 과자 상품들로 구성된 랜덤 박스를 정기 배송받을 수 있는 ‘월간 과자’ 서비스를 시범적으로 시작한다고 지난 17일 밝혔다.

특히 최근 코로나19로 식음료 구독 서비스를 이용하는 소비자들이 크게 늘고 있다. 한국야쿠르트 관계자는 “2018년 밀키트 제품인 ‘잇츠온’의 구독 서비스를 시작했는데, 올해 들어 코로나19로 비대면 서비스를 선호하는 트렌드가 강해지면서 이용자들이 급증하고 있다”고 말했다.

식음료 업체들이 잇따라 구독경제에 뛰어드는 이유는 소비자들의 ‘록인(Lock in·기존에 이용하던 상품, 서비스를 계속 이용하려는 습성) 효과’를 노리기 때문이다. 업계 관계자는 “소비자들은 신제품에 대해 호기심을 갖기도 하지만 특히 식음료 카테고리의 경우엔 여전히 익숙한 맛, 가성비를 중요시하기 때문에 록인 효과가 중요하다”며 “구독경제는 제조업체 입장에서 가성비와 충성도를 동시에 높일 수 있는 효과적인 수단”이라고 말했다.

유통업계는 정기구독 상품이 객단가(한 고객이 구입하는 전체 상품의 단가)를 높이는 효과까지 불러올 수 있다고 본다. 실제 이마트24가 그간 제공해온 구독 서비스도 주로 얼음컵, 커피 등 연관 구매율이 높은 상품이 중심이 돼왔다. 구독 서비스를 제공하고 있는 한 백화점 관계자는 “백화점의 경우 문화센터 등을 이용해 방문율이 높은 고객들을 대상으로 구독 서비스의 가능성을 실험 중”이라며 “아직은 시범 단계지만 향후 더욱 다양한 형태의 구독 서비스가 이어질 것”이라고 말했다.

김지원 기자 deepdeep@kyunghyang.com"
2020-06-22 송지연,요리 초보도 셰프로 만드는 ‘마법의 밀키트’,"손질된 식자재를 판매하는 밀키트(Meal Kit) 시장이 급성장하고 있다. 밀키트에는 양념 등 모든 재료가 포함되어, 안내된 조리법을 따라 하면 ‘요린이’(‘요리’와 ‘어린이’를 합친말로 요리 초보를 일컬음)도 훌륭한 한 끼를 차릴 수 있다. 특히 코로나19 이후 반복되는 ‘집밥’의 단조로움을 피하려는 소비자들로 밀키트 수요가 크게 늘고 있다.



손질 식자재·양념 등 모든 재료 포함

장보기 번거로움 줄이고 요리 맛 살려



맞벌이부부·사회초년생에 인기만점

코로나19 이후 찌개류 등 매출 급증

2023년까지 7000억 규모 시장 전망











■해마다 커지는 밀키트 시장

밀키트 시장의 성장세는 판매량으로 확인된다. 올해 부산지역 이마트의 밀키트 매출(1~5월)은 직전 기간 5개월 대비 32% 증가했다. 전국 이마트의 밀키트 매출도 48% 증가했는데, 같은 기간 이마트의 성장세가 3%인 것과 비교하면 밀키트 매출이 급성장하고 있다는 평가다.

업계는 밀키트 시장이 2023년까지 7000억 원 규모로 폭발할 것으로 내다본다. 쿠킹 박스나 레시피 박스로도 불리는 밀키트는 가정간편식 중 가장 손이 많이 가지만, 소비자의 기호를 반영할 수 있다는 점에서 가장 진화된 형태로 꼽힌다. 가정간편식은 1세대 즉석밥, 2세대 냉동만두류, 3세대 국·탕류 제품, 4세대 유명 쉐프와 맛집 제품 구현한 제품으로 분류되기도 한다. 5세대 가정간편식으로 통하는 밀키트는 편의성과 더불어 소비자의 취향을 반영할 수 있는 것이 장점으로 꼽힌다.

밀키트의 성장세에 대형 업체들도 잇달아 시장에 뛰어들고 있다. 2016년께 ‘닥터키친’ ‘프레시지’ 등 스타트업들이 처음 밀키트 제품을 선보인 후 동원F＆B(더반찬 맘스키트)과 한국야쿠르트(잇츠온), GS리테일(심플리쿡) 등이 밀키트를 선보였다. 지난해는 CJ제일제당과 이마트가 잇달아 밀키트 브랜드 제품을 출시하며 밀키트 시장은 더욱 뜨거워졌다.

특히 코로나19 이후 성장세가 뚜렷한 밀키트 시장을 잡기 위한 업체들의 움직임도 빨라지고 있다. 이마트는 ‘채소밥상’ ‘저스트잇’ ‘피코크’ 등 3개로 나뉘어 있던 자사 밀키트 브랜드를 ‘피코크’로 통합 운영하며, 올해 안으로 현재 배에 가까운 40개 상품을 출시할 계획이다.

CJ제일제당 ‘쿡킷’은 요리 전문가들이 개발한 새로운 레시피를 매주 2회 선보인 후 고객 후기에 따라 추가 판매를 결정하는 식으로 수요에 즉각적으로 반영하고 있다.



■이마트 문현점이 밀키트 1위

원래 밀키트는 요리에 익숙한 4050 맞벌이 부부를 겨냥해 출시됐다. 젊은 세대는 냉동식품과 같은 편리성이 극대화한 가정간편식을 찾으리라 생각했기 때문이다. 하지만 최근 젊은층도 직접 요리하는 이들이 늘면서 밀키트 수요층도 젊어지고 있다.

부산지역 이마트 중에서도 밀키트 매출이 가장 높은 곳은 오피스 상권이 발달한 문현점이다. 문현점의 밀키트 매출은 다른 점포보다 52%나 높게 나타났다.

이마트 측은 주변에 업무시설이 밀집한 문현점의 특성 때문이라고 분석했다. 주변 거주지에 맞벌이 부부가 많은 데다 인근 문현금융단지는 주말부부가 많아 주중에 ‘혼밥’을 하면서도 집밥다운 집밥을 먹고자 하는 수요가 몰린다는 것이다. 쌀 매출의 경우, 금정점과 해운대점이 문현점보다 높다. 밀키트가 오피스 상권의 사회초년생이나 1인 세대, 젊은 맞벌이 부부들이 많이 찾는다는 방증이다.

이마트 관계자는 “문현점의 밀키트 인기는 외식에 질린 오피스 상권 거주자들이 간편하게 집밥을 즐기려는 경향이 반영된 것으로 보인다”고 말했다.

캠핑족들이 늘면서 밀키트 매출이 상승한다는 분석도 있다. 코로나19 이후 ‘나홀로 캠핑’을 즐기는 이들이 크게 늘었는데, 이들이 여러 가지 식자재를 구매하기 보다는 간편한 밀키트를 선호한다는 것이다.

부산에서 인기 있는 밀키트는 찌개류다. 지난달 부산지역 이마트에서 가장 많이 팔린 피코크 밀키트는 ‘오뎅식당 부대찌개’다. 메가마트가 판매하는 ‘신선도원’의 밀키트는 총 6종으로, 이 중 순두부찌개(410g), 부대찌개(370g), 버섯 된장찌개(430g) 등 3종이 찌개류다.

송지연 기자 sjy@busan.com"
2020-06-22 백인철,"`합리적 소비` 제품 두끼 가정간편식, 11번가 베스트 제품 등극해","떡볶이, 분식 프랜차이즈 '두끼'는 자사의 가정간편식(HMR)이 온라인 오픈 마켓 '11번가' 베스트 제품에 등극했다고 22일 밝혔다.



매장에서 직접 조리해 먹는 즉석떡볶이와 볶음밥을 주력 제공하고 있는 두끼는 언텍트(비대면) 문화 속에서도 HMR 제품을 통해 꾸준히 수요 흐름을 이어 가고 있다. 해당 브랜드의 HMR 키트는 오프라인 매장의 떡볶이와 볶음밥 맛을 그대로 구현함으로써 출시 이래 현재까지 높은 관심을 받고 있다.



실제로 두끼는 지난 4월 11번가 판매 개시 4주만에 1만 5천 팩 HMR 키트 완판을 달성했다. 이러한 수요에 힘입어 19일에는 24시간 단 하루 동안 30% 할인된 금액으로 11번가 긴급공수 특가 프로모션을 진행, 하루 만에 5천팩이상 판매를 달성하며 떡볶이 부분 베스트 1위를 넘어 간편식 / 냉장 / 냉동 베스트 1위로 등극하기도 했다.



구매 만족도 또한 90% 이상을 유지함으로써 긍정적인 후기를 다수 확보 중이다. 후기 중에는 ""같이 먹은 지인들이 모두 맛있다고 반응했다. 재고가 소진되지 않게 꾸준히 구매할 것"", ""지금까지 먹은 간편식 중 가장 만족스러우며 재구매 의사 300%다"", ""집에서 간편하게 뚝딱 만들어도 맛있어 좋다"" 등의 호평이 여럿 존재한다.



또한 두끼는 11번가 구매 고객을 대상으로 리뷰 이벤트도 진행 중에 있다. 리뷰를 남긴 고객 전원에게는 오프라인 매장에서 사용 가능한 퐁듀 치즈 쿠폰을 제공하며, 정성스러운 포토 리뷰를 남긴 소비자 가운데 추첨을 통해 20명에게 2인 식사권을 선물한다.



관계자는 ""두끼의 맛과 합리적인 가격으로 구성된 두끼의 밀키트에 관심과 성원을 보내주셔서 감사하다""며 ""가정에서도 더욱 다양한 자사 밀키트를 즐길 수 있도록 기획 중으로 빠른 시일 내에 선보일 수 있도록 준비하겠다""라고 전했다.



백인철기자 chaos@dt.co.kr"
2020-06-22 기자,[aT와 함께하는 글로벌푸드 리포트] 러시아 밀키트 전성시대…1000억 시장 꿈꾼다,"신종 코로나 바이러스 감염증(코로나19)가 장기화되면서 러시아 내 밀키트(Meal Kit) 분야가 큰 인기를 끌고 있다.

한국농수산식품유통공사(aT)에 따르면 가정간편식의 한 분류인 밀키트는 식사(Meal)+ 세트(Kit)가 합해진 단어로, ‘레시피 박스’ 라고도 불린다. 식재료 손질과 양념 준비 등의 조리 시간을 대폭 줄여주고 제대로 된 요리를 먹을 수 있다는 장점으로 글로벌 시장에서 성장하고 있다. 러시아내 밀키트 산업은 타 국가에 비해 일찌감치 시작됐다. 밀키트 1세대업체인 ‘셰프마켓’(Chefmarket)가 지난 2012년부터 50개 도시에 체인점을 세우며 해당 시장을 이끌어갔다. 러시아 분석기관 인포라인에 따르면 밀키트 시장은 러시아 온라인 식품 시장에서 4%를 차지하고 있다. 오는 2022년에는 60억 루블(한화 약 1050억)규모의 성장이 예상된다. ‘셰프마켓’의 창업자 세르게이 아쉰은 “코로나 19 사태로 전반적인 경제가 침체됐지만 러시아 밀키트 시장은 이를 계기로 크게 성장할 것”이라고 전망했다.

밀키트 메뉴는 보통 파스타, 스테이크등 대부분이 유럽식 메뉴이지만 일본식 된장국과 베트남의 ?양꿍도 나와있다. 특히 베트남 식당(Dyadyushka Ho)에서는 지난 4월부터 일부 메뉴를 밀키트처럼 구성해 배달하면서 주목을 받고 있다.

다만 밀키트는 다른 가정간편식 대비 단가가 높은 편이다. 또한 신선도가 강점인 만큼 보관 가능일이 짧아 관리도 어렵다. 러시아에서는 예약 주문 방식으로 배달이 이뤄져 오래 기다려야 한다는 불편함도 있다.

한식의 경우 식재료의 특성을 살린 요리가 많아 밀키트로 쉽지 않은 메뉴이다. 하지만 이국 요리에 대한 러시아인들의 흥미가 날로 높아지고 있기 때문에 한식 밀키트는 좋은 수출 전략이 될 수도 있다. 구교영 생물자원 기술사업화 전문회사 대표는 “한식 밀키트를 수출하려면 신선 간편식에 적합한 식재료 품질관리와 제조기술이 뒷받침되어야 할 것”이라고 강조했다. 육성연 기자

[도움말=송다미 aT 모스크바 사무소]"
,이미지·상품 강화 위해 3개 브랜드 피코크 '통합',"집밥 트렌드에 힘입어 급성장 중인 밀키트에 대해 이마트가 피코크로 단일 브랜딩한다.
기존 밀키트 상품은 지난 2017년 시작한 '채소밥상'부터 '저스트잇', '피코크' 등 3개 브랜드로 나뉘어져 있다.
이마트는 해당 3개 브랜드의 밀키트 상품을 전부 피코크로 통합해 상품 개발과 운영에 나선다.
앞으로 이마트에서 출시하는 밀키트 상품은 전부 피코크 라인업으로 출시하며 상품 수 역시 올해 안에 현재의 2배인 40개로 확대할 계획이다.
올해 들어 코로나로 소비자들이 집에서 보내는 시간이 많아져 집밥 수요가 크게 늘었다. 이에 요리를 편리하게 할 수 있도록 도와주는 밀키트 시장은 급속도로 팽창하고 있다. 실제로 올해 1~5월 밀키트 매출은 전년 동기간 대비 무려 48% 증가한 것으로 나타났다.
이마트는 밀키트 라인업 통합을 기념해 '피코크 밀키트 페스티벌' 행사를 선보인다.
17일부터 오는 7월 1일까지 피코크 밀키트 전품목인 총 20개 품목을 행사카드로 구매시 20% 할인하는 행사를 진행한다. 특히 이마트e카드로 결제시에는 40% 할인이 적용된다.
또한 이마트 앱으로 가입이 가능한 피코크 전용 멤버십 '피코크 클럽' 회원들에게는 '피코크 밀푀유나베'와 '피코크 오뎅식당 부대찌개' 2개 품목을 50% 할인받을 수 있는 쿠폰도 제공한다. 행사카드 할인과 쿠폰 할인은 중복 적용이 가능하다.
이마트는 이번 행사와 함께 오는 23일에는 밀키트 신상품 3종도 출시한다.
이번에 출시하는 신상품은 '피코크 샤브샤브 재료', '피코크 된장찌개 재료', '피코크 순두부찌개 재료' 세 상품이다.
밀키트 수요 확대를 위해 '밀키트 인증샷 챌린지'이벤트도 준비했다.
피코크 밀키트를 맛보고 인증샷과 함께 필수 해시태그를 SNS에 올리면참여한 고객 전원에게 1만원 상당의 '밀키트 상품 교환권을제공하며, 우수 참여자에 대해서는 추가 혜택도 증정한다.
최훈학 이마트 마케팅 담당은 ""최근 밀키트 시장이 급속도로 확대되면서 브랜드 이미지를 강화하기 위해 피코크로 밀키트 브랜드를 통합했다. 이를 기념해 역대 최대 수준의 혜택을 제공하는 피코크 밀키트 페스티벌도 기획했다""고 말했다.
도철기자 douls18309@srb.co.kr"
2020-06-19,이마트 밀키트 할인전 개최,"사진 이마트 제공
이마트가 7월 1일까지 '피코크 밀키트 할인전에 나선다. 이마트는 피코크 밀키트 전품목인 총 20개 품목을 행사카드로 구매 시 20% 할인하는 행사를 진행한다. 이마트e카드로 결제 시에는 40% 할인을 받을 수 있다."
