Date,Title,Content
2019-06-25 이지은,"""'강남맘' 마음을 훔쳐라""…신세계도 새벽배송 전쟁 뛰어들었다(종합)","[아시아경제 이지은 기자] 마켓컬리의 '보라색'으로 물든 강남 주부들의 마음을 신세계가 다시 빼앗아올 수 있을까. 신세계그룹 계열 온라인 통합몰인 SSG닷컴이 27일부터 새벽배송을 본격화한다. 마켓컬리보다 포장 쓰레기가 덜 나오고, 제품 가짓수는 두 배나 많아 우위가 있다지만 1위인 마켓컬리의 아성을 무너뜨릴 수 있을지는 미지수다.최우정 SSG닷컴 대표이사는 25일 김포 고촌읍에 위치한 물류센터 네오(NE.O)센터 2호에서 기자간담회를 열고 이달 27일부터 새벽배송을 본격화한다고 밝혔다.전날 자정까지 주문을 마치면 다음날 새벽 3시부터 새벽 6시 사이에 배송이 모두 완료되며, 배송 시점을 다음날 새벽 뿐 아니라 2일 후, 3일 후 새벽까지 지정 가능하다. 주문은 이달 26일 오후 3시 이후부터 가능하며, 강서구,양천구, 동작구,용산구,서초구, 강남구 등 서울지역 10개 구에서 먼저 서비스가 시작된다.신세계그룹 계열 온라인몰이 통합한 SSG닷컴은 지난 3월 본격 출범했다. 유통공룡 신세계그룹의 캐시카우인 이마트는 대형마트 할인점 시장에서 1인자로 군림해 왔으나 최근 몇 년 새 득세한 온라인몰에 고객들을 뺏기고 있다. 쿠팡으로 대표되는 초고속 로켓배송, 마켓컬리로 대표되는 새벽배송 등의 시장에서 이마트의 입지는 미약하다. 이에 신세계그룹은 새 물류센터를 바탕으로 신규 시장에 도전장을 낸 것.SSG닷컴이 내세우는 장점은 빠른 속도다. 사람이 일일이 상품을 찾으러 가는 것이 아닌 상품이 작업자를 알아서 찾아오는 GTP(Goods To Person)시스템이 출고 시간을 크게 줄일 수 있다는 것. 최 대표는 ""배송의 속도는 자동차, 오토바이 등 운송수단에 따라 결정되는 게 아니라 출하를 빨리 시키느냐에 달려 있다""며 타사가 따라오기 힘든 독보적 시스템이라고 소개했다.기존 새벽배송 업체들과 비교했을 때 신선상품 구색이 2배 이상 많은 것도 장점이다. 마켓컬리나 쿠팡이 보유한 상품을 모두 갖추고, 거기에 추가적으로 이마트 피코크, 노브랜드의 다양한 가공식품과 생필품을 보유했다는 것.자체 제작한 '알비백'을 활용해 배송 쓰레기를 획기적으로 줄인 것 역시 경쟁력으로 작용할 수 있다는 설명이다. 김예철 영업본부장은 ""마켓컬리나 쿠팡 로켓프레시는 똑같은 상품 비교해봤더니 포장재가 상품의 대부분임을 지적하는 영상이 유튜브에 돌기도 하더라""며 ""우리는 친환경 배송이 반드시 필요하다고 생각해 기존 8미리 대비 더 두꺼운 12미리 보냉재를 쓴 알비백을 만들었다""고 말했다.SSG닷컴 새벽배송 주요 경쟁자인 마켓컬리는 서울 등 수도권 지역을 중심으로 새벽배송을 실시하고 있다. 비용이 많이 드는 새벽배송 수요가 수도권에 몰렸기 때문이다. 특히 소득수준이 높은 강남권을 중심으로 인기가 많다. 마켓컬리가 인기를 얻은 것도 '강남맘 필수앱'이라는 입소문이 돌면서다. 매출액은 2017년 465억원에서 지난해 1571억원으로 237%나 성장했다.SSG닷컴이 강남 등 서울 10개 지역부터 새벽배송을 시작하는 것 역시 기존 마켓컬리 고객들을 공략하기 위한 전략으로 보인다. 마켓컬리가 첫 구매시 100원에 구매할 수 있는 혜택을 제공하는 것처럼, SSG닷컴 역시 7월 한 달 간 새벽배송 주문 고객 전원을 대상으로 시저샐러드, 스테이크 밀키트, 후앙베이커리 마늘바게트 등 30종이 넘는 아침식사용 사은품을 매일 하나씩 증정한다. 시중가 3~4만원인 알비백도 최초 주문시 무상제공한다.새벽배송 시장 공략에 뛰어든 건 신세계만이 아니다. 쿠팡, 롯데 등 기존 유통업체 역시 일찌감치 새벽배송 확대에 나섰고 동원F&B, CJ제일제당 등 식품 제조업체들도 자체 몰을 통해 새벽배송을 시작하는 등 치열한 경쟁을 벌이고 있다. 당분간은 경쟁 심화로 인한 출혈이 불가피할 전망이다. 이에 대해 안철민 SCM운영담당은 ""당장은 물고 물리는 구도가 되겠지만, 결국 새벽배송 시장의 수요가 늘게 될 것""이라며 ""이미 네오센터 2호는 작년부터 흑자를 보고 있으며, 치킨게임으로 생각하지 않는다""고 말했다.이지은 기자 leezn@asiae.co.kr"
2019-06-25 안소영 기자,신세계 SSG닷컴도 '새벽배송 전쟁' 합류...쿠팡·마켓컬리와 맞불,"25일 오전 11시쯤 찾은 SSG닷컴 온라인 전용 물류센터 ‘네오002(NE.O002)’. 상품이 자동으로 재빠르게 분류되고, 구획을 나눠 알아서 찾아갔다. 직원들은 모니터에 뜬 상품을 확인한 뒤, 바로 앞에 멈춘 상품을 집어들어 아래에 있는 박스에 넣었다. 수박 등 무게가 다른 신선식품은 ‘확인이 필요하다’는 신호로 컨베이어 벨트에 빙글 뱅글 돌기도 했다.

SSG닷컴이 네오를 바탕으로 이달 27일부터 총 1만여개 상품의 새벽배송서비스를 시작한다. SSG닷컴은 온라인 전용 물류센터를 통해 배송효율을 높여 ‘새벽배송 전쟁’에 뛰어든다는 계획이다. SSG닷컴의 온라인 전용물류센터는 2014년 첫 선을 보인데 이어 2016년 김포에 두번째 문을 열었다. 올 연말에 세번째 센터가 추가로 문을 열 계획이다.

네오는 주문부터 배송까지 전 과정의 80%를 자동화 공정 처리한 것이 특징이다. 고객 주문을 받으면 배송 박스 수를 자동으로 계산하고 322개 최첨단 고속셔틀이 상품을 준비해 1층으로 전달한다. 상품이 작업자를 알아서 찾아오고, 실수를 방지하기 위해 물품 무게가 다르면 알림이 울리는 시스템도 구축됐다. 실시간 재고 관리 시스템도 추가해 결품이 거의 발생하지 않는다.

SSG닷컴은 또 상품 입고부터 집 앞까지 상온에 한번도 노출되지 않도록 ‘콜드체인’ 시스템을 구축했다. 가공·신선식품이 배송주문의 80%를 차지한다는 점을 감안했다. 신선식품을 보관하는 물류센터 내부는 8도 이하를 유지하고 있는 것은 물론, 상품은 공장 내에서는 보랭제가 담긴 아이스박스, 밖에서는 냉장 냉동 기능을 갖춘 차량을 통해 이동한다.

SSG닷컴은 이러한 배송물류센터를 바탕으로 강서구, 양천구, 동작구, 용산구 등 서울 10개구에 먼저 새벽배송을 선보인다는 계획이다. 전날 자정까지 주문을 받으면 새벽 3시부터 배송을 시작한다. 4만원 이하는 배송료 3000원이 붙고, 4만원부터는 무료배송이다.

배송 가능한 상품은 신선식품,유기농 식재료,베이커리, 반찬류,밀키트 등 식품류는 물론 기저귀,분유 등 육아용품에서 반려동물 사료까지 총 1만여 가지다. 기존 이마트점포 배송에 비해 프리미엄 상품군도 보강했다. 앙트레, 프레시지 등 밀키트를 새로 도입하고, 메니쥬리, 크림바바, 대구근대골목 등 베이커리 품목도 강화했다.

SSG닷컴은 그간 새벽배송이 환경에 악영향을 미친다는 점을 감안해 친환경 배송서비스에 초점을 맞췄다. 반영구적 사용이 가능한 새벽배송용 보랭가방 ‘알비백’ 10만개를 자체 제작해 고객들에게 제공한다. 알비백은 최대 9시간 보냉력이 유지되는 보냉가방으로 재활용 가능한 종이봉투를 사용했다. 최초 주문시 무상제공하고, 매 주문시 재사용할 수 있게 했다.

SSG닷컴은 쓱배송을 가장 많이 이용하는 서울 10개구에 시범운영을 하고, 3번째 물류센터가 설립되면 추가로 확대 운영할 예정이다. 3번째 물류센터가 운영을 시작하면, 배송가능물량도 일일 4만4000건에서 8만건으로 늘어난다. SSG닷컴은 앞으로 온라인 물류센터를 전국 10개 이상 구축해 배송 능력을 더욱 키운다는 계획이다.

최우정 SSG닷컴 대표는 ""대량주문이 들어와도 똑같은 속도로 나갈 수 있도록 5년간 고민하고 구현했다. 온라인 전용 물류센터 네오는 저희의 도전이자, 자부심으로 앞으로 점차 늘려갈 것""이라고 말했다. 이어 ""올해 SSG닷컴의 매출목표는 3조1000억원이고, 절반 가량이 네오에서 나올 것으로 기대한다""고 덧붙였다."
2019-06-25 김아름,"SSG닷컴, 온라인 물류센터 강화 나선다…27일부터 새벽배송 시작","[디지털타임스 김아름 기자] SSG닷컴이 최첨단 온라인 전용 물류센터 네오(NE.O)를 앞세워 이커머스 선두 다툼에 나선다. 오는 27일부터는 서울 10개구를 시작으로 새벽배송 서비스를 도입한다.



25일 SSG닷컴은 연말까지 김포에 온라인 전용 물류센터 네오(NE.O)의 3번째 센터를 열고 이커머스 시장에서 본격적인 경쟁에 나선다고 밝혔다.



네오(NE.O, NExt Generation Online Store)는 지난 2014년 SSG닷컴이 국내 최초로 선보인 최첨단 온라인 전용 물류센터다. 2016년 김포에 두 번째 네오(NE.O 002)가 문을 열었고 올해 말 3번째 센터가 김포에 추가로 문을 열 계획이다.



네오는 주문에서 배송 준비까지의 전 과정 중 80%를 자동화 공정으로 처리한다. 고객 주문이 들어오면,중앙 관제시스템(ECMS)이 해당 차수에 나갈 배송 박스 총 숫자를 최적의 방법으로 계산해 작업을 배정한다. 322개의 최첨단 고속 셔틀이 ECMS가 배정한 순서에 따라 상품을 준비해 고속 슈트를 통해 1층 배송센터로 전달한다.



지하 1층,지상 5층에 연면적 4만3688㎡ 규모인 김포 온라인 센터가 하루에 처리하는 주문 건수는 3만1000여건으로 구로와 일산을 포함 수도권 서부 권역을 담당하고 있다. 보정에 위치한 네오(NE.O 001)가 처리하는 1만3000여건 더하면 두 개의 네오에서만 일 4만4000여건의 고객 주문을 처리할 수 있는 것이다.



SSG닷컴은 올 연말 하루 3만5000여건을 처리할 수 있는 네오 3이 문을 열면 하루 8만 건가량의 고객 주문을 처리할 수 있을 걸로 기대하고 있다. 여기에 전국 100여개 이마트 점포의 P.P센터를 포함하면 13만건 이상이 된다.



대규모 배송 물량을 빠르고 효율적으로 처리할 수 있는 것은 SSG닷컴 온라인 전용 물류센터가 갖추고 있는 최첨단 물류 시스템 덕분이다.



사람이 일일이 상품을 찾으러 가는 것이 아닌 상품이 작업자를 알아서 찾아오는 GTP시스템, 구매 빈도가 높은 상품 선별에 최적화 된 DPS, 상품을 알아서 정리하고 보관하는 자동 재고관리 시스템 , 신선, 냉장?냉동 상품을 낮은 온도로 일정하게 유지시켜 신선도를 높이는 콜드 체인 시스템 등이 핵심 시설이다.



SSG닷컴은 이 같은 김포 온라인 전용 물류센터의 경쟁력을 바탕으로 오는 27일부터 본격적으로 새벽배송에 나설 예정이다. 배송 시점을 다음날 새벽뿐 아니라 이틀 후, 사흘 후 새벽까지 날짜를 지정할 수 있다.



우선 한강에 인접한 강서구, 양천구, 동작구, 용산구, 서초구, 강남구 등 서울 지역 10개 구를 대상으로 먼저 새벽배송 서비스를 선보인다. 한강을 사이에 두고 위치한 올림픽대로와 강변북로 등 두 개의 서울 주요 고속화 도로를 최대한 활용한다는 방침이다.



배송 가능한 상품은 신선식품,유기농 식재료,베이커리, 반찬류,밀키트 등 식품류는 물론 기저귀,분유 등 육아용품에서 반려동물 사료까지 총 1만종에 달한다. 특히 기존 새벽배송 업체들과 비교했을 때 신선상품이 2배 이상 많은 것이 특징이다.



SSG닷컴은 연말께 김포 3호 센터가 오픈하면 새벽 배송 지역과 물량을 늘린다는 계획이다.



또한 회수용 보랭 가방을 자체 제작해 스티로폼 박스 등 환경에 유해한 일회용 포장을 전혀 사용하지 않는다. 그 동안 보랭가방을 제작해 체험단을 꾸려 운영한 사례는 있었지만 고객 전체를 대상으로 스티로폼 박스 등의 부자재를 사용하지 않는 것은 SSG닷컴이 처음이다.



최우정 SSG닷컴 대표는 ""자동화 설비를 갖춘 최첨단 온라인 전용 물류센터를 통해 배송 효율을 더욱 높여 온라인 배송시장에서 확실한 우위를 점할 것""이라며 ""타 업체 대비 2배 이상 많은 신선상품, 친환경 배송 등 차별화 된 '새벽배송 서비스'를 본격적으로 선보여 고객들에게 새로움을 선사하겠다""고 밝혔다.



김아름기자 armijjang@dt.co.kr"
2019-06-25 고은빛(silverlight@hankyung.com);,"'신세계' SSG닷컴, 27일부터 새벽배송…""마켓컬리 샛별배송 잡는다""","[ 고은빛 기자 ]
""다른 업체보다 2배 이상 많은 신선상품과 보냉가방을 통한 친환경 배송 등으로 차별화한 새벽배송 서비스를 본격적으로 선보이겠습니다.""

최우정 SSG닷컴 대표이사는 25일 경기도 김포에 위치한 온라인 전용 물류센터 네오(NE.O) 2센터에서 열린 기자간담회에서 이같이 밝혔다.

네오는 차세대 온라인 스토어(Next Generation Online Store)라는 뜻으로, SSG닷컴이 국내 최초로 선보인 최첨단 온라인 전용 물류센터다. 신세계는 1500억원을 들여 2016년 이 센터를 구축했다.

NEO센터는 지하 1층, 지상 5층 연면적 4만3688m2(1만3215평)으로 구성돼 있다. 시간당 2000개 주문건수를 처리하며, 2초당 1건의 주문을 처리하는 셈이다. 주문에서 배송 준비까지 전 과정 중 80%를 자동화 공정으로 설비를 마련한 덕분이다.

고객 주문이 들어오면 중앙 관제시스템(ECMS)이 해당 차수에 나갈 배송 박스 총 숫자를 최적의 방법으로 계산해 작업을 배정한다. 322개 최첨단 고속 셔틀이 ECMS가 배정한 순서에 따라 움직이면서 고속 슈트를 이용해 1층 배송센터로 전달한다.



콜드체인 시스템이 강점이다. 냉장·냉동식품이 있는 센터 내부를 8도로 유지해 식품이 상하지 않도록 조치했다. 전체 매출 중 80%가 신선식품이 차지하고 있어서다. 우유나 계란은 유통기한이 짧을 경우 반품률이 높아졌다는 점을 감안해 유통기한이 긴 상품을 배송한다. 이날 배송을 기다리는 우유의 유통기한은 7월2일까지였다.

SSG 닷컴은 콜드체인 시스템을 앞세워 새벽배송을 본격 시행한다. 배송가능 상품을 기존 신선식품에 밀키트 베이커리 등 메뉴를 추가해 총 1만개로 확대했다. 마켓컬리를 비롯한 기존 새벽배송 업체들보다 신선상품 구색을 2배 이상 늘어난 수준이다. 새롭게 앙트레 프레시지 등 밀키트도 강화했고, 신세계 백화점의 베이커리 브랜드인 메나쥬리 크림바바 대구근대골목 등 빵 종류도 도입했다. 또 유기농 무항생제·동물복지 신선식품도 늘렸다.

김예철 본부장은 ""마켓컬리는 베이커리 신선식품 반찬류 등을 잘 운영하고 있는 만큼, 기존의 이마트 상품군으로만 운영하면 부족하다고 느꼈다""며 ""이마트 주력 고객 대상으로 피코크 노브랜드 등을 유지하되, 이번에 프리미엄 상품을 더 추가하면서 마켓컬리에 있는 상품군은 다 갖췄다""고 강조했다.

새벽배송의 선두주자로 알려진 마켓컬리의 '샛별배송'을 감안해 배송시간도 앞당겼다. SSG닷컴의 새벽배송은 전날 자정에 주문하면 다음날 새벽 3시~6시 집앞으로 물건이 배송된다. 현재 마켓컬리의 샛별배송은 전날 오후 11시까지 주문한 상품을 다음날 오전 7시 전까지 배송하는 시스템이다.

배송시간을 앞당길 수 있었던 이유는 자동화 시스템을 갖췄기 때문이다. 물류센터 내 1층은 배송기사가 배송하는 지역에 맞춰 물품이 자동으로 배치된다. 가장 먼 지역의 배송물품은 차량 안 쪽에 들어가는 것이다. 배송물품의 상차가 완료되면 실시간 교통정보가 배송기사의 전용 앱으로 30분 단위로 안내된다. 고객들은 SSG닷컴 앱을 통해 배송물품이 어디까지 왔는 지 확인할 수 있다.


또 기존 새벽배송업체엔 없는 보냉가방도 만들었다. 환경을 생각한 소비자들이 많다는 점을 고려한 결정이다. 첫 배송시 보냉가방에 보증금 2000원을 부과해 재사용율을 높여갈 계획이다. 배송을 받은 뒤 소비자가 문 앞에 가방을 두면 배송기사가 가방 안에 소비자가 주문한 물품을 담는다. 해당 보냉가방은 40L 용량으로 9시간 냉장을 유지할 수 있다. 12mm의 충전재를 사용해 보냉력을 극대화한 덕분이다.

안철민 SCM 물류운영 담당은 ""쿠팡이나 마켓컬리와는 달리 전담 배송기사를 두고 있어 보냉가방 재활용이 가능하다""며 ""환경을 고려한 고객들을 감안한 결정으로, 고객들이 가방 사용을 많이 할수록 비용도 줄어드는 구조""라고 설명했다.

오는 27일부터 서울 강서구 양천구 마포구 서대문구 영등포구 구로구 용산구 동작구 서초구 강남구 송파구(잠실만) 등 10개구 대상으로 새벽배송을 진행한 뒤 올해 안에 배송 지역을 추가로 확대해 나갈 계획이다. 현재 마켓컬리의 샛별배송의 배송 지역은 서울 경기 인천이다.

SSG닷컴은 현재 2호센터(NEO 002) 옆에 3호센터(NEO 003)가 개장하면 하루 3만5000건의 주문을 처리할 계획이다. 최대로 설비를 가동하면 8만건의 주문까지 소화할 수 있을 것으로 보고 있다.

고은빛 한경닷컴 기자 silverlight@hankyung.com"
2019-06-25 이유진,"SSG닷컴, 27일부터 서울 10개구에 새벽배송 시작","새벽배송 시장에 오프라인 유통강자 이마트도 가세한다. 이마트와 신세계백화점 온라인몰을 분할합병해 3월 출범한 SSG닷컴은 27일부터 서울 일부 지역에 새벽배송 서비스를 시작한다고 25일 밝혔다. 새벽배송은 서울 강서구, 양천구, 동작구, 용산구, 서초구, 강남구 등 10개 구에서 먼저 진행한다.
SSG닷컴은 ""26일 오후 3시 이후 주문 분부터 새벽배송이 가능하다""고 설명했다. 자정 전 주문하면 새벽 3~6시 사이에 고객 집 앞에 배송하는 방식이다. 신선식품, 유기농 식재료, 베이커리, 반찬류, 밀키트 등 식품류와 기저귀, 분유 등 육아용품과 반려동물 사료 등 1만여 가지 품목을 취급한다.
무료 배송 기준은 기존 쓱배송과 동일한 4만원으로 책정됐다. 2일 후, 3일 후 새벽까지 날짜를 지정해 배송받을 수 있다.
김포 온라인전용물류센터(네오002)만을 활용하기 때문에 서비스 초기 새벽배송 물량은 하루 3000건으로 제한된다. 연말까지는 약 1만건, 오는 12월 3번째 물류센터(네오003)를 오픈하면 최대 2만 건의 배송물량을 처리할 수 있을 것으로 SSG닷컴 측은 기대했다.
신선상품 관련 과대배송 문제를 해결하기 위해 배송상품은 친환경 보냉백을 통해 전달된다. SSG닷컴은 반영구적 사용이 가능한 새벽배송용 보냉가방 10만개를 자체 제작했다. 고객 전체를 대상으로 보냉가방을 제공하고, 스티로폼 박스 등 부자재를 사용하지 않는 것은 새벽배송 업체 중 SSG닷컴이 처음이다.
최우정 SSG닷컴 대표이사는 ""자동화 설비를 갖춘 최첨단 온라인 전용 물류센터를 통해 배송 효율을 더욱 높여 온라인 배송시장에서 확실한 우위를 점하겠다""며 ""타 업체 대비 2배 이상 많은 신선상품, 친환경 배송 등 차별화된 서비스로 고객에게 새로움을 선사하겠다""고 말했다.
[이유진 기자]"
