Date,Title,Content
2021-07-12 차혜영,"류수영, 예능·드라마 이어 광고까지 접수…2021년 열일 행보 주목","배우 류수영의 2021년 열일 행보가 주목되고 있다.

지난해부터 류수영은 예능 ‘신상출시 편스토랑’에서 누구나 쉽게 따라 할 수 있는 요리 꿀팁과 초간단 레시피를 선보이며 큰 사랑을 받고 있다. 새해 첫날 류수영의 ‘치치닭’이 우승하며 19번째 메뉴로 선정된 것에 이어 ‘또치닭’이 26번째 메뉴로 출시됐다. 전국 해당 편의점 및 밀키트로 출시된 제품들은 품절 대란을 일으켜 류수영이 ‘완판남’이라는 수식어를 거머쥐는 영예를 안았다.

또한 예능 ‘나의 판타집’과 ‘류수영의 동물티비’에서는 MC로서 탁월한 진행 실력과 뛰어난 공감 능력을 보여주며 활약을 펼쳤다. 해박한 건축 지식을 방출하며 게스트들과 소통하는가 하면 동물들과 교감하며 따뜻한 힐링을 전하고 있다.

특히 드라마 ‘목표가 생겼다’에서는 19세 소녀의 복수 대상이자 목표 ‘이재영’ 역을 맡아 열연을 펼쳤다. 친아빠인 줄 알고 펼쳐진 복수에도 불구하고 오해를 풀기 위해 노력하고 그의 상처를 감싸 안아주는 진정성 가득한 연기로 보는 이들마저 뭉클하게 만들었다. 눈빛 하나, 표정 하나, 말투 하나까지 섬세하게 표현하는 등 이재영 캐릭터의 복잡한 내면 심리를 완벽하게 그려내며 안방극장을 사로잡았다.

더불어 류수영은 영화 ‘강철비2: 정상회담’을 통해 제 67회 백상예술대상 영화 부문 남자 신인상 후보에 노미네이트되는 영광을 안았다. 류수영이 연기력과 흥행성을 모두 지닌 배우라는 저력을 다시금 체감하게 했다.

그 결과, TV화제성 분석 기관 굿데이터코퍼레이션과 방송콘텐츠 가치정보 시스템(라코이)에서 꾸준히 상위권을 기록했다. 출연하는 프로그램과 작품 속에서 보여주는 류수영의 다채로운 매력이 남녀노소를 불문한 폭넓은 연령대에서 호응을 불러일으키고 있는 것. 이름만 들어도 신뢰감이 더해지는 ‘믿고 보는 류수영’이라는 타이틀을 확고히 했다.

이러한 높은 호감도를 바탕으로 광고계에서 또한 류수영에 대한 관심이 뜨겁다. 다수의 프로그램 속 류수영 특유의 반듯한 이미지, 친근한 매력이 브랜드들이 추구하는 가치와 맞닿아있다는 것이 업계 관계자의 전언이다. 한돈, 오픈 마켓 앱은 물론 건강기능식품, 새벽 배송 앱까지 분야를 막론하고 광고 모델로 발탁됐다. 뿐만 아니라 경기지역화폐, 주방용품 등 더욱 다양한 광고 모델로서 활약을 예고했다.

브라운관과 스크린을 비롯 광고까지 다방면에서 활동하며 만능 엔터테이너로 자리매김한 류수영에게 러브콜이 계속 이어지고 있다는 후문. 올해 하반기에도 류수영은 분주히 대중을 찾아갈 예정이다. 이유 있는 열일 행보를 걷고 있는 류수영이 하반기를 어떻게 수놓을지 귀추가 주목된다.

한편 KBS 2TV ‘류수영의 동물티비’는 토요일 오전 9시 20분 방송된다.

차혜영 한경닷컴 연예·이슈팀 기자
기사제보 및 보도자료 hub@hankyung.com"
2021-07-12 부산=조원진 기자,"대선주조, 다이아몬드·대선소주와 어울리는 4가지 메뉴 구성","대선주조, 대선X푸드어셈블 콜라보 밀키트 패키지 출시
최근 집에서 술을 마시는 홈술 문화가 확산하며 음식과 궁합이 맞는 주류를 즐기는 푸드 페어링(Food pairing)이 인기를 얻고 있는 가운데 대선주조가 밀키트 전문 업체 푸드어셈블과 홈술족을 겨냥한 콜라보 상품을 선보였다.


대선주조는 푸드어셈블과 협업을 통해 자사 소주제품들과 함께 먹으면 어울리는 밀키트 패키지를 출시한다고 12일 밝혔다.


콜라보 메뉴는 총 4가지다. 깔끔하고 깊은 맛이 일품인 대선소주와 어울리는 음식엔 콩나물 불고기, 연남동 통삼겹 김치찌개, 부드러운 목 넘김을 자랑하는 다이아몬드 소주엔 매콤 감바스 알 아히요와 바게트, 로얄 하우스 스테이크 구성돼 고객들의 입맛을 사로잡을 계획이다.


프로모션 기간은 12일부터 재고소진 시까지며, 해당 콜라보 제품들은 푸드어셈블 공식 홈페이지에서 다양한 이벤트와 함께 만나 볼 수 있다.


조우현 대선주조 대표는 “홈술족의 증가로 푸드 페어링이 트렌드가 되면서 지역 대표 주류기업으로서 새로운 제품을 준비하게 됐다”며 “앞으로도 지역 기업들과 협업을 통해 다양한 제품을 선보이겠다”고 말했다."
2021-07-12 김태현(hyun@hankyung.com);,"대선주조, 푸드어셈블과 콜라보(협력) 밀키트 상품 출시","다이아몬드 소주, 대선소주와 어울리는 4가지 메뉴 구성


대선과 푸드어셈블이 콜라보 프로모션을 진행하는 밀키트 제품. 대선주조 제공.

최근 집에서 술을 마시는 홈술 문화가 확산되며 음식과 궁합이 맞는 주류를 즐기는 푸드 페어링(Food pairing)이 인기를 얻고 있는 가운데, 대선주조(대표 조우현)가 밀키트 전문 업체 푸드어셈블(대표 윤정일)과 홈술족을 겨냥한 콜라보(협력) 상품을 선보였다.

대선주조는 푸드어셈블과 협업을 통해 자사 소주제품들과 함께 먹으면 어울리는 밀키트 패키지를 출시한다고 12일 밝혔다.

콜라보 메뉴는 총 4가지다. 깔끔하고 깊은 맛이 일품인 대선소주와 어울리는 음식엔 콩나물 불고기, 연남동 통삼겹 김치찌개가, 부드러운 목 넘김을 자랑하는 다이아몬드 소주엔 매콤 감바스 알 아히요&바게트, 로얄 하우스 스테이크로 구성돼 고객들의 입맛을 사로잡을 계획이다.

프로모션 기간은 12일부터 재고소진 시까지다. 해당 콜라보 제품들은 푸드어셈블 공식 홈페이지에서 다양한 이벤트와 함께 만나볼 수 있다.

조우현 대표는 “홈술족의 증가로 푸드 페어링이 트렌드가 되면서 지역 대표 주류기업으로서 새로운 제품을 준비했다”며 “앞으로도 지역 기업들과 협업을 통해 다양한 제품을 선보이겠다”고 말했다.

부산=김태현 기자 hyun@hankyung.com"
2021-07-12 NEWSFLOW;,"베트남 전문 외식브랜드 ‘에머이’, 간편식 ‘쌀국수 밀키트’ 출시…‘마켓컬리’서 선봬","지난 2017년 20억원대에 불과했던 밀키트 시장이 지난해 2000억원 규모로 불과 4년 동안 100배 가까이 성장했다. 최근에는 외식 전문 프렌차이즈 기업들도 이러한 홈쿠킹 트렌드에 발맞춰 가정에서 간편하게 조리할 수 있는 RMR(레스토랑 간편식) 제품들을 출시하고 있다.

이러한 가운데 베트남 전문 외식브랜드 ‘에머이’는 베트남 전통방식 그대로의 쌀국수를 집에서도 간편하게 준비하고 맛볼 수 있는 간편식 ‘에머이 쌀국수 밀키트’ 2종(소고기·닭고기 쌀국수)을 출시해 이달 9일부터 마켓컬리에서 선보인다고 밝혔다.

에머이는 국내 베트남 여행자 수가 급증한 2016년에 종로에 본점을 오픈한 이래, 2018 미쉐린 빕구르망에 선정되는 등 고객들에게 꾸준히 사랑받고 있는 베트남요리 전문 외식브랜드로써 쌀국수, 분짜 등의 인기메뉴를 앞세워 현재 전국 55개 매장을 운영 중이다.

에머이 측에 따르면 이번 베트남쌀국수 밀키트 제품은 외부활동의 어려움으로 늘어난 홈쿠킹족과 요리에 부담을 느끼는 이른바 ‘요린이’ 등을 겨냥해 출시했으며 캠핑지 및 홈파티 등에서도 간편한 조리를 통해 베트남 전통 그대로의 맛을 즐겨볼 수 있도록 메뉴의 퀄리티 극대화를 초점으로 기획했다고 한다.

베트남의 생면 식감을 그대로 살리고자 현지 제면방식을 구현해 특허를 획득한 에머이 쌀면은 밀가루를 사용하지 않고 부드러우면서도 쫄깃한 식감을 선사하는 것이 특징이다. 또한 전국의 에머이 매장에서는 쌀국수 육수를 24시간 우려내어 깊고 진한 맛을 선보이며 SNS 등에서도 소비자들의 좋은 평가를 이끌고 있다.

‘에머이 쌀국수 밀키트’ 2종 제품은 매장에서의 맛을 가정 또는 캠핑지 등에서 간편하게 구현할 수 있도록 에머이의 쌀면과 고기의 원물 고명 및 갖은양념을 그대로 급랭시켜 맛을 유지하고 쌀국수 육수는 농축소스로 구현했다. 2인분 기본 구성으로써 각 1인분씩 별도 포장되어 있으며 권장 조리 시간은 1인분 기준 400ml 끓는 물에 1분이다.

한경닷컴 뉴스룸 open@hankyung.com"
"2021-07-12 문수정,정신영",“평소 주말의 4분의 1”… ‘가혹한 거리두기’ 이미 시작됐다,"더현대 서울·롯데월드몰 가보니 대기인원 확 줄고 식품관도 한산 집콕족 늘자 온라인 매출은 껑충
수도권 거리두기 4단계 상향 적용을 하루 앞둔 11일. 서울 여의도 더현대 서울은 개점 후 가장 덜 붐비는 주말을 맞았다. 지난 2월 문을 연 뒤 주말마다 8만∼9만명이 방문했던 가장 ‘힙한’ 장소였지만 눈에 띄게 방문객 수가 줄었다.

점심시간인 오후 1시30분 더현대 서울 지하 1층 식품관은 일요일인데도 평일보다 한산한 모습이었다. 푸드코트 테이블 24개 중 5개나 비어있었다. 현장 직원은 “평소 주말의 4분의 1 수준”이라며 “주말에는 앉을 곳이 없어서 한참 기다려야 했는데 지난 8일부터 손님이 많이 줄었다”고 말했다. 위생장갑을 낀 채 쇼핑을 하는 사람도 있었다.

가장 붐비는 곳 중 하나인 5층 ‘블루보틀’도 대기 인원이 10팀 정도로 급감했다. 블루보틀에는 주말이면 100팀 정도 대기하곤 했다. 블루보틀 직원은 “평소 1시간 가량 기다려야 입장할 수 있었는데 어제부터 손님이 확 줄었다”고 말했다. 식당, 카페뿐 아니라 구찌, 보테가베네타 등 명품 매장도 대기 인원이 2~3팀 정도로 크게 줄었다.

서울 송파구 롯데월드몰도 비슷했다. 코로나19로 방문객 수가 크게 줄었던 롯데월드몰은 올 들어 빠르게 회복세를 보여 왔다. 하지만 이날은 최근 주말 풍경과는 다소 달랐다. 어린 아이와 함께하는 가족 단위 방문객이 눈에 띄게 줄었다.

한 어린이 놀이 시설은 줄을 서지 않고도 입장이 가능했다. 이 곳 직원은 “최근 주말마다 하루 입장객 수가 900명 이상이었는데, 어제 오늘은 100명 조금 넘었다”며 “아이들이 주로 이용하는 곳이라 그런지 고객 수가 뚝 떨어졌다”고 말했다.

입장권을 사려면 한참 동안 줄을 서야 했었던 아쿠아리움과 롯데월드 어드벤처도 방문객 수가 크게 줄었다. 입장객들은 대부분 10~20대였다. 한 방문객은 “기말고사 끝나서 오랜만에 친구들과 나왔다”며 “사람도 많지 않다고 해서 조심히 다녀오려고 한다”고 말했다.

더현대 서울 입점업체의 한 직원은 “(현대백화점 무역센터점) 식품관에서 확진자가 나온 탓인지 식품관을 찾는 손님이 평일이고 주말이고 크게 줄었다”고 말했다. 롯데백화점 잠실점도 식품관을 오가는 사람이 현저히 줄었다.

다만 코로나19 2·3차 대유행 때처럼 외출하는 사람이 급감하지는 않은 것으로 보인다. 롯데월드몰에 입점한 카페 대부분은 만석이었다. 더현대 서울도 인기 있는 매장은 짧게 나마 대기해야 입장이 가능했다.

한편 온라인 쇼핑은 증가세를 보이고 있다. 하루 확진자 수가 1000명을 넘어선 지난 6일 이후 상승세가 눈에 띄게 나타나고 있다. 지난 6~8일 SSG닷컴의 배송 물량이 90%를 상회했다. SSG닷컴은 하루 최대 13여만건의 주문을 소화할 수 있다. 밀키트, 마스크, 손소독제, 라면, 생수 등이 10~20% 이상 매출 신장률을 보였다.

롯데마트 온라인 매출 신장률은 전 주 동기 대비 17.8% 늘었다. 휴지·위생용품 매출은 57.0% 늘었고, 라면·컵밥 등 상온식품류 17.9%, 과일 16.5%, 쌀 8.5% 등도 10%대 안팎의 증가율을 보였다. 마켓컬리의 지난 6~8일 주문 건수도 전주 대비 4% 증가했다. 김치·국·밑반찬 등 반찬류 8%, 쌀·잡곡류 9% 등 ‘집콕’에 필요한 제품의 매출 증가폭이 컸다. 수도권 지역에 거리두기 4단계 적용이 예상되던 시점부터 생필품 위주로 매출이 증가한 것으로 보인다.

문수정 정신영 기자 thursday@kmib.co.kr"
2021-07-12 김현아 기자,“코로나 시대 지역축제 새로운 방향 제시” 댄싱카니발·산천어축제 성공 사례 눈길,"[대한민국 대표 축제박람회] 원주시·화천군 프레젠테이션
대한민국 대표 축제박람회 부대행사로 진행된 팔도 축제 프레젠테이션에서 원주시와 화천군이 발표자로 나서 지역 축제와 관광지를 알렸다.

원주시는 대표 축제인 ‘다이내믹 댄싱카니발'을 주제로 PT를 진행했다. 특히 코로나19 이후 변화한 댄싱카니발 개최 방식에 초점을 맞췄다. 기존 댄싱카니발이 커다란 메인 무대를 중심으로 시민들을 불러 모으는 방식으로 이뤄졌다면 팬데믹 이후 댄싱카니발은 작은 축제들이 직접 시민들을 찾아가는 분산 방식으로 바뀌었다는 설명이다. 또한 기존 프로그램의 온라인 전환을 통해 축제의 시·공간까지 확대했다고 강조했다.

발표자로 나선 김성수 원주문화재단 팀장은 “원주 댄싱카니발은 팬데믹 이후 축제의 새로운 방향을 제시한 사례”라고 말했다.

화천군은 산천어축제와 함께 화천의 주요 관광지를 소개했다. 우선 방문객, 경제파급효과 등 정확한 수치를 들어 산천어축제의 인기를 자랑했다. 이어 화천의 특색 관광지인 DMZ, 임남댐, 백암산 케이블카, 파로호 하트섬 등을 사진과 함께 홍보했다. 전국적으로 인기를 끌었던 산천어 밀키트, 선물세트를 보이며 팬데믹 시대에 화천군이 어떻게 돌파구를 마련했는지 소개하기도 했다.

무대에 오른 화천군 관계자는 “서로의 따뜻한 체온이 그리운 겨울날 화천에 와서 사랑을 만들어 가길 기대한다”면서 화천 방문을 유도하며 PT를 마무리했다.

부산=김현아기자 haha@kwnews.co.kr"
2021-07-12 유지연.배정원(yoo.jiyoen@joongang.co.kr),"[View & Review] 생선·와인 같이 팔고, 수퍼서 그림놀이…동네 가게 생존법","대형 온라인 쇼핑몰 틈새 공략 조양마트 ‘전국구 와인숍’ 유명세 보마켓, 산책나온 애완견 빵 판매 주민들 위한 ‘동네 사랑방’ 역할
물류와 자본을 앞세운 거대 온라인 상거래 플랫폼이 일상을 지배하면서 동네 생활은 건조해졌다. 골목마다 하나쯤 있었던 철물점과 문구점, 과일 가게와 책방 대신 편의점만 여럿 불을 밝힌다. 웬만한 물품은 모두 온라인으로 받아볼 수 있다. 동네 가게가 생존의 위기를 겪고 있는 이유다. 살아남은 것 자체가 성공이라 할 수 있는 요즘, 작은 가게 다섯 곳의 특별한 생존법을 소개한다.

약 9.9㎡(3평) 남짓 작은 상점에 들어서면 생선 비린내 대신 백화점 수산 코너 수준으로 깔끔하게 놓인 생선들이 손님들을 반긴다. 서울 용산구 이촌동의 ‘생선씨’다. 삼치·가자미·고등어 등 국민 생선부터 금태·연자돔 등 고급 생선까지 있다. 생선 매대 맞은편 냉장고에는 초밥 전문점 못지않은 고급 초밥과 회 도시락도 볼 수 있다. 회 도시락 옆으로는 내추럴 와인도 구비했다. 근처 한강에서 회와 와인을 즐기는 손님을 위한 ‘피크닉 세트’도 눈에 띈다.

최시준 생선씨 대표는 “동네에서 다양한 생선을 사기가 어렵고, 근처 시장이 있다 해도 깔끔하지 않아 잘 안 가게 되는 것 같아 시작한 생선 가게”라며 “단순 생선 가게라기보다 바로 먹을 수 있는 해산물에, 도치 알탕이나 대구탕과 같은 즉석 밀키트 등까지 취급하는 해산물 그로서리(식료품점)를 표방한다”고 했다.

동네 수퍼지만 와인만 700여 종류가 있는 서울 광진구 자양동 ‘조양마트’는 전국구 유명 수퍼다. 근처 ‘새마을 구판장’과 함께 동네 수퍼 와인숍 1세대로 불리는 이곳은 와인 전문점 못지않은 다양한 구색의 와인을 합리적인 가격대로 제공한다. 주말이면 지방에서까지 와인을 사러 올라와 몇십 병씩 와인을 사서 가는 이들이 넘친다.

와인과 어울리는 치즈 등 안줏거리부터 와인 잔, 디캔터, 와인 셀러 등까지 갖췄다. 인기의 비결은 비교적 합리적인 가격이지만, 그보다 더 중요한 건 동네 슈퍼면서도 와인에 진심이라는 점이다. 조양마트 인스타그램에는 그날그날 새로 들어온 와인은 물론 와인과 어울리는 안주 등 정보도 가득하다.

남산 자락에 벌써 두 개가 있고, 서울역 근처에 또 하나의 상점을 열 준비를 하는 ‘보마켓’은 생활밀착형 동네 수퍼마켓이자 동네 플랫폼을 지향한다. 딱 정해진 주제가 없는 가게 콘셉트로 식료품부터 치약·비누 등 생활용품은 물론 샌드위치나 떡볶이 등 간단한 음식도 판매하는 이곳은 수퍼와 간이 식당, 동네 사랑방 역할을 자처한다.

유보라 보마켓 대표는 “잠시라도 머무르면서 동네에 살고 있다는 느낌을 주는 가게를 만들고 싶었다”며 “점점 문구점이나 꽃집 같은 동네 정취를 느낄 수 있는 장소가 사라지고 있어 아쉽다”고 했다.

일반 편의점이나 수퍼에서는 찾기 어려운 치즈나 신선한 샐러드 채소, 과일, 와인 등 상품 구성에도 공을 들이면서도 편안한 분위기 마련에 공을 들였다. 남산맨션 보마켓 1호점에는 아이들이 그림을 그리며 놀 수 있게 스케치북을 가져다 놓고, 이태원 경리단길의 보마켓 2호점에는 강아지 산책시키는 주민들이 많아 강아지용 쿠키와 빵을 낸다.

서교동 ‘슈퍼스티치’는 동네 주민이 참새 방앗간처럼 들려 한 끼 때우고, 이웃을 만나 커피를 마시거나 밀린 업무를 마무리하기 좋은 장소다. 옛 수입 식료품점인 ‘미제가게’ 콘셉트로, 동네 커뮤니티를 넘어 동네의 ‘거실’이 되겠다는 게 목표다. 키오스크로 돈가스·족발·냉면·김치찌개 등을 주문해 먹거나, 호주 스페셜티 커피를 마실 수 있다. 유기농 제철 과일도 배달해준다. 진열된 상품은 뒤죽박죽이지만, 보물찾기의 재미가 있다.

와인병과 소주병 옆에는 단호박 모닝죽이 놓여있고, 바로 앞에는 비누·인센스스틱(향초나 향침)·주방세제·숟가락 등 생활용품이 있다. 수제팔찌와 목걸이 등 액세서리도 판다.

김수민 대표는 “온라인이 성장하고 있지만 소비재와 경험재로서 공간 중심의 오프라인 매장도 상품성이 있을 거라 판단해 위기를 기회로 만들기로 했다”며 “무조건 회전율만 높이다간 부쩍 오른 인건비를 감당하기 어려울 것 같아 커뮤니티 기능이 강화된 개념의 매장을 시도했다”고 설명했다.

동네 가게들은 매장이 중심이지만 비대면·온라인 접점도 필수다. 오히려 동네 가게들이야말로 비대면 선택지를 보완하면 더 큰 시너지를 낼 수 있다.

서울 시내 약 40여개 매장을 직영으로 운영하는 반찬가게 ‘슈퍼키친’의 매장에는 주방이 없다. 고객 응대에 집중하기 위해 조리는 경기도 부천에 있는 공장에서 전담한다. 오후 6시까지 온라인으로 주문하면 다음 날 집 앞 새벽 배송도 가능하다.

온라인과 오프라인의 장점을 섞는 이유는 간단하다. 편리한 온라인 주문 못지않게 당일 먹는 반찬을 눈으로 보고 구매한 뒤 곧바로 식탁에 올리려는 수요도 높기 때문이다. 최건영 슈퍼키친 공동 대표는 “속도를 따져볼 때 구매 후 배송까지 반나절 또는 하루가 걸리는 온라인 플랫폼보다 집 앞에서 방문 구매하는 동네 상권은 아직은 덜 성장한, 즉 기회가 있는 시장”이라며 “저녁 식사를 준비하기 위해 퇴근길에 들려 식자재를 쇼핑하는 동네 상권의 중심이 되는 게 목표”라고 말했다."
2021-07-12 김영 기자,"""코로나·무더위 함께 이겨냅시다""","[충청투데이 김영 기자] 음성천연가스발전소 건설을 추진하고 있는 한국동서발전㈜이 코로나19 장기화에 지친 음성지역 어르신에게 보양식을 지원하며 응원에 나섰다.

초복을 앞둔 9일 동서발전 음성그린에너지건설본부는 대한노인회 음성읍 분회를 방문해 음성읍, 소이면, 원남면 경로당 150곳에 지원할 삼계탕용 생닭 3000마리를 전달했다.

보양식으로 마련한 삼계탕용 생닭은 코로나19로 힘든 시간을 보내고 있는 지역 어르신들이 이 시기를 잘 이겨내고, 무더위를 극복해 건강한 여름나기를 지원하고자 준비했다. 특히 이 삼계탕은 찹쌀·인삼·밤·대추 등의 약재가 포함된 밀키트 타입으로 가정에서 간편하게 끓여 먹을 수 있도록 포장 되어있다.

장양원 읍성읍 분회장은 ""지역 어르신들을 위해 보양식을 지원해준 동서발전에 깊이 감사드리며, 발전소 건설사업을 통해 지역경제 활성화에 많은 도움이 되었으면 한다""고 말했다. 장익상 음성건설본부 실장은 ""코로나19지난 5일에도 지역사회 취약계층에 소방용품 및 구급상자 등을 전달하였으며, 하반기에는 음성군 어르신을 위한 한방의료 지원 등을 준비하고 있다""고 밝혔다.

한국동서발전㈜는 음성군 음성읍 평곡리 일원에 사업비 약 1조 2000억을 투입해 시설규모 1122㎿급 음성천연가스발전소 건설을 추진하고 있다. 이에 지난 4월 환경영향평가 협의를 완료하고, 7월 중 전원개발사업 실시계획 승인을 통해 2024년 12월말 1단계, 2026년 12월말 2단계 각각 준공을 목표로 사업을 추진하고 있다. 음성=김영 기자 ky58@cctoday.co.kr"
2021-07-11 오인근,"한국동서발전(주) 음성그린에너지건설본부, 음성군 경로당에 보양식 전달","음성읍, 소이면, 원남면 경로당 150곳에 삼계탕 3000마리 전달
[음성]한국동서발전(주) 음성그린에너지건설본부(본부장 이영찬)는 지난 9일 대한노인회 음성읍 분회(분회장 장양원)에 삼계탕용 생닭 3000마리를 지원했다고 밝혔다.
음성그린에너지건설본부는 코로나19로 힘든 시간을 보내고 있는 어르신들이 이 시기를 잘 이겨내고, 무더위를 극복하여 건강한 여름나기를 지원하고자 보양식을 마련했다.
이날 전달된 삼계탕은 찹쌀, 인삼, 밤 대추 등의 약재가 포함된 밀키트 타입으로 가정에서 간편하게 끓여 먹을 수 있도록 포장 되어있다.
장양원 분회장은 ""지역 어르신들을 위해 보양식을 지원해준 음성건설본부에 감사드린다""며 '발전소 건설사업을 통해 지역경제 활성화에 많은 도움이 되었으면 한다""고 말했다.
또한, 음성건설본부 장익상 실장은 ""지난 5일에도 지역사회 취약계층에 소방용품 및 구급상자 등을 전달했다""며""하반기에는 음성군 어르신을 위한 한방의료 지원 등을 준비하고 있다""고 밝혔다.
한편, 한국동서발전(주)은 음성군 음성읍 평곡리 일원에 사업비 약 1조 2000억원을 투입하여 시설규모 1122MW급 음성천연가스발전소 건설추진을 위해 지난 4월 환경영향평가 협의 완료, 7월 중 전원개발사업 실시계획 승인을 통해 2024년 12월말 1단계, 2026년 12월말 2단계를 각각 준공 목표로 사업을 추진하고 있다. 오인근 기자"
