Date,Title,Content
2019-07-31 봉원종 기자,"GS프레시, ‘갓프레시 핫딜’ 실시 ‘시간대별 온라인 최저가의 행운’","GS fresh(프레시)에서 여름 맞이 시원한 타임 특가 특가할인… 삼성 서큘레이터가 4만원대에
GS리테일의 ‘신선함의 시작 장보기 쇼핑몰 GS fresh(프레시)’가 최상의 신선한 상품들을 갓 도착한 듯이 빠르게 당일 전달하며 고객들에게 차별화된 가치를 전하겠다는 의미를 담은 슬로건 ‘갓프레시’에 걸맞게 여름철 무덥고 습한 날씨에 몸도 마음도 모두 시원하게 할 특가 할인을 준비했다고 밝혔다.해당 행사는 7월 31일 하루, 전체 카테고리의 대표 상품을 특가로 구입할 수 있으며 낮 12시부터 저녁 6시까지 진행한다. 이번 핫딜은 포털사이트 네이버에서 ‘갓프레시 핫딜’ 키워드 검색 후 노출되는 배너를 클릭해 선착순 참여가 가능하며 시간대별로 다른 카테고리의 상품을 6시간동안 2시간씩 총 3회 선보인다.31일 낮 12시에는 풀무원 함흥비빔냉면 2인*4봉을 9,900원, DHA 옳은 우유 120ml*24팩을 9,980원에, 오후 2시에는 최근 ‘혈관청소부’로 연일 화제되고 있는 크릴오일 30정을 9,980원, 제천농협 오대쌀 10KG를 28,700원에, 오후 4시에는 간편 밀키트 심플리쿡의 핫한 신상품 마라 감바스알아히오를 반값인 9,250원, 삼성 서큘레이터를 단돈 48,450원에 선보인다. 그 외 다양한 상품도 준비되어 있다.이 밖에도 GS fresh 첫구매 고객 이라면 비비고왕교자 455g*2봉을 단돈 100원에 구매 가능하다.GS프레시 관계자는 “시간대별로 신선식품, 공산품, 위생용품, 냉장 및 냉동식품 대표 품목을 선보이며 온라인 최저가에 도전하는 ‘갓프레시 핫딜’에 고객들의 뜨거운 관심과 참여가 예상된다”며 “앞으로도 GS프레시는 장보기 대표 쇼핑몰로서 알뜰하고 합리적인 쇼핑을 즐기는 고객들의 만족도를 높이기 위한 다양한 이벤트를 선보이겠다”고 말했다. /봉원종 기자"
2019-07-31,전날 밤에 주문하면 오늘 아침 문앞에 ‘쓱’ 새벽배송 서비스 봇물,"늦은 저녁 주문해도 다음날 아침 문 앞에 신선식품을 배달해주는 ‘새벽배송’ 시장에 마켓컬리와 쿠팡 등 스타트업 위주의 기존 업체는 물론 신세계와 롯데 등 대형 유통채널이 빠르게 가세하고 있다.


롯데홈쇼핑은 최근 새벽배송 전문관 ‘새롯배송’을 열었다. TV홈쇼핑과 자사 온라인몰인 ‘롯데아이몰’에서 판매하는 신선식품, 간편식, 생활용품 등 500여 개 상품을 평일 기준 오후 6시 전에 주문하면 다음날 오전 7시까지 집 앞에 배송한다. 그밖에도 당일 경매된 최고 등급의 제철과일과 축산품을 비롯해 트러플 오일소금, 이베리코 흑돼지, 강화도 고시히카리 쌀 등 최상급 식자재와 지역 특산품을 판매한다. 4만 원 이상 주문 시 무료배송하며 재활용이 가능한 친환경 아이스팩과 보냉박스로 배송 쓰레기를 줄였다. 강남, 서초, 송파 등 서울 일부 지역에 우선 도입한 뒤 올해 안에 서울 전역으로 배송 지역을 확대하며 상품 수도 7000여 개로 늘어날 예정이다. 내년 상반기엔 롯데슈퍼와 연계해 수도권과 지방에 진출한다. 먼저 새벽배송을 시작한 롯데슈퍼는 온라인 쇼핑몰인 ‘롯데프레시’에서 새벽배송 누계매출이 100억 원을 넘었다. 오후 10시 전에 주문 시 다음날 오전 7시 전에 문 앞에 배송한다.
신세계의 온라인몰 통합법인 SSG닷컴은 최근 새벽배송 지역을 서울과 경기 17개구로 늘렸다. 자정 전에 주문을 마치면 오전 6시 이전에 배송한다. 신선식품, 유기농 식재료, 베이커리, 밀키트, 반찬류를 비롯해 유아용품과 반려동물 상품 등 1만여 가지의 상품을 판매한다. 피코크와 노브랜드 등 이마트 간편식 브랜드도 선보인다. 특히, 최대 9시간 보냉 효과가 있는 40ℓ 용량의 대형 보랭백인 ‘알비백’을 자체 제작해 택배 쓰레기를 줄였다. 2~3일 후로 배송을 예약할 수 있어 계획적인 쇼핑이 가능하며 주문액이 4만 원을 넘으면 무료배송한다.
편의점 GS25와 GS슈퍼마켓 등을 운영하는 GS리테일은 온라인몰 ‘GS프레시’에서 오후 11시까지 주문 시 다음날 오전 7시까지 배송한다. 서울 전지역과 경기 일부 지역에서 운영하며 그 외 지역은 당일배송이 가능하다. 5000여 종의 신선식품과 반려동물 상품을 비롯해 밀키트 방식으로 유명 브랜드 메뉴도 주문할 수 있다. GS샵은 GS프레시 새벽배송을 입점시킨 데 이어 동원과 손잡고 ‘더반찬’으로 반찬류를 새벽배송 상품군에 추가했다. 희망배송일을 지정할 수 있으며, 밀키트도 판매한다.
현대홈쇼핑은 H몰의 ‘싱싱냉동마트’ 코너에서 500여 개 신선식품을 오후 4시까지 주문 시 서울·경기·인천 일부 지역에 한해 다음날 오전 7시 전에 배송한다. 인기브랜드 제품을 묶음배송하며 2만 원 이상 주문 시 무료배송한다. CJ오쇼핑은 올해 하반기 CJ제일제당 밀키트 ‘쿡킷’을 새벽배송 방식으로 CJ몰에서 판매할 예정이며, NS홈쇼핑도 새벽배송을 준비 중이다.
지난 2015년 가장 먼저 새벽배송 서비스를 선보인 마켓컬리는 오후 11시 이전에 주문하면 다음날 오전 7시까지 배송한다. 프리미엄 식자재를 내세워 산지 직송 방식을 선택했다. 4만 원 이상 구입 시 무료배송하며, 월 4500원의 유료멤버십 서비스인 ‘컬리패스’를 이용하면 일부 지역에 한해 주문 가격에 상관없이 무제한으로 무료배송이 가능하다.
지난해 새벽배송 서비스인 ‘로켓프레시’를 선보인 쿠팡은 자정까지 주문 시 다음날 오전 7시 전에 배송한다. 1만5000원 이상 주문해야 무료배송하며, 타사와 달리 전국 대부분의 지역에서 주말 제외 없이 4000여 종의 상품을 새벽배송으로 이용할 수 있다. 다만 월 2900원의 유료 멤버십 제도인 ‘로켓와우’에 가입해야만 한다.
앞서 BGF리테일이 인수한 헬로네이처는 새벽배송 서비스는 물론 생산자 직송 방식과 비건 전문존 등을 선보이며 차별화에 나서고 있다. 오아시스 마켓 역시 새벽배송 외에도 서울·경기 일부지역에 한해 낮에 주문하면 하루 2회 당일배송하는 주간배송을 최근 시작했다.
[글 디지털뉴스국 배윤경 기자 사진 각 업체]
[본 기사는 매일경제 Citylife 제690호 (19.08.06) 기사입니다]"
2019-07-30 김태이,"GS프레시, 선착순 타임 특가 ‘갓프레시 핫딜’ 단 하루 진행","삼성 서큘레이터 ‘10만 원 할인’ 단돈 4만 원대에 특별한 행운
GS리테일에서 운영하는 ‘신선함의 시작 장보기 쇼핑몰 GS fresh(프레시)’가 오는 7월 31일 하루, 전체 카테고리의 대표 상품을 특가로 구입할 수 있는 ‘갓프레시 핫딜’을 낮 12시부터 저녁 6시까지 진행한다.
GS프레시는 갓 수확한 최상의 신선한 상품들을 갓 도착한 듯이 빠르게 당일 전달하며 고객들에게 차별화된 가치를 전하겠다는 의미를 담은 슬로건 ‘갓프레시’에 걸맞게 여름철 무덥고 습한 날씨에 몸도 마음도 모두 시원하게 할 특가 할인을 준비했다고 밝혔다.
이번 핫딜은 포털사이트 네이버에서 ‘갓프레시 핫딜’ 키워드 검색 후 노출되는 배너를 클릭해 선착순 참여가 가능하며 시간대별로 다른 카테고리의 상품을 6시간 동안 2시간씩 총 3회 선보인다.
31일 낮 12시에는 풀무원 함흥비빔냉면 2인 4봉을 9900원, DHA 옳은 우유 120ml 24팩을 9980원에, 오후 2시에는 최근 ‘혈관청소부’로 연일 화제 되고 있는 크릴오일 30정을 9980원, 제천농협 오대쌀 10KG를 2만 8700원에, 오후 4시에는 간편 밀키트 심플리쿡의 핫한 신상품 마라 감바스알아히오를 반값인 9250원, 삼성 서큘레이터를 단돈 4만 8450원에 선보인다. 그 외 다양한 상품도 준비되어 있다.
이 밖에도 GS fresh 첫 구매 고객이라면 비비고왕교자 455g 2봉을 단돈 100원에 구매 가능하다.
GS프레시 관계자는 “시간대별로 신선식품, 공산품, 위생용품, 냉장 및 냉동식품 대표 품목을 선보이며 온라인 최저가에 도전하는 ‘갓프레시 핫딜’에 고객들의 뜨거운 관심과 참여가 예상된다”라며 “앞으로도 GS프레시는 장보기 대표 쇼핑몰로서 알뜰하고 합리적인 쇼핑을 즐기는 고객들의 만족도를 높이기 위한 다양한 이벤트를 선보이겠다”라고 말했다.
온라인뉴스부 iseoul@seoul.co.kr"
2019-07-30 온라인뉴스팀,"GS프레시, 여름맞이 시원한 타임 특가`갓프레시 핫딜` 실시","31일 단 하루동안 시간대별 각 카테고리 상품 온라인 최저가에 도전
7월 31일 단 하루, GS리테일의 장보기 쇼핑몰 'GS fresh(프레시)'가 여름철 무덥고 습한 날씨에 몸도 마음도 모두 시원하게 할 특가 할인을 준비했다고 밝혔다.



GS프레시는 갓 수확한 최상의 신선한 상품들을 갓 도착한 듯이 빠르게 당일 전달하며 고객들에게 차별화된 가치를 전하겠다는 슬로건 '갓프레시'의 의미를 담아 전체 카테고리의 대표 상품을 특가로 구입할 수 있는 '갓프레시 핫딜'을 7월 31일(수) 낮 12시부터 저녁 6시까지 실시한다.



GS프레시 관계자는 ""시간대별로 신선식품, 공산품, 위생용품, 냉장 및 냉동식품 대표 품목을 선보이며 온라인 최저가에 도전하는 '갓프레시 핫딜'에 고객들의 뜨거운 관심과 참여가 예상된다""며 ""앞으로도 GS프레시는 장보기 대표 쇼핑몰로서 알뜰하고 합리적인 쇼핑을 즐기는 고객들의 만족도를 높이기 위한 다양한 이벤트를 선보이겠다""고 말했다.



이번 핫딜은 포털사이트 네이버에서 '갓프레시 핫딜' 키워드 검색 후 노출되는 배너를 클릭해 선착순 참여가 가능하며 시간대별로 다른 카테고리의 상품을 6시간동안 2시간씩 총 3회 선보인다.



31일 낮 12시에는 풀무원 함흥비빔냉면 2인*4봉을 55% 할인된 가격 9,900원, DHA 옳은 우유 120ml*24팩을 41% 할인된 9,980원에 판매된다. 오후 2시에는 최근 '혈관청소부'로 연일 화제되고 있는 크릴오일 30정을 67% 할인된 9,980원, 제천농협 오대쌀 10KG를 46% 할인된 28,700원에 구매할 수 있다. 오후 4시에는 간편 밀키트 심플리쿡의 핫한 신상품 마라 감바스알아히오를 50% 반값인 9,250원, 삼성 서큘레이터를 68% 할인된 단돈 48,450원에 선보인다. 그 외 다양한 상품도 준비되어 있다.



이 밖에도 GS fresh 첫구매 고객 이라면 비비고왕교자 455g*2봉을 단돈 100원에 구매 가능하다.



온라인뉴스팀기자 onnews@dt.co.kr"
2019-07-30 조윤주,"이커머스 ""셀러가 경쟁력""… 고객분석 자료 주고 교육 지원도","세계 이커머스 시장 한국셀러 매출 작년보다 17%↑, 中·美 이어 3위
업계, 셀러에 실적 데이터 공유 등 ‘스타 셀러’ 확보 위한 다양한 정책











SSG닷컴이 개발한 셀러리포트. 오늘의 매출 현황을 비롯해 매출과 취소 비교, 고객 분석 등의 다양한 내용이 일목요연하게 정리되어 있다.


이커머스 시장에 '스타 셀러' 잡기 열풍이 불고 있다. 급성장 중인 이커머스 시장에서 자신의 플랫폼에 '잘 키운 셀러'(판매자)를 얼마나 보유했는가가 매출을 흔들 핵심 경쟁력이 됐기 때문이다.



전 세계 이커머스 시장에서 한국 셀러들의 영향력은 날로 커지고 있다. 29일 페이오니아코리아에 따르면 전세계 이커머스 시장에서 한국 셀러의 매출은 전년 동기 대비 17%가 늘며 중국, 미국에 이어 3위를 기록했다.



이에 따라 SSG닷컴, 11번가 등 대형 이커머스 업체들은 다양한 지원책을 제시하며 우수 셀러 확보에 총력을 다하고 있다. 주목할 점은 일회성 또는 단기 행사로 그치던 지원에서 벗어나 판매 실적 데이터 공유, MD와 접점 늘리기 등 보다 실질적이고 다각적인, 함께 성장할 수 있는 방안을 모색하기 시작했다는 점이다.



SSG닷컴은 최근 입점 셀러들이 언제든지 주문량이나 고객분석 현황을 확인할 수 있는 '셀러 리포트'를 개발하고, 본격적인 서비스를 시작했다.



지난 1월부터 전담팀까지 꾸려 6개월간 시스템을 개발한 SSG닷컴은 이 리포트가 셀러들에게 수많은 기회를 줄 수 있다고 보고 있다. 셀러와 담당 바이어가 실적을 공유하고, 이를 바탕으로 좀더 현실적인 판매 전략을 세워 매출 증대를 꾀할 수 있어서다.



SSG닷컴은 내년까지 상품 관련 심층 데이터 분석 시스템을 추가로 개발하고, 고객의 구매패턴을 분석해 '라이프스타일 맞춤형' 서비스를 제안하는 프로파일링 데이터도 셀러에게 제공할 방침이다.



위메프는 '위메프 파트너 지원 프로그램'을 확대했다. 올해에만 2000개 중소기업과 소상공인의 온라인 진출을 돕는다. 위메프는 이 프로그램을 통해 지난 2017년 647개, 2018년 1216개 파트너사를 지원했다. 올해 위메프에서 현재까지 해당 교육을 받은 소상공인 파트너사는 1251곳이다.



온라인쇼핑에 맞는 상품 및 가격 구성, 위메프의 데이터를 활용한 시기 별 판매전략 등을 제공하는 이 프로그램으로 상당한 성과를 본 업체들도 많다. 2018년 10월 위메프를 통해 온라인 채널에 진출한 솜씨협동조합이 대표적이다.



이 회사는 주력상품인 밀키트 제육볶음을 위메프에서 1인가구 시대에 맞게 소량 포장, 무료배송으로 판매하면서, 3개월동안 1만 3000개 이상을 판매해 약 1억4000만원의 매출을 기록했다.



11번가는 지역 셀러들과의 접점을 늘리고 있다. 이미 스타 셀러가 다수 배출된 서울·경기에 비해 성장 잠재력이 높은 셀러들이 많다고 봤기 때문이다. 전국적인 파워 셀러 영입을 비롯해 부산·경남을 시작으로 광주와 대구 등지를 다니며 MD 간담회 형식으로 보유 셀러 영역을 확장하고 있다.




yjjoe@fnnews.com 조윤주 기자"
2019-07-29 박종필(jp@hankyung.com);,1만3600여곳 GS25·GS수퍼마켓서 산다…특급호텔 셰프 손끝서 탄생한 '심플리쿡',"GS리테일의 밀키트(meal kit) 브랜드 ‘심플리쿡’ 메뉴는 밀솔루션팀이 개발한다. 특급호텔 셰프 출신 3명이 포함돼 있다. 이 팀은 지난해 초 신메뉴 개발을 위해 부산 맛집을 샅샅이 뒤졌다. 용호동에서 ‘낙곱새’를 맛보고 “이거다” 싶었다. 낙곱새는 이 지역 대표 안주거리로 낙지, 곱창, 새우의 준말이다.

인맥이 닿는 부산 지역 셰프들을 통해 맛의 비결과 레시피를 파악했다. 소셜네트워크서비스(SNS)에 올라와 있는 낙곱새 인증샷도 분석했다. 그해 5월 심플리쿡 브랜드로 낙곱새를 출시했다. 지금은 월 1만 개 이상 판매되는 1위 상품이 됐다.

호텔 셰프 영입해 메뉴 개발

GS리테일은 2017년 말 국내 유통 대기업으로는 처음으로 가정간편식(HMR)의 일종인 밀키트 시장에 뛰어들었다. 식품전문회사가 아닌데도 발 빠르게 밀키트 시장에 진출할 수 있었던 건 계열사를 통해 식품 생산·유통 노하우를 쌓아왔기 때문이다.

GS리테일은 편의점 GS25에서 판매하는 자체상표(PB) 도시락 등을 위한 저온배송체계(콜드체인)를 오랜 기간에 걸쳐 구축했다. 또 GS수퍼마켓을 통해 품질 좋고 신선한 식재료를 소비자에게 판매해왔다. 식재료와 간편식을 생산해 배송한 경험이 충분한 만큼 메뉴만 개발하면 바로 밀키트를 내놓을 수 있었다.

메뉴 개발은 특급호텔 출신 셰프들에게 맡겼다. 롯데호텔, JW메리어트, 포시즌스 등 특급호텔에서 셰프로 일한 경험이 있는 3명과 세계 3대 요리학교 중 하나인 CIA(Culinary Institute of America)를 나온 1명이 심플리쿡을 만드는 데 합류했다. 이들이 지금까지 선보인 심플리쿡 메뉴는 60여 개에 달한다.

식재료 확보에도 공을 들였다. 하노이 분짜는 베트남에서, 팟타이꿍은 태국에서 가져온 향신료를 사용한다. 인도 북부식 요리를 재현한 ‘치킨마크니커리&파라’는 인도산 강황을 카레 원료로 넣는다. 회사 관계자는 “심플리쿡 메뉴엔 납품받는 식재료 중 최상의 제품을 사용한다”고 말했다.


편의점에서도 살 수 있는 밀키트

심플리쿡의 가장 큰 강점은 소비자들이 구매할 수 있는 채널이 다양하다는 것이다. 가까운 편의점에서도 구매할 수 있다. GS25와 GS수퍼마켓을 합쳐 오프라인 매장만 1만3600여 개다. 지금도 심플리쿡을 판매하는 점포 수는 계속 늘고 있다.

심플리쿡 제품의 약 60%는 GS리테일의 신선식품 온라인몰인 ‘GS프레시’에서 판매되고 있다. 주문하면 다음날 배송이 이뤄진다.

GS리테일은 지난해 말부터 전국 1만3300여 개 GS25 점포에도 심플리쿡을 공급하기 시작했다. 온라인 대신 바로 구입해 요리해 먹으려는 소비자를 위해서다. 다만 가맹점주가 발주하지 않거나 재고가 소진되는 경우가 있는 만큼 GS25의 모바일 앱(응용프로그램)인 ‘나만의 냉장고’를 통해 예약 주문할 수 있도록 했다. 원하는 시간대에 원하는 점포에서 밀키트를 받아갈 수 있다. 해당 점포는 소비자가 수령해 갈 때까지 제품을 냉장 보관해 준다.

심플리쿡 제품 중엔 1인 가구를 겨냥한 메뉴도 인기를 끌고 있다. 치즈부대찌개, 베이컨볶음우동, 누들떡복이 키트 등이 대표적이다. 밀키트는 보통 2~3인용으로 생산되는 경우가 많지만, 이들 제품은 1인분으로 포장돼 판매되고 있다.

박종필 기자 jp@hankyung.com"
2019-07-29 최서영,“얼얼해도 다시 한번” ‘마라탕’에 반한 韓...깨끗하게 ‘마라’ 즐기는 방법은,"TV조선 ‘연예의 맛 시즌2’ 캡처
29일 오전 주요 포털 사이트의 실시간 검색어에 ‘마라’가 올라 화제다

최근 많은 직장인들이 마라탕과 마라샹궈 등 마라 소스를 이용한 음식을 즐기는 등 마라의 인기가 사그라지지 않고 있다.

날씨가 더워지고 중복, 말복을 지나면서 얼큰하고 매콤한 음식에 대한 욕구는 커지는 중인데, TV 소재로도 인기다.

지난 4일 방송된 TV조선 예능 프로그램 ‘연예의 맛 시즌2’에서는 공개 열애를 인정한 배우 오창석(맨 위 사진 왼쪽), 이채은(〃 〃 〃 오른쪽) 커플이 모든 연인이 한번은 거쳐 간다는 ‘마라탕 데이트’를 해 화제를 모았다.

당시 두 사람은 마라 음식 전문집을 찾아 재료를 직접 골라 한끼를 즐겼다.

◆마라가 뭐기에...대한민국이 ‘들썩’

마라는 중국 쓰촨 지역의 매운 맛을 내는 향신료다.

‘마비되다’라는 뜻의 ‘마’(麻)와 ‘맵다’의 ‘라’(辣)가 합쳐져 말 그대로 혀가 마비될 정도로 맵고 얼얼한 매운 맛을 자랑한다.

마라는 고추와 육두구, 화자오, 후추, 정향, 팔각 등의 향신료를 더해 습하고 더운 쓰촨 지역의 음식이 상하는 것을 막기 위해 만들기 시작한 것으로 전해진다.

한국의 매운 맛과는 다른 차별점이 우리 입맛을 사로잡은 것으로 보인다.

주로 고추에 들어있던 매운 맛은 캡사이신 성분으로, 칼칼하고 얼큰한 맛이 주다. 마라의 주 원료는 산초의 영향으로 알싸하고 얼얼한 매운 맛을 낸다.

그래서 기존에 느껴왔던 캡사이신의 매운 통증과 색다른 느낌에 한국인이 매료됐을 것으로 보인다.

◆위생 논란도….지방자치단체 행정처분 철저히 할 계획

근래 ’마라 열풍’에 마라 전문 음식점들이 우후죽순 생겨났고, 이에 따른 위생 문제도 심각해졌다.

지난 25일 마라탕 전문점들의 위생 문제가 불거지면서 ‘제2의 대만 카스텔라 사태’로 번지는 것이 아니냐는 우려도 커지고 있다.

식품의약품안전처는 지난 22일 마라탕과 ‘마라샹궈 등을 판매하는 음식점과 원료 공급업체 63곳의 위생을 점검한 결과 37곳(58.7%)이 식품위생법 위반으로 적발됐다고 밝혔다.

식약처 관계자는 “이번에 적발된 업체는 관할 지방자치단체가 행정처분 등의 조치를 하고, 3개월 이내 다시 점검하여 개선 여부를 확인할 계획”이라고 밝혔다.
왼쪽 상단부터 시계 방향으로 마라 불닭 떡볶이, 마라 샹궈, 마라탕, 마라 감바스. 프레시지 제공
◆“내가 만들어 먹는다”…밀키트·HMR 마라 인기

마라 전문점들의 위생 문제가 불거지면서 밀키트 형태의 제품을 구매하거나 인터넷에서 조리법을 보고 직접 만들어 먹는 소비자들이 늘어나고 있다고 한다.

밀키트는 요리에 필요한 손질된 식재료와 딱 맞는 양의 양념, 조리법을 세트로 구성해 제공하는 제품을 가리킨다.

이른바 ‘먹스타그램’(음식 사진을 올리는 인스타그램)을 즐긴다는 대학생 김지유(24)씨는 사회관계망서비스(SNS)에 “마라탕 위생 문제 너무 슬프다”며 “먹는 것으로 장난치지 말았으면 좋겠다”고 적었다.

그러면서 “하지만 안 먹을 수도 없고 자꾸 먹고 싶어서 결국 HACCP(해썹·식품안전관리인증기준) 인증 받은 업체의 밀키트를 시켜서 집에서 직접 요리해서 먹는다”며 인증 사진을 올렸다.

실제로 올 1~5월 위메프에서 마라탕 재료의 매출은 전년 동기 대비 96배 이상 급증했고, 마라를 넣고 볶은 마라샹궈 재료도 41배 넘게 판매가 늘어난 것으로 집계됐다.

밀키트 전문업체 프레시지는 이러한 소비자의 욕구를 충족시키기 위해 마라탕과 마라샹궈에 이어 감바스(새우)와 순대 볶음, 불닭 떡볶이 등 다양한 마라 소스 요리를 선보이고 있다.

최승우 프레시지 판매전략부문 상무는 “최근 문제가 되는 마라 위생 관련 문제에 대해 소비자들에게 믿음을 드리고, 한국식품안전관리인증원의 해썹 인증을 받아 건강하고 깨끗한 식재료를 제공하고 있다”고 밝혔다.

최서영 온라인뉴스 기자 ace3@segye.com"
