Date,Title,Content
2021-07-09 김형엽,"저렴한 왕전복, 간편조리 삼계탕으로 '초복 몸보신'","■ 고객 입맛 사로잡을 다양한 보양식 출시
삼복(三伏)은 양력 7월 중순에서 8월 중순 사이에 들어가는 잡절로, 24절기에는 속하지 않지만 무더운 여름철을 건강하게 보내기 위해 특별히 챙겨오고 있다. 하지와 입추를 기준으로 계산되는 복날은 하지를 기준으로 세 번째 경일(庚日)이 초복이고, 네 번째 경일이 중복이다. 말복은 입추 다음 첫 경일이다. 각각 열흘씩 차이를 두고 찾아오는 복날은 올해의 경우 오는 11일과 21일이 초복과 중복이며, 다음 달 10일이 말복이다. 유달리 덥게만 느껴지는 복날을 기다리면서까지 챙기는 이유 중 하나는 '음식'이라고 해도 과언이 아니다. 삼계탕과 치킨, 장어 등 각종 산해진미를 복날이라는 이유 하나로 마음껏 즐길 수 있기 때문이다. 이에 유통업계에서는 복날을 앞두고 간편하게 조리할 수 있는 밀키트부터 생닭, 전복, 장어 등 보양식 매출 증대를 노리며 고객 입맛 사로잡기에 나서고 있다.


롯데마트 대구율하점 초복 할인
자이언트 왕전복 회원가 50%↓
데친 왕문어 100g3280원에 판매
대백프라자선 손질 장어 선보여

◆'복날' 다가오자 매출 증가세 보이는 보양식

이례적인 7월 늦은 장마와 초복이 겹치며 올해 복날은 여느 때와는 다른 보양식 트렌드를 보이고 있다. 기존 복날 음식의 대명사였던 삼계탕에서 벗어나 전복, 장어, 간편가정식인 밀키트를 찾는 고객들이 많아진 것. 대구지역 이마트 매출 분석에 따르면 6월부터 지난 6일까지 전복 및 장어, 밀키트 매출은 작년 동기 대비 각 21.8%, 132.5%, 191.7% 상승한 반면 삼계탕용 생닭, 토종닭은 각각 -6.0%, -1.4%로 역신장했다.

특히 큰 폭의 매출구성비를 기록한 밀키트 매출이 눈에 띈다. 6월 한 달간 보양식 음식 매출 구성비에서 밀키트가 35.2%로 가장 높게 나타났고 이어 전복(18.4%), 장어(17.8%), 생닭(16.8%), 토종닭(11.8%) 순으로 높은 매출을 기록했다.

현재 이마트에서 운영 중인 자체 브랜드 'PEACOCK' 밀키트는 100여 종이 넘는 상품을 운영하고 있으며 다양한 상품을 선보이며 고객들로부터 큰 호응을 얻고 있다. 최초 출시된 밀키트는 2030 1인 가구를 위한 소용량 상품들이 주를 이뤘으나 최근에는 40~50대를 포함해

4인 가구가 함께 먹어도 충분한 상품들이 출시되고 있다. 복날 트렌드가 삼계탕 등 무거운 음식에서 가볍고 간단히 즐길 수 있는 밀키트로 옮겨가면서 밀키트의 인기는 더 높아질 전망이다.

이마트 만촌점 이준재 식품영업팀장은 ""복날 가운데서도 보양식 매출이 가장 높은 날은 초복""이라며 ""전통적으로 삼계탕, 수박 등이 복날 선호 음식으로 손꼽혔지만 젊은 층을 중심으로 전통적 의미의 복날 의미가 퇴색되면서 같은 값이면 더 맛있고, 간편한 음식을 선호하는 경향을 보이고 있다""고 전했다.

롯데마트의 경우 초복 맞이 대표 보양식인 삼계탕과 원기 충전에 좋은 수산물의 인기가 상승하고 있는 것으로 나타났다. 롯데마트 매출 집계 자료에 따르면 지난 5~6월 장어와 문어 매출은 작년 동기 대비 각각 218%, 173% 증가한 것으로 나타났다. 5월부터 30℃를 넘는 이른 더위가 찾아오며 일찌감치 여름 건강 보양식을 섭취하는 수요가 늘어난 데 따른 것이다.

이런 인기에 힘입어 롯데마트 대구율하점에서는 다가오는 초복을 맞아 14일까지 여름철 대표 보양식으로 꼽히는 삼계탕을 비롯해 원기 충전에 좋은 장어, 전복 등 '자이언트 수산물'을 합리적인 가격에 선보인다.

마리당 100g 이상의 큰 사이즈로, 전체 출하량의 상위 5%에 해당하는 '자이언트 왕 전복'(냉장·국산)을 엘 포인트(L.POINT) 회원 대상으로 50% 할인된 금액에 판매한다.

또 전체 출하량 중 최상위 사이즈로 30t 한정 수량으로 준비한 '자이언트 손질 민물 왕 장어'는 2만7천800원에, '자이언트 데친 왕문어'는 100g 당 3천280원에 판매한다.

롯데마트 대구율하점 김영태 부점장은 ""매년 초복에는 여름철 대표 보양식 삼계탕을 비롯해 전복, 장어 등 다양한 수산물이 인기를 얻고 있다""며 ""올해도 무더위를 이겨 낼 수 있도록 보양식 제품을 합리적인 가격에 선보일 예정""이라고 말했다.


합리적 가격·편리함·맛 '삼박자'
소비자 취향저격 간편보양식 인기
이마트 'PEACOCK' 밀키트 등
유통업계마다 간편식 잇따라 출시

◆'복날' 각종 혜택 선보이는 유통업계

대구신세계백화점은 초복을 맞아 여름철 체력 보충 및 면역력 강화를 위한 보양식재료 행사를 진행하고 있다. 푸드마켓 내 수산장르 대구수산에서는 여름철 대표 식재료 전복 4미를 1만2천원에, 선물용 '청산도 참전복 만복'(국내산 15미·1㎏)을 14만원에 기획 판매하고 있다. 또 보이드 행사장에서도 은하수산에서 전개하는 '만만해물~ 식탁에서 즐기는 바다의 감동'을 테마로 바다장어구이(2마리) 1만4천900원, 문어(1마리) 1만4천900원, 완도 활전복(8미) 1만7천900원에 각각 판매하고 있다.

대구백화점 프라자점에서는 초복을 맞아 지하 1층 식품코너에서 '현풍 일월정 식당 건강 보양식 독계탕'을 판매한다. 금산 수삼 생산자 초청 판매와 손질 장어와 전복 할인 행사를 진행한다. 오뚜기 및 청정원, CJ에서 만든 삼계탕 간편식도 매장 전면에 배치했으며 초복 선물로 안성맞춤인 포장 과일세트와 수박, 멜론, 한우 세트 등도 선보이고 있다.

대구경북권 이랜드리테일(동아백화점·NC아울렛) 식품매장에서도 다가오는 초복을 맞아 다양한 행사들을 진행한다. '으랏차차! 기운 솟는 복요리 생닭 할인행사'를 비롯해 삼계용 인삼·깐마늘·찹쌀 등 맛과 영양을 더하는 재료 행사와 민물장어, 완도 활전복, 냉동 낙지 할인행사를 진행한다.

현대백화점 대구점의 경우 오는 11일까지 밀키트를 비롯해 각종 삼계탕 재료와 백초당 옥수수, 민어 매운탕 등을 최대 26%까지 할인해 판매한다. 전통 식품 브랜드인 '명인명촌'과 현대식품관이 협업해 내놓은 각종 삼계탕 밀키트는 9일 300개 물량 한정으로 판매한다.
김형엽기자 khy@yeongnam.com"
2021-07-09 지영호|기자|,"6년연속 적자 CJ푸드빌, 흑자전환하나....김찬호 대표 승부수","[머니투데이 지영호 기자] CJ그룹의 외식사업 계열사인 CJ푸드빌이 뚜레쥬르 매각계획을 접은 이후 올해 최우선 목표를 흑자전환으로 잡았다. 임명 첫 해를 보내고 있는 김찬호 대표가 목표를 달성한다면 그룹 내에서 확실한 존재감을 보여줄 수 있다. 코로나19(COVID-19) 장기화에 따른 경영여건은 여전히 나쁘지만 판매채널 다양화와 외식사업 체질개선으로 위기를 기회로 삼겠다는 계획이다.

11일 식품업계에 따르면 CJ푸드빌은 올해 흑자전환을 목표로 최우선 과제를 외식사업 회복에 초점을 맞추고 있다. 사회적 거리두기 단계에 따라 매출에 직격탄을 맞는 오프라인 매장으로는 한계가 있는 만큼 인기메뉴를 중심으로 한 RMR(식당 메뉴를 밀키트로 만든 레스토랑 간편식) 제품으로 승부를 거는 전략이다. 대표적으로 패밀리레스토랑 빕스(VIPS)의 인기메뉴인 '빕스폭립', 한식 뷔페 브랜드 계절밥상의 '쪽갈비' 등을 주력으로 삼고 있다.

외식사업의 판매채널도 다양하게 늘렸다. 오프라인에 국한하지 않고 O2O 기반 배달앱, 네이버스토어 등 소비자가 모여있는 곳으로 영역을 넓혔다. '빕스 얌 딜리버리' 등 딜리버리 전용브랜드를 내놓고 배달수요를 고려한 공유주방을 확대 중이다. 빕스의 배달전용 매장수는 지난해 2개에서 지난달 기준 15개로 대폭 늘었다.

밀키트 쿠핑박스 배달서비스를 운영하고 있는 이탈리안 레스토랑 더플레이스는 홈파티 세트, 런치박스, 샐러드 정기구독 등 비점포 서비스를 확대한 효과로 비점포 매출은 전년동기 대비 539% 증가했다.

CJ푸드빌은 지난해 코로나19 영향으로 일부 영업중단을 겪으면서 연결기준 매출은 2019년 8903억원에서 지난해 6172억원으로 대폭 감소했다. 영업손실도 같은기간 39억원에서 490억원으로 크게 증가했다.

특히 CJ푸드빌은 2014년 38억원의 흑자를 낸 후 6년 연속 적자를 기록중이다. 10년동안 영업으로 1200억원 넘게 까먹었다. 패밀리레스토랑, 뷔페 중심의 외식 트랜드가 소비자들로부터 외면을 받은 까닭이다. 뚜레쥬르 역시 파리바게뜨와 힘겨운 경쟁을 벌이고 있는데다 출점제한까지 묶여있어 성장이 정체돼 있다. 이런 배경에서 CJ그룹은 CJ푸드빌의 뚜레쥬르 매각에 나섰다가 가격협상이 어그러지면서 매각계획을 철회한 바 있다.

식품업계는 CJ푸드빌이 흑자로 돌아서려면 뚜레쥬르가 본궤도에 올라서야 한다는 평가다. 신호는 긍정적이다. 배달 매출의 상승을 지렛대 삼아 브랜드 경쟁력을 끌어올리겠다는 계산이다. 실제 올해 상반기동안 배달 매출이 전년동기 대비 270% 증가했다. 뚜레쥬르는 2019년 9월 배달 서비스를 시작한 후 매장의 90% 가량이 배달 서비스를 시행 중이다.

해외사업도 긍정적이다. 뚜레쥬르 미국법인은 3년연속 흑자를 기록하며 턴어라운드의 발판을 마련했다. 지난해 6개 늘려 62개점포로 규모를 늘렸고, 올해엔 신규가맹점을 두자릿수 이상 늘릴 예정이다.

CJ그룹은 1990년대부터 글로벌 영업을 맡아온 김찬호 대표에게 거는 기대가 크다. 김 대표는 2019년 상무에서 지난해 부사장 대우로 1년만에 승진하며 대표 자리에 올랐다. 투썸플레이스와 뚜레쥬르 책임자로 있으면서 실적으로 실력을 입증한 바 있다.

증권업계에서도 CJ푸드빌이 오랜 적자 터널을 벗어날 것이란 전망이 나온다. 이승웅 이베스트증권 애널리스트는 ""투썸플레이스 매각, 점포축소 등 장기간 지속됐던 구조조정을 마무리했다""며 ""올해 흑자전환이 가능할 전망""이라고 내다봤다."
2021-07-09 윤경현,식감·풍미 뭐하나 흠잡을게 없네 간편식 권태기가 눈녹듯 '사르르' [먹어주는 얼굴],"프리미엄 가정간편식 테이스티나인
대만 음식 바오번, 풍미 잘 살린 먹어바오 '또 당기는 맛'
어려워 보이던 '밀푀유나베'도 초간단 밀키트로 뚝딱











테이스티 반점 '몽골리안 비프'













""이번에는 뭐 먹지?"" 고만고만한 가정간편식(HMR)들을 많이 먹다보니 입맛이 무뎌지는 듯하다. 새로운 먹거리가 절실하다. 한창 고민하고 있는데 불쑥 우리 부서(생활경제부) 식음료 담당 팀장의 목소리가 들려온다. ""테이스티나인 어떠세요? 프리미엄 가정간편식(HMR)이래요."" ""고뤠?"" '프리미엄'이라는 단어에 귀가 솔깃한다. 곧바로 인터넷 검색에 들어간다.



테이스티나인은 데우기만 바로 먹을 수 있는 차세대 밀키트 '레디잇(READY EAT)'을 비롯해 △프리미엄 가정식 '탐나는밥상' △육가공 전문 '신선고깃간' △스테이크 전문 부처스나인(Butcher's9)' △국물요리 전문 '온기원' △중화요리 전문 '테이스티 반점' △일본 가정식 '테이스티 도쿄' △마켓컬리와 협업한 '신사동백반' 등 여러 개의 하위 브랜드를 갖고 있다.



자연스레 그 맛이 궁금해졌다. 이리저리 잴 것도 없다. 공식 홈페이지에서 신박하게 보이는 이름들을 푸짐하게 쓸어담았다.










레디잇 '먹어바오'




■이 만한 간식 없다… 먹어바오



'찐빵 사이에 속재료를 채워 먹는 대만식 길거리 음식으로 바오번의 쫄깃한 식감과 풍미넘치는 속재료의 찰떡궁합!'



대만식 버거 '먹어바오'의 포장지에 적힌 문구다. 정말 한 치도 틀림이 없는 그대로의 맛이다. 중국음식점에서 자주 접하는 '고추잡채'와 언뜻 비슷해 보이지만 맛은 많이 다르다. 훨씬 더 깔끔하고 상큼하다.



전자레인지에 데운 바오번 안에 소스를 바르고, 샐러드와 당근피클, 돼지등심 바베큐를 넣는다. '입이 짧은' 아내와 딸아이는 ""고기에서 동남아 음식 특유의 냄새가 난다""며 얼굴을 찌푸린다.



하지만 포기를 모르는 이들이다. 고기를 빼고 속을 채운 다음 맛나게 먹는다. ""고기가 없어도 맛나다"" ""매콤 달달한 소스가 일품""이라며 5개를 모두 먹어치웠다. 이럴 때는 집안 서열 3위라는 게 서럽다. 투덜대면서 바오번을 대신해 식빵으로 남은 고기들과 재료를 넣어 샌드위치를 만들었다. 나의 기대와 상상을 뛰어넘는다. 새로운 요리를 발견한 것 같다. 먹는 내내 기쁨의 웃음이 나온다. 나쁘지 않은 정도가 아니라 아주 맛있다. 바오번은 더 맛있을까 궁금해진다.



먹어바오는 한 마디로 ""꼭 한 번 먹어보라""고 주위에 광고하고 싶은 맛이다. 재구매 의사 200% 있다. ""이렇게 맛있는 건 냉장고에 넉넉히 쟁여두고 먹어야 한다""며 아내가 이미 3개를 주문했다. 속으로 조용히 ""만세""를 불렀다.



'몽골리안 비프'는 난생 처음 만나는 퓨전 중국식 요리다. 테이스티나인 홈페이지에는 '소고기를 한 번 튀겨 쫀득한 식감을 더하고, 달큰 짭조름한 양념에 한 번 더 볶은 중국식 고기볶음'이라고 쓰여 있다. 식감이 독특하다. 부드럽지도, 딱딱하지도 않다. 꼬집어 한두 마디로 설명하기는 힘들지만 맛있다. 마늘쫑이 전체적으로 맛의 균형을 잘 잡아준다. 고추장 한 숟갈 넣어서 몽골리안 비프와 밥을 쓱싹쓱싹 비비니 다른 반찬은 1도 필요 없다. 술 안주로도 괜찮을 듯하다.










탐나는밥상 '밀푀유나베'




■와인보다 소주…비프 토마토 스튜



'비프 토마토 스튜'는 와인을 좋아하는 아내를 위해 골랐다. 하지만 나의 실수였다. 아내는 '물에 빠진 고기'를 절대 먹지 않는다. 소고기가 든 스튜를 먹을 리가 만무하다. 그래도 완전히 나쁘지는 않다. 내가 다 먹으면 되니까.



작게 썰어 놓은 소고기와 감자, 치즈, 브로콜리까지 한가득이다. 파슬리가 색감을 살려준다. 보글보글 끓으니 냄새가 끝장이다. 마음이 급해진다. 국물(소스)부터 한 숟갈 뜨니 와인이 아니라 소주가 생각난다.



바삭하게 구워낸 바게트는 국물에 찍어 먹는 게 건더기를 올려 먹는 것보다 훠얼~씬 낫다. 바게트가 달랑 4개 밖에 없어 서운할 정도다. 하필이면 이럴 때 냉장고에 빵이 하나도 남아 있지 않다니. '밥을 말아 김치랑 먹으면 어떨까' 궁금했지만 스튜에 대한 예의가 아닌 것 같아서 참는다.



함께 먹은 '미트볼 파스타'는 아주 익숙한 맛이다. 미트볼을 아주아주 좋아하는 관계로 언제 어디서든 실패하지 않을 메뉴 가운데 하나다. 오늘은 딸아이한테 한 젓가락도 양보하지 않았다.



호기심에 남은 비프 토마토 스튜 소스에 파스타를 비벼 먹으니 둘의 조화가 예사롭지 않다. 벌써부터 비프 토마토 스튜와의 다음 만남이 기다려진다.



이날 아내의 와인 안주는 '부처스9 안심스테이크'로 정해졌다. 부드러운 호주산 안심살에 아스파라거스와 새송이버섯, 양파, 그린빈까지 알차게 들었다. 마른 침을 꼴깍 삼키며 쳐다보았으나 자비는 없었다. 아내가 넘겨준 것은 본인이 싫어하는 아스파라거스와 희미한 크기의 안심 한 점이 전부였다. 그마저도 감사하면서 맛을 봤다. ""이렇게 맛있는 걸 혼자 먹다니…내일 바로 주문해서 제대로 먹어보리라.""








탐나는밥상 '전주식 비빔밥'




■야채와 푸짐한 만남…전주식 비빔밥



'전주식 비빔밥'은 제일 잘 고른 메뉴다. 요즘처럼 이른 더위에는 아점(아침+점심)으로 이 만한 메뉴도 없다. 콩나물, 참나물, 도라지, 고사리, 애호박, 무채 등 나물 6가지와 소고기볶음, 계란지단까지 푸짐하게 들었다.



아내의 눈대중은 믿을 것이 못 된다. 내 눈에는 딱 봐도 2인분이다. 하지만 아내는 비빔밥을 만들기 위해 양푼까지 등장했음에도 ""대식가라는 걸 부끄럽게 생각하지 말라""며 '윤경현용 1인분'이라고 박박 우긴다. 게다가 ""비빔밥에는 계란프라이가 있어야 제 맛""이라며 두 개나 부쳐냈다. ""'쭈꾸미볶음'을 얹으면 더 좋겠다""는 아내를 겨우 말렸다.



다행히 나물들은 서로 조화를 잘 이루고 있다. 고추장은 3분의 2만 넣었다. 조금 싱거운 듯한 게 좋다. 나물의 양이 밥보다 두 배는 돼 보인다. 그래도 맛있는 걸 어쩌나. 어느 새 양푼을 끌어안고 비빔밥을 입에 퍼 넣는 내 모습을 본다. 믿거나 말거나 나는 역시 고기보다 나물, 즉 채식이 체질이다.



아내의 예언대로 기어이 '완양푼'했다. 깨끗이 비워냈다는 얘기다. 아침부터 운동을 빡세게 한 탓에 배가 많이 고팠던 때문이다. 하루 종일 배가 꺼지지 않았다. 이날의 식사는 이 한 끼로 끝났다. 당분간 비빔밥은 식사 메뉴에서 빼야겠다.



'밀푀유나베'를 실물로 영접한 것은 다음날 저녁이었다. 일본드라마에서 많이 보던 음식이라 기대가 크다. 밀푀유나베는 '1000겹의 잎사귀'라는 프랑스어 '밀푀유(mille feuille)'와 '냄비'를 뜻하는 일본어 '나베(なべ)'가 합쳐진 말이다.



번거로운 재료 손질은 테이스티나인이 전부 다 했다. 켜켜이 쌓인 배추와 깻잎, 고기를 냄비에 옮겨 담고, 육수를 부어서 끓이기만 하면 된다. 팽이버섯과 표고버섯, 청경채도 들어 있다. 처음 봤을 때는 양이 적은 줄 알았는데 냄비가 가득찬다.



첫 인상이 강렬하지는 않다. 멸치육수를 먼저 맛본다. 살짝 싱거운 듯하지만 초깔끔하다. 잔치국수가 생각난다. 이번에는 배추, 깻잎, 고기를 한 입에 담는다. 나쁘지 않다. 그렇다고 존맛탱이라기엔 5% 부족하다. 샤브샤브와 뭐가 다른지 모르겠다. '고기가 조금 더 부드러웠으면' 하는 아쉬움이 남는다. 소스 없이도 충분히 먹을 만하다고 생각했으나 얼마 지나지 않아 김치를 꺼냈다. 탁월한 선택이다. 역시 한국사람 곁애는 김치가 있어야 한다.



건더기를 다 먹은 후에는 죽이다. 육수를 적당히 남겨서 밥과 잘게 썬 김치, 양파를 넣고 눌어붙지 않도록 한참을 젓는다. 팔이 아플 만큼 열심히 저어야 맛이 배가 된다. 마지막으로 계란과 참기름, 김가루를 투하하면 완성이다. 역시 이 맛이다. 밀푀유나베를 빛나게 만든다. 아내도, 나도 그릇에 코를 박는다."
2021-07-08 김덕준,백년가게 ‘밀키트’ 공영쇼핑서 2시간만에 2억원 판매,"백년가게인 경부 영주의 풍기삼계탕에서 밀키트로 판매한 풍기삼계탕. 중기부 제공



중소벤처기업부에서 선정하는 백년가게 중에서 밀키트를 만드는 가게가 TV홈쇼핑을 통해 큰 인기를 끌었다.

중기부는 공영쇼핑에서 판매하는 백년가게 밀키트가 판매 2회 2시간 만에 2억원의 매출을 올렸다고 8일 밝혔다. 풍기삼계탕은 28일 오후 방송됐는데 한시간 동안 2822세트, 1억 1800만원 어치를 판매했고 7월 7일 우거지추어탕은 2431세트 1억 1900만원 어치가 판매됐다.

풍기삼계탕은 경부 영주에 있는 백년가게로 풍기인삼만을 사용하고 국내산 닭을 활용해 부드러운 육질이 일품이다. 우거지추어탕은 경기도 수원에 있는 민물추어탕에서 만든 것으로, 생미꾸라지와 15가지 채소 등을 넣어 시원한 육수가 특징이다.

공영쇼핑에서 동행세일 행사를 맞아 주문금액의 10% 할인 혜택을 제공하고, 백년가게 고유의 맛을 간편한 밀키트로 제품화해 여름에 맞는 보양식을 판매한 것. 이같은 판매 성과는 방송시간을 주요 고객인 주부들의 시청률이 높은 시간대로 선정한 것이 성공 요인이다.

아울러 중기부에서는 동행세일 행사 기간 분위기 확산을 위해 동행세일 기간 중 백년가게·백년소공인 대국민 방문·구매 인증샷 이벤트를 추진하고 있다.

이번 이벤트는 지역별 맛집 정보를 제공하는 식신 앱에서 참여할 수 있으며 추첨을 통해 경품도 지급할 예정이다.

오는 28일 당첨자를 발표하며 경품은 에어팟프로 1명, 5만원 주유권 10명, 치킨교환권 20명, 커피교환권 90명 등이다.

백년가게는 중기부에서 업력 30년이 넘은 전국의 소상공인을 발굴해 100년 이상 지속가능하도록 지원하는 사업으로, 지역상권을 살리는 핵심 점포로서 역할을 다할 수 있도록 온라인 판로지원, 시설개선 등 적극적인 정책지원이 이뤄지고 있다. 현재 812개가 선정됐다.

백년가게를 대상으로 밀키트 지원을 통해 ‘화정떡갈비’(광주), ‘왕갈비찜’(안성) 등 현재 11종을 개발해 시판하고 있으며 연내 10여 종을 추가 출시할 예정이다."
2021-07-08 김아름,"신세계TV쇼핑, 전국 맛집 RMR 만든다…‘미싱 더 시티’ 프로젝트","[디지털타임스 김아름 기자] 신세계TV쇼핑이 전국 맛집 메뉴를 간편식으로 개발해 판매하는 '미싱 더 시티(Missing the City)'프로젝트를 론칭한다.



신세계TV쇼핑은 최근 RMR(레스토랑 간편식)시장의 급격한 성장세에 발맞춰 단독 상품을 통해 고객 락인 효과를 이끌어내고자 RMR 판매를 시작한다고 8일 밝혔다.



신세계TV쇼핑은 이번 '미싱 더 시티' 프로젝트의 진행을 위해 밀키트 개발 전문기업 프레시지와 손잡았다. 상품의 기획과 개발을 신세계TV쇼핑과 프레시지가 공동으로 진행하고, 제조 전문성을 갖춘 프레시지가 생산한 제품을 신세계TV쇼핑이 방송 및 온라인몰을 통해 판매한다.



신세계TV쇼핑은 여름 휴가 시즌에 맞춰 '미싱 더 시티 제주편'을 시작으로 부산, 강원도 등 지역의 유명한 맛집 메뉴를 간편식으로 개발한 상품을 하반기 내 선보일 계획이다.



신세계TV쇼핑은 전국 맛집 간편식(RMR) 상품 개발을 위해 작년 하반기부터 전담팀을 구성하고 8개월 여의 기간 동안 공을 들였다. 직접 후보 지역을 방문해 발품을 팔며, 건강한 식재료를 사용하는 지역 대표 맛집들을 선정했다. 프레시지와 함께 해당 가게와 계약을 맺고 조리 비법을 그대로 담아 상품화했으며, 각각의 제품 특성에 맞는 공정, 포장, 유통 과정을 거쳐 소비자에게 최선의 상품이 전달될 수 있도록 했다.



신세계TV쇼핑은 오는 7월 중 '제주 넉둥베기 접작뼈국'을 신세계TV쇼핑 방송을 통해 출시한다. 접작뼈국은 제주식 전통 곰탕을 이르는 말이다. 제주시 용두암 근처의 접작뼈국 전문점 '넉둥베기'는 진하고 담백한 육수와 그릇 가득 채워 나오는 양 많은 고기로 유명한 맛집이다.



신세계TV쇼핑에서 판매하는 '제주 넉둥베기 접작뼈국'은 식당과 동일한 조리법을 그대로 구현해 맛을 냈다. 신세계TV쇼핑에서만 단독으로 판매한다.



강성준 신세계TV쇼핑 라이프스타일담당 상무는""상품을 단순히 소개하고 판매하는 유통사가 아닌 고객 관점을 기반으로 상품을 기획하고 선보일 것""이라며 ""단독 상품을 바탕으로 고객의 만족과 즐거움을 최우선으로 삼는 신세계TV쇼핑이 되겠다""고 말했다.



김아름기자 armijjang@dt.co.kr"
