Date,Title,Content
2019-08-30 이택현 기자,한가위 보름달 같은 사랑·정성 가득하면 굿∼,"불경기로 소비 꽁꽁 얼어붙었지만 커피·건강식품 등 초저가 상품 인기
추석을 앞두고 소비가 꽁꽁 얼어붙었다. 한국은행이 지난 27일 발표한 8월 소비자 동향조사에 따르면 소비자심리지수는 2년 7개월 만에 최저치로 떨어졌다. 올 초만 해도 온갖 부정적인 경제 전망에도 민간소비는 건실했다. 그런데 일본 수출규제와 수출부진 등 악재가 겹치면서 지난 5월부터 소비도 급격히 위축되고 있다.

매년 기업들의 숨통을 트여줬던 추석 특수마저 실종될지 모른다는 우려가 나온다. 특히 추석 연휴 매출이 일년 사업을 좌우하는 일부 생필품 업계에는 비상이 걸렸다. 추석이 예년보다 이르고 연휴도 짧아 불안감이 더하다. 한국 경제에는 자칫 그 어느 때보다 우울한 추석이 될 수도 있다.

다행히 지난달부터 일찌감치 시작된 추석 선물세트 예약판매 매출 실적이 나쁘지 않다. 매년 예약 판매 비중이 늘고 있다는 점을 고려해도 일단 선방했다는 평가다. 제조업체와 유통업체들은 한여름인 7월 말부터 이른 추석에 어울리는 선물세트를 출시하고 열심히 홍보 활동을 벌여왔다.

한우, 굴비, 과일 등 전통적인 고급 선물세트들이 여전히 잘 팔렸다. 특히 대형마트에서는 한우 선물세트가 급신장했다. 한우와 함께 추석 선물세트의 스테디셀러인 프리미엄 굴비 세트도 여전히 잘 나간다.

불경기를 반영하듯 초저가 상품도 인기를 끌고 있다. 최근 몇 년 사이 10만원 이하 선물세트 판매가 급격히 늘고 있다. 온라인전용 선물세트 중에는 3만원이 채 안 되는 상품도 많다. 초고가와 초저가 상품이 동시에 인기를 끄는 업계 동향이 추석 선물세트 시장에도 적용되는 것이다.

단순히 가격을 낮춘 게 아니라 실용성 있는 선물세트가 늘어난 점도 눈에 띈다. 커피, 건강식품은 물론 밀키트까지 추석 선물세트로 출시됐다. 과거 쉽게 선택하기 어려웠던 만원 미만 음료 선물세트라도 가격 대비 성능만 따라준다면 주저 없이 구매한다.

가치 소비도 늘었다. 유통업계는 최근 앞 다투어 추석 선물세트 ‘친환경 포장’을 과시했다. 과대포장된 선물세트를 보면 겉치레에 만족감을 느끼기보다 환경을 더 걱정하는 소비자들을 염두에 둔 것이다.

이택현 기자 alley@kmib.co.kr"
2019-08-29 김윤정,‘혈중 마라 농도’ 채우기는 밖에서만? ‘집마라’ 즐기는 2030,"최근 젊은층을 중심으로 ‘마라’ 열풍이 불고 있다. 마라는 매운 맛을 내는 중국 사천지방 향신료로, 혀가 아리고 얼얼할 정도로 매운 맛이 특징이다. ‘밖에서 먹는다’는 인식이 강한 음식 마라. 정말 마라 맛은 밖에서만 즐길 수 있을까.
‘혈중 마라 농도(혈중 알코올 농도에 빗댄 마라 관련 신조어)’는 멀리서만 채울 수 있는 것이 아니다. 마라의 인기에 힘입어 집에서도 간편하게 마라 맛을 즐길 수 있는 제품들이 속속 등장했기 때문이다.

먼저 편의점에서 다양한 마라 요리를 만나볼 수 있다. CU에서는 마라탕면, 마라볶음면, 마라만두, 마라새우 등 다양한 마라 관련 상품을 출시했다 특히 지난 3월 출시한 마라족발은 출시 한 달 반 만에 냉장 안주 부문에서 매출 1위를 달성할 만큼 인기를 끌었다. 세븐일레븐도 마라핫치킨도시락, 마라볶음삼각김밥 등을 선보였고, GS25는 대만의 만한대찬마라우육면 제품을 직수입해 판매 중이다.
배달음식도 빼놓을 수 없다. 많은 마라 음식들이 배달음식 주문 서비스에 진출했다. 치킨에도 마라 맛이 찾아왔다. 지난 4월 출시된 bhc의 마라칸치킨은 출시 한 달 만에 판매량 15만 개를 돌파해 마라와 치킨의 인기 조합을 증명했다. BBQ는 마라핫치킨, 굽네치킨은 마라볼케이노 등을 내놓았다. 돈치킨은 20일 매운 맛과 달콤한 맛을 더한 이경규치킨(허니마라치킨)을 선보이기도 했다.
이런 흐름에 맞춰 집에서 간편하게 마라 맛을 즐기는 젊은층도 늘고 있다. 편의점에서 혈중 마라 농도를 채운다는 대학생 배진솔(24)씨는 “집 근처에 마라 음식점이 없어 버스나 지하철을 타고 나가야 한다”며 “하지만 편의점은 가까이에 여러 곳이 있으니 마라 관련 제품을 바로 사먹을 수 있어 좋다”고 말했다. 회사원 박주현(27)씨는 집 밖으로 나가지 않고 마라를 즐긴다. 박씨는 “요즘엔 배달 앱에서도 마라 음식을 손 쉽게 찾을 수 있어 행복하다”며 “오늘도 집에서 마라 맛을 즐길 예정”이라고 말했다.

마라 음식을 집에서 만들어 먹는 사람들도 등장했다. 비교적 간단하게 요리할 수 있는 ‘밀키트(Meal kitㆍ반제품 형태의 요리)’를 이용하는 경우가 많다. 실제로 쇼핑몰 GS프레쉬에선 지난 초복 밀키트 브랜드인 심플리쿡 사천식마라훠궈, 해물마라짬뽕이 판매 1, 2위를 차지하기도 했다. 밀키트 전문 쇼핑몰 프레시지에서는 28일 기준 마라샹궈와 마라탕이 각각 베스트메뉴 1, 2위를 차지하며 꾸준히 인기를 얻고 있다.
젊은층은 밀키트의 도움 없이 마라 음식을 직접 만들어 먹기도 한다. 회사원 신민희(28)씨는 재료를 직접 사 마라 음식을 요리해 먹는다. 음식점마다 맛이 달라 자신의 입맛에 맞는 마라 음식점을 찾기 어려웠다는 게 이유였다. 재료를 사서 직접 마라 음식에 도전해보니, 입맛 취향에 맞춰 만들어 먹는 게 훨씬 맛있었다고 한다. 신씨는 “요즘 마라 음식점 위생과 관련해 논란이 많은데 직접 식재료를 사서 만들어 먹으면 안전한 기분이 든다. 마라 음식이 입에 맞지 않아서 먹지 못했던 사람들도 입맛에 맞춰 먹을 수 있을 것”이라고 말했다.
김선영 요리연구가는 “예전에는 집에서 해외 음식을 요리할 때 해외 재료나 향신료 등을 살 수 없었기 때문에 대체할 수 있는 제품으로 비슷한 맛을 내는 게 고작이었다”며 “그러나 수입이 다변화된 요즘에는 국내 대형마트만 가도 마라와 같은 해외 향신료를 구할 수 있어 보다 쉽게 요리가 가능하고 더 열광하는 것 같다”고 말했다.

김윤정 인턴기자 digital@hankookilbo.com"
2019-08-29 임홍조|기자,"한국야쿠르트, 50주년 기념 콕콕 이벤트 실시","[머니투데이 대학경제 임홍조 기자] 한국야쿠르트는 창립 50주년을 기념해 지난 5월 실시한 '황금 코코 찾기' 이벤트에 이어 '황금 코코 찾기 2탄' 이벤트를 진행한다고 29일 밝혔다.

이번 이벤트는 응모권을 획득해 원하는 경품에 응모하면, 개별 경품 응모자 중 경품을 추첨하는 방식의 콕콕 이벤트다.

응모권 획득 방법에는 여러 가지가 있다. 매일매일 hyfresh 홈페이지 방문 시 응모권 1개를 증정하고, 온라인 hyfresh 몰에서 상품 구매 시 최대 3개 응모권을 증정한다.

또한 지난 황금 코코 찾기 이벤트 참여 고객에게는 '인증하기'를 통해 응모권 10개를 증정하며, 총 10가지 경품 중 자신이 원하는 경품에 응모할 수 있다.

응모기간은 내달 6일까지며, 경품으로 순금 1돈과 액션캠, 에어팟, 모바일 상품권, 왕뚜껑, 콜드브루 등을 지급한다. 당첨자는 내달 18일 한국야쿠르트 공식 온라인몰 하이프레시를 통해 공지한다.

'코코'는 영어 'Cold'와 'Cool'의 합성어로, 세계 최초 이동형 냉장카트다. 냉장카트이기 때문에 발효유 외에도 콜드브루, 밀키트 등 다양한 제품을 신선한 상태로 보관, '프레시 매니저(전 야쿠르트 아줌마)'가 안전하게 배달한다.

변경구 한국야쿠르트 마케팅 상무는 ""콕콕 이벤트는 '황금 코코 찾기' 이벤트를 통해 보낸 고객의 성원에 감사하며, 고객 참여 이벤트를 추가로 기획했다""며 ""온라인몰 하이프레시을 통해 고객이 쉽게 건강한 한국야쿠르트 제품을 경험할 수 있도록 더욱 노력하겠다""고 말했다."
2019-08-29 김현주,"올 상반기 식품업계, ‘가정간편식(HMR)’이 多~했다!","상반기 식품 산업에서는 가정간편식(HMR), 육류가공품이 사료 및 조제식품과 함께 시장 성장을 견인한 것으로 나타났다. 특히 급성장하고 있는 가정간편식 시장의 성장이 두드러졌다.

29일 식품의약품안전처의 ‘2018년 국내 식품생산실적 통계’에 따르면 식품 유형 중 즉석조리?편의식품이 지난해 급성장 한 것으로 나타났다. 가정간편식으로 팔리는 즉석조리?편의식품 생산실적은 2018년 3조40억원으로 전년과 비교해 13.7% 증가했다. 2016년 14.3%, 2017년 22.6% 등으로 성장률이 꾸준히 증가하고 있다. 업계는 올해 가정간편식(HMR) 시장 규모가 4조원에 육박할 것으로 전망하고 있다.

한국농촌경제연구원이 ‘국내 식품제조업과 업종별 동향, 교역 동향’을 분석한 결과에 따르면, 2019년 1~5월 식품제조업의 육류가공업은 출하량이 7.9% 증가했으며 이러한 증가는 가정간편식 시장의 성장이 주 요인이라고 분석했다. 또한 기타식품 제조업의 출하액 역시 전년대비 2.6% 증가했으며, 기타식품 중 가정간편식의 출하액이 크게 증가한 것으로 분석했다.

가정간편식의 수요가 증가하는 주요 원인으로는 ‘편의성’, ‘시간 단축’, ‘가성비’를 꼽는다. 1인 가구의 증가로 사람들이 보다 손쉽고 간편한 요리를 선호하고, ‘소확행’, ’홈파티’ 등의 문화가 확산되면서 외식보다는 집에서 근사한 요리를 빠르게 만들어 먹는 것을 즐기는 사람이 늘면서 가정간편식이 주목받기 시작했다. 뿐만 아니라 정량의 재료로 포장되어 있어 잔반 걱정 없이 경제적이라는 이유로 많은 사람들이 찾고 있다.

롯데멤버스가 지난 3월 20~60대 남녀 총 4900명 대상으로 실시한 조사에 따르면, 10명 중 8명 이상인 82.7%이 가정간편식을 이용해봤다고 응답했다. ‘식사 준비가 쉽고 빨라서 구입한다’는 비율이 응답자의 68%를 웃돌았다. 직접 재료를 사서 이용하는 것보다 저렴하기 때문에 가정간편식을 이용한다는 응답도 37.4%에 달했다.

가정간편식의 수요가 급증하자 대형 유통업체를 비롯해 대형마트와 주요 육류가공업체 등에서 가정간편식 브랜드를 만들어 경쟁에 박차를 가하고 있다. 신세계푸드의 가정간편식인 ‘올반 삼계탕’은 지난 5월부터 두 달 동안 6만5000개가 팔렸다. 이는 지난해 같은 기간 2만8000개가 판매된 것에 비해 132% 증가한 수준이다.

요리연구가 빅마마가 자신만의 육수 비법을 담아 자신 있게 내놓은 가정간편보양식인 ‘이혜정의 일품 소한마리탕’도 작년 NS홈쇼핑에서 판매를 시작한 이래 60만 개 이상이 팔리는 등 지속적인 인기를 얻고 있다. ‘이혜정의 일품 소한마리탕’은 체계적인 관리 시스템을 통해 안전하게 생산된 우수한 품질의 북미산 프리미엄 소고기 브랜드 ‘엑셀비프(Excel®)’의 갈비와 빅마마 이혜정만의 비법 육수로 맛과 영양을 모두 잡았다. ‘엑셀 비프(Excel®)’는 국내 미국산 소고기 시장 점유율의 37%를 차지할 정도로(2018년 5월 미국 PIERS 리포트 기준) 한국에서 위상을 굳건히 하고 있는 고품질 소고기 브랜드다.

식품업계는 이러한 인기에 따라 다양한 콜라보레이션을 통한 가정간편식을 출시해 소비자의 마음을 사로 잡고 잡기 위한 마케팅에 열을 올리고 있다. HMR 가정간편식 전문기업 ㈜프레시지는 최근 tvN 인기 예능 프로그램인 ‘삼시세끼 산촌편’과 콜라보한 ‘구수한 버섯 된장찌개’와 ‘돼지고기 고추장찌개’ 밀키트를 론칭했다. 방송에서 출연진이 직접 요리한 레시피를 구현한 가정 간편식으로 다른 가정간편식과 차별화를 시도했다.

떡볶이 브랜드 죠스떡볶이는 11번가와 콜라보레이션한 신제품 '매워죠스'와 '마라죠스' 세트를 출시해 5000개 한정 판매한다. 수요가 증가하고 있는 가정간편식에 외식업계에 불고있는 매운 맛과 마라 맛 열풍을 반영했다. 이번 신제품은 기존 죠스떡볶이보다 11배 매운 매워죠스 3개와 특제 마라소스로 풍미를 더한 마라죠스 3개, 스틱형 분말 음료 '죠스쿨' 12개, 죠스 캐릭터 모양의 액세서리 '죠스키링' 등으로 구성됐다.

업계 관계자는 “1인 가구의 증가와 편의성을 중시하는 소비자 특성이 뚜렷하게 나타남에 따라 가정간편식 시장은 계속 성장할 것으로 보인다”며 “대기업을 비롯한 식품업계의 가정간편식 경쟁도 더욱 치열해지면서 보다 다양한 제품들이 출시 될 것으로 예상된다”고 말했다.

김현주 기자 hjk@segye.com"
"2019-08-29 조윤희,김민석 기자",[시그널] 투자자 사로잡은 밀키트시장...프레시지 또 500억 투자유치,"소프트뱅크벤처 등 국내 VC서
[편집자註] 이 기사는 2019년 8월 28일 11:18 프리미엄 컨버전스 미디어  '시그널(Signal)' 에 표출된 기사입니다.

가정 간편식(HMR, Home Meal Replacement) 전문기업 프레시지가 국내 주요 벤처캐피탈(VC)로부터 또 한 번 투자를 받는다. 프레시지는 창업 3년 만에 누적 투자금 1,000억원을 확보해 빠르게 확장하는 모습을 보이고 있다.

28일 투자은행(IB) 업계에 따르면 국내 1위 밀키트 업체 프레시지는 최근 국내 VC업계를 대상으로 500억원 규모 신규 투자 유치 작업을 진행하고 있다.



소프트뱅크벤처가 100억~150억원의 투자를 검토하고 있고 SBI인베스트먼트·나우아이비캐피탈·유니온투자파트너스 등 다른 VC들도 투자 금액을 막판 조율하고 있는 것으로 전해졌다. 투자유치는 오는 10월까지는 마무리될 것이라는 게 해당 업계의 전망이다.

당초 500억원의 자금 유치를 목표로 투자자를 모집한 프레시지는 시장의 반응이 뜨거워 100억원 가량 증액해 발행하는 방향도 검토하고 있다.

회사는 이미 올 상반기, 두 차례에 걸쳐 대규모 투자금을 유치한 바 있다. 지난 2월 하나금융투자 프라이빗에쿼티(PE)로부터 260억원을 조달했고 3월엔 GS홈쇼핑으로부터 40억원을 투자받기도 했다. 6개월 만에 역대 최대 규모 펀딩에 나서면서 시장에서 인기를 증명했다. 이번 투자까지 성사되면 2016년 설립 이후 3년만에 누적 투자 유치금은 1,000억원에 이른다.

투자자들은 가파른 성장세를 보이는 밀키트 시장에 주목하고 있다. 식품업계에 따르면 국내 밀키트 시장 규모는 지난해 200억원에서 올해 400억원으로 성장했다. 5년 안에 7,000억원 규모에 이를 것이라는 긍정적인 전망이 이어지는 가운데 신세계와 한국야쿠르트, GS와 같은 대기업들도 사업에 뛰어들고 있다.

새로운 투자자를 유치하면 프레시지의 외형은 빠르게 확장할 것으로 보인다. 프레시지는 받은 투자금 대부분을 공장 증설 등 설비 작업에 쓰이고 있다. 지난 3월부터 약 450억원을 들여 용인시 처인구에 제2공장을 세운다. 인천시 남동구에 위치한 제1공장보다 부지면적은 약 6배, 연면적은 8배 이상 확장된 규모다. 프레시지는 한편 ‘밀푀유 나베’, ‘시그니처 스테이크 세트’, ‘자이언트 부대찌개’ 등 50여 개 제품이 현재 국내 주요 온라인몰과 오프라인에서 판매하고 있다. 올해 예상 매출액은 1,200억원으로 국내 밀키트 시장 추정치(1,700억원)의 70%를 차지한다."
2019-08-28 이한빛,"김병원 농협 회장, 안성농식품물류센터 방문","김병원 농협중앙회 회장은 지난 27일 충남 예산 사과산지와 안성 농협농식품물류센터를 방문하며 현장경영에 나섰다.

김 회장은 이날 오전 사과 주산지인 충남 예산의 과수 농가를 방문해 출하상황을 살피고, 산지유통센터(APC)를 찾았다.

이어 농협안성농식품물류센터를 찾아 사과ㆍ배 등 농산물 선물세트 준비상황을 살피고 소포장ㆍ전처리 시설을 돌며 직원들을 격려했다.

안성농식품물류센터는 전국 각지에서 출하되는 농산물을 수도권 주요 판매장으로 공급하는 국내 최대 농식품물류센터로, 농산물 선물세트는 물론 한식차례세트 등의 밀키트, 다양한 제철 과일 꾸러미 상품의 공급에 집중하고 있다.

김병원 회장은 ""이른 추석을 앞두고 농산물을 안정적으로 공급하는 것이 매우 중요하다""면서 ""추석 연휴 더욱 안전하고 신선한 농산물을 소비자에게 공급할 수 있도록 품질관리에 만전을 기해 달라""고 당부했다."
"2019-08-28 조윤희,김민석 기자",[시그널] 투자자 사로잡은 밀키트시장...프레시지 또 500억 투자유치,"소프트뱅크벤처 등 국내 VC서
[편집자註] 이 기사는 2019년 8월 28일 11:18 프리미엄 컨버전스 미디어  '시그널(Signal)' 에 표출된 기사입니다.

가정 간편식(HMR, Home Meal Replacement) 전문기업 프레시지가 국내 주요 벤처캐피탈(VC)로부터 또 한 번 투자를 받는다. 프레시지는 창업 3년 만에 누적 투자금 1,000억원을 확보해 빠르게 확장하는 모습을 보이고 있다.

28일 투자은행(IB) 업계에 따르면 국내 1위 밀키트 업체 프레시지는 최근 국내 VC업계를 대상으로 500억원 규모 신규 투자 유치 작업을 진행하고 있다.

소프트뱅크벤처가 100억~150억원의 투자를 검토하고 있고 SBI인베스트먼트·나우아이비캐피탈·유니온투자파트너스 등 다른 VC들도 투자 금액을 막판 조율하고 있는 것으로 전해졌다. 투자유치는 오는 10월까지는 마무리될 것이라는 게 해당 업계의 전망이다.

당초 500억원의 자금 유치를 목표로 투자자를 모집한 프레시지는 시장의 반응이 뜨거워 100억원 가량 증액해 발행하는 방향도 검토하고 있다.

회사는 이미 올 상반기, 두 차례에 걸쳐 대규모 투자금을 유치한 바 있다. 지난 2월 하나금융투자 프라이빗에쿼티(PE)로부터 260억원을 조달했고 3월엔 GS홈쇼핑으로부터 40억원을 투자받기도 했다. 6개월 만에 역대 최대 규모 펀딩에 나서면서 시장에서 인기를 증명했다. 이번 투자까지 성사되면 2016년 설립 이후 3년만에 누적 투자 유치금은 1,000억원에 이른다.

투자자들은 가파른 성장세를 보이는 밀키트 시장에 주목하고 있다. 식품업계에 따르면 국내 밀키트 시장 규모는 지난해 200억원에서 올해 400억원으로 성장했다. 5년 안에 7,000억원 규모에 이를 것이라는 긍정적인 전망이 이어지는 가운데 신세계와 한국야쿠르트, GS와 같은 대기업들도 사업에 뛰어들고 있다.

새로운 투자자를 유치하면 프레시지의 외형은 빠르게 확장할 것으로 보인다. 프레시지는 받은 투자금 대부분을 공장 증설 등 설비 작업에 쓰이고 있다. 지난 3월부터 약 450억원을 들여 용인시 처인구에 제2공장을 세운다. 인천시 남동구에 위치한 제1공장보다 부지면적은 약 6배, 연면적은 8배 이상 확장된 규모다. 프레시지는 한편 ‘밀푀유 나베’, ‘시그니처 스테이크 세트’, ‘자이언트 부대찌개’ 등 50여 개 제품이 현재 국내 주요 온라인몰과 오프라인에서 판매하고 있다. 올해 예상 매출액은 1,200억원으로 국내 밀키트 시장 추정치(1,700억원)의 70%를 차지한다."
