Date,Title,Content
2019-02-21 안효주(joo@hankyung.com);,故 허만정 창업주 뜻 이어…GS리테일 '역사 알리기' 캠페인,"주요 상품에 女독립운동가 스티커
창업주가 독립운동 후원금 지원한 상하이 임시정부 방문 행사 마련


[ 안효주 기자 ] GS리테일이 고(故) 허만정 GS그룹 창업주(사진)의 애국정신을 이어받아 3·1운동 및 임시정부 수립 100주념을 기념해 역사 알리기 캠페인에 나선다.

허만정 선생은 허연수 GS리테일 대표의 할아버지로, 고 구인회 LG 창업주와 함께 LG그룹을 공동 창업한 인물이다. 그는 1914년 상하이 임시정부에 독립운동을 지원하는 비밀자금 조달기관이었던 백산상회 설립에 참여하는 등 상하이 임시정부에 후원금을 지원했다.

또 독립을 위해서는 민족 교육이 먼저 바로 서야 한다는 신념으로 1925년 진주여고의 전신인 진주일신여자고등보통학교를 설립했다.

GS리테일은 GS25를 비롯해 GS수퍼마켓, 랄라블라 등 전국 1만3500여 개 오프라인 매장에서 연말까지 캠페인을 이어갈 계획이다. GS25는 도시락 전 상품 20종에 여성 독립운동가 51인을 알리는 스티커를 붙인다. 독립운동에 생애를 바쳤지만 상대적으로 잘 알려지지 않은 독립운동가를 알린다는 취지에서다.

GS수퍼마켓과 GS리테일의 밀키트 브랜드 심플리쿡도 주요 상품에 여성 독립운동가 스티커를 부착한다. 해당 상품 판매수익 일부를 독립운동가 후손들에게 전달할 계획이다.

GS리테일은 멤버십 회원 가입 시 증정하는 멤버십 카드 3종도 역사 알리기를 주제로 4월부터 새롭게 선보인다. 각각 임시정부 주요 인사들의 단체 사진과 국군 장병 사진, 무궁화 디자인을 담는다.

또 임시정부 100주년을 기념해 2박3일 일정으로 중국 상하이의 임시정부 유적지 견학 행사도 마련한다. 다음달 15일부터 한 달 동안 GS25, GS수퍼마켓 등 GS리테일의 주요 유통 브랜드별 공식 소셜네트워크서비스(SNS) 계정을 통해 ‘나라 사랑’과 관련된 주제로 콘텐츠를 제출하면 된다. 우수 콘텐츠를 게시한 100명을 선발해 5월 중 GS리테일 임직원들과 함께 상하이를 방문할 예정이다.

GS리테일 관계자는 “올 한 해는 역사 알리기에 앞장서며 국민이 지킨 역사와 국민이 이끌 나라의 소중한 가치를 일깨우는 데 함께 실천해 가고자 한다”고 말했다.

안효주 기자 joo@hankyung.com"
2019-02-21 곽재민(kwak.jaemin@joongang.co.kr),“창업주 허만정 정신 잇는다”…3.1운동 알리기 나선 GS리테일,"편의점에서 판매하는 도시락에 유관순 열사 등 여성 독립운동가 51인의 이름과 공적이 담긴 스티커가 붙는다.

GS리테일은 국가보훈처와 함께 3ㆍ1운동과 임시정부 수립 100주년을 맞아 ‘국민이 지킨 역사, 국민이 이끌 나라’라는 테마로 역사 알리기 사업을 진행한다고 21일 밝혔다.

먼저 GS리테일이 운영하는 편의점 GS25는 여성 독립운동가 51인의 스티커를 제작해 현재 판매 중인 도시락 20종에 부착하기로 했다. 여성 독립운동가 51명은 독립을 위해 생애를 바쳤음에도 상대적으로 잘 알려지지 않아 이들을 기억하자는 취지에서 기획됐다. GS수퍼마켓과 GS리테일의 밀키트(Meal Kit) 브랜드인 심플리쿡에도 각각 조리 식품과 밀키트 상품에 여성 독립운동가 알리기 스티커가 부착된다.

GS리테일은 이번 캠페인을 일회성이 아닌 매달 다양한 주제로 지속해서 이어나간다는 계획이다.

이를 위해 편의점 GS25와 GS수퍼마켓, 랄라블라, GS프레시와 같은 오프라인 점포를 비롯해 공식 SNS 채널 등 하루 700만명이 이용하는 GS리테일의 모든 온ㆍ오프라인 채널을 총동원한다.

임시정부 100주년을 맞는 오는 4월 11일에는 고객 100명과 임직원 10명이 함께 임시 정부 인사의 주요 발자취를 따라가는 일정의 상하이 임시 정부 견학도 추진 중이다. 또 크라우드 펀딩을 통해 모금액을 독립운동가 후손에게 전달한다는 계획도 있다.

GS리테일이 독립운동 역사 알리기에 적극적으로 나서는 것은 창업자 정신을 이어받지는 취지다. GS그룹의 창업주인 허만정 선생은 100여 년 전 백산상회 설립에 참여했고, 이를 통해 상하이 임시정부의 독립운동 후원금 마련에 힘을 보탰다.

GS리테일의 이용우 대외협력부문장은 “올해가 3ㆍ1운동과 임시정부 수립 100주년을 맞는 뜻깊은 해인 만큼 GS25가 중심이 돼 다양한 활동을 국가 보훈처와 연중 지속할 예정”이라며 “GS리테일의 1만 3500여 플랫폼이 올 한 해는 역사 알리기에 앞장서며 국민이 지킨 역사의 소중한 가치를 일깨우는 데 힘쓰겠다”고 했다.

곽재민 기자 jmkwak@joongang.co.kr"
2019-02-21 박진영|기자|,GS25에 가면 '독립운동가' 안내 방송이…,"[머니투데이 박진영 기자] [독립운동가 정보 도시락 제품에 스티커로…매장 내 방송, 동영상 제작도 진행 ]

GS리테일이 3·1운동과 임시정부 수립 100주년을 맞아 우리나라 독립운동 역사알리기에 적극 나선다.

GS리테일은 전국의 1만3500여 오프라인 매장을 통해 '국민이 지킨 역사, 국민이 이끌 나라'를 핵심 테마로 국가보훈처의 역사알리기 사업을 돕는다고 21일 밝혔다.

보훈처와 함께 하는 GS리테일의 역사 알리기 활동은 연중 다양한 월별 테마를 가지고 지속된다. 또 편의점 GS25, GS수퍼마켓, 랄라블라, GS프레시, 각종 공식 SNS 채널 등 하루 700만명이 이용하는 GS리테일의 모든 온·오프라인 고객 접점 채널이 총동원된다.

먼저 편의점 GS25는 여성 독립운동가 51인의 스티커를 제작해 도시락 전상품 20종에 부착하기로 했다. 우리나라 독립을 위해 생애를 바쳤지만 상대적으로 잘 알려지지 않은 자랑스런 여성 독립 운동가 51명을 기억하자는 취지에서 기획됐다. 이 캠페인은 이달 22일부터 3·1절이 있는 3월 말까지 이어진다.

GS수퍼마켓과 GS리테일의 밀키트 브랜드인 '심플리쿡'에도 각각 조리 식품과 밀키트 상품에 여성 독립운동가 알리기 스티커를 부착한다.

또 여성 독립운동가를 알리는 동영상도 제작해 지하철 3호선·9호선, GSTV와 주요 공식 SNS 채널에 선보이고 GS25, GS수퍼마켓, 랄라블라 1만3500여 점포에서 올해말까지 '이 달의 독립운동가'를 소개하는 성우의 음성을 BGM(배경음악)으로 내보낼 예정이다.
고객 100명과 임직원 10명이 함께 임시 정부 인사들의 주요 발자취를 따라 가보는 2박3일 일정의 상하이 임시 정부 견학도 계획 중이다.

GS리테일은 3월 15일부터 한달 간 GS25, GS수퍼마켓, 랄라블라 등 주요 사업 별 SNS 공식 계정을 통해 고객이 스스로 애국을 실천하고 있는 방법을 간단한 동영상으로 제작하거나 독특한 방식으로 응모하면 100명을 선발해 10명의 GS리테일 임직원과 함께 5월24일부터 2박3일간의 일정으로 상해 임시정부 및 역사 유적지를 견학할 계획이다.

협력사와 함께 크라우드 펀딩을 조성해 독립 운동가 후손에게 기금을 전달할 계획도 세웠다. 고객이 특정 상품을 구매할 경우, GS리테일과 제조사는 발생하는 수익의 일부를 적립해 독립운동가 후손들을 후원하는 기관을 통해 기금을 전달할 예정이다. 현재 카페25(cafe25), 그랜드 야쿠르트 등 인기 있는 PB(자체브랜드) 제품을 포함한 다양한 상품에 대해 선정 작업을 진행하고 있다.

한편 GS그룹의 창업주인 허만정 선생은 100여년전 백산상회 설립에 참여했고 이를 통해 상해 임시정부의 독립운동 후원금을 마련하는 데에 힘썼다. 독립을 위해서는 민족 교육이 먼저 바로서야 한다는 신념으로 진주여고를 설립하는 등 배경이 있다.

GS리테일 관계자는 ""올해가 3·1운동과 임시정부 수립 100주년을 맞는 뜻깊은 해인만큼 의미 있는 활동들을 국가 보훈처와 함께 연중 지속 실시할 예정""이라며 ""GS리테일의 1만3500여 플랫폼을 활용해 국민이 지킨 역사와 국민이 이끌 나라의 소중한 가치를 일깨우고 싶다""고 말했다."
2019-02-21 이주현,"GS25, CU 편의점, 3・1운동 100주년 맞아 '애국 마케팅'","GS25와 CU 등 편의점 업계가 3・1운동과 임시정부 수립 100주년을 맞아 애국 마케팅에 나섰다.

GS리테일은 전국 1만3500여 소매점 오프라인 플랫폼을 통해 '국민이 지킨 역사, 국민이 이끌 나라'를 핵심 테마로 한 국가보훈처 역사 알리기 사업을 돕는다고 21일 밝혔다.

GS그룹 창업주인 허만정 선생은 100여년 전 백산상회 설립에 참여했고, 이를 통해 상해 임시정부 독립운동 후원금을 마련하는 데 힘썼다. 독립을 위해서는 민족 교육이 먼저 바로서야 한다는 신념으로 진주여고를 설립하기도 했다.

GS리테일은 3・1운동과 임시정부수립 100주년을 맞아 허만정 선생의 정신을 이어 애국의 사회 공헌을 대물림해 실천하고자 이번 보훈처의 역사 알리기 사업에 앞장서기로 했다. 이 외에도 GS리테일은 PB상품 판매와 프로모션 등을 통해 독도 및 위안부 피해자 기금 모음 활동도 해왔다.

보훈처와 함께 하는 GS리테일 역사 알리기 활동은 3・1절을 앞두고 일회성 캠페인에 그치는 것이 아니라 연중 다양한 월별 테마를 가지고 지속된다. 여성독립운동가, 대한민국임시정부기념일, 국내 독립 현충 시설 등 홍보를 민・관이 협력해 추진함으로 보훈을 매개로 한 국민 통합 계기를 마련하는 데에 뜻을 같이하고 있다.

이를 위해 GS리테일은 GS25, GS수퍼마켓, 랄라블라, GS프레시, 각종 공식 SNS 채널 등 하루 700만명이 이용하는 GS리테일 모든 온・오프라인 고객 접점 채널이 총동원된다.

GS25는 여성 독립운동가 51인 스티커를 제작해 현재 취급 중인 도시락 전상품 20종에 부착한다. GS수퍼마켓과 GS리테일의 밀키트 브랜드인 심플리쿡도 각각 조리 식품과 밀키트 상품에 여성 독립운동가 알리기 스티커를 부착해 전사 캠페인에 참여한다. GS리테일은 협력사와 함께 크라우드 펀딩을 조성해 독립 운동가 후손에게 기금을 전달할 계획이다.

GS리테일 관계자는 “토종 브랜드로 출발한 대한민국 대표 편의점 GS25가 중심이 돼 대한민국 역사 알리기 캠페인을 비롯한 다양한 의미 있는 활동들을 국가 보훈처와 함께 연중 지속 실시할 예정”이라며 “올 한해는 역사 알리기에 앞장 서 국민이 지킨 역사와 국민이 이끌 나라의 소중한 가치를 일깨우는데 함께 실천해 가고자 한다”라고 말했다.


CU를 운영하고 있는 BGF리테일은 독립기념관과 '독립운동사 대중화를 위한 업무협약'을 20일 체결하고 3월부터 '함께해요 3・1운동 100주년 캠페인'을 진행한다. CU 점포 내 각종 홍보 플랫폼을 통해 매월 독립기념관에서 제공하는 학술자료에 따라 올바른 독립운동 역사 등을 알리는 역할을 수행한다.

CU는 점포 내 안내게시판에 기존 상품 정보 대신 국가보훈처가 선정한 '2019 이달의 독립운동가' 포스터를 매월 게시한다. 3월 손병희 선생을 시작으로 12월 윤봉길 의사까지 365일 24시간 독립운동가 희생과 공훈을 널리 알릴 예정이다.

CU를 찾는 월 평균 방문객 수는 약 1억2000만명으로 BGF리테일은 이번 캠페인을 통해 전 국민이 최소 월 2회 이상 CU에서 직・간접적으로 독립운동 정보를 접할 수 있을 것으로 기대하고 있다.

뿐만 아니라 BGF리테일은 아동・청소년이 올바른 독립운동 역사에 대해 배울 수 있도록 독립기념관 교육사업부에 기부금을 전달해 관련 교육 프로그램 개발 및 운영을 도울 예정이다.

류왕선 BGF리테일 상품해외사업부문장은 “CU를 찾는 고객들이 3・1운동의 숭고한 의미를 다시금 되새기는 시간을 가질 수 있길 바란다”며 “BGF리테일의 전국 최대 오프라인 네트워크를 활용해 공익적 역할을 수행하는 데 앞장설 것”이라고 말했다.

이주현 유통 전문기자 jhjh13@etnews.com"
2019-02-21 박로명 기자,"GS리테일, 보훈처와 ‘역사 알리기’ 앞장","GS25·GS수퍼마켓·랄라블라 등
상품에 女독립운동가 스티커 부착

GS리테일 역사 알리기 캠페인 [GS리테일 제공]
GS리테일이 3ㆍ1절과 임시정부 수립 100주년을 맞아 독립운동 역사 알리기에 나선다.

GS리테일은 국가보훈처와 함께 ‘국민이 지킨 역사, 국민이 이끌 나라’를 테마로 역사 알리기 사업을 진행한다고 21일 밝혔다. 단순히 1회성 캠페인에 그치는 것이 아닌, 매달 다양한 주제로 지속적으로 이어간다는 것이 회사측 설명이다. 이를 위해 GS리테일이 운영하는 GS25ㆍGS수퍼마켓ㆍ랄라블라ㆍGS프레시 등 오프라인 점포를 비롯해 공식 사회관계망서비스(SNS) 채널까지, 하루 700만명이 이용하는 GS리테일의 모든 온ㆍ오프라인 채널을 총동원할 예정이다.

GS리테일 관계자는 “GS그룹의 창업주인 허만정 선생은 100여년 전 백산상회 설립에 참여해 상해 임시정부의 독립운동 후원금을 마련하는 데에 힘썼다”며 “GS리테일은 창업주 허만정의 정신을 이어 받아 애국의 사회 공헌을 대물림하여 실천하고자 이번 보훈처의 역사 알리기 사업에 앞장서기로 했다”고 밝혔다.

먼저 GS25는 여성 독립운동가 51인의 스티커를 제작해 현재 판매 중인 도시락 전상품 20종에 부착하기로 했다. 여성 독립 운동가 51명은 독립을 위해 생애를 바쳤음에도 상대적으로 잘 알려지지 않아 이들을 기억하자는 취지에서 기획했다.

GS수퍼마켓과 GS리테일의 밀키트 브랜드인 심플리쿡도 여성 독립운동가 알리기 캠페인에 동참한다.

박로명 기자/dodo@heraldcorp.com"
2019-02-21 박준호 기자,3·1운동...임정 100주년...태극기 휘날리는 유통가,"GS리테일, 국가보훈처와
올해로 3·1운동과 임시정부 수립 100주년을 맞아 유통업계에서도 애국심을 고취하는 마케팅 활동을 늘리고 있다. 이들은 정부기관과 공동으로 각종 캠페인을 벌이거나 수익 일부를 관련 사업에 기부하는 등 독립운동 역사 알리기에 나섰다.

GS리테일(007070)은 21일 국가보훈처와 공동으로 GS25·GS수퍼마켓·랄라블라 등 전국 1만3,500여 매장에서 ‘국민이 지킨 나라, 국민이 지킨 역사’를 주제로 한 캠페인을 벌인다고 밝혔다. 허만정 GS그룹 창업주가 100여년전 백산상회 설립에 참여해 상하이 임시정부의 후원금을 지원하는 등 독립운동에 기여한 역사에 착안해 이번 캠페인을 시작했다고 GS리테일은 전했다. 삼일절 맞이 일회성 캠페인이 아닌 여성독립운동가, 대한민국임시정부기념일, 국내 독립·현충 시설 등 연중 월별로 다양한 주제로 꾸준히 이어간다는 계획이다.

우선 편의점 GS25에서는 다음달 말까지 독립을 위해 생애를 바쳤지만 상대적으로 잘 알려지지 않은 여성 독립운동가 51명의 스티커를 만들어 도시락 전 상품 20종에 부착한다. GS수퍼마켓에서 파는 조리식품과 GS리테일의 밀키트 브랜드 심플리쿡 상품에도 여성 독립운동가 알리기 스티커를 부착한다. 임시정부 수립 기념일이 있는 4월에는 고객 100명과 임직원 10명이 함께 임시정부 인사의 주요 발자취를 따라 가보는 상하이 임시정부 견학 이벤트를 2박 3일 일정으로 계획 중이다. 아울러 특정 상품을 선정해서 GS리테일과 제조사가 발생하는 수익 일부를 적립해 독립운동가 후손도 후원하기로 했다.

편의점 씨유(CU)를 운영하는 BGF리테일(282330)도 독립기념관과 ‘독립운동사 대중화를 위한 업무협약’을 체결하고 다음 달부터 ‘함께해요 3·1운동 100주년 캠페인’을 진행한다. 전국 CU 점포 내 게시판에 국가보훈처가 선정한 ‘2019 이달의 독립운동가’ 포스터를 매달 게시하고 독립운동사를 알린다. 바나나우유와 콘소메맛 팝콘 등 인기 자체브랜드(PB) 상품 13종에는 포장에 인천 만국공원과 천안 아우내장터 등 전국 각지의 3·1운동 사적지 사진을 싣는다. 아동·청소년들이 올바른 독립운동 역사를 배울 수 있도록 관련 프로그램 개발을 위해 독립기념관 교육사업부에 기부금도 전달할 예정이다.

농심(004370)은 3월 한 달 대표 라면 제품인 ‘안성탕면’ 판매액의 3.1%를 국가유공자 복지와 보훈 선양 사업에 기부한다. 안성탕면의 월평균 매출이 90억원 가량임을 고려하면 기부금은 약 3억원 선이 될 것으로 보인다. 경기도 안성이 3·1운동 3대 항쟁 지역 중 한 곳임을 고려해 안성탕면을 기부행사 제품으로 선정했다는 게 농심의 설명이다. 안성탕면과 해물안성탕면 멀티팩 포장에는 3·1절 100주년 기념 캠페인 문구를 넣은 한정판 패키지도 선보인다."
2019-02-21 최한성,"GS리테일, 보훈처와 함께 역사 알리기 앞장","GS리테일이 31운동과 임시정부 수립 100주년을 맞아 한국의 독립운동 역사 알리기에 적극 나서기로 했습니다.

우선 GS리테일이 운영하는 편의점 GS25는 여성 독립운동가 51인의 스트커를 제작해 현재 취급 중인 도시락 전상품에 부착합니다.

GS수퍼마켓과 GS리테일의 밀키트 브랜드인 심플리쿡도 조리 식품과 밀키트 상품에 여성 독립운동가 알리기 스티커를 부착해 전사적 캠페인에 동참합니다.

상해 임시정부 수립 100주년이 되는 오는 4월 11일에는 고객 100명과 GS리테일 임직원 10명이 함께 임시 정부 인사들의 주요 발자취를 따라가보는 2박3일 일정의 상하이 임시정부 견학도 추진합니다.

GS리테일은 이밖에 협력사와 함께 크라우드펀딩을 조성해 독립운동가 후손에게 기금을 전달한다는 계획도 세웠습니다.

GS리테일 관계자는 ""올 한해 GS리테일의 1만3천500여 플랫폼이 역사 알리기에 앞장 서며 국민이 지킨 역사와 국민이 이끌 나라의 소중한 가치를 일깨우는 데 함께 실천해 가고자 한다""고 말했습니다.<최한성(hsforyj@obs.co.kr)>"
2019-02-21 박로명 기자,"GS리테일, 보훈처와 손잡고 역사 알리기 앞장서","-GS25ㆍGS수퍼마켓ㆍ랄라블라 등 오프라인 점포 총동원
-여성 독립운동가 51인 스티커 제작해 GS25 도시락 상품에 부착
-보훈처와 함께 기획한 팝카드도 선보여…참여형 캠페인도 진행 

GS리테일 역사 알리기 캠페인 [GS리테일 제공]
[헤럴드경제=박로명 기자] GS리테일이 3ㆍ1절과 임시정부 수립 100주년을 맞아 독립운동 역사 알리기에 나선다.

GS리테일은 국가보훈처와 함께 ‘국민이 지킨 역사, 국민이 이끌 나라’를 테마로 역사 알리기 사업을 진행한다고 21일 밝혔다. 단순히 1회성 캠페인에 그치는 것이 아닌, 매달 다양한 주제로 지속적으로 이어간다는 것이 회사측 설명이다. 이를 위해 GS리테일이 운영하는 GS25ㆍGS수퍼마켓ㆍ랄라블라ㆍGS프레시 등 오프라인 점포를 비롯해 공식 사회관계망서비스(SNS) 채널까지, 하루 700만명이 이용하는 GS리테일의 모든 온ㆍ오프라인 채널을 총동원할 예정이다.

GS리테일 관계자는 “GS그룹의 창업주인 허만정 선생은 100여년 전 백산상회 설립에 참여해 상해 임시정부의 독립운동 후원금을 마련하는 데에 힘썼다”며 “GS리테일은 창업주 허만정의 정신을 이어 받아 애국의 사회 공헌을 대물림하여 실천하고자 이번 보훈처의 역사 알리기 사업에 앞장서기로 했다”고 밝혔다.

먼저 GS25는 여성 독립운동가 51인의 스티커를 제작해 현재 판매 중인 도시락 전상품 20종에 부착하기로 했다. 여성 독립 운동가 51명은 독립을 위해 생애를 바쳤음에도 상대적으로 잘 알려지지 않아 이들을 기억하자는 취지에서 기획했다.

GS수퍼마켓과 GS리테일의 밀키트 브랜드인 심플리쿡도 여성 독립운동가 알리기 캠페인에 동참한다. 조리 식품과 밀키트 상품에 해당 스티커를 부착할 예정이다. GS리테일은 관련 동영상도 제작해 지하철 3호선, 9호선, GSTV와 주요 SNS 채널에 공개할 예정이다. 아울러 GS25, GS수퍼마켓, 랄라블라 등 1만3500여개 오프라인 점포에서는 ‘이 달의 독립운동가’를 소개하는 성우 음성이 배경음악을 통해 재생될 예정이다.

GS리테일은 오는 4월 보훈처와 함께 디자인한 3종의 멤버십 팝카드를 선보일 예정이다. 3종의 멤버십 팝카드는 ▷임시 정부 주요 인사들의 단체 사진 ▷호국보훈의 달 기념 국군 장병 사진 ▷한국을 대표하는 꽃 무궁화 등이 디자인된 카드다. 아울러 제조사와 함께 진행하는 크라우드 펀딩을 통해 기금을 조성해 독립 운동가 후손에게 전달할 계획이다. 제조사가 선정한 상품에 보훈처의 공식 엠블럼을 인쇄하고, 해당 상품을 통해 발생된 수익의 일부를 독립운동가 후손들에게 전달하는 방식이다.

아울러 GS리테일은 오는 15일을 시작으로 한달 간 ‘내가 나라를 사랑하는 법’ 캠페인을 진행한다. GS25, 랄라블라 등 SNS 공식 계정을 통해 진행되는 고객 참여형 캠페인으로, 고객이 스스로 애국을 실천하고 있는 방법을 간단한 광고영상(UCC)으로 제작해 응모하면 된다. 해당 캠페인에 선발된 100명의 고객은 10명의 GS리테일 임직원과 함께 오는 5월 24일부터 2박3일 동안 상해 임시정부, 역사 유적지 등을 견학할 예정이다.

dodo@heraldcorp.com"
