Date,Title,Content
2020-05-18 정영동(jyd541@hankyung.com);,[테샛 공부합시다] '메세나'는 문화·예술·스포츠 등에 대한 기업의 지원활동,"테샛(TESAT)을 공부하는 고교생들이 가장 어려워하는 영역은 시사경제와 금융영역이다. 시사영역은 범위가 넓고 학생들이 학교 공부를 하면서 신문 등을 꼼꼼하게 읽어볼 시간이 현실적으로 부족하기 때문이다. 특히 최근 국내외 시사경제 이슈를 제대로 따라가지 못하는 ‘시사 지체 현상’은 더욱 심하다. 테샛 시사·경제용어를 정리해보자.

○메세나(mecenat)=문화·예술·스포츠와 공익사업 등에 대한 기업의 지원활동을 총칭하는 프랑스어다. 기업에서는 이윤의 사회적 환원이라는 기업 윤리를 실천하는 것 외에 회사의 문화적 이미지까지 높일 수 있는 홍보 수단으로도 사용한다. 로마제국에서 예술인을 적극 후원한 정치가 가이우스 클리니우스 마에케나스(Gaius Clinius Maecenas)의 이름에서 유래됐다.

○최종대부자(lender of last resort)=대규모 예금 인출 사태인 뱅크런 등으로 인한 금융시스템 붕괴를 막기 위해 최후에는 중앙은행이 개입할 수밖에 없는데, 금융위기의 확산을 막기 위해 중앙은행이 발권력을 동원해 금융시장에 일시적으로 유동성을 공급하는 기능을 최종대부자 기능이라 한다.

○퍼펙트 스톰(perfect storm)=원래 의미의 퍼펙트 스톰은 개별적으로 보면 위력이 크지 않은 태풍 등이 다른 자연현상과 동시에 발생하면서 엄청난 파괴력을 갖게 되는 현상을 말한다. 경제분야에서는 세계 경제가 두 가지 이상의 악재가 동시에 발생해 초대형 경제위기가 발생할 수 있는 상황을 뜻한다. 누리엘 루비니 미국 뉴욕대 교수가 2011년 6월 세계 경제를 예측하면서 이 용어를 처음 사용했다.

○리세션(recession)=리세션은 경기 후퇴 초기 국면에 나타나는 침체다. 리세션에 진입하면 생산·투자·소비 활동의 하락, 실업률 상승 등 경제활동이 둔화된다. 리세션이 심해지면 경기침체가 더욱 깊어지게 된다.

○퍼플오션(purple ocean)=레드오션(red ocean)과 블루오션(blue ocean)의 중간개념이다. 경쟁 없이 완전히 새로운 분야를 개척하는 블루오션 상품보다 기존의 익숙한 레드오션 상품에서 발상의 전환을 통해 조금 다른 상품을 만드는 것이다. 최근 삼성전자가 내놓은 폴더블폰도 퍼플오션 전략의 결과물이다.

○인구 데드크로스=데드크로스(dead cross)는 주식 시장에서 주가나 거래량의 단기 이동 평균선이 장기 이동 평균선을 뚫고 내려가는 것을 이르는 현상으로 주식 시장이 약세로 진입한다는 신호로 해석된다. 인구 데드크로스는 사망자가 출생아보다 많아 인구가 자연감소하는 현상을 말한다. 통계청에 따르면 한국은 2020년부터 인구 데드크로스가 시작될 것으로 보인다.

○재무적 투자자(financial investors)=단순히 매각차익을 노리고 회사나 지분 일부를 인수하는 세력을 말한다.

○전략적 투자자(strategic investors)=실제로 해당 사업을 영위할 목적으로 자금을 들여 회사를 인수하는 세력을 말한다.

○영업용순자본비율(NCR: net capital ratio)=은행의 BIS비율처럼 증권회사의 재무건전성을 나타내는 대표적인 지표로, 부담하고 있는 위험의 규모가 증권사의 유동성에 비춰 적합한지를 판단하는 지표로 활용된다. 영업용순자본을 총위험액으로 나눠 백분율로 표시한다.

○밀키트(meal kit)=손질된 식재료와 양념, 요리법을 묶은 꾸러미로 레시피 박스라고도 불린다. 밀키트는 조리 전 냉장 상태의 식재료를 배송하기 때문에 유통기한이 길지 않으며 소비자가 동봉된 조리법대로 직접 요리한다.

정영동 한경 경제교육연구소 연구원 jyd541@hankyung.com

테샛관리위원회는 테샛 홈페이지 ‘오늘의 TESAT’ 공부방에 기출문제와 시사경제용어를 정리한 게시물을 올려두고 있습니다. 특히 테샛 시험 주에 공지하는 ‘시사경제용어 따라잡기’는 응시자라면 꼭 공부해둘 필요가 있습니다. 테샛관리위원회는 수험생들이 경제이해력을 높일 수 있도록 많은 배려를 하고 있습니다."
2020-05-18 김현주,코로나19로 가족과 집에서 즐기는 '성년의 날' 기념 음식 뭐가 좋을까?,"오늘(18일)은 일생의 단 한번인 스무 살을 맞이하는 올해 성년이 되는 2001년생을 축하하는 성년의 날이다. 다같이 삼삼오오 모여 성인이 된 날을 축하하는 모습이 상상되지만, 올해는 코로나19로 그 기쁜 마음을 집에서 가족과 함께 즐기려는 사람이 늘고 있다.

가족과 함께 즐기는 홈파티에 음식을 빼놓을 수가 없다. 가족과 함께 성년의 날 축하파티 분위기를 보다 고조시켜주는 외식업계의 다양한 프로모션 및 서비스를 이용해 보다 재미있는 하루를 보내보자.

파티를 즐기고 싶지만 어떠한 음식을 준비할 지 고민되거나 음식을 만드는 시간이 부족한 사람 혹은 귀찮은 사람이라면 피자헛의 ‘스페셜 패밀리세트’를 배달시켜보자. 합리적인 가격과 메뉴 구성으로 부담 없이 손쉽게 파티 음식을 배달 받을 수 있다.

피자헛은 사랑하는 가족과 함께 푸짐하게 즐길 수 있도록 프리미엄 피자와 리치치즈 파스타, 함박스테이크, 펩시콜라 1.25L로 구성된 ‘스페셜 패밀리세트’를 출시했다. 미디엄 사이즈는 2만 3900원부터, 라지 사이즈는 2만 7900원부터로, 미디엄 세트 기준 포장 시 약 46%(20,700원) 할인된 가격으로 만나볼 수 있다. 특히, 프리미엄 피자 중 슈퍼슈프림, 베이컨포테이토 메뉴 선택 시 2,000원 더 저렴하게 구입 가능할 수 있어 보다 유용하다.

파티 음식을 직접 준비하고 싶다면 CJ제일제당의 ‘CJ쿡킷’을 이용해보자. 정성스럽게 준비된 식재료로 만든 밀키트(반조리식품)로 쉽고 간편하게 파티 음식을 준비할 수 있다.

요리 초보자도 따라하기 쉬우며 조리 시간 10분~30분이면 부채살 찹스테이크, 빠네크림파스타, 감바스알아히요 등 다양한 파티 음식을 손쉽게 요리할 수 있어 편리하다.

스마트폰만 있다면 원하는 날짜와 장소로 언제 어디서든 주문할 수 있으며, CJ대한통운을 통해 원하는 날의 새벽, 현관 앞에서 쿡킷을 만나실 수 있다.

간단한 안주와 함께 소소하게 분위기를 내고 싶다면 대상 청정원의 안주 간편식 브랜드 ‘안주야’를 이용해보자. 파우치를 열지 않고 그대로 세워서 전자레인지에 1분만 조리하면 바로 먹을 수 있어 포장이 뜯어지거나 내용물이 밖으로 튈 염려가 없어 편리하다. 거기에 청정원의 원료 가공 및 제조 노하우를 기반으로 제품 최적의 맛을 살렸다.

특히, 신제품은 '통마늘 모듬곱창', '매콤제육오돌뼈', '매콤껍데기', '소양돼지곱창', '통마늘 제육오돌뼈', '통마늘 매콤껍데기' 등은 상온에서 9개월간 보관까지 할 수 있다.

김현주 기자 hjk@segye.com"
2020-05-17,"언택트 소비·동네상권 재발견…외식업, 성공방정식이 달라졌다","신종 코로나바이러스 감염증(코로나19) 사태로 직격탄을 맞은 프랜차이즈 등 외식업 관계자는 고민에 빠졌다. “코로나19 이전으로 돌아갈 수 없을 것”이라는 전문가들의 경고대로 외식산업을 둘러싼 환경이 크게 달라지고 있기 때문이다. BC(코로나 전), AC(코로나 후)로 시대를 구분해야 한다는 말이 나올 정도다.

업계에서는 코로나19 사태에 따른 외식시장의 변화를 크게 △동네상권 다시보기 △언택트 소비 △외식상품 다양화 등 세 가지 키워드로 보고 있다. 먼저 대로변 1급 상권의 입지를 고집하지 않아도 될 것이란 분석이다. 코로나19 확산 후 카드 사용처를 분석한 결과 유동인구가 많은 중심 상권과 오피스 상권은 크게 위축됐다. 주택가 동네 상권과 시장은 방문객이 늘어난 것으로 나타났다. 전문가들은 근로시간 축소, 재택근무 확산, 사람이 많이 모이는 곳을 피하고 외출을 자제하는 생활 문화 확산으로 집에서 가까운 ‘근거리 소비’가 늘어날 것으로 전망하고 있다. 가맹본부나 창업희망자들은 상권의 변화를 눈여겨볼 필요가 있다.

두 번째는 언택트 문화의 확산이다. 배달 시장은 폭발적으로 성장했다. 닐슨코리아의 ‘코로나 임팩트’ 보고서에 따르면 코로나19 발생 이후 배달 음식을 주문한 소비자는 33%에서 52%로 두 배 가까이로 증가했다. 매장 방문 소비자는 44%에서 19%로 급감했다. 위생 등을 이유로 비대면 서비스를 선호하는 소비자가 늘었다. 이에 따라 프랜차이즈 본사들도 모바일 앱을 활용한 사전 주문, 키오스크 등 스마트 오더 시스템, 결제 시스템을 갖춰가고 있다. 무인매장, 셰프봇, 서빙봇 등 협동로봇 개발에 뛰어든 프랜차이즈 본사도 있다. 기계와 로봇이 사람을 대체하는 언택트 시스템이 본격화하고 있는 것이다.

마지막으로 외식 상품의 다양화를 꼽을 수 있다. 집에서 보내는 시간이 늘자 쉽게 조리할 수 있는 가정간편식(HMR) 시장이 크게 성장했다. 여러 식재료가 필요하고 레시피가 어려워 가정에서 조리하기 힘든 일품요리를 쉽게 만들 수 있는 다양한 밀키트 제품도 속속 출시되고 있다. 향후 조리된 음식뿐만 아니라 밀키트를 판매하는 프랜차이즈 매장이 크게 늘어날 전망이다. 가맹점 운영 방식에도 큰 영향을 미치는 변화다.

한 번도 경험하지 못한 변화의 시대가 성큼 다가왔다. 전문가들은 코로나19 사태가 종식되더라도 바뀐 소비 패러다임은 지속될 것으로 내다보고 있다. 종전 방식으로는 성공할 수 없는, 아니 생존할 수 없는 상황이 됐다.

박호진 < 한국프랜차이즈산업협회 사무총장 >"
2020-05-16 YTN,"호주, 코로나19가 몰고 온 '비대면화' 바람","[앵커]
포스트 코로나 시대의 키워드는 사람과의 접촉을 최소화하는 비대면화, 일명 '언택트'입니다.

우리나라와 달리 배달업이나 온라인 쇼핑이 발달하지 않은 호주에도 최근 비대면화에 발맞춰 변화의 바람이 불고 있습니다.

윤영철 리포터가 소개합니다.

[기자]
손님이 찾지 않아 빈 의자만 수북이 쌓인 식당.

그런데 전화벨 소리가 끊이지 않고, 주방에는 포장된 음식으로 가득합니다.

이 식당은 코로나19 이후 배달과 테이크아웃 위주로 영업방식을 바꿨습니다.

[배기중 / 한식당 운영 : 집에서 친근하게 먹을 수 있고 간편하게 빨리 먹을 수 있도록 밀키트 형식으로 만들어서 배달하고 있거든요. (앞으로도) 와서 식사하시는 손님은 아무래도 적을 것 같고요. 테이크아웃에 초점을 더 맞춰야 할 것 같습니다.]

멜버른 무역관에서 일하는 예광호 씨는 코로나19로 재택근무를 하게 된 뒤 일상에 여러 변화가 생겼습니다.

[예광호 / 코트라 멜버른 무역관 과장 : 코로나19가 시작된 이후로는 요리는 전부 다, 음식은 집에서 요리로 해 먹고. 온라인 판매 통해서 가전제품이나 인테리어 쪽, 홈코노미 제품에 관심을 가지면서 보게 됐습니다.]

관광·외식업이 발달한 호주에서 상대적으로 규모가 작았던 온라인 시장.

하지만 항공길이 막히고 비대면화가 새로운 흐름으로 자리 잡으면서 호주에서 온라인 서비스가 새롭게 뜨고 있습니다.

호주 전반의 취업 시장이 얼어붙은 상황이지만, 온라인 산업에 필수적인 배달이나 운송업 등에서는 꾸준히 새로운 인력을 찾고 있습니다.

[변용섭 / 코트라 멜버른 무역관장 : 온라인 비즈니스가 크게 발전할 것으로 생각합니다. 온라인 쇼핑이 아직 호주는 10% 미만이거든요. 이 시장이 커질 것으로 보고 있고요. 온라인으로 하는 원격의료. 온라인 교육 등 이런 사업이 커질 것 같습니다.]

비대면화와 온라인화에 발맞춰 호주의 경제·사회구조가 급변할 거란 예측 속에, 호주는 새로운 변화를 뒷받침할 제도개선과 디지털에 취약한 계층을 위한 대비책 마련을 함께 준비해야 하는 과제가 남았습니다.

호주 멜버른에서 YTN 월드 윤영철입니다."
