Date,Title,Content
2017-12-17,"GS리테일, '간편 요리 세트' 시장 진출…4세대 식문화 혁명 선도","GS리테일 심플리쿡

GS리테일이 4차 식문화 혁명을 이끌 밀키트(간편 요리 세트) 시장 개척에 나선다고 17일 밝혔다. 밀키트 관련 산업은 미국에서 최근 아마존이 진출해 관심을 받으며 지난해 기준 1조7000억원대 시장을 형성하고 있다.

GS리테일은 밀키트 배송 서비스 '심플리 쿡(Simply Cook)'을 론칭하고 오는 22일부터 온라인쇼핑몰 GS fresh와 종합 푸드 플랫폼 스타트업 해먹남녀를 통해 본격적인 판매를 시작한다. 내년 1월에는 GS25 모바일 어플리케이션 나만의 냉장고를 통해서도 판매를 진행할 계획이다.

Simply Cook은 요리에 필요한 육류, 야채, 소스, 육수 등 모든 식재료를 칼질도 필요 없이 바로 조리 할 수 있는 상태로 정량만큼 포장해 상세한 레시피와 함께 제공하는 토탈 밀 솔루션 서비스다.

Simply Cook을 통해 고객들은 레시피에 맞게 준비된 식재료를 그대로 조리하기만 하면 전문점 수준의 근사한 음식을 최대 30분내에 직접 요리할 수 있는 셰프가 될 수 있게 됐다.

GS리테일은 기존 렌지업만으로 즐길 수 있는 가정간편식(HMR)이나 반조리 상품(RTC)는 명확한차별화를 위해, 육수나 소스를 제외한 모든 식재료를 요리에 적당하게 다듬어 신선한 상태로 포장해서 제공함으로써 고객들은 레시피에 맞춰 조리를 하면 간편하게 전문점 셰프 요리 수준의 맛과 식감을 살릴 수 있다.

Simply Cook은 고객들이 보다 편리하게 밀키트로 요리를 진행할 수 있도록 레시피카드와 함께 판매 채널의 웹과 모바일을 통해 조리 동영상도 제공할 예정이다.

Simply Cook은 최초 갈비찜, 스키야키, 월남쌈, 파스타 등 14종의 밀키트를 선보인 후, 향후 다양한 레시피를 활용한 메뉴를 지속 확대해 나갈 예정이다. 가격은 2~3인분 기준 평균 2만4000원이다.

전국 고객들은 GS fresh나 해먹남녀를 통해 Simply Cook의 다양한 밀키트 주문이 가능하며, 전날 밤 10시까지 주문 완료된 건에 대해서 다음 날까지 고객이 원하는 곳으로 배송이 완료된다. 또 GS fresh의 새벽배송이 가능한 서울 지역에서는 전날 오전 10시까지 완료된 주문은 다음 날 새벽 원하는 곳 문 앞으로 배송돼 아침 식사도 가능하다.

조만간, 외출 등으로 집에서 상품을 수령하기 어려운 경우를 대비해 가까운 GS25에서 수령할 수 있도록 하는 옴니채널 시스템도 구축해 고객 편의를 높일 계획이다.

GS리테일은 고객이 주문하는 수량에 맞춰 생산하는 주문 생산 방식으로, 고객들은 가장 신선한 상태의 식재료를 받아서 요리할 수 있도록 밀키트 생산 시스템을 구축했다.

GS리테일이 아직 생소한 밀키트 시장 개척에 나선 것은 새로운 식문화에 대한 고객의 니즈를 이끌어 낼 수 있다는 확신 때문이다. GS리테일은 1~2명의 자녀를 둔 바쁜 맞벌이 부부가 믿을 수 있는 재료로 직접 요리한 음식을 집에서 아이들과 함께 단란하게 즐기고 싶은 욕구에 주목했다.

현대인들은 자신이 손수 요리한 레스토랑 수준의 근사한 음식을 가족과 함께 먹으며 즐거운 대화를 나누는 행복한 식사 시간을 꿈꾸지만, 현실은 마트에서 장을 보고 다듬고 요리까지 하는데 들이는 시간과 노력 등 비용이 너무 크다는 것. 또 투여한 비용 대비 음식의 맛을 보장받지 못하고, 남은 식재료는 처치 곤란으로 이어지는 일련의 상황이 요리를 시도조차 할 수 없게 만들고 있다고 판단한 GS리테일은 모든 준비를 대신함으로써 고객의 리스크를 없애고 요리하는 즐거움만 제공하는 이번 Simply Cook을 시작하게 됐다.

GS리테일은 도시락을 제조해 왔던 노하우와 인프라를 바탕으로 초기에는 자회사인 후레쉬서브에서 밀키트 생산을 진행하고, 향후 수요가 늘어남에 따라 2, 3 생산시설로 확대해 나갈 계획이다.

김경환 GS리테일 디지털전략부문장은 “밀키트 배송 서비스는 고객의 니즈를 충족시키는 것이 아닌 아직 고객이 인지하지 못한 니즈를 개발 해야 하는 새로운 영역의 서비스”라며 “밀키트는 단순히 편리함만을 추구한 먹거리가 아닌, 직접 맛있는 요리를 해서 가족과 함께 집에서 식사를 즐기고 싶은 고객의 바람을 녹여낸 밀솔루션 서비스로 향후 그 시장의 성장 가능성은 무한하다고 확신한다”고 말했다.

이주현 유통 전문기자 jhjh13@etnews.com"
2017-12-17,‘재료+요리법’ 한 팩에 담긴 ‘밀키트’ 한국에서도 꿈틀,"필요한 재료와 요리법이 한 팩 안에 들어 있어 쉽게 요리를 즐길 수 있는 ‘밀키트(Meal Kit)’가 인기를 끌면서 국내 기업들이 시장에 진출하고 있다.

지에스(GS)리테일는 밀키트 배송 서비스 ‘심플리 쿡’을 론칭하고 오는 22일부터 온라인쇼핑몰 지에스프레시와 종합 푸드 플랫폼 ‘해먹남녀’를 통해 본격적인 판매를 시작한다고 17일 밝혔다. 내년 1월에는 지에스25 모바일 어플리케이션 나만의 냉장고를 통해서도 판매할 계획이다.

심플리 쿡은 요리에 필요한 육류, 야채, 소스, 육수 등 모든 식재료를 칼질이 따로 필요 없이 바로 조리 할 수 있는 상태로 포장해 상세한 요리법과 함께 제공하는 서비스다. 기존 전자레인지로 데워 먹는 가정간편식과 차별화를 위해 육수나 소스를 제외한 모든 식재료를 신선한 상태로 제공한다. 소비자들은 요리법에 맞춰 조리만 하면 된다. 지에스리테일은 갈비찜, 스키야키, 월남쌈, 파스타 등 14종의 밀키트를 선보일 예정이다. 가격은 2~3인분 기준 평균 2만4000원이다. 지에스리테일 관계자는 “바쁜 맞벌이 부부가 믿을 수 있는 재료로 직접 요리한 음식을 아이들과 함께 즐기고 싶은 욕구에 주목했다”며 “새로운 식문화에 대한 고객의 니즈를 이끌어 낼 수 있다는 확신 때문에 아직까지 우리나라에서 생소하지만 밀키트 시장에 나선 것”이라고 말했다.



앞서 한국야쿠르트도 밀키트 사업을 시작했다. 올해 가정간편식 시장에 뛰어든 한국야쿠르트는 지난 9월부터 훈제오리 월남쌈, 땅콩비빔국수, 황태해장국, 알리오올리오파스타 등 9종의 잇츠온 밀키트를 선보였다. 이 밖에 프렙, 테이스트샵, 배민프레쉬, 마이셰프 등 10여곳이 넘는 푸드 기업들도 박스에 식재료들을 담아 배송해주는 밀키트 사업을 활발히 진행하고 있다.

밀키트 사업은 미국에서도 인기를 끌고 있다. 대한무역투자진흥공사(KOTRA) 자료를 보면, 미국의 경우 지난 2012년 ‘블루에이프런’이 최초로 사업을 시작했고, 지난해 밀키트 시장이 1조7000억원 규모로 성장했다. 미국 밀키트 업체는 150여개나 되며 최근 전자상거래업체인 아마존까지 서비스를 시작하면서 시장은 계속 확대될 것이라는 전망이 나온다.

김소연 기자 dandy"
2017-12-17,"GS리테일, 밀키트 시장 진출…`심플리쿡` 론칭","GS리테일이 간편요리(밀키트·Meal Kit) 배송 서비스인 '심플리쿡(Simply Cook)'을 17일 론칭했다고 밝혔다.



이 서비스는 2012년 미국 스타트업 블루 에이프런이 처음 시작했으며 아마존도 현재 운영 중이다. 대한무역투자진흥공사에 따르면 지난해 미국 밀키트 시장규모는 1조7000억원대로 성장했다. GS리테일은 오는 22일부터 온라인쇼핑몰 GS 프레시와 종합 푸드 플랫폼 스타트업인 해먹남녀를 통해 밀키트를 판매한다. 내년 1월에는 GS25 모바일 앱인 '나만의 냉장고'에도 선보일 예정이다. GS리테일은 19일부터 내부 고객을 대상으로 테스트 판매를 한 뒤 22일 외부 고객을 대상으로 그랜드 오픈한다는 계획이다.



심플리쿡은 요리에 필요한 육류·야채·소스·육수 등 모든 식재료를 칼질할 필요 없이 바로 조리할 수 있는 상태로 정량만 포장해 상세한 레시피와 함께 제공한다. 고객이 주문하는 수량에 맞춰 주문생산해 가장 신선한 상태의 식재료를 받아 요리할 수 있도록 했다. 고객은 배송받은 식재료를 활용해 레시피에 맞게 그대로 조리하면 전문점 수준의 음식을 최대 30분 내에 완성할 수 있다. GS리테일은 온라인·모바일에서 조리 동영상도 공개할 예정이다. 앞으로 심플리쿡에서는 갈비찜·스키야키·월남쌈·파스타 등 14종의 밀키트를 선보인 뒤 메뉴를 지속적으로 확대한다는 계획이다. 가격은 2∼3인분 기준 2만4000원.



특히 GS리테일은 전날 오후 10시까지 주문 완료되면 다음 날까지 고객이 원하는 곳으로 밀키트를 배송해준다. 서울지역의 경우 전날 오전 10시까지 주문한 상품을 다음 날 새벽에도 받을 수 있다. 앞으로 GS리테일은 GS25에서 주문상품을 찾아가는 옴니채널 시스템도 구축할 예정이다. 아울러 도시락 제조 노하우와 인프라를 바탕으로 자회사인 후레쉬서브에서 밀키트를 생산하며 수요가 늘어나면 생산시설을 확대할 계획이다.



김경환 GS리테일 디지털전략부문장은 ""밀키트 배송 서비스는 아직 고객이 인지하지 못한 수요를 개발해야 하는 새로운 영역의 서비스""라며 ""밀키트는 단순히 편리함만을 추구한 먹거리가 아닌, 직접 맛있는 요리를 해서 가족과 함께 집에서 식사를 즐기고 싶은 고객의 바람을 녹여낸 밀솔루션 서비스로 성장 가능성은 무한하다""고 말했다.



박민영기자 ironlung@dt.co.kr"
2017-12-17,"GS리테일, 간편 요리 세트 배송 서비스 'Simply Cook' 론칭","GS리테일이 간편 요리 세트 배송 서비스인 '심플리 쿡(Simply Cook)'
론칭을 통해 밀키트(Meal Kit) 시장에 진출한다.

GS리테일은 오는 22일부터 온라인쇼핑몰 GS fresh 및 종합 푸드 플랫폼 스타트
업 해먹남녀를 통해 본격적으로 Simply Cook를 판매한다고 17일 밝혔다. 내년
1월에는 GS25 모바일 어플리케이션 '나만의 냉장고'를 통해서도 판매를
진행할 계획이다.

Simply Cook은 요리에 필요한 육류, 야채, 소스, 육수 등 모든 식재료를 칼질도
필요 없이 바로 조리 할 수 있는 상태로 제공된다. 정량만큼 포장해 상세한 레
시피와 함께 서비스된다.

GS리테일은 기존 가정간편식(HMR)이나 반조리 상품인 반조리 상품(RTC)과는 차
별화하기 위해, 육수나 소스를 제외한 모든 식재료를 요리에 적당하게 다듬어
포장해 제공한다.

고객들이 보다 편리하게 밀키트로 요리를 진행할 수 있도록 레시피카드와 함께
판매 채널의 웹과 모바일을 통해 조리 동영상도 제공할 예정이다.

Simply Cook은 최초 갈비찜, 스키야키, 월남쌈, 파스타 등 14종의 밀키트를 선
보인 후, 향후 다양한 레시피를 활용한 메뉴를 선보일 예정이다. 가격은 2~3인
분 기준 평균 2만4000원이다.

전국 고객들은 GS fresh나 해먹남녀를 통해 Simply Cook의 다양한 밀키트 주문
이 가능하며, 전날 밤 10시까지 주문 완료된 건에 대해서 다음 날까지 고객이
원하는 곳으로 배송이 완료된다.

새벽배송이 가능한 서울 지역에서는 전날 오전 10시까지 완료된 주문은 다음 날
새벽 원하는 곳 문 앞으로 배송돼 아침 식사도 가능하다.

조만간, 외출 등으로 집에서 상품을 수령하기 어려운 경우를 대비해 가까운 GS
25에서 수령할 수 있도록 하는 옴니채널 시스템도 구축해 고객 편의를 높일 계
획이다.

김경환 GS리테일 디지털전략부문장은 ""밀키트는 단순히 편리함만을 추구한
먹거리가 아닌, 직접 맛있는 요리를 해서 가족과 함께 집에서 식사를 즐기고
싶은 고객의 바람을 녹여낸 밀솔루션 서비스로 향후 시장 성장성이 무한하다&q
uot;고 말했다.

조아라 한경닷컴 기자 rrang123@hankyung.com
기사제보 및 보도자료 open@hankyung.com"
2017-12-17,간편 요리세트 시장 커지자…GS리테일도 가세,"밀키트 배송 '심플리 쿡' 론칭
GS리테일(007070)이 간편 요리세트(밀키트) 시장에 진출한다. 밀키트 관련 산업은 미국에서 최근 아마존이 진출해 관심을 받으며 1조7,000억원대(2016년 기준)로 시장을 형성하고 있다.

GS리테일은 밀키트 배송 서비스 ‘심플리 쿡’을 론칭하고 오는 22일부터 온라인쇼핑몰 GS프레시와 종합 푸드 플랫폼 스타트업 해먹남녀를 통해 본격적인 판매를 시작한다고 17일 밝혔다. 내년 1월에는 GS25 모바일 어플리케이션 나만의 냉장고를 통해서도 판매를 진행할 계획이다.

심플리 쿡은 요리에 필요한 육류, 야채, 소스, 육수 등 모든 식재료를 칼질도 필요 없이 바로 조리 할 수 있는 상태로 정량만큼 포장해 상세한 레시피와 함께 제공하는 토탈 밀 솔루션 서비스다.

기존 렌지업만으로 즐길 수 있는 가정간편식(HMR)이나 반조리 상품(RTC)과는 명확한 차별화를 위해, 육수나 소스를 제외한 모든 식재료를 요리에 적당하게 다듬어 신선한 상태로 포장해서 제공한다.

심플리 쿡은 고객들이 보다 편리하게 밀키트로 요리를 진행할 수 있도록 레시피카드와 함께 판매 채널의 웹과 모바일을 통해 조리 동영상도 제공할 예정이다. 최초 갈비찜, 스키야키, 월남쌈, 파스타 등 14종의 밀키트를 선보인 후, 향후 다양한 레시피를 활용한 메뉴를 지속 확대해 나갈 예정이다. 가격은 2~3인분 기준 평균 2만4000원이다.

한편 이 회사는 향후 옴니채널 시스템도 구축해 고객 편의를 높일 계획이다."
2017-12-17,"GS리테일, 간편 요리 시장 진출…4세대 식문화 혁명 이끈다","[아시아경제 지연진 기자]GS리테일이 4차 식문화 혁명을 이끌 간편 요리 세트(밀키트) 시장 개척에 나섰다. 밀키트 관련 산업은 미국에서 최근 아마존이 진출해 관심을 받으며 1조7000억원대(2016년 기준)로 시장을 형성하고 있다.GS리테일은 밀키트 배송 서비스 ‘심플리 쿡’을 론칭하고 오는 22일부터 온라인쇼핑몰 GS프레시와 종합 푸드 플랫폼 스타트업 해먹남녀를 통해 본격적인 판매를 시작한다고 17일 밝혔다. 내년 1월에는 GS25 모바일 어플리케이션 나만의 냉장고를 통해서도 판매를 진행할 계획이다. 심플리 쿡은 요리에 필요한 육류, 야채, 소스, 육수 등 모든 식재료를 칼질도 필요 없이 바로 조리 할 수 있는 상태로 정량만큼 포장해 상세한 레시피와 함께 제공하는 토탈 밀 솔루션 서비스다.기존 렌지업만으로 즐길 수 있는 가정간편식(HMR)이나 반조리 상품(RTC)과는 명확한 차별화를 위해, 육수나 소스를 제외한 모든 식재료를 요리에 적당하게 다듬어 신선한 상태로 포장해서 제공한다. 심플리 쿡은 고객들이 보다 편리하게 밀키트로 요리를 진행할 수 있도록 레시피카드와 함께 판매 채널의 웹과 모바일을 통해 조리 동영상도 제공할 예정이다. 최초 갈비찜, 스키야키, 월남쌈, 파스타 등 14종의 밀키트를 선보인 후, 향후 다양한 레시피를 활용한 메뉴를 지속 확대해 나갈 예정이다. 가격은 2~3인분 기준 평균 2만4000원이다.전국 고객들은 GS프레시나 해먹남녀를 통해 심플리쿡의 다양한 밀키트 주문이 가능하며, 전날 밤 10시까지 주문 완료된 건에 대해서 다음 날까지 고객이 원하는 곳으로 배송이 완료된다. GS 프레시의 새벽배송이 가능한 서울 지역에서는 전날 오전 10시까지 완료된 주문은 다음 날 새벽 원하는 곳 문 앞으로 배송돼 아침 식사도 가능하다.향후 옴니채널 시스템도 구축해 고객 편의를 높일 계획이다.GS리테일은 고객이 주문하는 수량에 맞춰 생산하는 주문 생산 방식으로, 고객들은 가장 신선한 상태의 식재료를 받아서 요리할 수 있도록 밀키트 생산 시스템을 구축했다. 도시락을 제조해 왔던 노하우와 인프라를 바탕으로 초기에는 자회사인 후레쉬서브에서 밀키트 생산을 진행하고, 향후 수요가 늘어남에 따라 2, 3 생산시설로 확대해 나갈 계획이다.김경환 GS리테일 디지털전략부문장은 “밀키트 배송 서비스는 고객의 니즈를 충족시키는 것이 아닌 아직 고객이 인지하지 못한 니즈를 개발해야 하는 새로운 영역의 서비스”라며 “밀키트는 단순히 편리함만을 추구한 먹거리가 아닌, 직접 맛있는 요리를 해서 가족과 함께 집에서 식사를 즐기고 싶은 고객의 바람을 녹여낸 밀솔루션 서비스로 향후 그 시장의 성장 가능성은 무한하다고 확신한다”고 말했다.GS리테일은 심플리 쿡 론칭을 통한 밀키트 시장 개척이 단순히 새로운 사업의 시작이라는 의미를 넘어 4차 식문화 혁명을 이루어 내는 시발점이 될 것으로 예상하고 있다. 농경사회 집에서 밥을 지어 먹던 1세대 식문화, 외식이 시작된 2세대 식문화, 도시락, HMR, RTC 등 간편조리로 대표되는 3세대 식문화에 이어 배송된 밀키트로 요리를 해서 가족과 함께 즐기는 4세대 식문화가 지배적인 시대가 도래할 것이라는 것.양호승 GS리테일 밀키트팀장은 “이번 밀키트 시장 진출은 GS리테일이 추진하고 있는 밀솔루션 프로젝트의 시작”이라며 “그동안 수퍼마켓, 편의점 등 항상 새로운 시장을 개척하며 눈부신 성장을 이어온 혁신기업으로, 이번 밀키트 역시 고객들에게 혁신적인 가치를 제공하며 성장해 나갈 수 있을 것으로 확신하고 있다”고 말했다."
2017-12-14,역시 방판은 야쿠르트 아줌마!…新 유통채널 급부상,"-“우리 제품 좀 넣어 달라” 식품업계 요청 쇄도
-마켓오 디저트, 5개월 누적 80만개 팔려
-커피ㆍ치즈 이어 간편식 진출
-신선함+배송 편의성 강점

[헤럴드경제=장연주 기자] “야쿠르트 아줌마가 저희 제품 좀 팔면 안될까요? 저희 베스트셀러 제품을 판매해도 좋고, 야쿠르트쪽에서 원하는 콘셉트가 있으면 맞춤형으로 새로운 제품을 만들 수도 있습니다.”

한국야쿠르트에는 올들어 식품회사들로부터 이런 내용의 문의가 많이 온다. 방문 판매의 대표격인 야쿠르트 아줌마의 방판 경쟁력이 빛을 발하면서, 신선한 제품을 소비자들에게 편리하게 전달하는 신(新) 유통채널로 떠올랐기 때문이다.

실제로 올 2월 오리온이 만들고 한국야쿠르트가 배달 서비스를 맡은 ‘마켓오 디저트’는 올 11월 기준 전국 판매 개시 5개월 만에 누적 80만개가 팔렸다. 베이커리 전문점의 인기 디저트가 일 평균 3000개 가량 팔리는 점을 감안하면, 마켓오 디저트는 일 평균 5000개가 넘게 팔린 셈이다.

오리온의 ‘마켓오 디저트’ 3종
오리온 관계자는 “냉장 디저트의 성격상 유통기한 제한이 있어 많이 팔기 어렵지만, 야쿠르트 아줌마를 통해서는 사전예약으로 주문을 받아 재고 부담없이 많이 팔 수 있어 상당히 큰 효과를 보고 있다”고 했다.

야쿠르르 아줌마의 방판 경쟁력이 두각을 나타내기 시작한 것은 지난해 3월 ‘콜드브루 바이 바빈스키’(이하 콜드브루)가 출시되면서다. 콜드브루는 지난해 7~8월에는 하루 평균 10만잔이 팔릴 정도로 인기를 누렸고, 출시 1년 만에 1600만잔이 판매되는 기염을 토했다. 출시 후 올 11월까지 누계 매출액은 530억원으로, 식품업계에서 보기 드문 히트상품으로 자리잡았다.

콜드브루의 성공 배경에는 야쿠르트 아줌마가 매일 신선하게 소비자들에게 직접 전달하는 편리함이 가장 큰 장점으로 꼽힌다. 여기에다 커피전문점 대비 절반 가격, 당해 수확한 햇원두를 원료로 로스팅 후 10일 만 유통되는 신선함도 어필했다.

콜드브루에 이어 끼리치즈도 야쿠르트 아줌마의 방판 경쟁력을 입증했다.

전세계적으로 사랑받는 끼리치즈는 지난해 2월 서울과 경기 등 일부지역에서만 테스트 판매를 시작했지만, 입소문을 타면서 판매 요청이 이어져 5월부터는 전국에서 판매했다. 올 11월 기준 누적판매 500만개, 매출 250억원을 기록하고 있다. 

한국야쿠르트의 간편식 브랜드 ‘잇츠온’ 한국야쿠르트의 ‘밀 키트’ 제품
한국야쿠르트는 오프라인 인프라 강화에 따라 올해부터는 온라인 인프라를 강화하고 나섰다.

올 1월 기존 홈페이지와 쇼핑몰을 하나로 통합한 ‘하이프레시(hyfresh)’를 오픈했다. 오픈 10개월 만에 하이플레시 어플리케이션을 다운받은 수는 누적 63만건을 넘어섰고. 방문자수는 전년 동기 대비 15% 이상 늘어난 430만명을 기록했다. 온라인몰 매출은 67억원으로, 지난해 매출(41억원)을 넘어섰고 올해 연간 매출 80억원을 기록할 것으로 예상된다.

올 7월에는 가정간편식 시장에도 진출했다. 신선함에 초점을 두고 주문 후 요리하는 콘셉의 ‘잇츠 온’ 브랜드를 냈다. 잇츠온 브랜드는 국, 탕, 찌개, 요리, 반찬 등 총 80여종으로 구성된다. 잇츠온 매출은 올 7~10월 4개월 간 60억원을 기록했다. 올해 매출 목표는 100억원이다. 최근에는 ‘밀 키트(Meal Kit)’ 제품도 출시했다. 밀키트는 요리시 필요한 식재료를 미리 손질해 구성한 RTC(Ready To Cook) 식품으로, 딱 필요한 만큼의 식재료와 요리방법이 적힌 레시피 카드가 함께 배송된다. 훈제오리월남쌈, 땅콩비빔국수키트, 쉬림프크림파스타 등 10여종을 출시했다.

한국야쿠르트 관계자는 “올 2월에는 경기 용인시에 1만1109㎡ 규모의 신갈통합물류센터를 신축해 물류센터에서 신형 전동카트까지 신선한 제품을 빠르게 배달할 수 있는 인프라를 구축했다”며 “야쿠르트 아줌마의 방판 채널은 신선함이 강점인 만큼, 향후 밀 키트 제품을 대폭 늘려 종합식품유통기업으로 거듭날 것”이라고 했다.

yeonjoo7@heraldcorp.com"
